Title,Summary,Link,Date,Author,Teams,Article,Outlet
Liverpool players attend funeral for Jota and brother in Portugal,"The community in Gondomar grieves after the deaths of Liverpool star Diogo Jota and his brother, André Silva.",https://www.bbc.com/news/articles/c98jdq57dedo,"Sat, 05 Jul 2025 13:01:40",,['Liverpool'],"Footballers Diogo Jota and André Silva have been honoured by their family, friends and teammates at a joint funeral in Portugal.
Jota, 28, was laid to rest alongside his brother, Silva, 25, after they died in a car crash on Thursday.
Hundreds of locals and supporters gathered at the Igreja Matriz in Gondomar, where the brothers are from, on Saturday.
The funeral also brought together huge names from across football, including Jota's teammates Virgil van Dijk and Andy Robertson, who were seen carrying floral tributes into the church ahead of the ceremony.
The service was held in Gondomar, a small Portuguese city near Porto, that has been left reeling after the brothers died.

Jota and Silva died at about 00:30 local time in the Spanish province of Zamora.
It is understood they were on the way to take a ferry and return to Liverpool for  Jota's pre-season training when the accident happened.
The Portugal forward had undergone minor surgery and doctors had advised him against flying.
The accident came just 11 days after Jota married his long-term partner Rute Cardoso, with whom he had three children.
Players from Liverpool FC, who only three months ago were celebrating their Premier League win, arrived at the funeral together.
Watching them walk in line with each other, almost as they do when walking onto the pitch, was an emotional experience.
There was a strong feeling of community, but also a shared sombreness.
Many were visibly upset, with supporters on the other side of the barrier applauding the players. One woman in the crowd shouted towards them as they walked in: ""Força!"" - strength.
Family and close friends walked into the church in complete silence, many of them with their heads bowed down as the church bell rung.
One person in the procession held up a sign with Silva's photograph, which read: ""Para sempre um de nós."" (Forever one of us.)
So much was the brothers' impact on football and their local community that some of the guests had to watch the ceremony from outside of the church, often hugging and comforting one another.
Locals and football fans in the crowd watched silently for most of the service, which went on for about an hour.
Many wore football shirts and carried merchandise from the different teams across Portugal and abroad where Jota and Silva, who played for local club Penafiel, spent some time in.
One of these fans was Antônio Moreira, who set off early in the morning to be one of the first outside the Igreja Matriz de Gondomar where the funeral took place.
""I know I won't be able to go inside, but I wanted to pay my respects,"" he told me from the barrier outside the church.
Antônio later showed me his phone case - a little old, he said - with the emblem of FC Porto.
Antônio recalled fond memories of Jota on the field, as he spent a year playing for the local club, but added that the brothers were so much more than football stars.
""They were good people, from a humble family, people like us.""
This has hit him especially hard, he said, as 40 years ago his family went through a similar tragedy. His aunt, uncle and young cousin died in a car accident three days before Christmas, leaving his other cousin behind.
Jota and Silva may not have been his direct family, he said, but their deaths felt personal.
""This is what I think: losing your parents is hard, really hard. But losing your children is unimaginable,"" he added.
Jota's journey as a player inspired many people here in Gondomar, football fan Fábio Silva told me.
He has kept up with the brothers since they started in the local clubs - and said he had to be here for their final journey.
""Despite the impact they had on football, and even financially, they never let it show,"" he told me, adding the family are well-loved in the town.
""The community is sad, devastated,"" he said.
Having spent some time with them over the years, Fábio said there was only one reason he was here: ""Respect for the brothers, the family.""
Avid football fans Fábio and Rafaela travelled from the nearby town Lordelo to honour Jota and Silva.
Wearing Jota's shirt, Fábio said it was important to him to be here ""for Jota's final day"". Both said it meant a lot to the community that so many people showed up to pay their respects.
They watched the ceremony from outside the church, like hundreds of other fans - which Fábio said was hard. Nodding, Rafaela agreed, but said it was also beautiful.
""This is an example that you need to live life to the max,"" Rafaela said, ""because you never know when will be your last day.""
""Say everything you want to say, and need to say - tomorrow could be too late,"" Fábio added.
",BBC
West Ham reject £50m Kudus bid from Tottenham,West Ham reject a £50m bid from Premier League rivals Tottenham for Mohammed Kudus.,https://www.bbc.com/sport/football/articles/cj9v73zng01o,"Sat, 05 Jul 2025 23:15:51",Sami Mokbel,['Tottenham Hotspur'],"West Ham have rejected a £50m offer from Tottenham for Mohammed Kudus.
The Ghana international is open to a move away from the London Stadium and is prioritising a switch to a Champions League side.
Spurs fit that bill after qualifying for the competition by winning the Europa League.
Talks are ongoing, with West Ham open to letting the 24-year-old attacking player leave.
Kudus, who joined West Ham in a £38m deal from Ajax in 2023, has an £85m release clause but Tottenham are looking to secure a deal under that figure.
At least six top clubs have enquired about Kudus in recent weeks, according to well-placed sources.
Chelsea are among the clubs with an interest in Kudus.
West Ham may look to sell one of their top stars this summer with a view to reinvesting the recouped money into the squad ahead of manager Graham Potter's first full season in charge.
Kudus, who still has three years to run on his contract, has 13 goals and nine assists in 65 Premier League appearances for the Hammers.
",BBC
Chelsea complete £48m signing of Dortmund's Gittens,Chelsea complete the signing of Borussia Dortmund winger Jamie Gittens for an initial fee of £48.5m.,https://www.bbc.com/sport/football/articles/c3enp85lg1eo,"Sat, 05 Jul 2025 14:04:54",Adam Millington,['Chelsea'],"Chelsea have completed the signing of winger Jamie Gittens from Borussia Dortmund for a fee of £48.5m plus the potential for a further £3.5m in add-ons.
The 20-year-old, who joined Dortmund from Manchester City in 2020, has signed a seven-year deal at Stamford Bridge.
The England Under-21 forward scored 17 goals and contributed 14 assists in 107 games for the German club.
Chelsea have already signed Ipswich Town striker Liam Delap, Brighton & Hove Albion forward Joao Pedro, Sporting midfielder Dario Essugo and Strasbourg defender Mamadou Sarr this summer.
Gittens, who will not be able to play for the Blues until after the Club World Cup, said it is an ""amazing feeling"" to move to Stamford Bridge.
""It feels great to join such a big club as Chelsea,"" he added.
Dortmund announced a deal had been agreed on Thursday, with sporting director Sebastien Kehl saying talks with the Premier League side had been ""challenging"" but ultimately his club were ""pleased"" with the outcome.
""Jamie is an outstanding player who has given us a great deal of pleasure,"" he added.
""He now wants to take the next step in his career at Chelsea, and we wish him all the best and much success.""
Check out all the summer transfer deals on our dedicated page.
",BBC
Chelsea's Madueke agrees personal terms with Arsenal,Chelsea winger Noni Madueke agrees personal terms for a move to Premier League rivals Arsenal.,https://www.bbc.com/sport/football/articles/c93kdgnnw2zo,"Sat, 05 Jul 2025 21:21:46",Sami Mokbel,"['Arsenal', 'Chelsea']","Arsenal have agreed personal terms with Chelsea winger Noni Madueke ahead of a possible move for the England international.
An agreement between the Premier League teams is yet to be reached but 23-year-old Madueke is believed to be open to moving across London should the clubs strike a deal.
Multiple sources are indicating that while there is yet to be a club-to-club agreement with regards to a transfer fee, there is a sense from all parties that a deal is possible.
Chelsea are understood to be aware of Arsenal's interest in Madueke but the Gunners are still to make a formal approach for the attacker.
Madueke is currently part of Chelsea's Club World Cup side and made a substitute appearance in their 2-1 quarter-final win against Palmeiras.
BBC Sport reported Arsenal's interest in Madueke on Thursday, with the winger's ability to operate on either flank a key factor in the north London side's interest.
Arsenal are looking to strengthen their creative options in the summer window with Real Madrid's Rodrygo and Crystal Palace's Eberechi Eze among the other options considered.
The financial outlay attached to an approach for Rodrygo has raised questions over whether the Gunners can execute a successful deal for the Brazil international, nevertheless the club have explored a swoop for the 24-year-old.
Eze, who has a release clause worth a total of £68m, is another player the club have a serious interest in.
Sources have indicated the Eagles will demand the full release fee but it remains to be seen whether their stance softens later in the window.
",BBC
Teenage left-back whose role model is Marcelo - Leon joins Man Utd,"Diego Leon has completed his move to Manchester United, so what will the 18-year-old bring to Old Trafford?",https://www.bbc.com/sport/football/articles/cy08g24xelxo,"Sat, 05 Jul 2025 12:39:14",Marcus Alves,['Manchester United'],"'Left-back wanted' was the message in ABC Color, Paraguay's most-read newspaper.
Coach Manolo Jimenez had been left without much of a choice as he prepared his Cerro Porteno side to face Sportivo Ameliano in Paraguay's top flight in early August.
Having lost both senior left-backs through injury, Jimenez was left with a dilemma - play right-back Victor Cabanas in the position or hand 17-year-old novice Diego Leon his senior debut.
Only a few months earlier, Leon was an unknown featuring for Cerro's Under-17 team.
But Jimenez opted to go with the teenager against Ameliano and his boldness was rewarded as the youngster secured a 1-0 win with a powerful header.
He scored again a week later and impressed so much that he was named player of the month by the coaches' association.
""This is what every kid dreams of. I invite you all to dream. I'm a dreamer,"" he said.
That dream has now taken Leon to the 'Theatre of the Dreams', after the deal - which was agreed in January - was completed by Manchester United., external
And, while his first-team breakthrough may not be immediate, there are plenty who believe he can make a huge impact at Old Trafford.
""He's a left-back like no other in the world, the kind that's rare to find,"" said Cerro president Juan Jose Zapag.
There seems little doubt about Leon's potential.
Lightning quick and fearless with the ball at his feet, he caused such an impact with Cerro's first team that Jimenez had to ask European sides to leave him alone, with Arsenal and Manchester City also approaching him.
Ultimately, he was convinced by United's long-term vision and their determination to secure him.
The full-back will now follow in the footsteps of Diego Gavilan, the first Paraguayan to play in the Premier League. Like Leon, he was a Cerro product and left the team for Newcastle United in 2000.
""Things have happened very quickly for him,"" Gavilan, who coached the club's senior and youth teams, told BBC Sport.
""But at 17, there's still plenty for Leon to learn, improve, and refine. It's going to be a massive change for him, moving to a different country, a different continent.
""Going from a country he's used to, with its own ways of life, language and culture, to adapting to the English way of thinking about football. A lot of things, right?
""But I believe United know what they're getting and will give him time to settle in.""
'He has tremendous potential and physical power'
Leon has one immediate plan - and it does not involve a football pitch.
""The first thing he wants to do is build a house for our parents,"" revealed his eldest brother Hernan.
He did not have it easy growing up in a humble family as the youngest of nine siblings in Juan Emilio O'Leary, a small city close to the borders with Brazil and Argentina.
But not even that stopped him from pursuing his dream and packing his things for Cerro Porteno's academy in Paraguay's capital city Asuncion at the age of 12.
""I followed him during his time in the youth ranks at Cerro, back when I worked there as the coach for the Under-19s, Under-20s, Under-23s and later the first team,"" Gavilan recalled.
""He's a kid from the countryside with tremendous potential and great physical power.
""He always stood out in every level he played at and perhaps more importantly he's someone who can also play in various roles.""
Leon spent his formative years as a left winger, so his attacking prowess is perhaps no surprise.
""He plays as a left-back, but he really enjoys getting forward, overlapping from his position to join the attack,"" said Hernan Acuna, Cerro's head of scouting.
""He initially joined the club as a winger, but due to necessity he was used as a left-back.
""His attacking quality, being able to join offensive moves, does sometimes mean he neglects his defensive duties a little.
""However, he is very effective when joining the offensive actions, particularly with his finishing ability.""
Marcelo is Leon's role model
The defender was picked for most of Cerro Porteno's league games this year but played a very limited role in the side's progression to August's Copa Libertadores knockouts - an indication Manchester United are signing potential rather than a finished product.
Leon has benefited from working with Jimenez, a coach who had previously helped nurture talents such as Sergio Ramos, Jesus Navas and Jose Antonio Reyes at Sevilla.
""He was a player in development, but I saw his strength and quality, so I took the chance on him. Physically, he's a powerhouse,"" Jimenez, who now works at Apoel Nicosia in Cyprus, told Madrid newspaper Marca.
Leon has already admitted his role model for the position is former Real Madrid defender Marcelo.
""Diego has natural talent, but a long journey ahead, too. Hopefully, one day we can say he's had a career similar to Marcelo's - or perhaps one like [Patrice] Evra's at United,"" added Jimenez.
Leon's progress will be watched closely both by United fans and by followers of South American football.
""His transfer is quite a unique case because usually players who leave the club are transferred to South American teams before eventually making their way to Europe,"" Acuna said.
""In the past, many teams, particularly from Spain, used to sign players directly from Cerro. Nowadays, we have this situation with Leon, who is signed directly by a Premier League club, just like what happened with Gavilan.
""There's also the case of Miguel Almiron, who first went to Argentina, then to the MLS, and from there to Newcastle. It's been a long time since a player was signed directly from Cerro to a Premier League club.""
",BBC
Burnley sign Walker from Man City in £5m deal,Burnley sign England defender Kyle Walker from Manchester City for a fee of up to £5m.,https://www.bbc.com/sport/football/articles/cn5kq5k96vdo,"Sat, 05 Jul 2025 10:38:31",Alex Fletcher,['Manchester City'],"Burnley have signed England defender Kyle Walker from Manchester City for a fee of up to £5m.
The right-back completed his medical on Friday and has signed a two-year contract with the Clarets.
The 35-year-old will work again with head coach Scott Parker, with whom he played at Tottenham Hotspur for two seasons.
""I'm delighted to be here,"" Walker told Burnley's website. ""I can't wait to come in and add my experience and quality to what looks an exciting squad.
""When I spoke to Scott and heard about his plans for next season, it was an opportunity I jumped at. He's done an amazing job here, guiding the club back to the Premier League.""
Walker made 15 appearances in the first half of last season for City before joining AC Milan on loan in January, but the Italian club decided not to make his move permanent.
He won 17 trophies during his time at Etihad Stadium and was part of the squad that won the Treble in 2023.
Walker, who started his career at Sheffield United, signed for City in the summer of 2017 for an initial £45m and made 319 appearances for the club.
Burnley were promoted back to the Premier League last season following their relegation in 2024.
The Clarets creatively announced Walker's arrival on X, , externalusing Popstar Lionel Richie's music video for his song 'Hello'.
Walker is their fifth signing of the summer, following the arrival of defender Axel Tuanzebe, left-back Quilindschy Hartman, goalkeeper Max Weiss and French winger Loum Tchaouna.
Check out all the summer transfer deals on our dedicated page.
",BBC
What Chelsea can expect from £48m winger Gittens,"Chelsea have signed Jamie Gittens, but why have they targeted him and where will he fit in at Stamford Bridge?",https://www.bbc.com/sport/football/articles/cd0lxlklmvvo,"Sat, 05 Jul 2025 15:48:06",Emily Salley,['Chelsea'],"Chelsea's prolonged effort to sign Jamie Gittens from Borussia Dortmund was finally rewarded on Saturday as they sealed the England Under-21 winger's arrival for an initial fee of £48.5m.
The 20-year-old Englishman had agreed a seven-year contract with Chelsea in June.
The arrival of Gittens is good news for Chelsea manager Enzo Maresca, who has had on-loan Jadon Sancho return to Manchester United this summer and made no secret of the fact a transfer priority for him was to sign a winger.
The Italian has been keen to add competition for Noni Madueke, Pedro Neto and Tyrique George.
Gittens remained the club's first-choice target this transfer window despite the Blues exploring other potential moves after initial bids for him failed before the start of the Club World Cup.
The 20-year-old joins an already well-stocked attacking line-up including Liam Delap, Joao Pedro, Cole Palmer, Nicolas Jackson, Christopher Nkunku, Marc Guiu - who generally play centrally - as well as wingers Neto, Madueke and George.
""It might feel as though Chelsea are almost doing deals just for the sake of it, but there is a specific plan,"" said BBC Sport football news reporter Nizaar Kinsella.
""Gittens will come in as a left winger and replace Jadon Sancho after his loan spell from Manchester United was not made permanent. It's also worth noting Mykhailo Mudryk remains provisionally suspended for a failed drugs test.""
Gittens is another exciting youth prospect that Borussia Dortmund have nurtured into a star player.
Dortmund confirmed a deal had been agreed with Chelsea on Thursday and he becomes the latest signing for the Blues with strong Manchester City links - joining the likes of Delap, Palmer and manager Maresca at Stamford Bridge.
""He can become the next [Jadon] Sancho, Erling Haaland or [Jude] Bellingham,"" former Dortmund striker Karl-Heinz Riedle said in November.
But will Gittens live up to those expectations and where will he fit in at Stamford Bridge?
'Gittens has been a long-term target for Chelsea'
It is not Gittens' first spell at Chelsea.
He spent a brief period on the books at the Blues' academy before turning them down to continue his development at his hometown club Reading.
After a two-year stint in Manchester City's youth set-up Gittens made the move to Borussia Dortmund in 2020, making his senior debut two years later.
He caught the attention of several clubs after a breakthrough 2024-25 season in which he scored eight goals in 32 Bundesliga appearances.
""He has no fear. For me, he is one of the best players one-against-one I have ever seen, to be honest. He will be a really good player,"" said Dortmund winger Karim Adeyemi.
Despite a strong start to last season, Gittens fell out of favour at Dortmund after the arrival of new manager Niko Kovac in February.
""Gittens has been a long-term target for Chelsea. They were looking at him in January, but that wasn't seen as viable,"" Kinsella added.
But the move became possible once it became apparent the winger did not fit into Kovac's preferred 3-5-2 formation.
Where Gittens will play at Chelsea
A rapid, right-footed left winger, Gittens' arrival fills the void left by Sancho's departure after Chelsea opted not to sign him on a permanent basis.
Speaking earlier in the summer, Maresca said: ""Jadon is not with us so for sure that is a position we need to do something.
""We have Noni, Pedro and Ty only as the proper wingers so something for sure is going to happen. When the transfer window is open, for sure, we can do something.""
He also fits the recruitment profile set by co-sporting directors Paul Winstanley and Laurence Stewart - a young and adaptable winger on a long-term contract, with a potentially high resale value.
""They are looking to get more than one option in every position as the squad will need to be stronger because of the Champions League pressures,"" Kinsella added.
""The squad will be quite well balanced now. The question is will Gittens and Delap hit the round running? They are still young players, so there are question marks.""
Palmer, Romeo Lavia and summer signing from Ipswich Delap were all part of City's Under-21s when Maresca was in charge, while Tosin Adarabioyo is another to have come through that academy.
Chelsea boss Maresca is also an admirer of Aston Villa's Morgan Rogers, who failed to break through at City, while the club tried to sign City full-back Nico O'Reilly in January.
""Gittens is a young English player with that Manchester City link again, so he can play that style of football,"" Kinsella said.
""He also has a relationship with some of the recruiters, there are a lot of ex-Manchester City staff who know him and have had success with signing former City players.""
How can Chelsea afford to keep spending?
Chelsea have already assembled a big squad, with a value heading north of £1.4bn.
Delap and Brighton forward Pedro have already signed during this close season, while midfielders Kendry Paez and Essugo, winger Estevao Willian, goalkeeper Mike Penders and defender Sarr complete their moves this summer.
By buying younger players on lower wages and spreading the payments over long-term contracts, Chelsea's strategy is to unearth new stars and sell on unwanted talent for a profit.
But further additions may be determined by the Premier League's response to the sale of their women's team to parent company BlueCo for £198.7m - a process that put the wider business into profit.
""If this is accepted by the Premier League, then Chelsea would have significant spending flexibility and another £200m is a possibility,"" football finance expert Kieran Maguire told BBC Sport earlier this month.
""If it is excluded, then things will be far more challenging and they may have to sell before buying.""
Chelsea's finances have been bolstered by qualifying for next season's Champions League, while they are set to receive more than £50m for taking part in the expanded Club World Cup.
However, their ability to register new players for European competition next season may be affected by Uefa's financial rules, which are different from the Premier League's PSR rules.
The club were fined 31m euros (£26.7m) on Friday for breaching Uefa's spending rules and could be prevented from registering new players for Uefa competitions unless they have a positive transfer balance by the end of the summer transfer window.
",BBC
