Title,Summary,Link,Date,Author,Teams,Article,Outlet
"Analyzing preseason friendlies is maddening, but right now it’s all we have | Jonathan Wilson","Every team enters preseason at a different stage of readiness and with different goals, making results hard to decipher",https://www.theguardian.com/football/2025/aug/04/analyzing-pre-season-friendlies-is-maddening-but-right-now-its-all-we-have,"Mon, 04 Aug 2025 15:57:26",Jonathan Wilson,"['Arsenal', 'Manchester United', 'Tottenham Hotspur']","Glory for Manchester United, who lifted the Premier League summer series on Sunday despite twice being pegged back by Everton to draw 2-2 in Atlanta. A degree of relief for West Ham, who beat Bournemouth to finish second in the competition despite all the gloomy prognostications about their campaign to come. In Seoul, meanwhile, there was a very Tottenham moment as they followed the glee of last week’s 1-0 win over Arsenal with a 1-1 draw against Newcastle in which James Maddison was stretchered off with a knee injury described by his manager Thomas Frank as “bad”.
It all looks real, it sounds real and yet everybody knows it isn’t real. That even now, in this age of data and minute analysis, there remains an element of randomness, is one of soccer’s great joys as a sport. But that tendency is magnified in pre-season.
The Premier League has been away for 10 weeks now. For those hooked on its soap opera, the wait is intolerable. The Club World Cup, the England men’s team being dreadful in June as they so often are, the Under-21s continuing their unfamiliar excellence, even the women’s Euros … none of it quite offers the same hit. Obsessing over transfers suffices only for so long; eventually there is a need to see them play.
And so there are pre-season games, and there is is analysis. The best of it is skeptical, acknowledging the absurdity of making judgements on 45 minutes. The worst of it is breathlessly insistent – of Bryan Mbeumo and Matheus Cunha, the two senior players United have managed to sign, appearing together against Everton. What does it mean that Rasmus Højlund was only on the bench? Does that mean Benjamin Šeško is more likely to sign? The front three, with Mbeumo dropping deep and Cunha and Bruno Fernandes at times running beyond him, looked fluent. Fernandes and Mbuemo set up Amad Diallo, overlapping from wing-back to score the opener. This is the way Ruben Amorim’s 3-4-3 is supposed to work.
In that, at least, there is a sense of something tangible, a United that is, at last, able to execute their manager’s attacking plan. But Ayden Heaven’s own goal was a reminder that United remain as self-destructive as ever. Perhaps more significant was the equaliser conceded after Manuel Ugarte lost possession, the lack of urgency to get back. Did this happen because it was only a friendly and United are nowhere near peak fitness yet? Or because this is an irredeemably feckless bunch of players?
This is smoke on a foggy day. Will any of it be relevant when the season begins for real? United fans will remember ruefully just how good they looked in pre-season under Louis van Gaal in 2014, only for the season itself to prove anticlimactic.
The problem with assessing pre-season games is that different sides are at different stages of readiness. Some expect to hit the ground running from week one; others are building to peak in March or April, the differences magnified two weeks before the opening day. Some managers are working on specific plans and are less bothered by the whole, some are just hoping to get semi-competitive minutes into their players’ legs.
Sign up to Soccer with Jonathan Wilson
Jonathan Wilson brings expert analysis on the biggest stories from European soccer
In the old days, before Premier League teams went on foreign tours and everybody was desperately promoting themselves to a global audience, pre-season was about team bonding as much as anything else: the team that drinks together wins together, as the adage had it. The stories are legion: the Everton winger Peter Beagrie driving a motorbike through a plateglass window in San Sebastián; Sunderland’s diminutive but extremely tough full-back John Kay terrifying a much larger local who had threatened him by casually eating the antiseptic cubes from a urinal in Bristol; Arsenal’s French midfielder Gilles Grimandi joining five of his English teammates on a night out in Switzerland where the first round comprised 35 pints of lager and a dry white wine. Many managers, you suspect, would quite relish a return to the days, if not of booze, then at least of pre-season being a largely private affair rather than a projection of the club to the world.
Very occasionally something consequential happens, such as Chelsea conceding four in the second half to an experimental New York Red Bulls led by Jesse Marsch in the summer of 2015, the first sign that something had gone badly wrong for José Mourinho’s side since winning the Premier League two months earlier; within five months, Mourinho had been sacked. (It was also the debut first-team appearance for Bournemouth and US national team midfielder Tyler Adams, then 16 years old.)
Pre-season is very much the phoney war, the jockeying, the probing. It matters to the clubs, but to outsiders it is essentially like watching an artist mix his paints. There’s anticipation and a vague technical interest, but it means nothing until it starts being applied to the canvas.
This is an extract from Soccer with Jonathan Wilson, a weekly look from the Guardian US at the game in Europe and beyond. Subscribe for free here. Have a question for Jonathan? Email soccerwithjw@theguardian.com, and he’ll answer the best in a future edition.
",TheGuardian
"Tottenham fans will only appreciate me when I am gone, says Daniel Levy",Chair says stadium has put club ‘on the global map’,https://www.theguardian.com/football/2025/aug/04/tottenham-hotspur-daniel-levy-spurs-thomas-frank-stadium,"Mon, 04 Aug 2025 13:52:56",Ed Aarons,['Tottenham Hotspur'],"The Tottenham chair, Daniel Levy, believes he will get credit for his time in charge only when he leaves and is confident that Thomas Frank can help the club to “compete at the ­highest level”.
In a rare interview, Levy described the construction of the Tottenham Hotspur Stadium as his greatest achievement and hit back at fans who have blamed him for the club’s failure to win more trophies. “It’s one of those situations when I’m not here I’m sure I’ll get the credit,” Levy told Gary Neville on his Overlap podcast.
“This stadium is a symbol of ­Tottenham Hotspur on the global map. It’s fantastic for the local ­community – the employment we’re creating because of this stadium. The fact that other clubs are now trying to copy what we’re doing, that should be a sign that maybe we did do something bold and something right.”
The Europa League triumph last season was Spurs’ first trophy since 2008 and came just before the end of a Premier League campaign when they finished 17th after a record 22 defeats. Levy sacked Ange ­Postecoglou 16 days after the win against Manchester United in the final in Bilbao and he is hopeful that Frank can help the club to challenge for trophies on a more consistent basis.
“Whenever you appoint a coach, you always believe it’s right,” Levy said. “You need a lot of ­ingredients for it to be right. Thomas is a highly intelligent individual, a ­fantastic way about him in terms of communication.
“He will be great at ­developing young players and older players and making them better. He gets the style of football we want to play. We haven’t said to him: ‘You’ve got to win the league this year.’ We just want to compete at the highest level.”
Levy was critical of the Premier League for the time it has taken to conclude the case involving alleged breaches of the league’s regulations by Manchester City. The club, who deny wrongdoing, were charged in ­February 2023 with more than 130 breaches .
“It would be really unfair of me to talk about another club in the Premier League,” he said. “All I would say is that it’s going through a process which has gone on for far too long. It needs to be brought, for the good of the game, to a conclusion one way or another.”
",TheGuardian
Thomas Partey close to joining Villarreal in week of court appearance,Former Arsenal midfielder has denied rape charges,https://www.theguardian.com/football/2025/aug/04/thomas-partey-villarreal-court-appearance,"Mon, 04 Aug 2025 11:00:03",Ed Aarons,['Arsenal'],"The former Arsenal midfielder Thomas Partey is poised to join Villarreal on a free transfer this week.
Partey is due to appear at Westminster magistrates court on Tuesday after being charged with five counts of rape and one count of sexual assault last month, a few days after he left Arsenal having failed to agree a new deal. He has denied all the charges.
Partey is understood to have completed his medical at Villarreal having settled on personal terms for a move back to Spain, where he has played for Atlético Madrid, Mallorca and Almería. He is believed to have agreed a one-year contract with an option to extend by 12 months, and the opportunity to play in the Champions League next season is thought to have been a motivating factor in the 32-year-old’s decision. Partey also had offers from Saudi Arabia and Turkey.
Arsenal are due to host Villarreal in a friendly on Wednesday. Some supporters of the Spanish club have voiced opposition to his expected move, with a hashtag #NoAThomasPartey (No to Thomas Partey) trending on X and others being encouraged to write to Villarreal to express disappointment.
Partey had been the subject of an investigation that began in February 2022, with the allegations relating to three women who reported incidents between 2021 and 2022. Partey’s lawyer has said her client “welcomes the opportunity to finally clear his name”.
Partey continued to play for Arsenal after first being arrested on suspicion of rape in July 2022 and held talks about extending his contract after Mikel Arteta said he was keen for him to stay. Arsenal’s manager said last month he was “100%” sure Arsenal followed the correct protocols over Partey.
",TheGuardian
Football Daily | Tears for Mr Tottenham as Son and his trademark smile head for pastures new,Sign up now! Sign up now! Sign up now? Sign up now!,https://www.theguardian.com/football/2025/aug/04/football-daily-son-heung-min-tottenham-hotspur,"Mon, 04 Aug 2025 15:05:29",Barry Glendenning,"['Manchester United', 'Tottenham Hotspur']","CHEERS, SON’S CRYING
Due in no small part to their peerless work in the field of curing the ills of struggling and out-of-sorts opponents in need of a fillip, few Spurs fans would be sorry to see the back of Dr Tottenham if he ever decides to leave their club. But on Sunday in Seoul, during a pre-season friendly between the Bigger Vase champions and Newcastle, there was scarcely a dry eye in the house as Tottenham and their South Korean supporters’ branch bade an emotional farewell to a player who, over the past decade, has to all intents and purposes become Mr Tottenham. Substituted after 65 minutes of the 1-1 draw, an emotional Son Heung-min received warm hugs and a guard of honour from both his teammates and the players of Newcastle before retiring to the substitutes’ bench for a little weep. After 10 years of service, one of the most popular, high-performance and low-maintenance players to ever grace the Premier League is off to ply his trade in MLS with LAFC and an English football landscape so often synonymous with spittle-flecked and snarling rage will be considerably poorer for the absence of his trademark beatific beam.
“I didn’t think I was going to cry at first but after hearing a few words from my teammates, leaving the club I’ve spent so much time with felt really tough,” he sobbed. “I felt really, really happy playing this match. Thanks to my fans, my teammates and also my opponents, I’ve had an unforgettable day. My career is not over yet, and I want to continue to bring joy. I know I have more things I want to accomplish as a football player.” In his 454 appearances for Spurs, the man they call Son accomplished plenty. He scored 173 goals and provided 101 assists but such metrics don’t come even close to measuring his contribution to the club’s cause. On the pitch a graceful, lightning fast predator with the cold eye of an assassin, Son lifted Tottenham’s first trophy in 16 years last season and at other points during his time in north London, won a Puskás Award and shared a golden boot.
In arguably his greatest act of personal selflessness for the benefit of the greater Tottenham Hotspur good, he also made a complete dog’s breakfast of that one-on-one with Manchester City goalkeeper Stefan Ortega to deny Arsenal the title two seasons ago. Off the pitch, it has long been apparent that Son is that rare breed of elite footballer who few people, except perhaps Arsenal fans in whose collective side he has been a constant thorn, has a bad word to say about. Among those shedding salty tears in Seoul was Ben Davies, the similarly long-serving Spurs player who is so close to the departing South Korean that – try saying this without slurring after a skinful – his son is Son’s godson. “I saw my good friend Ben Davies cry,” said Son in the post-match interview. “Seeing him tearing up with his eyes going all red made me feel sorry and thankful at the same time. A mixture of feelings really but as the godfather of his son, I need to strive for more, to make my godson proud.”
While Son’s rigid adherence to his duties as a moral guardian are to be commended, Football Daily is prepared to wager that as long as he remembers to pony up the obligatory readies each and every birthday, Davies Jr is unlikely to give two hoots whether or not he ever kicks a football again. “Sonny is Tottenham and Tottenham is Sonny,” declared James Maddison before the friendly, a game in which the midfielder was carried off the field on a stretcher after suffering a bad case of knee-knack. “It’s weird to think about Tottenham Hotspur without Son.” For those who continue to pass in and out of the gates of the Spurs training complex, it will also be weird not to see the small gaggle of South Koreans who regularly convene on the Enfield outskirts hoping to get a smile, a kind word or a selfie as Son comes and goes from training. Exceedingly rare were the days, by all accounts, when the subject of their unbridled adoration failed to oblige them.
QUOTE OF THE DAY
We didn’t want to finish [our USA USA USA tour] in this way. Our performance wasn’t the best and we were a little bit lazy today. We want to avoid that because with laziness you can pay at any moment. [The squad’s quality] is improving. But it’s not the place it needs to be. It was crystal clear we needed more competition... hopefully we can get one or two players more” – Bruno Fernandes warms up for the new season with a familiarly downbeat refrain about Manchester United after a 2-2 draw with similarly underpowered Everton in Atlanta. They did win the Premier League Summer Series, mind. So cheer up, Bruno.
FOOTBALL DAILY LETTERS
If ever the Ineos Grenadiers’ head carer needed evidence that he wasn’t involved in any performance enhancement shenanigans (Friday’s News, Bits and Bobs, full email edition), working at Manchester United last year should prove it beyond reasonable doubt” – Jim Hearson.
I see Norwich have signed midfielder Mirko Topic. Does he come with a hazelnut in every biting tackle?” – Darian Boyd.
If you have any, please send letters to the.boss@theguardian.com. Today’s winner of our letter o’ the day is … Jim Hearson, who lands some Football Weekly merch. Terms and conditions for our competitions are here.
RECOMMENDED LISTENING
Max Rushden is joined by Barry Glendenning and the Football Weekly pod squad to discuss Son Heung-min’s Tottenham farewell and the return of the Football League.
RECOMMENDED BOOKING
On Thursday 11 September, join Max Rushden, Barry Glendenning and a host of your other Football Weekly favourites live on stage for an evening of unfiltered football punditry at Troxy in London and livestreamed globally. Book now.
This is an extract from our daily football email … Football Daily. To get the full version, just visit this page and follow the instructions.
",TheGuardian
Son signs off at Spurs and the Football League kicks off – Football Weekly,"Max Rushden is joined by Barry Glendenning, Ali Maxwell and Dan Bardell as Son Heung-min bids farewell to Tottenham after a decade and the Football League returns",https://www.theguardian.com/football/audio/2025/aug/04/son-signs-off-at-spurs-and-the-football-league-kicks-off-football-weekly,"Mon, 04 Aug 2025 11:46:12",Max Rushden,['Tottenham Hotspur'],"Rate, review, share on Apple Podcasts, Soundcloud, Audioboom, Mixcloud, Acast and Stitcher, and join the conversation on Facebook, Twitter and email.
On the podcast today; Son Hueng-min leaves Spurs after a decade having captained the side to their first trophy in 17 years in May. The panel discuss where he sits in the pantheon of Premier League greats.
Elsewhere, Leagues One and Two kicked off at the weekend, featuring a hapless own goal to open the season, a fiery encounter between Plymouth and Barnsley and tannoy requests for a qualified ref in Shrewsbury.
Plus, Celtic start their season with a win as Rangers drop points, Marta scores a belter in the Copa América Femenina and your questions answered.
Buy tickets to Football Weekly LIVE in September here.
Support the Guardian here.
You can also find Football Weekly on Instagram, TikTok, and YouTube.
",TheGuardian
