Title,Summary,Link,Date,Author,Teams,Article,Outlet
Everton agree loan deal for Grealish - why Man City dream turned sour,Everton agree a season-long loan deal to sign winger Jack Grealish from Manchester City.,https://www.bbc.com/sport/football/articles/cp8zjrnw6yro?at_medium=RSS&at_campaign=rss,"Mon, 11 Aug 2025 13:41:10",Shamoon Hafez,['Manchester City'],"Everton have agreed a season-long loan deal for Manchester City winger Jack Grealish.
The 29-year-old has fallen out of favour at City and was left out of their squad for the final Premier League game of last season at Fulham as well as the Club World Cup in the United States.
Sources have told BBC Sport that the clubs have reached an agreement over a deal for Grealish, who reportedly earns £300,000 a week, external at City, and a medical is imminent.
The England playmaker joined City from Aston Villa for what was a British record fee of £100m in August 2021 and has made more than 150 appearances, winning three Premier League titles, the Champions League and the FA Cup.
But he made only seven league starts last season as City ended the season without winning a major trophy.
He was left on the bench by manager Pep Guardiola during the FA Cup final defeat by Crystal Palace, with Argentine teenager Claudio Echeverri being given a debut instead.
In June it was understood Grealish wanted a clean break and a permanent new home, but he now seems poised for a loan move.
He would have preferred to join a team in the Champions League, but no offer has yet been made by the likes of Newcastle United or Tottenham Hotspur.
A move to Everton does not present the opportunity of playing European football but it will give him the chance to rejuvenate his career and take centre stage at their new Hill Dickinson Stadium.
Grealish will also be aiming to win his place back in the England squad after saying last summer he was ""heartbroken"" by being left out of the Three Lions squad for the 2024 European Championship.
Grealish's diminishing role for City
Noel Sliney, BBC Sport:
It has been a chastening two years for Jack Grealish, since he enjoyed the most successful season of his career.
He had played an integral role in Manchester City's historic Treble in 2022-23, starting the FA Cup final and every one of their seven knockout ties as the club won the Champions League for the first time.
Only six outfield City players spent more time on the pitch than Grealish in the Premier League too.
A hamstring injury halted his momentum early in 2023-24, which the England playmaker ended with more yellow cards (seven) than combined goals and assists (six) across all competitions.
He featured in just 40% of the total minutes played by City despite being in the squad for 82% of them.
His involvement dropped to 30% last term as Grealish's career plummeted to its nadir. Three of his six starts after Christmas came against lower-league opposition in the FA Cup, while 16 starts in total is his fewest in a campaign since he was 20 years old.
Unsurprisingly, it has also been his least productive season in terms of chances created and dribbling success since returning to the Premier League in 2019.
City's team structure has seldom afforded Grealish the license to take on and glide past opponents as he did with such insouciance as the talismanic captain at boyhood club Aston Villa.
The question now is whether the affable 29-year-old can reverse the downward trajectory of his career.
Can Grealish become main man again?
Grealish has grown more accustomed to sitting on the bench than playing football in recent times so his first task will be to get himself physically and mentally ready to play many more minutes of football than he has for the past two seasons.
Everton were rejuvenated following the appointment of Moyes in January, climbing up the table to finish 13th, but have struggled to build on that momentum with significant recruitment this summer.
Grealish will be a marquee signing as the club count down to their first season at their magnificent new Hill Dickinson Stadium.
England boss Thomas Tuchel has shown with his selections of players such as Marcus Rashford and Kyle Walker that he is not afraid to pick those that are out of favour at their clubs.
That will provide Grealish with hope that the England door has not been fully closed in a World Cup year.
Recapturing his form could well take him across the Atlantic next summer - but if that proves elusive it will likely bring about more disappointment for him when an England tournament squad is announced.
The ball, therefore, will firmly be in Grealish's court at Everton.
The highs...
Grealish said it was a ""dream come true"" when he became Britain's first £100m player by joining City from Aston Villa in August 2021.
He had been the undoubted star at Villa, coming through the academy to become a free-spirited maverick that helped the team to promotion from the Championship and re-established them in the Premier League.
In his first season at City, Grealish played 26 top-flight games, scoring three goals and providing three assists as they edged out Liverpool by a solitary point to claim the title again.
But the following season is when he really hit his stride, playing an integral role as City finally lifted the holy grail of the Champions League, as well as their third league title on the bounce and the FA Cup.
Grealish played 50 matches in all competitions, netting five times and providing 11 assists - his importance to the side highlighted by the fact he started all seven of their knockout ties in Europe.
""The main thing now is I feel loved,"" Grealish said during that season. ""I feel the manager really trusts me.""
He was the face of City's celebrations following their return home from Istanbul with the European trophy and it was anticipated he would kick on again, but his career has since taken an unexpected downward trajectory.
The lows...
Grealish knuckled down after he and team-mate Phil Foden were warned about their conduct by Guardiola having been pictured on a night out in December 2021.
He had a hamstring injury in the 2023-24 campaign and made just 10 starts in all, often overlooked for the quicker and more direct Jeremy Doku when he did regain full fitness.
He ended that season with more yellow cards (seven) than combined goals and assists (six) and featured in just 40% of the total minutes played by City.
Grealish has won 39 England caps but was left out of the Three Lions' squad for the 2024 European Championship, where they were edged out in the final by Spain.
Several people close to the player had told BBC Sport its impact on him should not be underestimated and it had made a ""real difference to his confidence"".
That appeared to be the case, because it did not get any better last term.
There was a further warning from Guardiola, who said in January: ""Do I want the Jack that won the Treble? Yeah I want it, but I try to be honest with myself for that. They have to fight.""
In fact, his involvement with the side for last season dropped to 30%, while 16 starts in total is his fewest in a campaign since he was 20 years old - and as a result, unsurprisingly it was his least productive season since 2019.
Former England winger Theo Walcott has suggested Grealish's ""incredible talent"" had been ""coached out of him"", but others close to the player disagreed that the manager had in some way drilled the creativity out of him.
Grealish's days were clearly numbered when he was excluded from City's final game of the season at Fulham, despite Guardiola giving an impassioned defence afterwards by saying his large squad means he has to leave out ""five or six players"" and that it was ""nothing personal with Jack"".
But he was also dropped from City's squad for the Club World Cup in the United States in the summer, instead working individually at the training ground in Manchester.
During an open training session on 5 August, Grealish was fully engaged in the tactical sequences and did not give off any vibes of a player that wanted to leave.
There has been no public falling out between Grealish and Guardiola, but after the disappointments of the last two seasons, the chance to drag his career back on track with the Toffees is surely one he will relish.
",BBC
Spurs open talks to sign Man City's Savinho - but how would he fit?,Tottenham express interest in signing Brazil winger Savinho during talks with Manchester City.,https://www.bbc.com/sport/football/articles/clyddxxgx9wo?at_medium=RSS&at_campaign=rss,"Mon, 11 Aug 2025 08:16:13",Sami Mokbel,"['Manchester City', 'Tottenham Hotspur']","Tottenham are in talks with Manchester City over a move to sign Brazil winger Savinho.
Discussions have been held between the two clubs in recent days over a possible deal for the 21-year-old.
Negotiations are at an early stage and it remains to be seen whether City will sanction a move for the Brazil international.
Sources have told BBC Sport that City are not looking to sell Savinho and that it would take offers of more than £50m for the club to consider doing so.
Should City obtain a fee in that region, the club would make a substantial profit on a player they signed from French club Troyes for £30.8m just a year ago.
Savinho was a regular under Pep Guardiola last season, scoring three times in 48 appearances across all competitions.
But City signed France winger Rayan Cherki from Lyon in a £30m deal this summer, which could limit Savinho's opportunities at the Etihad.
Tottenham head coach Thomas Frank is keen to bolster his attacking options after Son Heung-min was sold to Major League Soccer side LAFC last week.
Mohammed Kudus arrived in a £55m deal from West Ham earlier this summer, while the club failed to secure a £60m deal for Nottingham Forest playmaker Morgan Gibbs-White.
Spurs' need for attacking reinforcements has been heightened since midfielder James Maddison was ruled out for the majority of the upcoming season with a knee injury.
The England international sustained an anterior cruciate ligament (ACL) tear during a pre-season friendly draw against Newcastle United in Seoul, South Korea, earlier this month.
Where would Savinho fit in at Spurs?
After scoring nine league goals as Girona finished third in La Liga in the 2023-24 season, Savinho managed just one in his debut Premier League campaign.
That wasn't for the want of trying - only Erling Haaland and Kevin de Bruyne had more attempts on goal for City. But a lack of ruthlessness resulted in the Brazilian underperforming his expected goals total by four, the worst figure of any Premier League player last term.
However, the 21-year-old did offer plenty of creativity, registering eight top-flight assists, more than any of his team-mates. His tally of 46 chances created was the club's third highest, while he also showcased his ability to run at opposition defenders, attempting 102 dribbles - second only to Jeremy Doku among City players.
Tottenham are well stocked in wide areas despite the departure of Son Heung-min, with four players - Mohammed Kudus,  Wilson Odobert, Mathys Tel and Brennan Johnson - likely to compete for two starting spots in Thomas Frank's 4-2-3-1 formation.
But they are short of attacking midfielders - Maddison will take a long time to recover from his ACL injury, while Dejan Kulusevski is recovering from a long-term patella issue.
Savinho, who is left footed, made two-thirds of his league appearances for City on the right, while he predominantly played for Girona on the left. While there seems little prospect of him being deployed centrally by Spurs, his arrival could free up Mohammed Kudus to play there. Kudus, who has impressed in pre-season, was occasionally used as a number 10 by West Ham and also has experience in that role for Ajax and Ghana.
",BBC
Spurs open Eberechi Eze talks as they try to beat Arsenal to Crystal Palace attacker,Arsenal have been ahead but want to make sales first,https://www.theguardian.com/football/2025/aug/12/spurs-open-eberechi-eze-talks-arsenal-crystal-palace,"Tue, 12 Aug 2025 07:48:22",Jacob Steinberg,"['Arsenal', 'Tottenham Hotspur']","Tottenham have opened talks over a move for Eberechi Eze and are pushing to beat Arsenal to the Crystal Palace attacker.
Eze, whose £68m release clause expires on Friday, is the subject of a tussle between the north London rivals. Arsenal have been leading the race for the England international but are yet to send an offer to Palace. They have indicated they need to make sales in attack before pressing ahead with their pursuit of Eze.
The delay from Arsenal, who are looking for buyers for Leandro Trossard, has opened the door for Spurs to act on their longstanding interest. Thomas Frank, the new Spurs manager, needs attacking additions after losing James Maddison to a long-term knee injury and missing out on the signing of Nottingham Forest’s Morgan Gibbs-White. They can offer Champions League football to Eze after winning the Europa League last season.
An agreement is yet to be reached, though, and Spurs do not intend to meet Eze’s clause. A further complication for Spurs is that Arsenal are believed to be the 27-year-old’s favoured destination should he leave Palace.
Arsenal, who have bolstered their attack with the additions of Victor Gyökeres and Noni Madueke, have shown ambition this summer as they look to win the title for the first time since 2004. They have spent close to £200m and would like to shift unwanted players. Trossard has fallen down the pecking order in attack and Fábio Vieira has no future at the club.
Arteta is understood to have identified Eze as a player capable of giving Arsenal an extra edge against deep defences. Creativity was a problem for the Spaniard’s team last season. Their hopes of keeping up with Liverpool foundered on a chronic lack of ruthlessness, causing them to draw too many winnable games.
Palace, who have lost their appeal to be reinstated to the Europa League, will hope to hold on to their best attacker. Eze, who hopes to earn a spot in England’s squad for next summer’s World Cup, scored the winner in last season’s FA Cup final and has developed into one of the league’s most dangerous talents.
Palace are trying to sell Marc Guéhi to avoid losing the defender for nothing next summer when his contract expires. He is a target for Liverpool.
",TheGuardian
‘Perfect modern player’: Hugo Ekitiké has all the attributes to thrive at Liverpool,Frenchman’s display of natural ability during spells in Denmark and Germany is a positive indicator for his move to Anfield,https://www.theguardian.com/football/2025/aug/12/hugo-ekitike-attributes-to-thrive-at-liverpool,"Tue, 12 Aug 2025 07:00:15",Will Unwin,['Liverpool'],"Hugo Ekitiké is a £79m striker who has swapped the Bundesliga for the Premier League champions and is preparing to test himself against the best defenders in England and Europe. Four years ago, he was struggling to make the breakthrough at his boyhood club Reims and was sent on loan to Denmark to learn about football and himself.
Ekitiké arrived as an 18‑year‑old in the city of Vejle in January 2021 to join a club primed for a relegation battle, a world away from what he can expect at Liverpool. Although a naturally confident person, he took time to settle into life away from home. But it was quickly apparent Ekitiké possessed natural ability and electrifying pace with which to torment teammates in training and excite his manager. First, though, he needed to get up to speed with the Danish league and began with a cameo off the bench in a goalless draw against Aarhus.
“We put him on for the final 10 minutes as a striker and he didn’t play very well, but that is normal,” the former Vejle head coach Constantin Galca says. “You need a little time to adapt to the team. But the next game we put him left-wing. We saw before in the clips of him that he had good control, good speed. Before he was playing more as a striker, but we thought he would be dangerous on the wing. He’s a perfect player for modern football because he has all the attributes: pace, skill, physicality and finishing.”
Ekitiké showed for Liverpool on Sunday, in the Community Shield against Crystal Palace, why Galca thought he would be an asset on the wing. Although he started as the central striker, he cut in from the left and curled the ball into the corner for the opener. If Alexander Isak arrives from Newcastle in the next few weeks it could be a useful option for Arne Slot.
At Vejle, Ekitiké’s naivety was as obvious as his talent and he had to bide his time. It was almost two and a half months, during which he made four substitute appearances, before Ekitiké was given a start, at Odense.
“Denmark is a hard place to move to in winter for anyone,” Galca says. “The days are short, the nights are long and it is very cold. But step by step, he spoke a little more. He became more settled in the environment and got to know his teammates.
“He worked very hard every day and earned the confidence of his teammates. He was very smart, learning and adapting to our philosophy very quickly.”
Ekitiké became a big part of the dressing room. When the music played he was first up to dance, trying to encourage his more conservative Danish teammates to join in. He is remembered at the club for an infectious smile and was embraced, despite the pleasure he took in humiliating more experienced colleagues in training with his quick feet and dribbling prowess.
At Reims the following season Ekitiké was better equipped to deal with everything. He scored 10 Ligue 1 goals and in July 2022 Paris Saint-Germain took him on loan before making the deal permanent a year later for €35m. He was transferred to Eintracht Frankfurt in 2024 for just under half that.
Considering the figures for which the 23-year-old has been sold, it is surprising he is yet to make his full international debut, even allowing for the talent at France’s disposal. The clubs have, in essence, paid for potential and Liverpool feel that if he continues at the same rate of progression he will become one of the world’s leading marksmen. He scored 15 times in 33 Bundesliga games for Eintracht Frankfurt last season.
“It doesn’t matter if he played facing or with his back to the goal, he always had a solution, regardless of the situation, whether he was close to goal or further back up the pitch,” Galca says. “It proved he had good quality, because it is difficult to think of the solution before receiving the ball and then play fast when you get it.”
Galca often used Ekitiké as a winger. The player’s key contributions in the battle for survival included scoring twice in a crucial victory over Horsens and once in a draw with Odense. The trick for Galca was getting him to use his skills at the right time.
Galca is head coach at Rapid Bucharest after an eclectic coaching journey and follows Ekitiké’s progress closely. He spent most of his playing days in Spain and won 68 caps for Romania. During a spell managing Espanyol he had a young Marco Asensio on loan from Real Madrid.
“Marco was similar, playing at a very high level, but Ekitiké has more quality one against one,” he says. “He works harder, he has better physical condition … He would always score more goals because he is the better finisher.”
Vejle offered Ekitiké a grounding and an understanding of a different football world. He was smart enough to seize it and has taken this attitude to Anfield.
",TheGuardian
Premier League 2025-26 preview No 13: Manchester City,"Squad will need to adapt quickly to Pep Guardiola’s evolutionary tactics, while a battle looms between James Trafford and Ederson for the No 1 jersey",https://www.theguardian.com/football/2025/aug/12/premier-league-2025-26-preview-no-13-manchester-city,"Mon, 11 Aug 2025 23:01:05",Will Unwin,['Manchester City'],"Guardian writers’ predicted position: 3rd (NB: this is not necessarily Will Unwin’s prediction but the average of our writers’ tips)
Last season: 3rd
Prospects
Plenty of money, about £300m, has been spent over the past eight months to get City back on track after a disastrous season by their standards. They finished a distant third and lost the FA Cup final, leaving them trophyless. The latest crop of incomings got a brief taste of life under Pep Guardiola at the Club World Cup and all showed promise. After Rodri missed most of last season, it feels as if his fitness will decide the fate of the team. If Guardiola can get him back to his best – and keep him fit – after a horrible injury, then City can feel excited once again.
Guardiola has indicated City need to adapt to the evolution of football, having struggled with the increase in physicality and fitness that has blunted their skills. There could be a greater emphasis on dribbling past opponents to try to open up the spaces. Rayan Cherki, Phil Foden, Jérémy Doku and Savinho will be extremely important in a post-Kevin De Bruyne world. City struggled more than ever when it came to breaking down teams last season and Guardiola felt his team were unable to cope with the physicality of others.
It will be interesting to see who gets the nod in goal on the opening weekend. Ederson has been Guardiola’s No 1 for years, but the arrival of James Trafford could change that. The Brazilian has redefined the position and Trafford, a former City academy player, is part of a new generation who followed his strategy and have attempted to replicate his ability to distribute the ball short and long. Trafford is young and not the finished article, but he has all the qualities to be a world-class goalkeeper for years to come.
At the other end, Erling Haaland will be as dangerous as always, with fitness the only question mark hanging over him after some disruptions. Unlike this time last year, Guardiola has a second striker he can all upon if needs be in Omar Marmoush. The Egyptian was integral in reigniting City’s season after arriving in January and should be fully settled, giving them extra dimensions.
The manager
Pep Guardiola took last season personally, upset with himself for failing to arrest the slide and irritated by underperforming players. He will not accept a similar showing this season, especially after the sizable outlay on reshaping the squad. Guardiola overhauled his coaching staff, with the most eye-catching appointment being Jürgen Klopp’s former No 2 Pep Ljinders, who joins as an assistant coach. The change in personnel will bring new ideas, something Guardiola was seeking as he sought a refresh on the pitch and in the dugout.
Off-field picture
Those pesky charges just will not go away for Manchester City and the Premier League. It feels as if this situation has dragged on since Adam was a lad and rivals will continue to use it as a stick to beat the club with, while City plead innocence and claim a witch-hunt. No one is satisfied with the state of affairs and everyone will want finality as soon as possible because it is a constant distraction. A freeze on ticket prices brought some goodwill after lengthy criticism of the club’s desire to squeeze every penny they could out of supporters.
Star signing
It is a positive that City finally have a proper left-back in Rayan Aït-Nouri, but Rayan Cherki is the more exciting acquisition. The 21-year-old has been linked with top clubs since his teenage years, but City finally got their hands on Lyon’s attacking midfielder, who falls into the maverick category. He dribbles, creates and scores goals, while also possessing the ability to produce the unpredictable with the ball at his feet, and he can play in numerous positions behind a striker. It is hard to predict what he will do next, which will concern defenders. In an era when football is prescribed, Cherki can be the rule breaker.
Stepping up
A year ago, Oscar Bobb scored in the Community Shield to signal he was about to break out. He had enjoyed a great pre-season and Guardiola was confident in his qualities. The highly rated Bobb was the reason City were happy to part with Cole Palmer, thinking they had someone who could surpass him in their ranks. Unfortunately for Bobb, he broke a leg in training and required a lengthy rehabilitation period, taking longer than anyone expected, meaning he made three Premier League appearances, all as a substitute. There is greater competition in the positions he wants to play, but given a chance he could be a star turn.
A big season for …
By his own admission, 2024-25 did not live up to Phil Foden’s high standards. From claiming the Professional Footballers’ Association’s player of the year award for the previous season, Foden dropped off dramatically. He attributed the problems on the pitch to various factors, including facing challenges “off the pitch mentally” and it is understandable that those affected his ability to perform. The 25-year-old is a generational talent, possessing everything his manager wants in a player, and he will be desperate to show it. Given the correct freedom, he should be the man leading the latest incarnation of Guardiola’s football and a new era at City.
",TheGuardian
