Title,Summary,Link,Date,Author,Teams,Article,Outlet
‘It’s offensive’: voices from Iran as fans face 2026 World Cup travel ban,"After Donald Trump banned Iranians from entering the US, one of the co-hosts, there are different views on what should be done",https://www.theguardian.com/football/2025/jul/05/iran-fans-2026-world-cup-us-donald-trump-travel-ban,"Sat, 05 Jul 2025 07:00:05",John Duerden,['Manchester City'],"“It’s offensive for any football fan to be prevented from participating in the World Cup, not just Iranians,” Ali Rezaei of Tehran’s Borna News Agency says. In March, the national team became the second to qualify for the 2026 World Cup that will be hosted by Canada, Mexico and the United States. In June, Donald Trump authorised the dropping of bombs on Iran and hit the country with a travel ban. As things stand, while the national team will be able to enter the US next summer, fans – and perhaps media – will not.
Residents of Tehran and other cities may have had enough to deal with of late, but still, being barred from entry stings, even if Iranians have long found it difficult to get into the US. “If the US government has issues with the Iranian regime for any reason, it should not result in discrimination against Iranian citizens,” Behnam Jafarzadeh, a writer for leading sports site Varzesh3, says. “If someone hasn’t committed any illegal activity, why should they be punished? It’s not just about the World Cup – the policy needs to change in general.”
What can Iran do? “Boycotting the World Cup is not a solution,” Siavash Pakdaman, a Tehran-based fan, says. “Refusing to play on US soil would be a dangerous precedent – any host country could start excluding teams it has issues with. Just as the Iranian delegation can and should be present at the United Nations in the US, the Iranian team should also play on American soil if the draw requires it – without relocation.”
There is a feeling that staying away would not make much difference anyway. “It would only deprive the national team of the opportunity to participate in a major tournament and would ultimately hurt Iran more,” Jafarzadeh says. “It might even be welcomed by some American officials. It could make headlines briefly, but once the tournament starts, it will be forgotten and will have achieved nothing.”
Questions have been asked – including in Iran, whose supreme leader, Ayatollah Ali Khamenei, has long banned competing against Israeli athletes – about what the international reaction would have been if Qatar had banned citizens from certain nations from attending the 2022 World Cup.
“If the USA makes it difficult for football fans to attend, then changing the host country is necessary,” Rezaei says. “Doing so would harm the USA’s reputation, not the World Cup’s. If strict entry rules remain, we should focus on protecting football. This is supposed to be a celebration of sport.”
Jafarzadeh is not confident that the competition could be taken away from the busiest of the three hosts. “It is not a challenge Fifa and [its president Gianni] Infantino would want to take on.” Perhaps there is another way. “Fifa should use all of its influence to push for a suspension of this policy at least during the World Cup.”
Fifa may find it easier to place Iran in Canada or Mexico and hope that Iran don’t make it to the latter stages, when there would have to be a game in the US. “Playing in Mexico or Canada is not a real solution – it just ignores the actual problem,” Rezaei says.
Many expect it to happen anyway. “Canada has a large Iranian immigrant population, although some of them are opponents of the Iranian regime and the national team can’t count on their support,” Jafarzadeh says. “Mexico is probably a more attractive and less controversial destination for the team.”
That is another question. The Iranian-American community is more than a million strong yet many of these headed west before, or in response to, the Islamic Revolution of 1979.
“It seems that many Iranians who oppose the government consider the national team to be a representation of the regime – which I believe is wrong,” Pakdaman says. “And since a larger number of these opponents live in the US, the team may face pressure from the audience during the matches. Of course, I hope my analysis is wrong.”
Jafarzadeh, who went to the World Cups in Russia and Qatar and would love to go to the United States, says: “Some see the team as one that represents the regime, and this sentiment is even stronger among Iranians living abroad. Of course, the war with Israel has stirred feelings of patriotism among many Iranians, but I’m not sure if this will translate into support for the national team. We’ll have to wait and see how things unfold in the coming months.”
That there is time is perhaps a small reason for optimism that things could change. Iran is one of 19 countries subject to a full or partial US entry ban. Several of the others retain hope of qualifying for the first 48-team World Cup, including Sudan, Sierra Leone, Venezuela and Haiti.
“Considering that there is almost a year left until the 2026 World Cup, there is a possibility that the situation may stabilise,” says Isa Azimi, a columnist and translator, regarding Iran’s situation, though he is not confident. “Despite claims of separating politics from football, Fifa has shown that it is not particularly independent when facing major political powers.”
Especially when Infantino appears to prize his close relationship with Trump. “If Fifa considers itself a global body independent of governments, it must stand up to such laws and not allow politics to contaminate the world of sports,” Pakdaman says. “Of course, we all know that, unfortunately, such contamination exists – especially when one side of the issue is a superpower that answers to no one. It is Fifa’s duty to treat all member countries equally, but will that actually happen?”
",TheGuardian
Kyle Walker closes in on shock £5m move to Burnley from Manchester City,Right-back will sign two-year deal at Turf Moor,https://www.theguardian.com/football/2025/jul/04/kyle-walker-shock-5m-transfer-burnley-manchester-city,"Fri, 04 Jul 2025 19:32:10",Will Unwin,"['Manchester City', 'Tottenham Hotspur']","Kyle Walker is poised to make a surprise move from Manchester City to Burnley after the two clubs agreed a £5m deal for the right-back, who will sign a two-year deal at Turf Moor.
The 35-year-old England international, who spent the second half of last season out on loan at Milan, played alongside Scott Parker at Tottenham and will reunite with his former teammate once he has completed a medical. Burnley have been seeking Premier League experience in the transfer market as they bid to survive in the top flight after earning promotion from the Championship.
The move to Burnley will allow Walker to stay in the north-west, something he has been eager to do following his six months in Italy. Walker had interest from across the globe but wanted to stay close to his family. Everton were previously interested in signing the defender but Walker has eventually been lured to Burnley.
Walker, who has 96 international caps, won 17 trophies during his time with City but was keen for a new challenge last season. Pep Guardiola sanctioned the temporary move to Milan and left him out of the Club World Cup squad, signifying he would not return to the first-team fold once his loan had come to an end.
He will become the club’s fourth signing of the summer after fellow defenders Axel Tuanzebe, Quilindschy Hartman and goalkeeper Max Weiss.
Meanwhile, Newcastle have agreed a £55m fee with Nottingham Forest for Anthony Elanga, with the winger set to complete a move to the Champions League side in the coming days.
The winger’s personal terms are not thought to be an issue and the signing of the Sweden international will end a year-long pursuit by Eddie Howe. Newcastle tried to sign Elanga last summer but the Forest owner, Evangelos Marinakis, was adamant he would not be sold.
A fee of £55m was seen as too good to refuse for a player the club purchased for £15m two seasons ago from Manchester United.
The 23-year-old has excelled at the City Ground helping Forest to qualify for Europe for the first time in more than 30 years. Last season he scored six goals and created 11 more in his 38 appearances as Forest finished seventh in the league.
Forest will make the 22-year-old PSV winger Johan Bakayoko, who has been tracked by Borussia Dortmund and by rival Premier League clubs, a prominent target if Elanga departs.
",TheGuardian
"Garnacho, Rashford and Sancho among five who tell Manchester United they want out",Antony and Malacia also ask for transfers,https://www.theguardian.com/football/2025/jul/04/marcus-rashford-to-report-for-pre-season-training-at-manchester-united-next-week,"Fri, 04 Jul 2025 14:58:00",Will Unwin,"['Manchester United', 'Tottenham Hotspur']","Alejandro Garnacho and Marcus Rashford are among five players who have asked to leave Manchester United and been told they do not need to return for pre-season training next week. Antony, Tyrell Malacia and Jadon Sancho have also requested transfers and been given more time away from the club to sort their futures.
Rashford, whose No 10 shirt has been given to the new signing Matheus Cunha, was sent on loan last season with Malacia, Antony and Sancho and it was always unlikely they would have a future under Ruben Amorim. Garnacho struggled for minutes in the latter part of the season and was a substitute in the Europa League final defeat by Tottenham. “I played 20 minutes today – I don’t know,” he said after that game. “I’m going to try to enjoy the summer and see what happens next.”
The club have made their rehabilitation and medical facilities available to the five players but they will not be part of group sessions. If any fail to secure a departure, they will be welcomed back to train at Carrington later in July.
Garnacho has been linked with Chelsea, and Rashford has interested Barcelona, who have missed out on the Athletic Bilbao winger Nico Williams, who has signed a new 10-year contract, enhancing the chances that the England international will head to Catalonia. Rashford has spent time working with a personal trainer in Spain to maintain fitness.
Malacia was on loan at PSV last season but the full-back’s fitness record has meant interested parties are in short supply. Chelsea did not take up their option to sign Sancho permanently but talks with Juventus have been held recently. Antony impressed at Real Betis after a disastrous spell at Old Trafford.
United informed Rashford’s representatives of the fact that Cunha would take the No 10 shirt. The change is said not to be related to the forward’s clear desire to leave.
United are working to overhaul the squad to make it more suited to Amorim’s style of play. They have signed Cunha from Wolves and are working on a deal to sign Bryan Mbeumo from Brentford after having two bids rejected for the Cameroonian.
United’s finances mean they need to sell if they want to buy and they will hope to get about £60m for Garnacho, an academy graduate, which would ease the situation. The four forwards’ wages will limit the number of prospective suitors.
",TheGuardian
Mourners gather in Portugal for Diogo Jota’s wake as Salah and Robertson pay tribute,Mourners gathered on Friday morning to honour Liverpool footballer Diogo Jota at a vigil in Portugal,https://www.theguardian.com/football/2025/jul/04/diogo-jota-portugal-liverpool-wake-tributes,"Fri, 04 Jul 2025 14:38:01",Andy Hunter,['Liverpool'],"Mourners have gathered at a vigil in Portugal to commemorate Diogo Jota and his brother, André Silva, following their deaths in a car accident.
Jota and his 25-year-old sibling died when the Lamborghini they were travelling in careered off a road in north-western Spain in the early hours of Thursday. The bodies of the two professional footballers were returned to Portugal later that day. Jota was 28 and had married his long-term partner, Rute Cardoso, 11 days before his death. They had three young children.
José Manuel Macedo, parish priest at the Igreja Matriz de Gondomar in São Cosme, said that a vigil for the brothers was taking place at the nearby Capela da Ressurreição on Friday before their funeral at the Igreja Matriz church on Saturday at 10am. Jota and Silva grew up in Gondomar, a small city east of Porto.
Liverpool have chartered a plane to take club staff to Portugal before the funeral service. Liverpool players, most of whom are currently on holiday, will also be in attendance. The majority were due to report back for the start of pre-season training early next week but all football-related activity at the club, from first team to academy level, has been put on hold. The club’s priority is supporting Jota’s bereaved family.
On Friday Mohamed Salah said Jota’s death had left him dreading going back to Liverpool. “I am truly lost for words,” he wrote on social media. “Until yesterday, I never thought there would be something that would frighten me of going back to Liverpool after the break. Teammates come and go but not like this. It’s going to be extremely difficult to accept that Diogo won’t be there when we go back.
“My thoughts are with his wife, his children, and of course his parents who suddenly lost their children. Those close to Diogo and his brother Andre need all the support they can get. They will never be forgotten.”
Jota had been working with Dr Miguel Gonçalves in Portugal before his return to pre-season training, having undergone a procedure on his lung. In an interview with Portuguese media outlet Record, Dr Gonçalves said: “I said goodbye to him and his brother, André, at around 8.30pm. His brother was a great companion and decided to go with him, to accompany him on the trip, and that way they would also spend more time together.
“They were going to travel at night because it was cooler, but they weren’t going direct. He told me that the journey would take about eight hours but that they would stop at a hotel in the Burgos area to rest. Diogo was very aware of his professionalism. They were only supposed to arrive in Santander today [Friday], catch the boat and then go to England. The family would arrive later by plane, organise their lives over the weekend and then, on Monday, they had a medical appointment scheduled in Liverpool to assess the situation.”
Dr Gonçalves claimed Jota was receiving specialist treatment over a collapsed lung. He added: “I started working with him last Saturday and I was with him every day until this Wednesday. I said goodbye to him at dinner time. He made an extraordinary recovery, he was undoubtedly an unparalleled professional. He strictly followed what I told him, as you could see in the way he was recovering.
“The base of his right lung had collapsed a little, but with the post-surgery physiotherapy he was practically flawless. When I left him yesterday he was no longer in pain and was going to return to Liverpool. He was excited, confident in his recovery and enthusiastic about the next season. He told me that he would not go on the pre-season tour that Liverpool is going to Japan to strengthen his recovery, he believed he was going to have a great season.”
Liverpool players have spoken of their pain in paying tribute to their teammate. Virgil van Dijk, the captain, said on Instagram he was “absolutely devastated and in total disbelief”. The defender wrote in a post alongside a picture of Jota with the Premier League trophy: “What a human being, what a player, but most importantly what an unbelievable family man.
“You meant so much to all of us and you always will! For your family to lose two sons, a husband and a father is just unimaginable. So cruel and unfair. My heart is breaking for all of your beautiful family, for Rute and for your kids. I promise you that in these difficult times and beyond we will always be there for your family.
“A champion forever, number 20 forever. It’s been a privilege to have stood by your side on the pitch, and to have been your friend off it. We will miss you beyond words and never forget you. Your legacy will live on, we will make sure of it! Rest in perfect peace Diogo & André.”
Andy Robertson, a close friend of the popular striker, also paid an emotional tribute. “The ones I’m thinking about most right now are the family. Their loss is too much to bear,” the Scotland left-back posted on Instagram. “I’m so sorry that they have lost two such precious souls – Diogo and André. For the team and the club, we’ll try to cope with this together … however long that takes.
“For me, I want to talk about my mate. My buddy. The bloke I loved and will miss like crazy. I could talk about him as a player for hours, but none of that feels like it matters right now. It’s the man. The person. He was such a good guy. The best. So genuine. Just normal and real. Full of love for the people he cared about. Full of fun. He was the most British foreign player I’ve ever met. We used to joke he was really Irish ... I’d try to claim him as Scottish. I even called him Diogo MacJota. We’d watch the darts together, enjoy the horse racing. Going to Cheltenham this season was a highlight – one of the best we had.
“The last time I saw him was the happiest day of his life – his wedding day. I want to remember his never-ceasing smile from that magical day. How much he was bursting with love for his wife and family. I can’t believe we’re saying goodbye. It’s too soon, and it hurts so much. But thank you for being in my life, mate – and for making it better”.
The former Liverpool captain Jordan Henderson returned to Anfield on Friday to pay his own respects to Jota. Henderson was visibly moved as he laid flowers among the huge number of tributes to the striker and spent time reading some of the messages in memory of Jota and his brother. The Ajax captain, who played alongside Jota for three seasons, later signed the book of condolence that Liverpool have opened inside the stadium.
“Jots it was a pleasure to share a pitch with you but more importantly a friendship,” Henderson wrote on Instagram. “All the laughs we had off the pitch and trying to find ways to wind milly [James Milner] up and get him fined, which we never could. Taking pictures of me asleep on the bus travelling then sending them to me later. You always wanted to have a laugh and were a pleasure to be around.
“I know how much Rute and your family meant to you and I know you will always be looking down on them. Thank you for everything you brought into this world, we will all miss you.”
 A delegation from Everton that included their two Portuguese-born forwards Beto and Youssef Chermiti also visited Anfield to pay tribute to Jota, whose final goal came against them in the Merseyside derby in April. The Everton players and club ambassador Ian Snodin were applauded by Liverpool fans as they each left a wreath outside the stadium. One read: “Our city is united in grief. With deepest sympathy from all at Everton Football Club.”
At Wimbledon, the Portuguese pair Nuno Borges and Francisco Cabral paid tribute to their compatriot by wearing black ribbons on court. Borges wore the item on his cap during his third-round singles match with 17th seed Karen Khachanov after Cabral donned one on his shirt sleeve during his doubles match earlier on Friday as the All England Club relaxed its strict all-white dress code to allow tributes to the Liverpool forward.
Uefa has announced that a moment of silence will be observed at Women’s Euro 2025 matches on Friday, as they were on Thursday.
",TheGuardian
Anxiety and excitement combine for Williamson with Wiegman’s new England,Lionesses captain admits much has changed since 2022 with the manager stressing that team has to move on as they prepare for France,https://www.theguardian.com/football/2025/jul/04/euro-2025-williamson-wiegman-new-england-france,"Fri, 04 Jul 2025 18:02:14",Suzanne Wrack,['Arsenal'],"Leah Williamson said she had felt anxious in the buildup to ­England beginning their European title defence against France on Saturday night, the Arsenal defender having missed the 2023 World Cup after an anterior cruciate ligament injury.
“I’ve probably held some anxiety up until this moment just because I wanted to be here and I wanted to be here with the team and I wanted to experience another ­tournament with England,” said the ­Lionesses’ captain. “It’s special when you come to another country, to ­represent your country and just take ­everything in. It’s a bit different to England in 2022. I’m very excited but so much has changed, so I’m intrigued to come back and enjoy this ­tournament football.”
England look different from the team that beat Germany in the final in 2022. Millie Bright stepped back to protect her mental and physical health and Jill Scott, Ellen White, Rachel Daly, Mary Earps and Fran Kirby have retired completely or, in the case of the last two, retired from ­international duty. The mantra has been that this is a new England.
“The team has been a bit in ­transition, of course,” the manager, Sarina Wiegman, said, “and we ­absolutely cherish what we have done before, and we never forget it, and those are lifetime experiences for us and for our families and also for the fans. But you have to move on and you have to be on top. Things are changing very quickly, so we have to, too. We came together in February and we said: ‘It’s a new challenge.’ The approach was there anyway, but we called it the New England.”
France have changed too, but there are familiar faces everywhere, not least in the dynamic Chelsea forward Sandy Baltimore. How do you stop her? “Whisper in her ear,” said Lucy Bronze, her Chelsea teammate, with a grin. What do you say? “Nothing in English,” the England full-back said, still grinning.
Bronze, competing at her seventh major tournament having been part of every Euros and World Cup squad since 2013, has probably played with or against most players in ­Switzerland for Euro 2025.
There is one absent face in ­particular she will miss, though – that of the France centre-back Wendie Renard, who was dropped by the manager, Laurent Bonadei, along with Kenza Dali and Eugénie Le ­Sommer. It is a testament to Bronze’s competitive nature that she was unhappy about Renard’s omission.
“I want to play against Wendie,” she said of her former Lyon ­teammate. “I want to play against the ­strongest French team. I want Wendie to be playing, defending corners and I can jump over her and win the ball. ­Winning a header over Wendie Renard, that’s an achievement.”
Renard’s replacement as France’s captain, Griedge Mbock, another former Lyon clubmate of Bronze’s, is a doubt. The Paris Saint-Germain centre-back has been training ­separately after a calf injury. The potential stand-in, 21-year-old Alice Sombath, who has four caps, was also at Lyon with Bronze. “She’s probably got more maturity than people might give her credit for,” Bronze said.
France have an enviable ­attacking lineup that includes Kadidiatou Diani, Baltimore and Marie-­Antoinette Katoto. “I think England have one of the best attacking lineups,” said Bronze. “The type of attackers France have got, we have quite similar, and as defenders we defend against that every day in training.”
Sign up to Moving the Goalposts
No topic is too small or too big for us to cover as we deliver a twice-weekly roundup of the wonderful world of women’s football
Bronze has played in some of the best teams in the history of women’s domestic football, so where does ­England’s front three, likely to be drawn from Alessia Russo, Lauren Hemp, Beth Mead, Lauren James and Chloe Kelly, rank in terms of ­providing that top-level test of a defender in training?
“I’d say it’s similar to those kinds of teams that I’ve been in,” said Bronze. “I might be playing up against Hempo for 30 minutes and then it’s LJ, then it’s Chloe; it’s just non-stop, and they’ve all got such ­different ­attributes. Even someone like Michelle [Agyemang], who is relatively young, just runs into ­people and bodies them because she’s so strong.”
James is ready to play more ­minutes, said Wiegman, after returning from a hamstring injury as a ­substitute against Jamaica last weekend. “I won’t give you the lineup but she played 30 minutes last week so she can play more than that,” the manager said.
After France, England face the 2017 European champions, the ­Netherlands, on Wednesday before completing the group stage against Wales. It has been referred to as the group of death. There is little room for error.
Bronze said it was “a good and a bad thing” having to start against a serious contender. “If we lose that game, everyone says it’s the worst; if we win that game, it’s the best,” she said. “We just try to look at the positives: the fact that we get to test ourselves against the good teams straight away. There’s no surprises going through the tournament. We know the standard that you have to be at. When you get to these kinds of tournaments, you want to play in the big games against the best ­players. Why not have it in your first game? It makes it more exciting.”
",TheGuardian
