Title,Summary,Link,Date,Author,Teams,Article,Outlet
Ekitike's Anfield debut & Nunez's future - Liverpool wins vs Athletic Club assessed,Liverpool secured back-to-back wins in a friendly double header against Athletic Club at Anfield on Monday. Here we examine some of the big talking points from their performance...,https://www.skysports.com/football/news/11095/13407066/liverpool-rio-ngumoha-hugo-ekitike-and-darwin-nunez-assessed-after-back-to-back-wins-against-athletic-club,"Mon, 04 Aug 2025 21:58:00",,['Liverpool'],"Liverpool secured back-to-back wins in a friendly double header against Athletic Club at Anfield on Monday. Here we examine some of the big talking points from their performance...
Both ahead of and since Hugo Ekitike's arrival at Anfield, the transfer has been met with questions as to how best the French forward fits into Arne Slot's plans but as he told LFCTV after the game, he is ""here to win"" regardless of where he plays.
A fee that could potentially rise to £78m removes any idea that the 23-year-old is bench-bound at Liverpool and is suggestive of a heightened role.
Interest in Alexander Isak has prompted further debate but in setting up Salah's opener, Ekitike showed he's more than just your typical No 9.
Down the left, after interchanging with Cody Gakpo, his skill and pass into Salah showed he's more than capable of slotting in to Slots' fluid front line.
""I am still trying to find connections with the others,"" Ekitke told LFCTV.
""But I enjoy playing with them. It is a pleasure to play with them; we have little things to fix, but I really enjoy playing with them.""
If the early signs are anything to go by, the Premier League will have much to fear when he eventually does find connections, as he already looks to have made Anfield home.William Bitibiri
""Rio [Ngumoha] is showing good things in every game in pre-season,"" said Arne Slot to LFCTV after the game.
That is a fairly understated assessment of the 16-year-old sensation from the Liverpool boss. Not only does he bring composure, quality and drive with the ball whenever he is in possession, he also sparks a wave of excitement among the supporters.
A rare gift in football, which is even more uncommon with players at the very early stages of their careers.
Without looking to pile too much pressure on someone who cannot even drive a car yet, he feels like the real deal.
Luis Diaz's exit to join Bayern Munich now provides the perfect opportunity for Slot to slowly integrate Ngumoha into the first team picture this season.
He only needed five minutes to register a goal and assist in this fixture. If he is given regular opportunities in the senior side this season, I think it could become quite a common occurrence for the young talent.Patrick Rowe
The embarrassment of riches within this Liverpool squad is immense. However, if you were going to pick one area where they seem light, it is at centre back.
Captain Virgil van Dijk missed this fixture due to illness and should be fit for the Premier League opener against Bournemouth, live on Sky Sports, on August 15. But more depth is needed.
Jarell Quansah's sale to Bayer Leverkusen and Joe Gomez's injury meant Wataru Endo started alongside Ibrahim Konate in the second fixture at Anfield.
Was it really a surprise when both of Athletic's goals came from set pieces? They missed Van Dijk's presence, leadership and physicality at the back.
""Two set-piece goals is not what you want, especially when you face Crystal Palace next week. It is something to work on,"" said Slot to LFCTV.
The investment in the squad has already been huge this summer and will likely continue. Aside from the saga involving Isak, signing a centre back to provide cover or competition for Konate and Van Dijk should be the priority.Patrick Rowe
Both Darwin Nunez and Harvey Elliott face uncertain futures at Liverpool, but everything from their respective performances to the reception from the Anfield crowd, you wouldn't be able to tell.
The pair started in the earlier 4-1 win over Athletic Club with Nunez scoring the second, displaying his striker's instinct as he tapped home a cushioned header from Ngumoha.
The Uruguay international's involvement didn't stop there as he teed up Elliott's goal with a neat touch and pass.
Sky Sports News understands that AC Milan are the latest side to be keen on Nunez's signature, but there's no love lost for the striker who walked through the doors from Benfica for a then-club record fee.
As for Elliott, he grabbed the badge and blew a kiss to the crowd, which may provide some indication as to where his head is at on his future at the club despite reported interest from elsewhere.William Bitibiri
August
15: Bournemouth (h) - 8pm, live on Sky Sports
25: Newcastle (a) - 8pm, live on Sky Sports
31: Arsenal (h) - 4.30pm, live on Sky Sports
September
13: Burnley (a) - 3pm
20: Everton (h) - 3pm
27: Crystal Palace (a) - 3pm
From next season, Sky Sports' Premier League coverage will increase from 128 matches to at least 215 games exclusively live.
And 80 per cent of all televised Premier League games next season are on Sky Sports.
",SkySports
Isak reports to Newcastle training ground after Liverpool bid rejected,Alexander Isak reported to Newcastle's training ground on Monday after his personal training camp in Spain - days after a bid from Liverpool of over &#163;100m was rejected by the Magpies.,https://www.skysports.com/football/news/11095/13406680/alexander-isak-transfer-news-newcastle-striker-back-at-training-ground-after-liverpool-bid-of-over-100m-rejected,"Mon, 04 Aug 2025 10:00:00",,['Liverpool'],"Alexander Isak reported to Newcastle's training ground on Monday after his personal training camp in Spain - days after a bid from Liverpool of over £100m was rejected by the Magpies.
The striker was back at Newcastle's facility on Monday morning after arriving back in the UK from Spain on Saturday afternoon.
Isak spent more than three hours inside and Sky Sports News understands he was receiving treatment for his thigh issue.
Eddie Howe and the rest of the Newcastle squad were not present as they recover from an overnight flight back from South Korea.
Isak had been training at his former club Real Sociedad's headquarters on his own, after missing Newcastle's pre-season tour of Asia.
Sky Sports News understands Liverpool's opening offer for Isak on Friday was £110m plus add-ons. However, the total offer did not reach £120m.
Newcastle do not want to sell, and value Isak at £150m. On Saturday morning, Newcastle made a £70m offer to RB Leipzig for Benjamin Sesko as they attempt to line up a replacement for Isak, should he leave.
Marcel Schafer, RB Leipzig's managing director for sport, confirmed on Saturday that clubs have made approaches for Sesko, who is also wanted by Manchester United.
""We won't go into detail on that but when I say that several clubs have shown strong interest and have made approaches, it's obvious what has happened,"" said Schafer.
The rest of the Newcastle squad are due back from their pre-season tour of Asia on Monday.
On Saturday, head coach Howe confirmed the club have turned down a bid from Liverpool for Isak, but is unsure on what will happen next.
""I am very much removed from anything that's happening back home,"" Howe said.
""I was made aware that there was a bid [on Friday] - that bid was turned down all before I even heard about it. There's people back in England dealing with the situation.
""I really don't know what's going to happen next, but from our perspective we still support Alex in every way, and my wish is still that we see him in a Newcastle shirt again.""
Howe revealed that he only found out about Isak training in Spain through the media and not from the player himself.
""I know where he is now - through the media,"" said Howe. ""So I think from that perspective, it is difficult to go into any type of detail.""
The 25-year-old has informed Newcastle that he wants to explore his options in this transfer window after Liverpool previously made an informal approach for him.
Liverpool play at Newcastle in the Premier League - live on Sky Sports - on August 25 on Monday Night Football.
Sky Sports Data Editor Adam Smith:
Alexander Isak scored 23 goals in the Premier League last season - second only to Mohamed Salah.
The Sweden international also outperformed his expected goals (20.42), underlining his elite-level finishing and composure in front of goal.
The 25-year-old consistently finds space around the penalty spot, where he converts a high proportion of his shots. But he's far more than a poacher: six of his 36 efforts from outside the box found the net - demonstrating his range and technique.
The chart below benchmarks Isak's per-90 stats against other strikers in Europe's top five leagues. He excels across a wide spectrum - from goalscoring and dribbling, to opposition-box entries and link-up play.
Newcastle have made a formal bid to RB Leipzig for Benjamin Sesko.
Sky Sports News understands the offer is €75m (£65.5m) plus €5m (£4.3m) in add-ons - which matches Leipzig's valuation.
Newcastle have presented their vision to the Slovenian striker and want the deal to happen.
Sesko is considering his options with Manchester United also at the table. The player is open to both projects and remains a top target for Manchester United.
It was thought Man Utd would have to make sales in order to bring in a striker. Whilst the priority is to offload players, it's understood Man Utd can buy before selling - provided there are sales before the window closes.
It's understood RB Leipzig are interested in Man Utd striker Rasmus Hojlund and have explored the conditions of a loan.
Howe added that Newcastle are only ""looking for the best"" in terms of transfer targets amid a challenging window for the club.
Not only have the Magpies been hit with Isak's desire to leave, but they have also missed out on a number of transfer targets to rivals, including Liam Delap, Joao Pedro, Hugo Ekitike and James Trafford.
Newcastle have also hit a roadblock in their pursuit of Yoane Wissa, although the Brentford striker was not part of their squad to face QPR in a friendly on Saturday as he continues to push for a move.
With Callum Wilson having departed earlier this summer, Will Osula is the only recognised first-team striker on their pre-season tour of Asia.
""We're looking for the best players that we can get,"" said Howe. ""Whatever our target position is, we're looking for the best so I see all situations open and available to us.
""I feel that's the only way that we're going to get to where we want to go, which is to maximise, and it's quality over quantity. It always has been. That's always been the way that we try to work and the way that we try to recruit, and I think we've done it pretty well to this point.
""It's been a challenging summer, because we've missed out on various targets for loads of different reasons, but we're still very competitive, and we're still in there trying to bring very good players to the club - and that won't change til the window shuts.""
From next season, Sky Sports' Premier League coverage will increase from 128 matches to at least 215 games exclusively live.
And 80 per cent of all televised Premier League games next season are on Sky Sports.
",SkySports
Papers: Newcastle hoping to hijack Liverpool's bid for Guehi,The top stories and transfer rumours from Tuesday's newspapers...,https://www.skysports.com/football/news/11095/13407060/newcastle-hoping-to-hijack-liverpools-bid-for-crystal-palace-defender-marc-guehi-paper-talk,"Mon, 04 Aug 2025 22:00:00",,['Liverpool'],"The top stories and transfer rumours from Tuesday's newspapers...
Newcastle are hoping to hijack Liverpool's bid to sign Crystal Palace defender Marc Guehi.
Real Madrid star Rodrygo has reportedly decided to stay and fight for his place at the Bernabeu this season, despite strong interest from Premier League clubs Liverpool, Arsenal and Tottenham.
Antony has turned down the chance to leave Manchester United for the third time this summer as he holds out for a return to Real Betis.

Newcastle are back in for Crystal Palace defender Marc Guehi with Eddie Howe set for Alexander Isak talks.
AC Milan and Al-Hilal expected to bid for Liverpool forward Darwin Nunez.


Chelsea have had a day of breakthroughs in sales with Kiernan Dewsbury-Hall, Lesley Ugochukwu and Armando Broja all closing in on permanent departures to fellow Premier League clubs.
Newcastle are pushing ahead to agree a deal with RB Leipzig for Benjamin Sesko after being given encouragement the striker wants to join.
Bernie Ecclestone has urged Lewis Hamilton to quit Formula One immediately, and to get his Ferrari contract paid out in full before 'anything bad' happens to him.
Raheem Sterling heads a list of NINE Chelsea players who are out of the first-team picture - literally. The former England international, 30, and eight other stars do not even have a profile or photo in the first-team section of the Blues' official website.
Andros Townsend has signed for Thai club Kanchanaburi Power, marking a move to the 16th different club of his career.
Ian Poulter is in danger of imminent relegation from LIV Golf, after the league issued a stark warning that, this time, there will be no safety net for those who finish in the bottom places - regardless if they are a team captain or not.
FIFA is facing a class-action lawsuit over its transfer rules that could include claims from every professional footballer who has played in the European Union or the United Kingdom since 2002, according to the newly created Dutch foundation behind the move.
Rangers will be without Mikey Moore for their crunch Champions League qualifier with Viktoria Plzen - but latest recruit Oliver Antman could line-up for the first leg showdown at Ibrox.


From next season, Sky Sports' Premier League coverage will increase from 128 matches to at least 215 games exclusively live.
And 80 per cent of all televised Premier League games next season are on Sky Sports.
",SkySports
Chelsea aiming to sign Simons and Garnacho this summer,Chelsea are aiming to sign both Xavi Simons and Alejandro Garnacho before the transfer window closes.,https://www.skysports.com/football/news/11095/13401889/alejandro-garnacho-xavi-simons-transfer-news-chelsea-aiming-to-sign-man-utd-and-rb-leipzig-forwards-this-summer,"Mon, 04 Aug 2025 14:10:00",,['Chelsea'],"Chelsea are aiming to sign both Xavi Simons and Alejandro Garnacho before the transfer window closes.
Chelsea are in talks to sign the two forwards, and discussions have been ongoing for some time, with good relations between all the clubs.
Simons was not in RB Leipzig's squad for their friendly on Saturday.
Sky Sports News reported last month that Bayern Munich are also interested in Simons, who has two years left on his contract.
Meanwhile, Garnacho is one of several players that Manchester United are looking to move on this summer.
United, who are expecting formal offers for Garnacho later in the window, are aware of Chelsea's interest in the forward, whose future is likely to be away from Old Trafford.
Man Utd boss Ruben Amorim said over the weekend to journalists in the USA that ""it's clear Garnacho wants a different thing with a different leadership"".
Amorim believes Garnacho is still a talented player but says things have not worked out for the 21-year-old academy graduate at Old Trafford.
""You can understand and you can see he's a really talented boy, and sometimes things don't work out,"" said Amorim.
""You cannot explain specifically what it is. But I have the feeling, I think it's clear that Garnacho wants a different thing with a different leadership, and I can understand that. So I think it's not a problem.
""Sometimes you adapt to one guy, you have the connection. Other times, you want a new challenge, so we try to make everything okay to all the parts. To the club, to the coach and to the players. It's a natural thing in football.""
Amorim also revealed that sales this summer are important because he wants a smaller squad this season, given United are not in Europe and will only fight on three fronts.
""I'm really happy with the team,"" said Amorim. ""Without European competitions, I want a small squad so everyone feels really important.
""If you have a lot of players, you have one week to prepare and a lot of players are going to be out, and then in training they will be frustrated and then the quality of the training will drop.""
Chelsea have agreed to a restriction on registering new players for UEFA competitions in the 2025/26 season, unless the value of new signings added to their squad is recouped in sales, after being fined - along with Aston Villa - by UEFA for breaches of its financial rules.
Chelsea have spent more than £250m this summer on eight new signings, with Ajax defender Jorrel Hato their latest addition, and there will be more incomings as players are sold and loaned out.
Nine players have left the club permanently, with Kiernan Dewsbury-Hall, Armando Broja, Carney Chukwuemeka, Marc Guiu and Lesley Ugochukwu also expected to leave Stamford Bridge.
Christopher Nkunku, Ben Chilwell and Raheem Sterling are also likely to leave, and question marks remain over the future of Nicolas Jackson.
Chelsea returned for pre-season training on Monday after having three weeks off since winning the Club World Cup.
Before their season opener against Crystal Palace on Sunday August 17, live on Sky Sports, Chelsea play Bayer Leverkusen on Friday and AC Milan on Sunday at Stamford Bridge.
In
Jamie Gittens - Dortmund, £51.5m
Joao Pedro - Brighton, £60m
Liam Delap - Ipswich, £30m
Jorrel Hato - Ajax, £38.5m
Estevao Willian - Palmeiras, £29m
Dario Essugo - Sporting, £18.5m
Mamadou Sarr - Strasbourg, £12m
Kendry Paez - Independiente del Valle, £17.3m
Out
Kendry Paez - Strasbourg, loan
Djordje Petrovic - Bournemouth, £25m
Bashir Humphreys - Burnley, undisclosed
Marcus Bettinelli - Man City, undisclosed
Kepa Arrizabalaga - Arsenal, £5m
Mathis Amougou - Strasbourg, undisclosed
Zak Sturge - Millwall, undisclosed
Noni Madueke - Arsenal, £52m
Caleb Wiley - Watford, loan
Mike Penders - Strasbourg, loan
Joao Felix - Al Nassr, £43.7m
Ishe Samuels-Smith - Strasbourg
From next season, Sky Sports' Premier League coverage will increase from 128 matches to at least 215 games exclusively live.
And 80 per cent of all televised Premier League games next season are on Sky Sports.
",SkySports
Levy: Frank doesn't need to win PL this year - but must deliver ASAP,"Tottenham chairman Daniel Levy says Thomas Frank does not need to win the Premier League title this season - but he does need to deliver it ""as soon as possible"".",https://www.skysports.com/football/news/11095/13406692/daniel-levy-tottenham-hotspur-chairman-says-thomas-frank-does-not-need-to-win-the-premier-league-this-season-but-must-deliver-soon,"Mon, 04 Aug 2025 11:00:00",,['Tottenham Hotspur'],"Tottenham chairman Daniel Levy says Thomas Frank does not need to win the Premier League title this season - but he does need to deliver it ""as soon as possible"".
This summer, Levy made the controversial decision to sack Europa League-winning boss Ange Postecoglou due to a 17th-placed Premier League finish, replacing him with the former Brentford boss.
After appointing Frank, Levy made the declaration that winning the Europa League was not enough - as he wanted Spurs to win the Premier League and Champions League.
In conversation with Gary Neville for The Overlap, Levy said Frank is not under immediate pressure to win the league, but that pressure may soon come.
""Whenever you appoint a coach, you always believe it's right,"" Levy said. ""You need a lot of ingredients for it to be right.
""Thomas is a highly intelligent individual, a fantastic way about him in terms of communication. I think he will be great at both developing young players and older players and making them better. He gets the style of football we want to play.
""He understands Rome wasn't built in a day. We haven't said to him that we want to win the Premier League this year.""
Asked when Frank is expected to win the league, Levy replied: ""As soon as possible, but no pressure. We just want to compete at the highest level.""
Levy stole the headlines when he revealed Spurs' desire to win the Premier League and the Champions League - something the club have never done in their history.
Spurs came close under Mauricio Pochettino via a second-placed Premier League finish in 2017 and reached the Champions League final in 2019.
Asked what has changed to make him say that, Levy replied: ""Nothing has changed in terms of our ambition. It's always been the case. After winning the Europa League, thanks to Ange, we've got a taste of it, but it's not enough. And it's never been enough.
""We've been in 16 or 17 semi-finals, we've been in six or seven finals and we haven't won enough. We need to use that as a springboard to keep winning, that's what it's all about. We've won two trophies in the last 20+ years.
""We've been so close so many times. I can't really answer why because I'm not the one that picks the team, picks the players.""
Spurs sacked Postecoglou despite delivering the club's first trophy in 17 years - and only the second of the Levy era at the north London club.
The Australian coach delivered on his promise to always win a trophy in his second season - and even declared that ""season three is better than season two"" during the club's Europa League trophy parade, before his sacking.
""Of course, the decision always has to rest with me,"" said Levy. ""But it's always a collective decision. We have a board of directors but under that we have a group of technical staff and they advise.
""Ange just won us a trophy, a European trophy. It's highly significant, it will always be in our history and we were asking him to leave. But we can't lose sight of the fact we finished 17th in the league, we lost 22 Premier League games. It's impossible for Tottenham to be in that position.
""We had to take the emotion out of it and we had to give some data points as to why we decided to do what we did.
""No one likes telling someone they're losing their job. But it's the nature of football. We're there to win. We won a European trophy and it was fantastic. But we also need to win on all fronts. The Premier League says it all.""
Levy also addressed criticism over his ownership, amid regular protests from Spurs fans against both him and the ENIC Group, which also has a stake in the club.
The 63-year-old believes his role in building the Tottenham Hotspur Stadium means he will only get credit for his work once he has left the club - before adding that he shares in the Spurs fans' pain when they do not succeed on the pitch.
""When I'm not here, I'm sure I'll get the credit,"" said Levy.
""When you come here and look at this wonderful building - and the fact that other clubs are trying to copy what we're doing - it should be a sign that we did something a bit bold and right.
""Of course [fan unrest] hurts, but their pain is also my pain. I want to win and when we're not playing well and not winning, believe me - I suffer as well.
""It ruins my whole weekend. It's horrible. You're in this to win. When you don't win, it's not fun.""
One of the criticisms Levy gets is an overinvolvement in the football side of the club, despite a strong track record in the commercial success of Spurs.
Asked if that criticism is fair, Levy replied: ""I would say that's completely unfair. People who have worked in this club and understand the workings of the football side of this club, I do not interfere at all in the decision-making of this player versus that player. It is always the coach and the technical staff.
""The only way I get involved is when they decide which player they want to buy or sell, I will go out and do my very best for this football club. But I'm not interfering in the football decisions.
""It's not different from any other club. It's not just me, it's a board. When we went through the decision to appoint Thomas, there were a number of people involved, in which I was just one of them.""
On whether Thomas Frank will be backed in the transfer market...
""We will support him to the best of our ability. If you look at transfer fees, we've been in the top four spenders since the stadium opened. We've spent around £700m net on new players.
""This isn't just about money, it's about some luck, having the right balance in the team, having the right coach. A lot of things have to come together.
""I very much hope Thomas brings all the right ingredients to put the club where it deserves, which is right at the top.""
On whether the Europa League triumph is his best achievement at Spurs...
""It has to be. Also when we came back here a few days later and did the parade. The outpouring of emotion for everyone to see around the world was amazing.
""It was nothing to do with the money, it was all about [that] we needed a trophy. I promise you. The money, you realise a few days later that we're in the Champions League. But it was about getting a trophy. It's my proudest moment.""
What is success for Spurs in the next three years?
""We need to compete at the highest level, we need to consistently try to win trophies. That's what it's all about.
On Man City's financial charges with the Premier League…
""It's going through a process which has gone on for far too long. It has to be brought to a conclusion for the good of the game.
""It's unfortunate that we haven't been able to sort things internally. [The reason why it's taking so long is] the lawyers, the lawyers are going to earn a lot of money over this.""
",SkySports
