Title,Summary,Link,Date,Author,Teams,Article,Outlet
Inspired by Liverpool? Man City's new approach explained,Man City's 4-0 win at Wolves showed they are up for a Premier League title chase - but the way they did it had Jamie Carragher wondering whether Pep Guardiola's fresh approach has been influenced by Liverpool.,https://www.skysports.com/football/news/11095/13414302/liverpool-influence-at-man-city-jamie-carragher-explains-how-former-jurgen-klopp-assistant-pep-lijnders-may-be-impacting-pep-guardiola,"Mon, 18 Aug 2025 20:23:00",Jamie Carragher,"['Liverpool', 'Manchester City']","Man City's 4-0 win at Wolves showed they are up for a Premier League title chase - but the way they did it had Jamie Carragher wondering whether Pep Guardiola's fresh approach has been influenced by Liverpool.
After City dropped off their usual standards last term, Guardiola brought in Pep Lijnders as assistant coach, Jurgen Klopp's former deputy at Liverpool.
With City playing an offside trap at Molineux and scoring on the counter-attack, Carragher believes Lijnders ""is having a big influence on Guardiola"", noting the similarities with the style Lijnders and Klopp favoured during their time together at Anfield.
Defensively, Man City repeatedly pushed up to try to catch Wolves offside - and did just that when Marshall Munetsi headed in during the first half. That plan was even executed close to the halfway line, with City's backline stepping right up high as Wolves tried to play the ball forwards.
""I couldn't believe what I saw, the players were all jumping high up to try and catch the Wolves players offside,"" said Carragher told Monday Night Football.
""This is very Liverpool-like. It made me think how much influence is maybe the new coach having on this team.""
Whether it was Liverpool-inspired or not, fellow Sky Sports pundit Gary Neville applauded the performance of Man City's defence to keep such a disciplined line.
""It's really good play,"" he added. ""To get a back-four unit in sync like that, it takes some doing. It's really good play from [centre-back] John Stones.""
Carragher also noted similarities between City's performance with Liverpool's threat on the break under Klopp.
Tijjani Reijnders' goal came from a swift move up the field, with Guardiola making a point of celebrating with Lijnders in the aftermath.
""The amount of counter-attacking goals that Liverpool team would score with [Sadio] Mane and [Mohamed] Salah, breaking forward,"" said Carragher. ""When I looked at the goal from Reijnders… not maybe a Pep Guardiola goal.
""Of course, Pep Guardiola's teams have scored plenty of counter-attacking goals in the past. But what really stood out for this one was the type of goal it was. They win it and then they're off.
""Lijnders - Guardiola gives him the thanks, the hug. Now we don't know exactly what that's for, but I don't think it's a coincidence with some of the things that I saw in the game that he, as a coach, is having a big influence on Pep Guardiola.""
Afterwards, Guardiola himself said City were trying to be better with attacking breaks than they were last season.
""It's a weapon that we want to use this season - when we're getting the ball, attack quicker than maybe before.""
Whether it is a Liverpool inspiration from Lijnders or not, it seems clear Guardiola has once again reimagined his Man City side.
Carragher says the serial winner recognised the shift in style in the Premier League away from controlled, patient build-up into a more dynamic approach - and has responded.
""What Pep said last season, when he was talking about where the game was going, he was actually saying, 'it's not really my football', the football that was seen of teams in the Premier League. Transition, end-to-end football.
""I think he mentioned Brentford, he was talking about Bournemouth, he wasn't just talking about the real top teams. How many teams in the Premier League were playing like that.""
City have shown they can have success playing that way too. After learning from their rivals, they look like they will be serious contenders for the Premier League crown once again. That's a view shared by Neville.
""Watching that game on Saturday, it was a little bit, 'Oh, did we just forget about the obvious?' Pep Guardiola, if he loses a title, he'll win it back,"" said Neville.
""He wins titles nearly every single year he's coached in his career, and when you saw Reijnders on Saturday, you think of Rodri to come back in, you think of Stones and [Ruben] Dias, [Erling] Haaland up front... that's a spine and a half, that's a title-winning spine, it's a treble-winning spine with a manager who's prolific.
""City, just off what we've seen on Saturday, if they keep their players fit, they could be really in business.""
",SkySports
Frank's flexibility helping Spurs - and Man Utd's unusual numbers,,https://www.skysports.com/football/news/11095/13414076/thomas-franks-tottenham-are-flexible-nottingham-forest-change-it-up-and-man-utds-possession-in-the-debrief,"Mon, 18 Aug 2025 13:08:00",Adam Bate,"['Manchester United', 'Tottenham Hotspur']","Welcome to The Debrief, a Sky Sports column in which Adam Bate uses a blend of data and opinion to reflect on some of the key stories from the latest Premier League matches. This week:
Having been in Udine to see Tottenham come close to doing a number on Paris Saint-Germain, the question was whether or not they would be able to adjust their style of play three days later against Burnley. Thomas Frank answered that emphatically.
The passing of Guglielmo Vicario illustrated that most clearly in their 3-0 win on Saturday. Having directed the ball long against PSG, the Spurs goalkeeper switched the focus to ball retention against Burnley, attempting only two kicks over the halfway line.
In fact, Spurs as a side attempted the most passes inside their own half of any team on the opening weekend of the Premier League season. Frank pointed out afterwards that the move for Richarlison's second goal featured 17 passes - and included Vicario.
Richarlison impressed again and with 13 goals in his last 16 starts, is emerging once more as a robust alternative to Dominic Solanke. The Brazilian registered three shots on target inside the penalty box - equalling his record for any game in his Premier League career.
In midfield, Frank trusted two teenagers, Archie Gray and Lucas Bergvall, with Rodrigo Bentancur and Joao Palhinha dropping to the bench. At the back, Kevin Danso, the new long-throw specialist, made way to accommodate Brennan Johnson - who duly scored.
It has been a promising start for Frank, particularly given that he had to manage those midweek exertions in Italy. His flexibility was a factor in his appointment, having been a persistent source of criticism for his predecessor and he got the balance right against Burnley.
Spurs not only created, scoring three against a side that did not even concede two in a single league game last season, but did so while keeping a clean sheet - their first in this competition since February and as many as in their previous 18 home games.
It is Manchester City away next, which will be as difficult as it gets. But Frank has already shown supporters that he is capable of setting this team up in whatever way that the match situation demands. Keep a close eye on Vicario's pass choices in that one.
A build-up attack is defined as a sequence in open play that contains 10 or more passes and ends either in a shot on goal or at least a touch inside the box. The team that did that the most times on the opening Premier League weekend was Nottingham Forest.
Nuno Espirito Santo's team did it seven times in their 3-1 win over Brentford, which is unusual because the most they managed in any game last season was just five. They ranked bottom but one in the Premier League for build-up attacks during that campaign.
Of course, it was a hugely successful season for Forest in which they came so close to securing Champions League football. But their style was built on containment without the ball and counter-attacking with it - they ranked top for the direct speed of their attacks.
There was still evidence of that in beating Brentford. Chris Wood's second goal came from a transition and it is clear that Forest will keep setting the traps that did for so many last year. But against Brentford there were also examples of clever pressing, of a possession game.
Forest completed 126 passes in the final third - the most of any Premier League team. After a pre-season in which Nuno complained about the lack of additions and one that featured no fewer than five goalless draws, maybe they have added some new aspects, after all.
That could prove important. Had Forest beaten Leicester at home - or indeed Brentford at the City Ground - towards the back end of last season, it could have been enough for a top-five finish. The manner of this performance suggests Nuno is out to address that.
Roy Keane may have bemoaned the erosion of standards that have led to Manchester United's home defeat to Arsenal being viewed as a positive step but the reality is that Ruben Amorim's side exceeded most expectations with their performance on Sunday.
It was not just that they caused one of the title favourites such problems but it was the way that they dominated the ball that surprised. Regardless of the game state, United have not done that against one of the top teams for a long time - and the stats back that up.
In Premier League matches against Arsenal, Chelsea, Liverpool and Manchester City - last season's top four and the favourites to contend this time around - you have to go back almost a decade to find an example of United having 60 per cent of the possession.
All three examples since Sir Alex Ferguson left came under Louis van Gaal in 2015. If Amorim can begin to fuse the possession game of the Dutchman with the potent running power of new signings Bryan Mbeumo and Matheus Cunha then there is hope.
Both Mbeumo and Cunha had chances to mark their Premier League debuts for the club with a goal. That they did not owes something to David Raya in the Arsenal goal and that dreaded phrase 'regression to the mean' that has been muttered about both men.
Mbeumo scored 20 goals for Brentford last season from an expected-goals tally of just 12.26. In every single game in which he had better chances than this last season, he scored. Remarkably, the same statistic was also true of Cunha. Rotten luck for United.
And yet, despite that disappointment, the overriding feeling is that if Amorim can keep getting the ball to his talented ball carriers in good areas then, whether it is Benjamin Sesko or Mason Mount up front with them, United will be a very different proposition this season.
",SkySports
Bournemouth sign Gannon Doak for £25m as Liverpool sales surpass £220m,Bournemouth have completed the signing of teenage winger Ben Gannon Doak from Liverpool for around &#163;25m.,https://www.skysports.com/football/news/11095/13414118/ben-gannon-doak-transfer-news-bournemouth-sign-winger-from-liverpool-in-a-deal-worth-up-to-25m,"Mon, 18 Aug 2025 19:00:00",,['Liverpool'],"Bournemouth have completed the signing of teenage winger Ben Gannon Doak from Liverpool for around £25m.
Sky Sports News understands the deal for the 19-year-old includes a buy-back option, which was an essential condition for Liverpool to agree to the transfer.
The Scotland international, who wishes to be known as Gannon Doak to reflect both of his parents' names, has signed a five-year deal at the Vitality Stadium.
Sky Sports News understands Gannon Doak is viewed by Bournemouth as a replacement for Luis Sinisterra, who is set to join Brazilian side Cruzeiro on loan.
The south coast club sold forward Dango Ouattara to Brentford for £42.5m and they are looking at Bayer Leverkusen's Amine Adli and FC Midtjylland winger Dario Osorio as targets to replace Ouattara.
Meanwhile, Gannon Doak's sale means Liverpool have now sold eight players this summer for a combined total of £227.6m, having spent £321m on new signings.

Sky Sports News reported earlier in the window that Doak was seeking regular first-team football this season.
It is understood Porto had made a bid for Doak earlier this summer, with Stuttgart, Bologna and Monaco among the other European clubs eyeing a move for the teenager.
A host of Premier League clubs, including Nottingham Forest, West Ham, Leeds, Everton and Wolves, were also interested in the Scotland international this summer.
Liverpool rejected bids of around £20m from Crystal Palace and Ipswich in the January transfer window.
Doak spent last season on loan at Middlesbrough, scoring three goals and adding seven assists in 24 Championship appearances before an injury in January cut his season short.

Gannon Doak could make his Bournemouth debut on Saturday at home in the Premier League against Wolves and he will wear the number 11 shirt.
He said: ""I'm buzzing to be here. I feel like it's the right time for me, and it's a great opportunity to play regular football at the highest level. It feels like the perfect fit.
""The team play very nice football. It's fast and it really suits my game, so I felt like I couldn't say no to the chance to play here.""
Gannon Doak is the Cherries’ fourth summer signing, taking the club's spending to just under £100m following the arrivals of goalkeeper Djordje Petrovic, left-back Adrien Truffert and centre-back Bafode Diakite.

Tiago Pinto, the club's Head of Football Operations, said: ""Ben is an exciting young talent who has shown his quality at the highest level despite his age.
""﻿He brings pace and energy that will fit our model well, and we're thoroughly looking forward to helping him fulfil his potential at AFC Bournemouth.
""﻿We're pleased to bring another player into the club during this window as we continue to reinvest in the squad.""

From this season, Sky Sports' Premier League coverage will increase from 128 matches to at least 215 games exclusively live.
And 80 per cent of all televised Premier League games next season are on Sky Sports.
",SkySports
Doak joins Bournemouth in £25m deal as Liverpool sales near £200m,Bournemouth sign Liverpool winger Ben Doak for an initial £20m with a further £5m in add-ons.,https://www.bbc.com/sport/football/articles/cm2vxp3e7gro?at_medium=RSS&at_campaign=rss,"Mon, 18 Aug 2025 18:35:19",Nizaar Kinsella,['Liverpool'],"Bournemouth have signed Liverpool winger Ben Doak for an initial £20m with a further £5m in add-ons.
The 19-year-old has signed a five-year contract and becomes Bournemouth's fourth summer acquisition.
Doak was left out of Liverpool's 4-2 win over Bournemouth at Anfield on Friday night.
""I'm buzzing to be here,"" Doak said.
""I feel like it's the right time for me and it's a great opportunity to play regular football at the highest level. It feels like the perfect fit.
""The team play very nice football. It's fast and it really suits my game, so I felt like I couldn't say no to the chance to play here.""
Doak has won six caps for Scotland and spent last season on loan at Middlesbrough in the Championship, scoring three times and recording seven assists in 24 matches.
Bournemouth are understood to have beaten interest from other Premier League clubs, including Leeds, as well as Portuguese side Porto.
Doak's move will give him a better chance of playing first-team football having featured just 10 times for Liverpool since joining from Celtic in 2022.
It takes Liverpool's sales to about £200m this summer, having spent more than £270m on new signings and a £110m bid for Alexander Isak rejected by Newcastle.
Liverpool's major sales have included Luis Diaz to Bayern Munich in a £65.5m deal, Darwin Nunez to Al-Hilal for £46.3m and academy player Jarrell Quansah to Bayer Leverkusen for £35m.
Caoimhin Kelleher, Tyler Morton and Nat Phillips have also been sold, while the club received £8.4m from Real Madrid to release Trent Alexander-Arnold early from his contract, though the Spanish club dispute this figure.
The sale of Doak means Liverpool have brought in about £85m in initial fees for the winger, Phillips, Alexander-Arnold, Kelleher, Quansah and Morton. The six players arrived as either youth players or development projects and cost the Reds an initial £600,000. The subsequent profit for players classed as 'homegrown' gives the Reds an immediate boost in terms of current profit and sustainability rule (PSR) calculations.
Bournemouth have also had a busy summer having sold Dango Ouattara to Brentford for £42.5m last week.
They already lost defenders Illia Zabarnyi, Dean Huijsen and Milos Kerkez for a combined total of about £150m to Paris St-Germain, Real Madrid and Liverpool respectively.
Bournemouth manager Andoni Iraola said his side are ""not where they want to be"" before the defeat at Anfield and added ""important movements"" will be made before the transfer window closes on 1 September.
Goalkeeper Djordje Petrovic, left-back Adrien Truffert and centre-back Bafode Diakite have joined the club this summer, with January signing Eli Junior Kroupi also coming into the squad after finishing last season on loan at Lorient.
Sources say the Cherries are in the market for a further central defender and a striker to compete with Evanilson, with alternative option Enes Unal expected to be out with a major knee injury until November or December.
Doak showcased potential in loan spell - analysis
Noel Sliney, BBC Sport
Doak was regularly terrorising opposition full-backs for Middlesbrough in the Championship with his pace and direct style before a thigh injury ended his 2024-25 season in late January.
The winger, who made his senior Scotland debut last September, provided three goals and seven assists in 21 starts for Boro.
Among players to have featured in at least 20 Championship games last season, the 19-year-old ranked in the top six per 90 minutes for assists, chances created and touches in the opposition penalty area.
",BBC
Amorim uses Ferguson tactic to defend Man Utd keeper call,Manchester United boss Ruben Amorim uses a tactic employed by legendary boss Sir Alex Ferguson to defend his choice of goalkeeper.,https://www.bbc.com/sport/football/articles/cx29yz0ezrjo?at_medium=RSS&at_campaign=rss,"Mon, 18 Aug 2025 16:51:49",Simon Stone,['Manchester United'],"Ruben Amorim was 55 seconds into a post-match news conference that lasted less than three and a half minutes at Old Trafford on Sunday when he was asked a question that made him flinch back and raise his eyebrows in disbelief.
It concerned his goalkeeper and whether he had given any consideration to picking veteran former England man Tom Heaton ahead of Altay Bayindir for the Premier League defeat by Arsenal.
""Why?"" came the response, the stare accompanying it unwavering.
What followed was the kind of exchange that used to be commonplace at Manchester United when Sir Alex Ferguson was the manager.
Essentially, journalists frequently asked questions that Ferguson either felt were genuinely ridiculous or that threatened to expose a weakness. Either, Ferguson reasoned, demanded a fierce rebuttal and a circling of the wagons.
""You are either with us, or against us,"" was Ferguson's mantra. The Scot viewed almost every journalist in the 'against us' camp, so he tended to treat their opinions with disdain, irrespective of their validity.
Amorim spoke to Ferguson just over a week ago, at the opening of United's revamped training ground. Whether tactics in dealing with the media were discussed is open to question.
But Amorim has certainly used this summer to try and create a tight bond with his squad, which lies behind how Sunday unfolded.
Events can change situations quickly when a transfer window is nearing its close and it has been established Andre Onana's former club Inter Milan are looking at bringing in a new goalkeeper. However, it is still the view of those at United on Monday there will be no additions to that part of their squad.
United chose to refresh their attacking positions with the finance that was available to the club this summer. When it became apparent Gianluigi Donnarumma was likely to be available as he is no longer required at Paris St-Germain, the word coming out of Old Trafford was the Italian goalkeeper would not be heading their way. That stance is not thought to have changed.
Picking Onana against Arsenal is bound to have come into Amorim's thinking. After all, it could not have been any clearer who his first choice was when the 29-year-old was picked for the Europa League final in May even though he had made high-profile mistakes in the build-up to the defeat by Tottenham in Bilbao.
However, while Amorim said in his pre-match news conference on Friday afternoon the Cameroon international was available to face Mikel Arteta's side, by kick-off, he had only three full training sessions behind him after suffering a hamstring injury early in July.
In Onana's absence, Amorim thought Bayindir had performed well during a summer campaign across three countries in which United remained unbeaten and the 27-year-old had featured in three and a half of the five games.
It was on that basis Amorim concluded in order for players to believe his 'group' philosophy, it would be the wrong decision to axe Bayindir, who in his eyes had done nothing to deserve it, for Onana, whose fitness had to be taken on trust.
That he chose to get on the front foot in his post-match news conference after his decision had been questioned seemed to be part of a wider strategy.
After all, if former England goalkeeper Joe Hart felt able to tell BBC Radio 5 Live that while he was initially minded to defend Bayindir, having seen a replay of the goal, he thought the player had made a mistake and could have used one hand to get William Saliba out of his way as he went to punch the ball with the other, it was fair to hold Amorim to account.
The former Sporting boss was forceful in his rebuttal: ""He suffered a goal like this where?"" he countered, when it was put to him Bayindir had conceded in similar manner - unable to deal with a set-piece superbly delivered under his crossbar – before.
When the game - a Carabao Cup tie at Tottenham last December when Son Heung-min scored direct from a corner - was mentioned, Amorim's reply was instant: ""Without VAR,"" he said. ""With VAR it is a foul.""
Amorim maintained his offensive by talking about Bayindir's next appearance, the FA Cup third-round tie at Arsenal a month later, when his goalkeeper was awarded man of the match in a shock penalty shootout win.
""You don't remember the game?"" Amorim said, without giving his inquisitor a chance to reply. ""I remember the game. Altay was unbelievable.""
And from that background Amorim made yesterday's call.
""I didn't drop Onana from the squad,"" he added. ""After just one week, without seeing a game, without training.""
Twice Amorim was then asked if he was happy with his three goalkeepers. He talked round the situation on the first occasion. When he was asked again, his reply confirming he was, was followed by a shake of the head, as if to say ""are you actually listening to me?""
Twenty seconds later, he had left.
Amorim is not due to speak to the media again until Friday, when it is almost guaranteed he will be asked who will be in goal against Fulham at Craven Cottage on Sunday, and it is equally likely he will refuse to say.
Most expect Onana to get the call.
History suggests that selection is not without risk. Amorim will hope not to spend the aftermath of the game having to defend it.
",BBC
