Title,Summary,Link,Date,Author,Teams,Article,Outlet
Chelsea face doubts over registering signings with Uefa after £27m fine,Aston Villa and Barcelona also punished over finances,https://www.theguardian.com/football/2025/jul/04/chelsea-aston-villa-and-barcelona-fined-by-uefa-over-spending-rule-breaches,"Fri, 04 Jul 2025 17:57:11",Jacob Steinberg,['Chelsea'],"Chelsea, Aston Villa and Barcelona have been fined by Uefa for ­breaking financial rules. Chelsea have been hit with a €31m (£27m) fine, with a ­potential further €60m looming over the next four years if they fail to ­comply with regulations again. They also face doubts over whether they will be able to register new signings in ­European competitions over the next two seasons.
Villa have been fined a total of €11m with a further €15m suspended for the next three years. Barcelona have been fined €15m and are also at risk of further conditional penalties.
Chelsea’s punishment leaves them under pressure to make sales this summer before their return to the Champions League. Uefa’s judgment included the detail that Chelsea would be forbidden from including new players in their squad for Europe next season and in 2026-27 unless they can show they have generated a cost saving with sale of players against acquisitions.
Chelsea have bought Liam Delap for £30m and João Pedro in a deal worth up to £60m. They have agreed a deal to sign the Borussia Dortmund winger Jamie Gittens and will add Palmeiras’s Estêvão Willian to their squad after the Club World Cup. Chelsea were already looking to make sales and are open to offers for Noni Madueke and Christopher Nkunku. A number of others, including João Félix and Raheem Sterling, have no future at the club. Sterling has two years left on a contract worth £325,000 a week.
Chelsea and Villa breached Uefa’s football earnings and squad-cost rules (SCR), the latter of which limits clubs operating in European competition to spending 80% of their revenue on player costs. Villa face being fined €5m for every year they breach ­financial rules. A new three-year cycle started in 2024-25.
Villa are confident they can absorb the fine and strengthen Unai Emery’s squad while agreeing to move in line with SCR. Villa and Uefa are understood to have agreed a “glide path” to meet their targets. Villa, who are also confident of avoiding a possible points deduction from the Premier League after moving to sell their women’s team to comply with financial rules, are adamant they do not need to sell key players.
The future of Emiliano Martínez, however, is uncertain, and while Aston Villa are yet to receive a bid for the Argentina goalkeeper, they are braced for further interest in the 32-year-old, who is under contract until 2029., Chelsea, Manchester United and Atlético Madrid, are thought to hold an interest in the World Cup-winner.
Reducing the wage bill is a priority for Villa. YesterdayOn Friday, the club confirmed they have terminated the contract of Philippe Coutinho, who has signed permanently for Vasco de Gama, his boyhood club. Villa want to trim the squad and offload fringe players, with Kaine Kesler-Hayden joining Coventry in a £3.5m deal and Emiliano Buendia, Louie Barry and Alex Moreno also poised to leave. Lyon (€12.5m), Besiktas (€900,000) Panathinaikos (€400,000) and Hajduk Split (€300,000) have also been sanctioned by Uefa.
",TheGuardian
Football Daily | Infantino awaits his ‘big bang’ as Club World Cup refuses to slide away,Sign up now! Sign up now! Sign up now? Sign up now!,https://www.theguardian.com/football/2025/jul/04/football-daily-email-club-world-cup-quarter-finals,"Fri, 04 Jul 2025 15:28:10",Barry Glendenning,['Liverpool'],"ROLL WITH IT
Like Dr John Hammond and his scientists in Jurassic Park, Gianni Infantino and his fawning Fifa lickspittles have spent recent years so preoccupied with whether or not they could, that they didn’t stop to think if they should. The upshot is that a preposterously lucrative tournament described by its creator as “a big bang” has been crowbarred into an already jam-packed calendar. And the largesse of its in-no-way unethically sourced prize-money for those participating now threatens to destroy several already under-threat footballing ecosystems around the world.
Excessive heat, often sparse crowds, overambitious stadium bookings, concerns over immigration raids, exhausted players, that Juventus video from the Oval Office, Saudi money, individual player walk-ons, discordant mismatches, lengthy weather delays – the list of snags that need to be ironed out in the inevitable future editions of Copa Gianni goes on and on. But if you can see past the Fifa overlord’s self-aggrandising and disingenuous bombast, this brain-fart of his is a wheeze that’s not entirely without merit. And with the quarter-finals upon us, the tournament might finally live up to the garrulous hype with which Fifa’s equivalent of The Simpsons’ monorail guy Lyle Lanley has long been trying to sell it to us marks.
First up are Al-Hilal and Fluminense in Orlando, the stuff of lurid Infantino fantasies that will ensure either a Saudi Pro League side or a Brazilian team will make the final four. One of two remaining Brazilian sides left in the competition, Fluminense have thoroughly enjoyed their stateside sojourn and are favourites to see off the self-styled plucky Saudi underdogs who have spent just £412m on transfers over the past two years. While most of their fans will be in bed, Chelsea take on Palmeiras, but may have to make do without one of their players of the tournament, Pedro Neto, who is mourning the sudden loss of his great friend Diogo Jota. “In terms of Pedro, he is very sad,” said Enzo Maresca. “Probably more than sad. I had a chat this morning with Pedro. We support him. Any decision he will take is the correct one.”
In what would certainly have been billed as the Bellingham Brothers derby if Jobe hadn’t gone and earned himself a spell on the Naughty Step, Dortmund play Real Madrid at the MetLife Stadium in Noo Joyzee, while Bigger Cup winners Paris Saint-Germain go toe-to-toe with Bayern in Atlanta. “We feel that when we’re at our best, we can beat anyone,” chirruped Harry Kane, reading from his Big Book of Pre-Match Platitudes. “We’ll approach this match with the same feeling.” As for the plodding dinosaurs who’ve been brought back from extinction? Well, their eagerly-awaited reunion tour kicks off later in Cardiff’s Millennium Stadium and, unlike at Copa Gianni, the dynamically priced tickets are sold out.
LIVE ON BIG WEBSITE
Join Barry Glendenning at 5pm (BST) for Euro 2025 updates on Denmark 0-0 Sweden and Scott Murray will be on hand at 8pm for Germany 0-0 Poland.
QUOTE OF THE DAY
I want to talk about my mate. My buddy. The bloke I loved and will miss like crazy. I could talk about him as a player for hours, but none of that feels like it matters right now. It’s the man. The person. He was such a good guy. The best. So genuine. Just normal and real. Full of love for the people he cared about. Full of fun. He was the most British foreign player I’ve ever met. I can’t believe we’re saying goodbye. It’s too soon, and it hurts so much. But thank you for being in my life, mate – and for making it better” – Liverpool’s Andy Robertson remembers his friend, Diogo Jota. And Miguel Dantas reports on how the deaths of Jota and his brother André Silva have shaken Portugal, where mourners are gathering in Gondomar for the funeral on Saturday.
FOOTBALL DAILY LETTERS
Diogo Jota, an opponent that you’d have in your team in a heartbeat, and that’s from a Toffee” – Ian Taylor.
Regarding Chinese third-tier club Changchun Xidu and the superstitious paper charms (yesterday’s News, Bits and Bobs, full email edition). Are they effective if you want to put off a co-worker competing for the same promotion? Asking for a friend” – Steve Mintz.
Please send your letters to the.boss@theguardian.com.
This is an extract from our daily football email … Football Daily. To get the full version, just visit this page and follow the instructions.
",TheGuardian
Football transfer rumours: Real Madrid give all-clear for Arsenal to sign Rodrygo?,Today’s rumours don’t really have their heart in it,https://www.theguardian.com/football/2025/jul/04/football-transfer-rumours-real-madrid-give-all-clear-for-arsenal-to-sign-rodrygo,"Fri, 04 Jul 2025 09:23:21",Stuart Goodwin,['Arsenal'],"Four days into July, Arsenal fans could be forgiven for getting antsy over their outgoings list outnumbering their incomings by seven to one. If Gunnersaurus had ears they’d be pricking ozone-wards at word that Real Madrid are willing to let Rodrygo leave during the current window. Xabi Alonso seemingly likes the trade-off of losing a player who doesn’t currently waltz into his preferred XI (just 88 mins of action at the Club World Cup to date) and getting a fee not far short of £80m to help continue his reconfiguration at the Bernabéu.
The tricksy 24-year-old is seen as a substantial upgrade on Arsenal’s current threats from the left wing, but his arrival would not necessarily herald the exit of his Brazilian compatriot Gabriel Martinelli. A player who will leave, however, is knack-plagued defender Takehiro Tomiyasu, whose contract is being ripped up. That’s, thankfully, a situation suiting both parties, with the Japan international still almost half a year from returning to action after an endless string of knee twangs.
Despite the relative hush, there is plenty of Stamford Bridge-related hubbub today: Djordje Petrovic has swiftly gone from being a goalkeeper who “might just be the one Chelsea needed all along” at the start of 2024 to being one of Enzo Maresca’s Expendables. Sunderland’s lively window looks likely to feature completion of a £21.5m deal for the Serbian before Monday’s Mill arrives.
Meanwhile, Borussia Dortmund’s Reading-born winger Jamie Gittens is all but Chelsea’s player now, with the German club having gone surprisingly early with a well-wishing statement.
The former Blues forward Tammy Abraham, not that long ago a headline attraction for the Mill, quietly completed a loan move from Roma to Besiktas on Thursday, with “a conditional obligation to buy”.
Speaking of Blues, Birmingham pounced on Thursday to bring Demarai Gray back to where it all began, thus ending his Saudi Pro League adventure with Al-Ettifaq. That spell unfortunately yielded more yellow cards (one) than goals or assists, but his three-year deal offers plenty of scope to improve those numbers for the Championship side.
Elsewhere in the Midlands, Aston Villa are purportedly closing in on Toulouse’s Jaydee Canvot – the 18-year-old, a French youth international centre-back, caught eyes in 18 Ligue 1 outings last season and reports in France suggest that Unai Emery has successfully beckoned the youngster in his club’s direction despite interest from Everton and Bournemouth. A fee in the region of £17m-£20m is said to be plenty, ta.
Finally, a bit of a Mill tap-in to finish, expect Anthony Elanga pen-in-hand pics with various Newcastle-affiliated logos as a background at more or less any time from here. Their improved offer is thought to be just the job for Forest, cheers.
",TheGuardian
