Title,Summary,Link,Date,Author,Teams,Article,Outlet
Sutton's predictions v Wolf Alice bassist Theo Ellis and AI,BBC Sport football expert Chris Sutton takes on Wolf Alice bassist and Arsenal fan Theo Ellis with his predictions for this weekend's Premier League fixtures.,https://www.bbc.com/sport/football/articles/c8jpw87pwxyo?at_medium=RSS&at_campaign=rss,"Thu, 21 Aug 2025 15:11:00",,['Arsenal'],"The Premier League returns for another mouth-watering weekend of football with Newcastle v Liverpool on Monday night being the pick of the fixtures.
BBC Sport football expert Chris Sutton is making predictions for all 380 Premier League games this season, against AI, BBC Sport readers and a variety of guests.
He was the prediction winner last weekend and told BBC Sport this week: ""It's a huge relief to get that first win.
""I even got the better of AI too. I've always said, you'll need more than just artificial intelligence to beat me.""
For week two, he takes on Wolf Alice bassist Theo Ellis, who supports Arsenal.
Wolf Alice's new album The Clearing is out on Friday and they tour the UK in November and December.
Do you agree with the predicted scores? You can make your own predictions below.
The most popular scoreline selected for each game is used in the scoreboards and tables at the bottom of this page.
A correct result (picking a win, draw or defeat) is worth 10 points. The exact score earns 40 points.
Ellis grew up in north London and is a lifelong Arsenal fan who started going to the club's former home Highbury as a young boy.
""That time was wasted on me a little bit,"" he told BBC Sport.
""Well, not exactly wasted because it is some of my best memories ever, but I was going to watch 'The Invincibles' play some of the greatest football ever and I was too young to appreciate it fully.
""Then as I got older, in my caring years, unfortunately I was put through the Sokratis Papastathopoulos and Shkodran Mustafi era instead.
""It's very different now, though. I love so many aspects of this team, from the Hale End graduates like Ethan Nwaneri and Myles Lewis-Skelly to the type of football we play.
""Despite not winning anything for a while, it has been a joy to watch us. That's the best bit, the football, and it's the heartbreak that keeps you coming back for more.""
Theo Ellis was speaking to BBC Sport's Chris Bevan.
Chris Sutton was speaking to BBC Sport's Joe Rindl.
The AI predictions were generated using Microsoft Copilot Chat - we simply asked the tool to 'predict this weekend's Premier League results'.
Premier League predictions
Friday, 22 August
London Stadium, 20:00 BST
West Ham were as flat as anything at Sunderland. My colleague Ian Dennis on BBC Radio 5 Live called them anaemic. I'm a little bit worried for them this season.
I was at Chelsea's last game against Crystal Palace and I thought they also lacked that spark.
A lot has been made about Chelsea's new attack. Joao Pedro was quiet, Cole Palmer was quiet. There's a stat going around that Palmer hasn't scored a league goal from open play since January.
West Ham might prove me wrong, it is a London derby after all, but I still think Chelsea will find a way to edge it.
Sutton's prediction: 0-2
Theo's prediction: I don't have high hopes for West Ham this season. 0-3
AI's prediction: 1-2
Saturday, 23 August
Etihad Stadium, 12:30 BST
Manchester City really impressed me last week and everyone is rightly talking about Tijjani Reijnders. Statman Dave told me to get him into my Fantasy team, I didn't take that advice and I should've done. He was brilliant against Wolves.
I do think Tottenham will be a level above under Thomas Frank. It'll be interesting how they set up. They played a back three in the Super Cup final against Paris St-Germain.
Cristian Romero has signed a new contract for Tottenham, that's a big deal. But how did they not get a deal for Eberechi Eze over the line? It had been going on for weeks and now Arsenal have come in and embarrassed them!
Tottenham are still a few players short from properly challenging the really big teams and in this game I think City at home will be too strong for them.
Sutton's prediction: 2-1
Theo's prediction: City to score five and Erling Haaland is going to bag four of them. 5-0
AI's prediction: 3-1
Vitality Stadium, 15:00 BST
I really liked Bournemouth having a go at Liverpool. I know they ended up losing but they always carry that attacking threat. They're so good in transition and get bodies forward.
How do you judge Wolves after they got walloped at home against Manchester City? I mean, they did have chances in that match.
There's also that concern as to whether Bournemouth have properly replaced their three best defenders who they sold this summer.
It'll be quite tight, I know AI will go for a draw because they're very predictable. But I'm going to stick my neck out. Bournemouth will sneak it.
Sutton's prediction: 1-0
Theo's prediction: Bournemouth got raided in the summer but they still have Antoine Semenyo and I love watching him play. He is going to score at least one here, too. 2-1
AI's prediction: 2-0
Gtech Community Stadium, 15:00 BST
Brentford under Keith Andrews were really disappointing in their opener, conceding after just a couple of minutes against Nottingham Forest.
It doesn't bode well, in fact I'm worried about Brentford. They've lost all the goals of Bryan Mbeumo while Yoane Wissa has seemingly downed tools and doesn't want to play.
They still have battle-hardened players with Premier League experience, but they need that first win under their belt to get that real belief in their new head coach.
I though Villa were really stale against Newcastle and were lucky to get a point.
But I'm going to pick them to bounce back. I think Ollie Watkins will score against his old club.
Sutton's prediction: 1-2
Theo's prediction: Brentford have lost too many good players and I think they could go down this season. Villa are a top-six team and they will have too much for them. 1-3
AI's prediction: 1-2
Turf Moor, 15:00 BST
I wrote Sunderland off months ago at the end of last season but they surprised me last week with a hell of a win against West Ham.
Those two headers from Eliezer Mayenda and Dan Ballard were absolutely brilliant and they deserved their victory.
Burnley had their moments against Tottenham but didn't take them. They'll need to get a foothold in this season sooner rather than later.
This one stinks of a draw. I think it'll be close and Burnley will want more but Sunderland will be satisfied with their start.
Sutton's prediction: 1-1
Theo's prediction: This is a proper game! It's massive for whoever wins. If Sunderland are in their cool black away kit and Granit Xhaka decides to power up then maybe they could win this, but Burnley are at home so I am backing them - proper Turf Moor vibes like they had under Sean Dyche.
I really want to meet Dyche by the way - I've heard he likes indie music and goes to a lot of gigs, especially in Nottingham where he lives. Sean, if you are reading this, we are playing Nottingham Arena in December - we will put you on the guest list if you want to come. 1-0
AI's prediction: 2-2
Emirates Stadium, 17:30 BST
I didn't feel Arsenal's performance was there against Manchester United but still, at least they found a way to win.
All the talk in this game is going to be about Viktor Gyokeres and whether he can get off the mark. There was such an overreaction after he didn't score against Man United.
He's been written off as a dud in some quarters already! That's the modern game, you can get written off after your first hour of playing in the Premier League.
Not me though, no, I think he'll come good.
Leeds played with such intensity against Everton, although the penalty they won was slightly harsh.
Will Daniel Farke's side show that same level of bravery at the Emirates? Probably, and if so it'll cost them.
Sutton's prediction: 4-0
Theo's prediction: 2-0
Theo on Arsenal's title hopes: It feels like the pressure is unbearable at our club. I don't think we handle pressure well and we constantly want to win absolutely everything. But of course I think we can win the league this season. I feel like if it's going to happen any time, then it will be now.
I am glad Leeds are back in the Premier League. I miss Marcelo Bielsa Leeds, when they played chaos-ball - that was my favourite. But, look, I am an Arsenal fan so we are going to win this. Declan Rice to open the scoring from a long way out and Ethan Nwaneri to get the other in the 73rd minute. 2-0
AI's prediction: 4-1
Sunday, 24 August
Selhurst Park, 14:00 BST
Watching Palace last week against Chelsea I thought they deserved to win the game. I love the way they play, the back three are phenomenal, they're a really good team.
The problem for Palace is that their squad is so thin without their stars. How do you replace a player like Eberechi Eze, for example?
Losing Eze and Marc Guehi is a massive part of the team gone. It'll leave a huge hole and completely changes how I'll be predicting them this season.
As for this game, I reckon it'll be another close one. Nottingham Forest also had a great result in their opener.
Sutton's prediction: 1-1
Theo's prediction: I absolutely love Forest midfielder Morgan Gibbs-White. Palace are great so maybe they get something but I am going to say Forest - that's for my friend Keane Shaw. He has designed some of the Forest kits and is a lifelong fan so I will dedicate that win to him. 1-2
AI's prediction: 1-1
Hill Dickinson Stadium, 14:00 BST
I've said this on many occasions. Everton overachieved last season. It's painted a false picture as to where they currently are.
They didn't offer a lot the other night against Leeds. Sorry Everton fans but I've just got a feeling Brighton will play party poopers in the first Premier League game at Everton's new stadium.
Sutton's prediction: 1-2
Theo's prediction: I would love if Everton just let Jack Grealish play wherever he wants in a completely free role. This is their first game at their new stadium so they are definitely going to win it and Grealish is going to score a hat-trick. 3-1
AI's prediction: 1-2
Craven Cottage, 16:30 BST
Like a lot of people, I try to be balanced about Manchester United. They lost last week but I do think they will be better this season. Well, they can't be any worse.
I really like Bryan Mbeumo and I especially like Matheus Cunha, I think he's got loads going for him.
Fulham were fortunate to get something against Brighton but I think they'll improve in front of their own fans.
Fulham don't play with any fear and will take the game to Manchester United which gives me a sneaking feeling United will exploit them and win this one.
But then again I always predict Manchester United games wrong. I want to be positive about them but I'm not sure I can be. Plus, I think I predicted Fulham wrong for every one of their matches last season.
I'm leaning towards a Manchester United win so, because of that, I'll go for a draw.
Sutton's prediction: 1-1
Theo's prediction: I like Fulham because of all their old Arsenal players but I can see United winning this. 1-2
AI's prediction: 0-2
Monday, 25 August
St James' Park, 20:00 BST
This match was going to be intense anyway, but the Alexander Isak transfer saga has ramped it up a notch. There's going to be an edge to this one and honestly anything could happen.
Newcastle go into this game hampered by the fact they don't have a number nine.  Isak hasn't covered himself. Newcastle were brilliant against Villa but guess what, they missed a centre-forward.
A lot has been made about Liverpool's defence, they conceded a couple of soft ones against Bournemouth so there'll be a worry there. But then you look at Liverpool's attack and you think, blimey.
Cody Gakpo, Mohamed Salah and Hugo Ekitike, who had a blinder of a debut and Newcastle wanted to sign. Funnily enough, had Newcastle got Ekitike then Isak would probably be at Liverpool.
There'll be goals in this. Neither of these sides take a backwards step. I veer towards Liverpool solely because Newcastle don't have a centre-forward. But, are they still capable of scoring goals? Absolutely.
Sutton's prediction: 1-2
Theo's prediction: St James' Park is a formidable place so I am going for a draw. 2-2
AI's prediction: 2-3
How did Sutton do last week?
It was a winning start to the season for Chris who got five correct results with one exact score from the 10 Premier League games he predicted in week one, giving him a total of 80 points.
The BBC readers came second - you got six correct results with no exact scores, giving you 60 points.
Guest, singer Tom Grennan, and AI both got five correct results with no exact scores, to leave them joint-third on 50 points.
",BBC
Is Reijnders a must-have? The FPL talking point,"In Fantasy Premier League gameweek one, Tijjani Reijnders scored and assisted in Manchester City's 4-0 win over Wolves - earning 10 points for those who picked him. Should he be in your team?",https://www.bbc.com/sport/football/articles/c70xn0l3gzlo?at_medium=RSS&at_campaign=rss,"Fri, 22 Aug 2025 05:58:54",,['Manchester City'],"Tijjani Reijnders' superb debut for Manchester City is the big talking point among Fantasy Premier League managers.
The midfielder (£5.6m) scored and assisted in City's 4-0 win over Wolves to earn those lucky enough to have picked him a solid 10 points.
After just one gameweek, and still at a low price, is he already a Fantasy must-have?
FPL expert Gianni Buttice and the guys from The FPL Podcast by BBC Sport debate this week's FPL talking point.
'You've got to have him' - the case for Reijnders
Statman Dave: You should be looking at Reijnders. If he plays for Manchester City consistently for the entire season, he's going to score a minimum of 10 goals in the Premier League, potentially 15. He's just someone that you want to get in your team - the spaces he plays in are perfect. Kevin de Bruyne is gone - he's basically playing that same area.
John Acres: If I didn't have him I think I would have jumped before his price rise. He just looks set, doesn't he? He just looks he looks like you've got to have him. And it feels like by the time we get to gameweek six or seven, everyone will have him.
Gianni Buttice: Before Manchester City's pre-season match against Palermo, where Reijnders scored twice in his 45-minute cameo, the Dutchman was under 5% owned in FPL. He now goes in to this weekend's fixtures in one of every three teams.
AC Milan fans would have been shocked to see FPL price the Dutchman at £5.5m. The Serie A's midfielder of the year scored 10 goals and earned five assists in the league last season for what was a poor Milan side that finished outside of the European places.
'Be aware of Guardiola rotation' - the case against
Gianni Buttice: Buying Reijnders seems to be the only thing FPL managers can agree on heading into this week, and rightly so. But, in the interest of balance, here are the, albeit few, reasons why you may want to hesitate before transferring him in.
Pep Guardiola goes through phases of 'flavour of the month' with his attacking players, midfielders and wide forwards. After arriving in January, Omar Marmoush started 14 of 16 league games last season. He was chucked straight in to the XI and hit the ground running, just like Reijnders. Then, in a surprise to many, Guardiola didn't pick the 10%-owned versatile attacker against Wolves.
With the Champions League not far off, some will also worry about rotation of Reijnders, with Guardiola having so many midfield options. But from what we have seen so far, and what we saw at AC Milan, Reijnders will likely keep his performances sky high.
",BBC
How Arsenal won the signing of Eze and where he could fit in,"An Arsenal fan as a boy, Eberechi Eze is set to reject rivals Tottenham and join the Gunners. But how has the move happened?",https://www.bbc.com/sport/football/articles/c754kq0e32wo?at_medium=RSS&at_campaign=rss,"Thu, 21 Aug 2025 15:03:22",Alex Howell,"['Arsenal', 'Tottenham Hotspur']","The expected signing of Eberechi Eze has completely changed the feeling of the transfer window for Arsenal supporters.
The Gunners have been busy and aggressive in this window, signing six players for around £190m before the Premier League season even kicked off.
The arrivals included £64m striker Viktor Gyokeres and midfielder Martin Zubimendi for around £60m, but it is the deal for England international Eze that has supporters feeling like they have won the window.
A huge factor is trumping their rivals Tottenham Hotspur, who had agreed terms with both Crystal Palace and the player hours before the Gunners swooped.
How Arsenal won Eze race
It all happened in a few whirlwind hours.
Earlier on Wednesday, it looked as though the 27-year-old Eze would be heading to the white side of north London.
But the deal was not completed.
And the reason was Palace's Europa Conference League play-off match with Fredrikstad on Thursday.
The Eagles wanted to keep Eze for a game they view as pivotal to their season, and one they did not want to tackle without having a replacement in place.
Palace manager Oliver Glasner was strong in his pre-match press conference when saying that Eze and Marc Guehi, who has also been linked with a move away, were ""committed"" to the team.
Over at Emirates Stadium, a subplot was brewing.
Arsenal were holding an open training session at their ground which did not feature Kai Havertz. It was later revealed the Germany international was being assessed for a knee injury.
Despite the exact severity of the injury being unclear, Arsenal knew enough to make a move.
Hours later on Wednesday afternoon, Arsenal bid for Eze, deciding to act on their long-standing interest in the player.
With Eze being a boyhood Arsenal fan who played in their academy, it was an easy decision for the player.
By 19:30 BST, news of the surprise transfer emerged in the media, with sources briefing that there was nothing Spurs could have done to make the transfer happen due to that emotional connection.
And that element - Eze turning down Tottenham - is sure to make him an instant fan favourite at Arsenal.
But why did they leave it so late?
Arsenal had seen Eze as more of a number 10 and, with Ethan Nwaneri securing his future to the club with a long-term contract, they had to think carefully about exactly how the England international would fit in.
But it seems the Havertz injury meant they decided he was needed in their squad after all.
Eze did not play in the Europa Conference play-off for Palace on Thursday, with Glasner saying the player had called him to say he was unwell.
He is certain to sign for the Gunners in the next few days, completing a full-circle moment in re-joining the club he was released by at 13.
Where will Eze fit at Arsenal?
The big question for Arsenal boss Mikel Arteta is this - where does Eze fit into the Arsenal team?
The forward is one of the last few players you could describe as being a maverick.
But that is what makes this signing make sense for Arsenal.
The Gunners have struggled to break down low blocks in the past and are implementing a new style this season which will see them move the ball quicker through the lines.
Eze is very different to all of the other forwards that Arsenal have and will provide a different option.
Of course, captain Martin Odegaard will be a hard player to shift from the number 10 role.
But the purchase of Eze adds to the range of options that teams who want to win the title might crave.
The Arsenal left wing position is probably the one that is most up for grabs.
Gabriel Martinelli had an up-and-down season last campaign and injury did not help things.
BBC Sport tactics correspondent Umir Irfan said: ""Eze will likely play frequently on the left wing, given Martinelli's recent form.
""Eze is able to thrive in more central areas from here if Arsenal's left-back was to push up the pitch.
""Eze's ability to play well with nearby team-mates in congested areas make him a smart choice if used in this way.
""His top carrying and passing quality in transition makes Eze an optimal option in end-to-end games, with Gyokeres up top.
""For games in which additional attacking threat is required, both Odegaard and Eze could play together as attacking midfielders.
""Off the ball, he slots in naturally as a left midfielder as Arsenal defend in a 4-4-2. This is done most easily when he starts from the left wing.""
How fans feel about the signing
In an interview with BBC Sport in May, Eze said the reason he plays how he does is for the ""people who are watching"" and that he likes to get ""fans off their feet"".
And that is a message that every supporter wants to hear.
Eze was hugely popular in both the dressing room and the stands at Palace. He has scored 40 goals and provided 28 assists in 169 appearances for the club, with his most memorable contribution being the winning goal in the FA Cup final against Manchester City in May.
It is a sign of a much-loved player who has given good times to supporters that it will be hard to find any Palace fan who begrudges him the move for how he has played and what he has done.
For Arsenal supporters, he has already won the affection of the fanbase by turning down their fierce rivals to sign for a club that he supported as a boy.
When Eze posted a swipe of celebration pictures on his Instagram account after winning the FA Cup, he included a picture of Ian Wright playing in the FA Cup final for Palace.
Eze had the same retro Palace shirt on as Wright and is now going to follow in the footsteps of the Eagles hero who became a fan favourite at Arsenal - and will hope that he can achieve that status himself.
",BBC
