Title,Summary,Link,Date,Author,Teams,Article,Outlet
Arteta highlights 15-year-old pair as Arsenal beat Milan,"Mikel Arteta says the performances of 15-year-olds Max Dowman and Marli Salmon were ""incredible"" as Arsenal beat AC Milan 1-0 in their opening pre-season game in Singapore.",https://www.bbc.com/sport/football/articles/cn41e8kyp2lo,"Wed, 23 Jul 2025 16:18:17",Alex Howell,['Arsenal'],"Mikel Arteta said the performances of 15-year-olds Max Dowman and Marli Salmon were ""incredible"" as Arsenal beat AC Milan 1-0 in their opening pre-season game in Singapore.
Summer signings Martin Zubimendi, Christian Norgaard and Kepa Arrizabalaga also played their first match for their new club in front of supporters.
Bukayo Saka scored the only goal with a close-range finish from Jakub Kiwior's excellent curled cross.
The Gunners dominated for the majority of the match, with Ben White and Saka linking up well down Arsenal's right side.
Ethan Nwaneri - playing in central midfield - produced two standout moments of skill, one of which resulted in a shot from the edge of the area that went narrowly wide.
Manager Arteta handed some game time to the two 15-year-olds in the squad - forward Dowman and defender Salmon.
""It's very good,"" said Arteta about the youngsters on show. ""There is a lot of work in our academy of the coaches, people involved and it is a moment to give opportunities and reward them.
""They certainly took their chance today in difficult circumstances against a very big team. Incredible how at 15 years old they can perform at that level.""
It was agreed there would be a penalty shootout regardless of the result of the match and AC Milan won that 6-5.
Zubimendi, Mikel Merino, Dowman, Leandro Trossard and Josh Nichols scored their spot-kicks but Martin Odegaard, Reiss Nelson, Kiwior and Salmon missed theirs.
Arsenal supporters are likely to be excited by so many academy graduates being included on the tour and Myles Lewis-Skelly, fellow 18-year-old Nichols and 15-year-olds Dowman and Salmon finished the game on the pitch together.
With Saka, Nwaneri and Nelson all playing a part, it means that Arsenal had seven academy graduates feature in total.
""Very happy with all the kids,"" added Arteta. ""I think they are able to play at that level at 15 years old in my opinion because of the environment and culture that is within the team.
""When somebody makes you feel so comfortable and so confident straightaway, you can go and do it. At least it gives you the best chance and then you have to have the qualities this kid has to deliver against opposition like this.""
There has been a lot of excitement around Dowman, with Arteta referencing his talent on a number of occasions last season, and the youngster stepped up to score his penalty in the shootout.
""They are in and around the team constantly and they are getting used to the dynamics and the demands,"" said Arteta.
""They are getting there and that gives them a good platform and they will have to earn it.""
How did Arsenal signings perform?
Arsenal have spent £128m so far this summer to bring in Zubimendi, Norgaard and Kepa, as well as Noni Madueke - with Cristhian Mosquera and Viktor Gyokeres expected to follow.
Madueke has been given two weeks off to rest after his participation in the Club World Cup with Chelsea, but this was the first time supporters had a look at how Arteta may use his other new signings.
Norgaard was the only summer signing to start the match and began in his favoured deep-lying midfield role.
The Denmark international was solid in his positioning and provided a base to allow his fellow midfielders Declan Rice and Nwaneri to get forward.
Zubimendi, a £60m signing from Real Sociedad, came on as a half-time substitute and immediately began to dictate the tempo of Arsenal's play.
He has a more expansive passing range than Norgaard and showed some of his repertoire, but in the heat and with numerous changes in personnel, the game lost its flow.
Goalkeeper Kepa, signed from Chelsea, was not tested during the 90 minutes but in the shootout saved three of Milan's penalties.
",BBC
Liverpool sign Hugo Ekitiké in £79m deal after fending off late Manchester United bid,Striker joins from Eintracht Frankfurt on six-year deal,https://www.theguardian.com/football/2025/jul/23/liverpool-sign-hugo-ekitike-79m-deal-fending-off-late-manchester-united-bid,"Wed, 23 Jul 2025 18:30:45",Andy Hunter,"['Manchester United', 'Liverpool']","Liverpool have completed the signing of Hugo Ekitiké from Eintracht Frankfurt, with the striker rejecting a late attempt by Manchester United to hijack the transfer.
The France Under-21 international has joined the Premier League champions for a guaranteed £69m plus £10m in add-ons, having undergone a medical in the UK on Tuesday.
Ekitiké is understood to have signed a six-year contract and will join his new teammates on their pre-season tour of Hong Kong and Japan.
The striker was a longstanding target for Liverpool, despite their interest in the Newcastle centre-forward Alexander Isak, and contact was first made with the 23-year-old’s representatives in January. Arne Slot then outlined his plans for Ekitiké in a call at the end of last season.
Newcastle made a move for Ekitiké last week after missing out on Liam Delap and João Pedro but their £70m bid was rejected by Eintracht and the player made it clear his preference was to join Liverpool. United also received the same information when they made a last-minute attempt to derail the deal. United’s director of recruitment, Christopher Vivell, is believed to have contacted Eintracht’s sporting director Markus Krösche over a possible transfer but Ekitiké was already set on Anfield.
Ekitiké scored 22 goals and made 12 assists in his one full season at Frankfurt, helping the club to qualify for the Champions League, and while he is primarily a No 9 Liverpool believe he can also operate as a second striker or out wide.
He is potentially the third most expensive signing in Liverpool’s history behind Florian Wirtz and Darwin Núñez. Anfield officials are confident he can become one of the finest forwards in the game should his recent progress with Eintracht be maintained.
The deal for Ekitiké, which is subject to international clearance, takes Liverpool’s summer spending to almost £300m. The former Paris Saint-Germain player is the club’s seventh signing of the window, following Wirtz, Jeremie Frimpong, Milos Kerkez and a trio of goalkeepers: Giorgi Mamardashvili, Armin Pecsi and Freddie Woodman.
",TheGuardian
Barcelona confirm Marcus Rashford loan from Manchester United with buy option,England forward says La Liga club ‘feels like home’,https://www.theguardian.com/football/2025/jul/23/marcus-rashford-barcelona-loan-manchester-united-buy-option,"Wed, 23 Jul 2025 17:05:43",Guardian sport,['Manchester United'],"Barcelona have signed Marcus Rashford on a season-long loan from Manchester United with an option to buy. The forward joins after falling out of favour under Ruben Amorim at his boyhood club.
“I want to win the biggest trophies and feel like Barcelona is a huge club in the football world so it is the perfect place,” Rashford said in an official unveiling by the Spanish club. “You see with the team last season, they have a young ambitious team and I want to add my qualities, my personality, improve the team and help them win.”
Earlier, in comments to the club’s own media, Rashford said: “It’s a club where people’s dreams come true and they win big prizes. And what the club stands for really means a lot to me as well. It feels like home and this is a big factor in my choice to come here.”
Rashford was one of five United players made to train away from Amorim’s squad this summer. The England international, who spent the second half of last season on loan at Aston Villa, has been training at a gym in Salford and at United’s Carrington base, although only after first-team players have left.
The 27-year-old forward has three years remaining on a £325,000-a-week contract at Old Trafford. Barcelona said he would become the 10th man to play for them and United, after Mark Hughes, Laurent Blanc, Henrik Larsson, Jordi Cruyff, Gerard Piqué, Víctor Valdés, Zlatan Ibrahimovic, Alexis Sánchez and Memphis Depay.
“The player has signed his contract as a Barça player this afternoon at a private meeting in the presence of the FC Barcelona president, Joan Laporta, the director of the football area and other board members,” Barcelona said in a statement.
Rashford said: “I was clear on my preference from the beginning. It didn’t work out in January so I went to Aston Villa and enjoyed a good period there. I’m very grateful for the opportunity to play there. The summer came around very quickly, it was time to make another decision. My choice was easy. It’s a family club, something I’m used to from my past.”
Rashford has spent 20 years at United, scoring 138 goals in 426 appearances for the club, but has not featured since being dropped by Amorim for the Manchester derby last December. He said later that month that he was ready for a new challenge.
“The situation with United is the club is in a period of change and they have been for a while,” Rashford said. “I don’t have anything bad to say about Manchester United as it has been an important part not only in my career but my life. I was grateful for the opportunity to play for them. But football is like life – not everything goes as simply as you thought and this is my next chapter. I’m fully focused on this and trying to improve myself and helping the team win trophies.”
In a statement United said: “Everyone at Manchester United wishes Marcus good luck for the season.”
",TheGuardian
"We’ve nothing left to prove, says Lucy Bronze as Lionesses reach third straight final",Defender praises England’s spirit after victory over Italy,https://www.theguardian.com/football/2025/jul/23/england-lucy-bronze-euro-2025-final,"Wed, 23 Jul 2025 09:00:49",Suzanne Wrack,['Chelsea'],"Lucy Bronze says England have “nothing to prove” after reaching a third successive major tournament final with a dramatic extra-time win over Italy despite some unconvincing performances.
“Do we have something to prove? Not really,” the Chelsea right-back said. “That’s people from the outside thinking that teams have to win every single game. We’ve done six consecutive semi-finals, three consecutive finals, who else has done that? Nobody. [The current] Spain and Germany are fantastic teams but even they haven’t managed that feat.”
Germany did win five successive Euros and World Cups between 2001 and 2009 but have not reached six consecutive semi-finals. However, a lot has changed since then and the rest of European football, and world football, has caught up.
“It’s hard to stay at the top in international football, there’s so many teams, it’s up and down, they develop, but this team just keeps fighting until the end,” said Bronze. “I feel like we don’t have anything to prove because we’ve been there, we’ve done it many, many times, and it’s just a fact that the game’s getting better and international football’s not as easy as it used to be. Everybody’s fighting and everybody wants to win and everybody feels like they can win.”
England left fans sweating on Tuesday night, Michelle Agyemang’s stoppage time equaliser ensuring the game went to extra time at 1-1 before Chloe Kelly’s penalty in the 119th minute was saved but she was alert and turned in the rebound.
England’s opening group stage defeat to France had sounded alarm bells but that disjointed and sloppy performance was turned around against the Netherlands and Wales as they escaped the group of death.
However, worries about England’s cohesion returned in the quarter-finals, the Lionesses forced to recover from two goals down with 10 minutes remaining against Sweden before extra time and and a penalty shootout saw Sarina Wiegman’s side progress. Against Italy in Geneva on Tuesday night they were again unconvincing for much of the 90 minutes before the super subs delivered.
“I don’t think us doing it the hard way is a concern,” said Bronze. “We’ve also got to give credit to the teams that we’re playing against. Sweden showed a lot of fight, Italy were a really good team. It’s not just about one team just winning every single game.
“We saw that in this tournament, and so many teams are at such a high level, and you switch off for a moment and you’re 1-0 down. We’re just showing that we’ve got fighters in this team and that’s what you need in a tournament.
“To show that we can do that in different scenarios gives you a lot of belief because we know we can play good football as well, we know we’ve got the performances in us. Now we know going into the final that we’re capable of so many different ways of playing and winning and digging in.”
Kelly and Agyemang were again critical to England’s success in Switzerland. “Michelle was so good when she came on,” said the defender Alex Greenwood. “She caused them so many problems and then Chloe goes and scores the rebound from the penalty – that takes a lot of courage to step up to take that. I asked her, she had no doubt in her mind, she was confident enough to take it.”
Sign up to Moving the Goalposts
No topic is too small or too big for us to cover as we deliver a twice-weekly roundup of the wonderful world of women’s football
Bronze echoed Greenwood’s praise for the impact players. “What a tournament from Michelle, especially coming in with the seniors just a couple of months ago,” she said. “What a great player, what a bright future she’s got. She’s such a humble, lovely down-to-earth girl. Honestly couldn’t think of a nicer person, and then Chloe’s just attitude, sass, confidence.
“I think Chloe’s one of those players who, when she’s on the pitch, no matter what the moment of the game is, or how she’s feeling or how the crowd is, is going to push her shoulders back, big up her chest and go for it. They’re both key players in this team, obviously they haven’t started in this tournament but it just shows the strength of our squad, I don’t know many teams that have that.”
The key for England now is recovery, said Greenwood, with the team having had to come through two 120-minute games, and penalties against Sweden, to reach the Sunday’s final. They do have the advantage of an extra day’s rest over Germany and Spain, who meet on Wednesday evening.
“I’ve played this game long enough to know how to recover from games but it’s going to be crucial from now until Sunday,” said Greenwood. “The biggest message is recovery. We’ll do that properly. We’ve got a fantastic support network and the staff and they work so so hard to make sure we’re ready for every game. The girls are in a Euro final on Sunday and we’ll make sure we do everything we can to be ready for that.”
",TheGuardian
Arsenal seal €73.5m Viktor Gyökeres deal after late-night breakthrough,Club also poised to confirm Cristhian Mosquera signing,https://www.theguardian.com/football/2025/jul/23/arsenal-seal-viktor-gyokeres-deal-sporting,"Wed, 23 Jul 2025 20:41:37",David Hytner,"['Arsenal', 'Chelsea']","Arsenal have finally reached agreement with Sporting for the transfer of Viktor Gyökeres in a deal worth up to €73.5m (£63.7m), having resolved the problematic issue of the €10m of add-ons to end a tortuous saga and Mikel Arteta’s hunt for a No 9.
The north London club, who are poised to confirm the signing of the centre-half Cristhian Mosquera from Valencia for an initial €15m, made the official breakthrough late on Tuesday, sending an updated offer to their Portuguese counterparts to satisfy them over the structure of the bonuses.
Sporting have wanted the add-ons to be achievable, based on appearances, goals and assists by Gyökeres plus Champions League qualification, whereas Arsenal had wanted to include some more difficult ones. As the negotiations dragged at the end of last week, it is understood Sporting thought €5m of Arsenal’s proposed bonuses were achievable, €5m not so. One clause that was suggested related to Gyökeres winning the Ballon d’Or with Arsenal.
The negotiations have been handled largely by the agents, with club-to-club contact kept to a minimum. Sporting are comfortable with the resulting bonuses deal, having in effect held out for what they wanted.
Sporting had demanded €70m plus €10m in add-ons; an €80m package was the target, albeit it was less than the €100m release clause in Gyökeres’s contract. They have got there with a basic fee of €63.5m and the agents having agreed to waive their 10% cut of that – a saving to Sporting of €6.35m.
The positions on both sides had long been entrenched, Gyökeres determined to force the move to Arsenal, ignoring interest from elsewhere; Sporting digging in hard for their money. There has been conflict, Gyökeres refusing to report back for pre-season training with Sporting, but Arteta can at last look forward to working with his man.
It was always going to be a pivotal summer for Arsenal and Gyökeres is the latest step in a spending spree. Arteta and the sporting director, Andrea Berta, have overseen the arrivals of Kepa Arrizabalaga, Martín Zubimendi, Christian Nørgaard and Noni Madueke for a combined £118.5m.
Mosquera has travelled to Singapore to link up with the squad on their pre-season tour. The 21-year-old, who represented Spain at this summer’s European Under-21 Championship, has signed a five-year contract which has the option of a further year.
Gyökeres was a sensation at Sporting, scoring 97 goals in 102 appearances. Having signed for £20.5m from Coventry in the summer of 2023, the 27-year-old helped Sporting to the league title in each of his seasons with them – plus the Portuguese Cup in the last campaign.
Chelsea have approached Ajax over the 19-year-old centre-half, Jorrel Hato, who is rated at €40m £35m, and believe he is keen to join them. The London club have been interested in Hato since the turn of the year and the player’s agent has confirmed they have now made a move.
“Yes, the club has contacted Ajax,” Humphry Nijman told De Telegraaf. “The only thing I can say is that Jorrel is now in talks with Chelsea.”
Hato, who has progressed through the youth ranks at Ajax, made his debut for the club as a 16-year-old in January 2023 and has played 111 games for them. Capped six times by the Netherlands, he played at left-back last season but prefers a central role.
According to statistics, the only under-19 outfield player in the top 10 leagues who played more minutes in all competitions than Hato last season was Barcelona’s Lamine Yamal.
",TheGuardian
