Title,Summary,Link,Date,Author,Teams,Article,Outlet
Jota death 'extremely difficult to accept' - Salah,Liverpool postpone the return of some players for pre-season training on Friday following the death of Portugal forward Diogo Jota.,https://www.bbc.com/sport/football/articles/clyn11lyxwdo,"Fri, 04 Jul 2025 19:22:08",Dan Roan,['Liverpool'],"Liverpool forward Mohamed Salah has said it is ""going to be extremely difficult to accept"" the death of fellow Reds player Diogo Jota.
Jota, aged 28, died in a car crash along with his brother Andre Silva, who was 25.
""I am truly lost for words,"" said Salah, who joined Liverpool in the summer of 2017.
""Until yesterday, I never thought there would be something that would frighten me of going back to Liverpool after the break. Team-mates come and go but not like this.
""It's going to be extremely difficult to accept that Diogo won't be there when we go back.
""My thoughts are with his wife, his children, and of course his parents who suddenly lost their children. Those close to Diogo and his brother Andre need all the support they can get. They will never be forgotten.""
The Guardia Civil told BBC Sport both men died at about 00:30 local time on Thursday.
Jota was on his way back to Liverpool for pre-season and, as doctors had advised him against flying because he had undergone minor surgery, he was making the trip by car and ferry.
Doctor Miguel Goncalves, who worked with Jota on his recovery, described him as an ""unparalleled professional"".
He told Portuguese sports newspaper Record: ""I started working with him last Saturday and I was with him every day until this Wednesday. I said goodbye to him at dinner time.
""He made an extraordinary recovery - he was undoubtedly an unparalleled professional. He strictly followed what I told him, as you could see in the way he was recovering.
""He was excited, confident in his recovery and enthusiastic about the next season.""
He married his long-term partner Rute Cardoso, with who he had three children, 11 days before the fatal crash.
Liverpool delay pre-season return
Several Liverpool players were scheduled to return on Friday from their summer break for an initial round of physical tests at the club's training ground.
That was postponed and there will now be a phased return for players on Monday.
Liverpool manager Arne Slot's side are set to play their first pre-season match against Preston North End on Sunday, 13 July.
Former Liverpool goalkeeper Caoimhin Kelleher also paid tribute to ""one of my closest friends in football"".
""We bonded over all things, sports, watching any football match we could find - often your brother Andre's game on your iPad,"" said Kelleher.
""I was surprised a lad from Portugal loved sports such as darts, snooker and horse racing so much and some of my best memories were having a laugh watching them with you.
""It's going hurt for a long time and I'm going miss you so much but I feel so lucky to have got to know you and have such a good friend.""
A vigil for Jota and Silva was held at the Chapel of Resurrection in their hometown of Gondomar later on Friday.
There will be a funeral service at 10:00 on Saturday at the Igreja Matriz de Gondomar.
Portugal and Nottingham Forest midfielder Jota Silva laid a wreath outside the chapel, where a private wake for the brothers' relatives took place on Friday afternoon.
Locals and fans have been paying tribute to Jota outside the football academy in Gondomar where he played from the age of nine to 17.
The academy is named after him and a picture shows Jota wearing both the colours of the Portugal national side and the yellow of his hometown club as a child.
People have also been paying their respects at Liverpool and former club Wolves, who he left in 2020 to join the Reds.
Everton players Beto and Youssef Chermiti, who are both Portuguese, and former Toffees midfielder Ian Snodin laid wreaths in Jota and Silva's memory outside Anfield.
Liverpool have set up a book of condolences in the Anfield Road Stand reception area and an online version of the book has also been made available to be ""accessible to fans across the globe"".
",BBC
Rashford among five to tell Man Utd they want to leave,"Marcus Rashford, Alejandro Garnacho and Jadon Sancho are among five players to have informed Manchester United they want to leave the club.",https://www.bbc.com/sport/football/articles/c0l4kpg6e93o,"Fri, 04 Jul 2025 17:14:59",,['Manchester United'],"Marcus Rashford and Alejandro Garnacho are among five players to have informed Manchester United they want to leave the club.
Antony, Jadon Sancho and Tyrell Malacia are also looking for a move away, with United allowing all five more time to explore their future options by delaying their pre-season return until later this month.
BBC Sport has been told the club will welcome the players back to Carrington if their futures are not resolved, allowing them access to medical and training support.
Rashford had previously indicated a willingness to return for the start of United's pre-season preparations on Monday.
The 27-year-old England forward was exiled by manager Ruben Amorim in December and spent the second half of the season on loan at Aston Villa.
Amorim had also told Garnacho, 21, he will be allowed to join a new club in the summer after the Argentine was left out of the squad for their final game of the Premier League season.
Sancho, meanwhile, returned to Old Trafford after Chelsea paid a £5m penalty not to sign him on a permanent basis following a season on loan at Stamford Bridge.
Brazil winger Antony was on loan at La Liga side Real Betis last season, while defender Malacia spent the second half of the previous campaign at PSV Eindhoven.
United's first pre-season friendly is against Leeds on 19 July in Stockholm before they go to the United States for the Premier League Summer Series friendlies.
Cunha given Rashford's number 10 shirt
Brazil forward Matheus Cunha will wear the number 10 shirt at Old Trafford next season, having completed a £62.5m move from Wolves last month.
Rashford had worn the number since 2018 after inheriting it from former Sweden striker Zlatan Ibrahimovic.
But with the English forward's future uncertain, the club have handed it to Cunha, who has signed a five-year deal, with the option of a further 12 months.
It is understood United made Rashford aware of the decision in advance. The club value him at £40m but are yet to receive any bids for the forward.
In February Amorim said he ""couldn't get Marcus to see the way you're supposed to play football and to train the way I see it"".
Rashford, who has scored 138 goals in 426 senior games during 20 years with United, said last month he would like to play alongside forward Lamine Yamal at Barcelona.
He made 17 appearances for Villa on loan, scoring four goals and providing six assists.
",BBC
Man City defender Walker set to sign for Burnley,Manchester City defender Kyle Walker is close to joining Burnley after passing a medical at the Premier League newcomers.,https://www.bbc.com/sport/football/articles/cp3lv27w8q4o,"Fri, 04 Jul 2025 19:15:52",Shamoon Hafez,['Manchester City'],"Manchester City defender Kyle Walker is close to joining Burnley after passing a medical at the Premier League newcomers.
The 35-year-old England right-back will sign a two-year contract with the Clarets, having spent the second half of the 2024-25 season on loan at Serie A side AC Milan.
The move will end Walker's eight-year stay at City, where he won 17 trophies including six Premier League titles and the 2023 Champions League.
He made 15 appearances for Pep Guardiola's side in the last campaign before joining Milan, who did not activate the option to sign Walker permanently.
His City contract was set to expire next summer.
Walker will link up at Burnley with head coach Scott Parker, who he played alongside at Tottenham during the 2011-12 and 2012-13 seasons.
The defender was part of Thomas Tuchel's England squad during June's international fixtures and won his 96th cap in a 3-1 friendly defeat by Senegal.
Walker will become Burnley's fifth summer signing, with defender Axel Tuanzebe, left-back Quilindschy Hartman, goalkeeper Max Weiss and French winger Loum Tchaouna having already joined Parker's men following their promotion to the Premier League.
",BBC
Who is Chelsea's new teenage signing Atherton?,"BBC Sport assesses the career so far of new teenage Chelsea signing Chris Atherton, the youngest player to play senior football in the United Kingdom.",https://www.bbc.com/sport/football/articles/c873yyxq4xdo,"Fri, 04 Jul 2025 14:33:10",Richard Petrie,['Chelsea'],"It seemed only a matter of time before teenager Chris Atherton would sign for a major club. The 16-year-old forward's dream has come true as Irish Premiership club Glenavon confirmed on Thursday that he has signed for Chelsea.
Atherton made headlines in September 2022 when he became the youngest senior footballer in the United Kingdom at 13 years and 329 years old.
Indeed, he missed out on becoming the youngest senior player in the world by just 10 days, that record being held by Souleymane Mamam, who played for Togo in a World Cup qualifier against Zambia in May 2001 at 13 years and 319 days.
Having joined the Glenavon academy at four years old, the Northern Ireland Under-17 international broke the United Kingdom record when he came on as a second-half substitute for the Lurgan Blues during a 6-0 win over Dollingstown in the BetMcLean Cup.
He was a first-team regular for Glenavon throughout the 2024-25 season, scoring his first Irish Premiership goal against Loughgall in March as his club finished 10th in the 12-team top division in Northern Ireland domestic football.
'My phone started blowing up'
Asked to recall the publicity garnered by his debut appearance for Glenavon in September 2022 when he was handed his senior bow by then manager Gary Hamilton, Atherton said that it was a ""crazy"" period.
""I didn't really know what to do because it was just like out of nowhere,"" he said.
""Before the game I thought it would just be normal, because I was in training with them so I didn't realise it would be that big of a deal.
""It was only really when I walked out getting food after the game, my phone started blowing up with everything. It was everywhere. There were already articles and stuff on it, I didn't expect it to be that big.
""At first I enjoyed it and then it got a bit much. I just kind of turned my phone on silent and looked by it and tried to just focus on my football.""
'He's terrorising defences on his own at 16 years of age'
""One of the most exciting talents I've ever seen in Irish football, north or south,"" Glenavon manager Paddy McLaughlin told BBC Sport NI after the move was confirmed.
""It's how effortless he is running with the ball and past players, and I'm not talking about players in his own age group, I'm talking about senior players playing full-time football in the Irish League.
""He's gliding past them and terrorising defences on his own at 16 years of age. I've never seen it before.
""The only other player I could compare him to, and I don't want to put too much pressure on the young lad, but he's like [former Northern Ireland international] Paddy McCourt at Derry City before he got his move to Celtic.""
McLaughlin, who has coached Atherton since taking over at Mourneview Park in November 2024, appreciates how difficult it will be the make the grade at Chelsea but feels Atherton has ""all the attributes"" to succeed.
""He's got the temperament and he's got the attitude to go to the top. He just needs time because he's got the tools,"" he added.
""He's going to one of the top sides not just in England but in Europe, so I'm sure he'll be well looked after.
""We met the people from Chelsea earlier in the season, they requested to meet us, and they really think highly of him as well, they've a lot of hope for Chris.
""It's all pointing in the right direction but Chris knows there's a long way to go and a lot of hard work, there's a lot of learning and development, but there's no better man for it. He's a class act.""
'He has that air of confidence about him'
Former Northern Ireland international and prolific Irish League goalscorer Gary Hamilton was the Glenavon manager who gave Atherton his debut.
Speaking to BBC Sport NI after the young player broke through at Mourneview Park Hamilton spoke of the attributes Atherton possessed at such a young age.
""He has attracted a lot of interest from across the water and he's just got so much ability and talent.
""He goes away from here and he works hard away from the game as well. He eats right, he sleeps right and does the right things.
""Talent only gets you so far, you need to have the rest of it as well, and he does that.
""Everybody knows when you're a good footballer but he's so humble about it and so quiet off the pitch. Then when he goes onto the pitch he has that air of confidence about him and goes and believes in himself on the football pitch and he delivers.
""The players couldn't believe how good a player he is for his age.""
Making his mark at Euro 2028 announcement
Prodigious talent Atherton was introduced to the international stage when he represented Northern Ireland as a youth ambassador at the announcement in Nyon of the UK and Ireland's successful bid to host Euro 2028 in October 2023.
Speaking at the event, the then 14-year-old said that he would ""dream"" of representing Northern Ireland at the finals of the competition and that attending the announcement was a moment  he would ""remember forever"".
Atherton explained that one of his biggest thrills at the event was speaking to one of his heroes, former Wales international and ex-Tottenham and Real Madrid player Gareth Bale.
""I've had a quick chat with him a couple of photos and stuff, just fantastic. One of my idols growing up and to be alongside him is just special,"" added the Northern Ireland youngster.
Provoking a change in Irish FA rules
The impact of his debut at such a young age provoked the Irish FA to change its own rules at their June 2023 annual general meeting with players now having to be aged 16 by the end of that particular season before they can play senior football.
The Irish FA's rule change meant Atherton could no longer train with Glenavon during the 2023-24 season or even player for the reserves, instead having to restrict his club action to the Lurgan Blues' under-18 side.
But Atherton has got on with his football and continuing development has led to interest from Premier League clubs in addition to earning a place in his country's Under-17 and Victory Shield squads.
",BBC
Chelsea edge Palmeiras as late deflection books Club World Cup semi-final spot,"Palmeiras 1-2 Chelsea (Estêvão 53); Palmer (16), Weverton (83, og)",https://www.theguardian.com/football/2025/jul/05/palmeiras-chelsea-club-world-cup-quarter-final-match-report,"Sat, 05 Jul 2025 03:40:21",Jacob Steinberg,['Chelsea'],"Their place in the last four of the Club World Cup in the bag and the prospect of a £97m windfall still up for grabs, Chelsea found themselves in an unusual position: relieved to have survived a taxing second half, hailing Malo Gusto’s unlikely role as matchwinner and able to delight in the opposition’s goalscorer being named superior player of the match.
For a while the story of this entertaining quarter-final looked like it was going to be about Enzo Maresca finding it within himself to forgive Estêvão Willian. Everything had changed when the Brazilian sensation, who joins Chelsea after this tournament, cancelled out an early goal from Cole Palmer and hauled Palmeiras level at the start of the second half.
Quiet during the first half, Estêvão threatened to take over and send his next team back to England. The consolation for Chelsea was likely to be seeing exactly why they have paid £52m to sign a talent tipped by many good judges to win the Ballon d’Or one day.
Yet that uncomfortable conversation between Estêvão and Maresca was averted thanks to a horrendous error from Weverton seven minutes from time, a deflected cross from Gusto somehow deceiving the Palmeiras goalkeeper and bobbling in. Palmeiras, who have never won this competition, could not believe their misfortune. They lost late to Chelsea in the final three years ago; now they were out thanks to an own-goal from their goalkeeper.
Not that Chelsea cared. The future looks bright. Palmer and Estêvão working in tandem after this tournament? It is a delicious prospect and Chelsea’s owners will have loved the symbolism of the duo embracing at half-time. As for the present, the focus is on reaching next Sunday’s final in New York. Next up are Fluminese, who beat Al-Hilal in the day’s other quarter-final, and that means a reunion with a Brazilian from a different era: the former Chelsea centre-back, Thiago Silva.
There was also rare positive PR for Fifa given that its dynamic pricing model pulled in a bigger crowd than expected and quelled any debate over scheduling this tie on Independence Day. This, after all, was far from the biggest show in town on Friday. Fourth of July festivities tend to be quite a big deal in Philadelphia, the birthplace of American democracy, and anyone looking for ways to mark the holiday could choose from Major League Baseball at nearby Citizens Bank Park, free concerts and a fireworks show in the city centre.
But prices dropping as low as $11.15 (£8.17) ensured there was a decent attendance at Lincoln Financial Field, where attention was on the weirdness of Estêvão playing his future employers. What to do? In Marc Cucurella’s case it was to stick tight to the teenager and kick him at every opportunity. It was as if the left-back was determined to show Estêvão what it will be like in the Premier League. The challenges were physical and there was even a blast of fury from Cucurella after Estêvão had a nibble at Levi Colwill midway through the first half.
Chelsea were aggressive. The worry for Maresca was how his midfield would function without the suspended Moises Caicedo and the injured Romeo Lavia. Enzo Fernandez moved deeper but there was another rejig when Reece James suffered an injury during the warm-up, forcing Maresca to hand a first start to Andrey Santos.
In that context, perhaps it was not a surprise when Chelsea grew a little ragged in the second half. Making up for the absence of Caicedo’s power and Lavia’s elegance was not easy for Santos. The 21-year-old Brazilian is still adjusting to Maresca’s system after an impressive loan spell at Strasbourg, although this was still an encouraging first step. Playing in a deeper role, Santos asked for the ball, got stuck in and did not hide when the game got tough after half-time.
Palmeiras, who were without key figures in defence, had struggled at first. Maresca had left it up to Pedro Neto to decide if he wanted to play after the death of his friend and Portugal team-mate Diogo Jota. Neto was excused from training on Thursday and it would not have been a surprise if the winger had accepted the offer of compassionate leave.
Instead, though, the 25-year-old lined up on the right wing and was soon giving Micael the run around. Palmer, playing as a No 10, was just as elusive. Sixteen minutes in, he moved to the right, took a pass from Trevoh Chalobah and turned. The outcome was inevitable. Palmer swerved on to his left foot, held off a couple of challenges and threaded a low shot into the right corner from 20 yards.
Chelsea remained on top. They should have scored again, only for Christopher Nkunku to shoot over. There was a lull as half-time approached. Richard Rios had an opening for Palmeiras. Liam Delap ruled himself out of the semi-final after picking up a booking.
The mind went back to Chelsea blowing a half-time lead against Flamengo during the group stage. The Brazilian teams are not to be underestimated. Palmeiras emerged with more intensity at the start of the second half. The narrative turned in the 53rd minute. There was a clever pass from the right from Rios. Estêvão nipped in, stepping past Colwill, and then came the demonstration of his unique talent: the daring to shoot from such a tight angle, the bravery to take it with his weaker right foot, and the technique to catch Robert Sanchez out at his near post, the ball flying past the Chelsea goalkeeper and going in off the bar.
Maresca responded by removing Delap for Joao Pedro and bringing Noni Madueke on for the disappointing Nkunku. Chelsea rallied. Joao Pedro, who has only had a couple of training sessions since joining from Brighton this week, looked bright. Madueke brought more drive on the left.
The game flew from end to end. Palmeiras were too open. Chelsea kept working themselves into promising positions, although the nature of the winning goal owed more to luck than judgement, Gusto squeezing in a cross, the ball changing course and Weverton not reacting in time.
",TheGuardian
Thomas Partey: the former Arsenal midfielder facing five rape charges,Ghanaian left club this week after playing a central role in Premier League title challenges under Mikel Arteta,https://www.theguardian.com/football/2025/jul/04/thomas-partey-the-former-arsenal-midfielder-facing-five-charges,"Fri, 04 Jul 2025 18:34:06",Ed Aarons,['Arsenal'],"For the first time since Thomas Partey left his home town of Krobo Odumase in eastern Ghana at the age of 11, he woke on Tuesday without a club. Three days later the midfielder, who had departed Arsenal after his contract expired, was charged with five counts of rape and one count of sexual assault.
What happens next with Partey’s career will be determined by the outcome of legal proceedings scheduled to start with his appearance at Westminster magistrates court on 5 August. The allegations relate to three women who reported incidents between 2021 and 2022. Partey denies all the charges and “welcomes the opportunity to finally clear his name”, his lawyer said.
Partey, 32, had been linked with moves to Spain, Turkey and Saudi Arabia in recent weeks after talks over extending his Arsenal contract hit an impasse, even though Arsenal’s manager, Mikel Arteta, had insisted in May that he wanted him to stay. “Consistency-wise it’s been his best season,” Arteta said. “The way he’s played, performed, his availability, has been exceptional and he’s a really important player for us.”
Partey joined Arsenal from Atlético Madrid in a record fee paid for a Ghanaian player – £45m – in October 2020. He struggled with injuries during his first two seasons at the Emirates but became a regular during the 2022-23 campaign when Arsenal finished as runners-up behind Manchester City. A hamstring injury in November 2023 kept Partey out for most of the following season before he emerged as a key performer last season at the base of Arsenal’s midfield.
The impending arrival of Martín Zubimendi from Real Sociedad in a £51m deal that has been in the pipeline since January affected Partey’s status as a first choice, with the Spain international expected to line up alongside Martin Ødegaard and Declan Rice in a recalibrated midfield.
Partey is understood to have been offered a new deal on slightly reduced terms and confirmation of his departure came with Arsenal having agreed a fee that could rise to £15m to bring in Brentford’s Christian Nørgaard as his replacement. Partey made 52 appearances last season. Arsenal will face questions about whether it was appropriate for him to have continued playing while being investigated by the police over such serious allegations.
Partey moved to Europe after being spotted playing for Ashaiman Revelation FC in Accra as a teenager. “I played for them until I was 18, which is when I moved to Spain,” Partey told Arsenal’s website. “But that was the club I grew up at as a footballer. We had a good, young, talented team at the time, and I still have a few mates from that time who are now playing elsewhere in Europe. They are not at the very top now but they are still playing and I still talk with them a lot.”
He was encouraged to attend trials in Spain by his father, who coached him as a junior, and joined Leganés before moving to Atlético in 2012. The tough-tackling player was sent on loan to Mallorca and Almería before eventually making his debut for Diego Simeone’s side in 2015. He made almost 200 appearances for Atlético and was part of the side beaten in the 2016 Champions League final by Real Madrid before winning the Europa League two years later.
Partey has played 52 times for his country, scoring nine goals. Ghana confirmed last month that Partey had been “given a break by head coach Otto Addo” after he wasn’t included in their squad for the Unity Cup tournament in London. He also missed their Africa Cup of Nations qualifiers against Angola and Niger last November after holding “confidential” talks with Addo.
Partey has represented Ghana at three Afcon finals and the 2022 World Cup, where they were eliminated in the group stages. He remains one of the country’s most famous figures.
",TheGuardian
