Title,Summary,Link,Date,Author,Teams,Article,Outlet
Everton agree Grealish loan - why move is 'vital for career',Everton have agreed a season-long loan deal with Manchester City to sign Jack Grealish.,https://www.skysports.com/football/news/11095/13410061/jack-grealish-transfer-news-everton-agree-deal-to-sign-winger-on-season-long-loan-from-manchester-city,"Mon, 11 Aug 2025 11:20:00",,['Manchester City'],"Everton have agreed a season-long loan deal with Manchester City to sign Jack Grealish.
The deal includes an option to buy for £50m.
Grealish was undergoing a medical with the Toffees on Monday afternoon.
The 29-year-old, who turns 30 next month, is a player much admired by Everton boss David Moyes and Grealish is looking forward to working under the Scot.



Everton have moved quickly to sign Grealish amid interest from lots of clubs, having been a target for Serie A champions Napoli earlier this summer.
City recognised Grealish's need to play consistent Premier League football in a World Cup year, and that was partly behind their decision to leave him out of the Club World Cup squad.
They wanted to give him a full pre-season to find the best move for him.
Grealish is now expected to undergo a medical and finalise his loan to Everton.

Sky Sports News has previously reported that the England international is desperate for more game time as he looks to force his way into Thomas Tuchel's thinking for next summer's World Cup.
Grealish has been working with a personal trainer in a bid to make sure he is in the best possible condition for the season to come.
Grealish could have waited until deadline day for other opportunities to materialise, but he wanted to get back playing as soon as possible with the aim of being back in the England squad for next month's World Cup qualifiers against Andorra and Serbia.

City's £100m club-record signing has fallen out of favour under Pep Guardiola.
Grealish made just one Premier League start last season and was an unused substitute at Wembley for the FA Cup Final defeat to Crystal Palace.
The ex-Aston Villa attacker helped City win the Treble in 2023 as he played a key part in their Premier League, Champions League and FA Cup success.
If Grealish can complete a move to Everton, he could make his debut in their Premier League opener at Leeds on August 18 in Monday Night Football, live on Sky Sports.
Sky Sports News' Rob Dorsett:
David Moyes is a huge admirer of Grealish and thinks he could do a really good job for Everton.
That probably means using him as a No 10 rather than as a left winger, because with Iliman Ndiaye and other options they have got on the left-hand side, Grealish would not naturally slot in in that position. So that is an interesting one.
But this is a player who will be fully aware there is a World Cup on the horizon next summer, and he has not been part of Thomas Tuchel's plans as of yet. So this is vital to accelerate his career.
As things stand, he is absolutely miles off even being considered for selection by Tuchel because he is just not playing enough games.
Everybody has been talking about the fact that Jack Grealish needs to move on. Pep Guardiola offered no guarantees he would remain at the club for this season, and certainly didn't offer any guarantees about how many games he would play. It is very, very obvious from all of what happened last season that he is not part of Man City's plans.
He made just one Premier League start in 2024/25. He was an unused substitute in the FA Cup final. And that is a £100m club-record signing. So it makes sense from all parties.
It is pretty clear that David Moyes and Everton have pretty ambitious plans right now and it looks like Grealish will be pulling on an Everton shirt at their new stadium.
Everton's move for Grealish is a major breakthrough for the club amid recent frustration in the summer transfer window.
Sky Sports News reported last week that the Merseysiders had an £18m bid rejected by Aston Villa for John McGinn.
Villa consider the midfielder not for sale.
Everton boss Moyes views the 30-year-old midfielder as a priority target and is keen to add his leadership, experience, and versatility to the midfield.
There has also been frustration at the Toffees' move for Southampton teenager Tyler Dibling.
Everton have had multiple offers turned down by the Championship club for the winger.
Their latest offer was understood to be worth an initial £35m plus £8m in add-ons.
Southampton's valuation of the winger is thought to be £45m.
It remains to be seen whether Everton will follow up with another bid.



From this season, Sky Sports' Premier League coverage will increase from 128 matches to at least 215 games exclusively live.
And 80 per cent of all televised Premier League games this season will be on Sky Sports.
",SkySports
Papers: Brighton reject Man Utd's cash-plus-player Baleba bid,The top stories and transfer rumours from Tuesday's newspapers...,https://www.skysports.com/football/news/11095/13410364/man-utd-see-carlos-baleba-cash-plus-player-bid-rejected-by-brighton-paper-talk,"Mon, 11 Aug 2025 23:00:00",,['Manchester United'],"The top stories and transfer rumours from Tuesday's newspapers...
THE SUN
Brighton have reportedly rejected Manchester United's opening bid for Carlos Baleba - which included a player as part of the deal.
Man Utd and Chelsea are reportedly considering moves for Gianluigi Donnarumma after he was not included in Paris Saint-Germain's 22-player squad for the UEFA Super Cup.
England legend John Barnes is facing a fresh threat of bankruptcy after amassing more than £1.5 million in unpaid debt.
Michael Smith has been told ""the tour waits for no one"" by Dutch star Vincent van der Voort.
Racing driver Robbie Brewer has tragically died after experiencing a medical emergency during a race over the weekend.
Man-of-the-people Dean Henderson put £1,000 behind the bar at a local pub after the goalkeeper's penalty shoot-out heroics in their Community Shield win over Liverpool on Sunday.
Micah Richards believes Fulham will struggle this season after the club banned players from using Snapchat.
Rio Ferdinand is set for a bigger involvement with Manchester United - after having a formal role on their US tour.
THE TIMES
Man City are only interested in selling Savinho if he is keen to move. If that is the case, City would want more than £50m to let him join Tottenham.
THE GUARDIAN
John Textor has teamed up with the football financier Keith Harris in an attempt to buy Sheffield Wednesday.
A deal for Newcastle to sign Brentford forward Yoane Wissa is expected to be concluded this week. The Magpies have also enquired about the availability of the Porto striker Samu Aghehowa.
Rugby union is to introduce flashing LED mouthguards that light up when a player sustains a significant head impact during a match.
DAILY MIRROR
Alexander Isak is still training alone at Newcastle United's Benton base, with Liverpool having been told the Swede is not for sale unless they launch a serious offer.
Manchester United believe that personal terms with Carlos Baleba will not be an issue with the player keen on the move - but it remains to be seen whether Brighton are open to selling.
Manchester City could make moves for Rodrygo late in the transfer window as they look to fill potential gaps left by Savinho and Jack Grealish - who are both in talks to leave the Etihad.
DAILY MAIL
Jack Grealish has agreed to a number of financial sacrifices to push through a loan move from Manchester City to Everton.
DAILY TELEGRAPH
Newcastle United are considering a move to trigger Leicester City midfielder Bilal El Khannouss's release clause this week.
SCOTTISH SUN
Rangers full-back Jefte is reportedly the subject of a multi-million pound bid from a club in his homeland.
Celtic hero Neil Lennon has launched a defence of Rangers boss Russell Martin.
Rangers have agreed deals with three other SPFL clubs to send players on loan this season, according to a report.


From this season, Sky Sports' Premier League coverage will increase from 128 matches to at least 215 games exclusively live.
And 80 per cent of all televised Premier League games this season will be on Sky Sports.
",SkySports
Spurs in talks with Man City over deal for Savinho,"Tottenham have approached Manchester City about signing Savinho, with talks under way between the two Champions League clubs.",https://www.skysports.com/football/news/11095/13409995/savinho-transfer-news-tottenham-in-talks-with-man-city-over-deal-for-winger,"Mon, 11 Aug 2025 08:27:00",,"['Manchester City', 'Tottenham Hotspur']","Tottenham have approached Manchester City about signing Savinho, with talks under way between the two Champions League clubs.
There are widespread reports that a fee of around £43m (€50m) has been discussed in these talks.
Sky Sports News understands the figure would need to be higher than that for City to consider selling the 21-year-old.



City are not interested in selling Savinho, who only signed for them last summer from sister club Troyes, and it would take a huge offer from Spurs for them to consider letting him go.
Any recruitment of wide forwards for Pep Guardiola in the final three weeks of the window is contingent on Savinho leaving.

Reports that the Brazil international's exit is imminent are believed to be premature.

Spurs have been in the market for a number 10, and that search is intensifying after a long-term injury to James Maddison.
Savinho can play at No 10 but is predominantly a winger.
Spurs winger Dejan Kulusevski has previously played at No 10 when Maddison has been injured.
The north London side have also lost forward Heung-Min Son this summer after his move to Los Angeles FC, bringing an end to the captain's decade at the club.
Savinho, who has mainly been used on the right wing at City under Guardiola, scored 11 goals for Girona in the 2023/24 season from the left side of their attack, and therefore could be a natural replacement for Son.

Savinho scored three goals and provided 13 assists in 48 appearances for Man City last season.
Savinho came on as a half-time substitute in Saturday's 3-0 pre-season win over Palermo.
Savinho may find game time harder to come by at City this season following the arrival of Rayan Cherki, while he faces competition from the likes of Phil Foden, Oscar Bobb and Jeremy Doku.
Tottenham, meanwhile, are pursuing a deal for Savinho, having spent £120.3m this summer on six signings.
The Europa League winners turned Kevin Danso's (£20.9m) and Mathys Tel's (£29.9m) loan moves into permanent deals.
Mohammed Kudus has been their most expensive signing of the summer so far after his £55m arrival from West Ham.
Midfielder Joao Palhiha has joined on loan from Bayern Munich, while defenders Luka Vuskovic (£9.5m) and Kota Takai (£5m) have also joined the club this summer.
From this season, Sky Sports' Premier League coverage will increase from 128 matches to at least 215 games exclusively live.
And 80 per cent of all televised Premier League games this season will be on Sky Sports.
",SkySports
How do Newcastle resolve Isak saga and rescue 'nightmare' window?,"MOTD pundit and Newcastle United legend Alan Shearer explains why his old club have had a pre-season to forget, and how Liverpool target Alexander Isak could stay at St James' Park.",https://www.bbc.com/sport/football/articles/c0mllyjp881o?at_medium=RSS&at_campaign=rss,"Mon, 11 Aug 2025 18:19:59",,['Liverpool'],"So far, Newcastle's pre-season has been a nightmare. There is no other way of describing it.
They have had a disastrous transfer window, missing out on every one of their top targets they went for, and on top of that they have got Alexander Isak's situation hanging over them as they get ready for the opening weekend.
One way or another they have to resolve it, but that won't be easy. Isak clearly wants to leave St James' Park and join Liverpool, but he cannot be sold if they don't get anyone in to replace him.
It's not just one new striker Newcastle need, either. Callum Wilson moved on earlier in the summer so the reality is that if they don't get two centre-forwards in, Isak does not go anywhere.
That is still a possible scenario and, if he is still at Newcastle when the window closes at the start of September, things get interesting because he will want to play - he could be playing for his World Cup place with Sweden at next summer's finals.
There are a lot of ifs, buts and maybes surrounding Isak at the moment, but over the next two or three weeks we will find out a lot more about how things could pan out.
At the moment, though, Newcastle's priority is Saturday and their trip to Aston Villa.
I feel for manager Eddie Howe and the rest of the players who are having to deal with all the noise around this when it is not their fault, and Isak is not going to be with them for that game - which is really disappointing.
'Liverpool are never going to get Isak for £110m'
This summer should have been a time for Newcastle to really kick on after last season, following the highs of claiming their first domestic trophy for 70 years and then qualifying for the Champions League.
I don't know how or why it has been allowed to happen, but right now it feels like much of that momentum has been lost.
Newcastle went into the summer with no chief executive or sporting director, which I find amazing. They knew Darren Eales was stepping down as chief executive last September - 11 months ago - and Paul Mitchell left as sporting director at the end of June.
I don't know why they haven't appointed anyone yet or if that has hindered them in the transfer market, because I am not inside the club, but from the outside it is not a good look. It's a mess, and it begs the question about who has been making the big decisions.
Now they have to deal with Isak as well. There are two sides to every story and we haven't heard from Isak yet, or anyone inside his camp, other than him saying he wants to explore his options.
We don't know when he told the club that, how he told them, or what his feelings are about exactly why he wants out. What we do know is that Liverpool have offered £110m for him.
In recent years we have seen Enzo Fernandez, Declan Rice and Jack Grealish go for around £100m so, if that is the bar, they are never going to get Isak - a 25-year-old striker who has scored 44 Premier League goals across the past two seasons - for £110m. I don't think you'd get Dan Burn for that, to be honest.
Newcastle have named their price, which is nearer to £150m, so we will have to see what Liverpool do next. The top and bottom of it is that if Newcastle don't get the money they want, or the two strikers they need, then Isak stays.
Why Wissa and Watkins would be a good fit
I am not angry about the way Isak has behaved, because I know how football works. I'm disappointed and surprised that this is happening now, but I have been in the game long enough to understand why we have got to this point.
It seems obvious that Liverpool have got into him, or his agent, to turn his head and make him want to go there. From a players' perspective, rather than a fan, I get the mentality where he has made his mind up about what is best for his future too.
But it is the club that matters most here and, whatever happens next, the crux of the matter is that Newcastle United are far bigger than any one individual - it always has been, and always will be.
Players move on all the time, and do what they have to do, but the club is always there. That's the one constant, every season.
So, Newcastle have to look after themselves, which means that if they are contemplating letting Isak go for whatever price they want for him, then they also need to get two strikers they want in before they can do that.
If they are available, Brentford's Yoane Wissa and Aston Villa's Ollie Watkins are proven Premier League strikers and probably the best-case scenario from Newcastle's point of view.
At the same time, I appreciate fans of those clubs won't like their centre-forwards being linked with moves away, the same way Newcastle supporters feel right now.
Wissa's situation, in particular, sounds very similar to Isak's. It just shows you that this is something that happens in football all the time, and of course it is frustrating when you are on the wrong end of it.
How will other new strikers settle in?
It is very difficult to predict what Newcastle's season could look like until Isak's future is sorted out, but it could still be a very good one.
They have got one of, if not the best, midfields in the country, they are really strong in wide areas and it looks like they are signing another centre-half in AC Milan's Malick Thiaw.
So, looking at the bigger picture, whether Isak stays or goes and they can bring two quality strikers in, they have still got a very good team.
Even so, I am still not sure they would be able to improve on last season's fifth-place finish. Last season's top four have done so much good business and gone so big in the transfer market, it is going to be extremely difficult for any of the chasing pack to break into those places, not just Newcastle.
In terms of the title I see Liverpool as favourites, even without Isak. You just have to look at what they did last season, and how they won the title at a canter.
They have seen Trent Alexander-Arnold leave, and tragically lost Diogo Jota, but have spent heavily to strengthen their squad and won't be distracted by having any stars coming to the end of their contract. Who knows what they might do under Arne Slot if they got another forward as good as Isak is, too.
Arsenal finally have an out-and-out striker in Viktor Gyokeres and will believe that, after three successive second places, he can get them over the line in a title race. Their top scorer in the Premier League last season was Kai Havertz with nine goals, so that tells you what they have been missing.
How Gyokeres fits in is one of the things I am really looking forward to finding out in the new campaign, and it is the same with other strikers at new clubs, like Liam Delap and Joao Pedro at Chelsea. I don't think they are finished yet in the transfer market, and their attack is already looking a lot more dangerous than last season.
The same applies with how Benjamin Sesko settles in at Manchester United. I was disappointed that he chose to go there over Newcastle, but at the same time I saw him live several times last season and he is a player with potential, rather than offering guaranteed goals.
I see what Sesko's strengths are, but £74m is a lot of money for a player with room for improvement. At 22 he is no way the finished article, but there will still be big pressure on him to perform.
With Sesko, Matheus Cunha and Bryan Mbeumo, Manchester United have spent more than £200m on their forward line, but I still don't see them getting in next season's top four.
I think it's almost impossible for them to go from 15th to the Champions League places, even if fifth place is good enough again. Instead I have them finishing anywhere between sixth and 10th, but no higher.
Alan Shearer was speaking to BBC Sport's Chris Bevan.
",BBC
'I said yes to them' - when Lewandowski nearly joined Man Utd,"Robert Lewandowski discusses the time he ""said yes"" to a Man Utd move, the influence of Jurgen Klopp and why the sky is the limit for Lamine Yamal.",https://www.bbc.com/sport/football/articles/c0kz3xnd0e8o?at_medium=RSS&at_campaign=rss,"Tue, 12 Aug 2025 05:26:41",Gary Rose,['Manchester United'],"Many football fans will be aware of the story of the volcanic ash cloud that scuppered Robert Lewandowski's potential move to Blackburn Rovers - but there was another club in England the striker wishes he had joined.
""To Manchester United I decided and said yes,"" he told BBC Sport. ""I wanted to join Manchester United, to see Alex Ferguson.""
The prospect of a move to the Red Devils came in 2012, when Lewandowski was scoring prolifically at Borussia Dortmund - and two years after a volcanic eruption in Iceland had put paid to his Blackburn switch.
However, the German club simply did not want to let their talismanic striker go.
""They could not sell me,"" Lewandowski said. ""Because they knew if I stayed they could earn more money, and that I could wait maybe one or two more years.
""But it is true that I said yes to Manchester United.""
While that move failed to materialise, Lewandowski has enjoyed a stellar career at some of Europe's biggest clubs, winning the Champions League with Bayern Munich  and La Liga twice at his current club Barcelona.
At 37 he has no plans to retire any time soon, but accepts a Premier League opportunity has probably passed him by.
Speaking in a wide-ranging interview with Liam MacDevitt, Lewandowski added: ""Maybe it could be a regret [not to play in the Premier League].
""But when I am looking back [having] played for Bayern Munich, Dortmund and now Barcelona I have to say I am very happy with my career.
""I don't have this kind of feeling that I missed something, because every move or decision... I made because I wanted it.""
'I learn a lot from the young players'
Lewandowski, who has scored more than 700 career goals for club and country, is preparing for his 22nd season as a professional.
He is now the old head in a young Barcelona team featuring supreme talents like Lamine Yamal, but the Poland international believes he still has plenty to offer.
""When I see that I still don't have to catch the young guys, that they still have to catch me, it means this next season can also be very good,"" he said.
""I am still there to show the best performance from myself.""
Lamine Yamal was not even born when Lewandowski's career began, but despite being 19 years his senior, the striker believes he is still learning from younger players.
""I understood that I cannot fight with them but I can help them and they can also help me,"" Lewandowski said.
""I learn from them a lot. I didn't think it would happen like that.""
Lamine Yamal is widely viewed as a future superstar, and Lewandowski said he could see the winger was special from the moment he trained with the first team aged just 15.
""It is the first time in my life I saw after 50 minutes that he had something special,"" he said.
""I didn't believe it because I didn't see this kind of player at this age - I thought this is impossible at 15.""
When Lewandowski came close to winning the Ballon d'Or
The latest nominees for the Ballon d'Or have been announced, and for Lewandowski this time of year will be a reminder of just how close he came to winning the award.
He was among the favourites for the 2020 edition which was cancelled because of the Covid-19 pandemic.
A year later he finished runner-up to Lionel Messi for the main prize, and was named striker of the year after a record-breaking season when he scored 41 league goals.
""I was in the best moment of my career, I won everything with my club,"" he said.
""I think the difficult thing with that case is until now I don't know why.""
On who could win it this year, Lewandowski added: ""You have so many players now who can [win the Ballon d'Or].
""Lamine Yamal's season was incredible but in the end it depends what is most important. He still has a lot of time, if not this year maybe next year.
""Raphinha also had an amazing season. We have players who can be one of the favourites to win this kind of title.""
The conversation that changed Lewandowski's career
Lewandowski has played under some leading managers during his career and is currently working under Hansi Flick, who was also in charge during his trophy-laden spell at Bayern Munich.
But it is former Liverpool boss Jurgen Klopp - who Lewandowski played under at Dortmund - who had the biggest influence on the striker.
""When I moved to Dortmund I was a very young guy, I lost my father when I was 16,"" he said.
""I for sure was a boy who was more closed, I didn't want to speak about my emotion.
""However, after a few years I met someone who I don't want to say was like a father but similar.
""Maybe after so many years the kind of conversation that I missed with my father, I had with Jurgen.
""I remember the conversation until now because it changed my life, it changed my football life. I put my emotion out, I put out the words I had kept in for a few years and after this I felt freedom.
""Maybe because of this I started to play better and better.""
",BBC
