Title,Summary,Link,Date,Author,Teams,Article,Outlet
What are Isak's options - and how could Liverpool afford him?,"Alexander Isak has told Newcastle he wants to explore his transfer options this summer - but what are they and could Liverpool afford him? Sky Sports News' Keith Downie, Lyall Thomas and Mark McAdam answer the key questions around his future.",https://www.skysports.com/football/news/11095/13401270/alexander-isak-transfer-news-newcastle-future-analysed-and-liverpool-finances-explained-as-striker-explores-options,"Thu, 24 Jul 2025 19:35:00",,['Liverpool'],"Alexander Isak has told Newcastle he wants to explore his transfer options this summer - but what are they and could Liverpool afford him? Sky Sports News' Keith Downie, Lyall Thomas and Mark McAdam answer the key questions around his future.
Sky Sports News' Keith Downie:
Isak is frustrated that he was denied the opportunity last week when Liverpool made an informal approach. Ektike, who was essentially meant to be his replacement at Newcastle, moved to Liverpool instead. From the outside looking in, that was another door closing for Isak.
Eddie Howe said something that stuck out to me in his post-match presser on Saturday after the friendly against Celtic. He said: ""I am really aware it's a short career for a footballer."" That to me is something that's likely been communicated to him by Isak or his representatives.
I think Isak feels, having been at Newcastle for three years, scoring 62 goals and helping them win the cup last year, he has done what he set out to achieve.
Isak's development has been almost faster than the club's. I'm not saying he's outgrown Newcastle, but he's in a position where he is one of the best strikers in Europe playing for a team that doesn't really have the opportunity to win the Premier League, you would suggest.
He is ambitious, wants to win trophies and feels he should be earning £250k to £300k. He's not earning that at Newcastle, and he knows the other top strikers in the Premier League are earning that money. I think he doesn't want to be denied the possibility of that earning potential.
Sky Sports News' Mark McAdam:
The fact that Liverpool made an approach last week suggests that they were willing to pay a fee at least in the region of what Newcastle are looking for, which is around £150m. That admiration hasn't just suddenly disappeared with the signing of Hugo Ekitike.
Liverpool are happy with their strike force and their squad, but that doesn't mean their business is finished. This is a new summer for Arne Slot. It's the first time he's really attacked a transfer window since being appointed a year ago.
He's had 12 months with the players, he understands the Premier League, he's a Premier League winner already and he wants to make Liverpool even better, and that means signing the very best players they possibly can.
Isak is certainly one of, if not the best, striker in the Premier League. Whether Liverpool decide they can fit both him and Ekitike into their plans remains to be seen, but it is certainly one to watch.
Eddie Howe believed he could fit Ekitike and Isak into the same team, so why wouldn't Slot?
Sky Sports News' Mark McAdam:
Quite simply, Liverpool can afford to do a deal for Isak because they are very sensibly and sustainably run by owners FSG and they have been for a number of years.
I spoke with an independent football finance expert who told me Liverpool could spend £500m in this summer's transfer window and still be PSR compliant because they are so well run.
In last summer's window, they only spent £12.5m on Federico Chiesa. They also generated around £60m in player sales. That means they've got a big wedge of cash in their pocket from last summer that was unspent, and that's helping them this summer.
Their turnover was £614m in their last set of accounts. It's going to be even more next time because of the commercial success, the football success and the bonuses that are attached to a lot of those commercial packages that they've set up. Therefore, the income is going to go up too.
In terms of player sales, Liverpool have generated more than £60m already. The four players they've moved on this summer have either been academy players, who represent pure profit under PSR, or have been sold on for big profits.
Then, if you add in the likes of Luis Diaz, Darwin Nunez and Harvey Elliott, those three players alone could raise another £150m. That would also create space in the forward line, potentially.
When you take that into account, their net spend potentially starts looking quite healthy on top of being a really well-run club.
Sky Sports News' Lyall Thomas:
It looks unlikely. Arsenal were perhaps the only other club that could have truly rivalled Liverpool for Isak, but they decided to pursue Viktor Gyokeres and he is now expected to join from Sporting.
Chelsea are not in the running for Isak. They've signed Joao Pedro and Liam Delap already this summer and the club have complete faith in the options at their disposal up front. They think Isak is a great player, but he is not a Chelsea target.
Manchester United are potentially looking for a striker this summer. However, the prices involved for such a deal rule them out immediately. The focus for United currently is on player sales after signing Matheus Cunha and Bryan Mbeumo.
Isak is not a player that has been under consideration at United and this latest development is not expected to change that.
Sky Sports News' Lyall Thomas:
Newcastle's asking price for Isak is £150m, which eliminates all but a handful of clubs. Only the very top sides in Europe and some in Saudi Arabia could even contemplate such a deal with the figures involved.
Barcelona and Real Madrid are the two clubs that usually come up in such conversations, but as it stands, there is no indication that either club are in for Isak. Barca are currently unable to register their new signings so it is safe to rule them out entirely.
Paris Saint-Germain certainly have the financial might, but again there is no suggestion that the Champions League winners want to pursue a move for Isak, who would be directly competing for a starting spot with Ballon d'Or favourite Ousmane Dembele in Paris.
There has been talk of Saudi Pro League interest, but that is unlikely given Isak's aspirations to challenge for top trophies in Europe.
Sky Sports News' Keith Downie:
He needs to be content. It sounds as though he's not content at the moment, given the fact he's asked to explore other opportunities. I think it's important to say he has not handed in a transfer request, but he's asked to explore other opportunities, which suggests to me that he's unsettled and he's been affected by the approach from Liverpool last week.
Eddie Howe is a brilliant man-manager. He's going to have to rely on all his man-management experience to get Isak's head into the right place ahead of the new season if he is to stay at Newcastle.
He is still a Newcastle player, we have to remember that. And if anyone is going to buy Isak, they're going to have to pay top dollar to get him.
There was talk, and there has been for a long time, that Isak would open contract talks over a new contract at Newcastle. That hasn't materialised. I think there's a frustration there on his part that his contract hasn't been increased, that his pay hasn't gone up.
I would suggest that the club might have to come to some kind of agreement with him if he was to stay, where he got a bit of a pay rise, and perhaps there was either a release clause put in that he could leave for a certain price next summer, or a gentleman's agreement, or something to placate him a little bit.
Because without doubt, there's a frustration on his part that he feels that opportunities are passing him by.
Sky Sports News' Keith Downie:
I think the replacement was Hugo Ekitike. He essentially gets called mini-Isak. Very similar player, similar style, scores similar goals. Newcastle have liked him for over three years now, so that would have been the replacement.
There will be a real fear from Newcastle that not only have they missed out on Ekitike, but they could lose Isak as well. We know they're in talks with Brentford to sign Yoane Wissa, but that was to be the number two to Isak - not to spearhead their attack.
So the big question is, where would they turn next if Isak goes? Newcastle have explored a move for Benjamin Sesko at RB Leipzig. That's just in case Isak leaves and keeping him is a priority.
Sesko would be an expensive one, but Newcastle will have money to spend if Isak does go.
Remember, Newcastle already missed out on Liam Delap. They've missed out on Joao Pedro and they've missed out on Ekitike. So they're quite far down their list already.
I feel that once the dust is settled on this, Newcastle could come to some kind of agreement with Isak that should placate him a little bit going into the new season. They insist he's not for sale. If he is sold, it would be for mega money, around £150m.
Time will tell if Liverpool have got the money to spend on Isak as well as Ekitike.
What will be hugely intriguing is that Newcastle's first home game of the season is against Liverpool on Monday Night Football, live on Sky Sports. Which team is he going to playing for?
",SkySports
Liverpool poised to make British record bid for Isak - Paper Talk,The top stories and transfer rumours from Friday's newspapers...,https://www.skysports.com/football/news/11095/13401402/alexander-isak-transfer-news-liverpool-poised-to-make-british-record-bid-for-newcastle-striker-paper-talk,"Thu, 24 Jul 2025 22:30:00",,['Liverpool'],"The top stories and transfer rumours from Friday's newspapers...
DAILY MAIL
Liverpool are poised to make a British record bid for Newcastle striker Alexander Isak.
THE GUARDIAN
Alexander Isak is open to a move away from Newcastle, with Liverpool his preferred destination.
THE INDEPENDENT
Eddie Howe had already privately told prominent figures at Newcastle this summer that he was concerned about Alexander Isak's situation.
THE ATHLETIC
Alexander Isak's absence from Newcastle's pre-season friendly at Celtic and tour to Asia was a preference of the 25-year-old striker despite the club insisting he was left behind because of a minor thigh problem.
Aston Villa have made an offer to sign highly-rated centre-back Jaydee Canvot from Toulouse.
Juventus midfielder Douglas Luiz is set to face disciplinary action after not reporting to training on Thursday.
Rangers have made an offer for Crystal Palace winger Jesurun Rak-Sakyi.
THE TIMES
Newcastle have held talks with Alexander Isak this summer to make him the best-paid player in the club's history. Isak is seeking a new deal worth about £300,000 a week.
Heung-Min Son is increasingly likely to leave Tottenham Hotspur this summer and has an offer to join Los Angeles FC in addition to renewed interest from clubs in Saudi Arabia.
David Rozman, the senior staff member of the Ineos Grenadiers cycling team, has left the Tour de France after being notified that he is the subject of an investigation by the International Testing Agency.
THE SUN
Luke Shaw faces a Manchester United exit and the injury-hit star could be gone by January with interest from Saudi clubs.
Tottenham are considering a £15m offer for captain Heung-Min Son.
Chelsea fans are in uproar after failing to secure tickets for the club's opening game of the Premier League season.
DAILY EXPRESS
Celtic and Ajax supporters clashed inside the stadium following their pre-season friendly with Ajax.
DAILY RECORD
Brendan Rodgers insists Celtic need to show ambition in the transfer market after suffering a pre-season reality check against Ajax.
",SkySports
Villa adamant Watkins not for sale amid Man Utd interest,Aston Villa consider Ollie Watkins not for sale amid interest from Manchester United.,https://www.skysports.com/football/news/11095/13401150/ollie-watkins-transfer-news-aston-villa-consider-england-striker-not-for-sale-amid-man-utd-interest,"Thu, 24 Jul 2025 19:45:00",,['Manchester United'],"Aston Villa consider Ollie Watkins not for sale amid interest from Manchester United.
It is understood that has been communicated back to United after an initial inquiry was made.
Watkins is one of a number of strikers United have looked at along with others including Chelsea's Nicolas Jackson and RB Leipzig's Benjamin Sesko.
Villa do not want to sell Watkins, who is thought to carry a value in the region of £60m.
Villa have been keen on Alejandro Garnacho - a player United want to sell - but they are understood to be unable to meet their current asking price to buy him outright.
Garnacho's preference is to remain in the Premier League and play in the Champions League, but no such move has yet materialised despite some interest from Chelsea.
Any potential deals for the two players would be separate.
United's focus is now on player sales after buying Bryan Mbeumo for £71m from Brentford.
After Marcus Rashford joined Barcelona, United are working on exits for Jadon Sancho, Antony and Tyrell Malacia - as well as Garnacho.
From next season, Sky Sports' Premier League coverage will increase from 128 matches to at least 215 games exclusively live.
And 80 per cent of all televised Premier League games next season are on Sky Sports.
",SkySports
Gyokeres heading to Arsenal after £63.8m deal agreed with Sporting,Viktor Gyokeres is expected in London on Friday after Arsenal agreed a &#163;63.8m deal with Sporting for the striker.,https://www.skysports.com/football/news/11095/13396301/viktor-gyokeres-transfer-news-arsenal-agree-deal-with-sporting-as-striker-heads-to-london-to-finalise-contract,"Thu, 24 Jul 2025 11:00:00",,['Arsenal'],"Viktor Gyokeres is expected in London on Friday after Arsenal agreed a £63.8m deal with Sporting for the striker.
The Gunners will pay the Portuguese club a £55.1m (€63.5m) guaranteed fee, plus £8.7m (€10m) in add-ons.
Sky Sports News understands Gyokeres is due in London on Friday to sort final contractual details with Arsenal.
It is thought that the plan is then for him to join up with the squad in Singapore and complete his transfer from Sporting.
Bringing in a striker has been a primary focus for Arsenal in this transfer window - they have explored conditions for a number of players, including RB Leipzig's Benjamin Sesko.
Sky Sports News reported in June that Gyokeres was a Manchester United target after they made an initial approach for him through intermediaries.
Last month, Sporting president Frederico Varandas revealed Gyokeres would not be allowed to leave for less than £59m (€70m) this summer after disputing the existence of a 'gentleman's agreement' with the Swede's agent that would allow him to leave for a fixed fee of £50.8m (€60m), plus £8.4m (€10m) in add ons.
After joining Sporting from Coventry City for around £20m in 2023, Gyokeres has scored an incredible 97 goals in just 102 matches during his two seasons in the Portuguese capital.
Gyokeres netted 54 goals in only 52 games in all competitions last campaign, including a hat-trick against Manchester City in the Champions League, as he helped Sporting win the league and the Portuguese Cup.
A move to Arsenal sees Gyokeres return to English football, having joined Brighton & Hove Albion in January 2018, before moving to Coventry after loan spells at St Pauli and Swansea City.
Gyokeres scored 43 goals for Coventry in his two and a half seasons with the Championship side.
For years, the football world called for Arsenal to sign a striker and the Gunners have finally responded. Viktor Gyokeres is on his way to the Emirates.
The move is set to be a standout one for the Premier League - no player in Europe's top eight divisions matched Gyokeres' 39 league goals for Sporting last season and it could herald the arrival of another elite goalscorer for the division.
But it is even more significant for Arsenal, given their spending under Mikel Arteta.
Read more on what Viktor Gyokeres can bring to Arsenal here...
Developments around Gyokeres come amid a busy summer of incomings at Arsenal.
They announced the signing of midfielder Martin Zubimendi from Real Sociedad in a £51m deal and another central midfielder, Christian Norgaard, arrived from Brentford for £15m.
Spaniard Kepa Arrizabalaga was signed for £5m from Chelsea, followed by a £52m deal for Noni Madueke.
And Arsenal are set to confirm the signing of Valencia defender Cristhian Mosquera in an initial £13m deal.
From next season, Sky Sports' Premier League coverage will increase from 128 matches to at least 215 games exclusively live.
And 80 per cent of all televised Premier League games next season are on Sky Sports.
",SkySports
'An important signing for Arsenal's future' - Gunners sign Mosquera from Valencia,Arsenal have completed the signing of Cristhian Mosquera from Valencia in a deal worth at least &#163;13m.,https://www.skysports.com/football/news/11095/13397102/cristhian-mosquera-transfer-news-arsenal-complete-deal-to-sign-defender-from-valencia,"Thu, 24 Jul 2025 17:00:00",,['Arsenal'],"Arsenal have completed the signing of Cristhian Mosquera from Valencia in a deal worth at least £13m.
Mosquera has joined up with his new team-mates in Singapore after agreeing a five-year contract.
The defender said: ""There's been a lot of hard work behind all of this.
""It's an opportunity that came up and I couldn't let it pass me by. I'm joining a historic, massive club. When you arrive here with your family, you really feel the greatness of this place.""
The deal for the 21-year-old, who underwent a medical in London, could rise with performance-related add-ons.
Mosquera had entered the final year of his contract at Valencia and turned down offers of a new deal because he wanted to join Arsenal.
Valencia's statement confirmed that Mosquera only wanted to join Arsenal.
""This decision comes as a result of the clear and unequivocal desire expressed by the player, who has made it clear he did not wish to renew his contract with Valencia CF and expressed his intention to join Arsenal FC exclusively,"" the Spanish club's statement read.
Arsenal boss Mikel Arteta said of the signing: ""As a 21-year-old defender, Cristhian has already performed consistently well with significant experience in LaLiga. He is an intelligent player with good pace, who can play centrally and on both sides.""He is a young player with exciting talent and enormous potential, who will fit well into our squad as we continue to prepare for next season.""
Gunners sporting director Andrea Berta added: ""We're very happy and excited to have signed a hugely talented young player in Cristhian Mosquera. We identified Cristhian as one of the strongest young defenders in European football, and he is an important signing for our future.""
Mosquera was born to Colombian parents in Spain and joined Valencia at the age of 12, going on to make 90 senior appearances and scoring one goal.
He has also made 11 appearances for Spain U21s, starting all of their games at this summer's U21 European Championship before they were knocked out by England in the quarter-finals.
Mosquera is a naturally right-sided centre-back but has also played on the left and is expected to provide competition for both William Saliba and Gabriel Magalhaes.
Sky Sports' Nick Wright:
One of the best indicators of Cristhian Mosquera's quality can be found in the sheer number of minutes he has played. Since being drafted into the Valencia team at the age of 19 in August 2023, he has started 70 league games out of a possible 72.
In probably the most challenging position on the pitch tactically, and with all the pressure of playing for one of the biggest clubs in Spain as they navigated a turbulent period, the young centre-back came to be seen as undroppable by two different managers.
His total of 6,394 minutes played across the last two seasons is the highest by anyone aged 21 or under in Europe's top-five leagues. The volume of playing time highlights reliability and robustness. It also gave suitors such as Arsenal plenty to go on.
Clearly they liked what they saw, and they were not the only ones, with Bayern Munich and RB Leipzig also said to have tracked him. He heads to Arsenal with a reputation as one of the the most promising young centre-backs in Europe...
From next season, Sky Sports' Premier League coverage will increase from 128 matches to at least 215 games exclusively live.
And 80 per cent of all televised Premier League games next season are on Sky Sports.
",SkySports
Mount says Man Utd should aim for European return,Manchester United midfielder Mason Mount says the club's focus is on qualifying for Europe next season.,https://www.bbc.com/sport/football/articles/c4gdgd82z5ko,"Thu, 24 Jul 2025 22:24:52",Simon Stone,['Manchester United'],"Qualifying for Europe is ""the focus"" for Manchester United this season says midfielder Mason Mount.
The 2025-26 campaign will be only the second season without European football for United since English clubs were banned by Uefa in the 1980s following the Heysel stadium tragedy.
Their 15th-place league finish last season and Europa League final defeat by Tottenham meant there will be no European matches at Old Trafford for the first time since 14-15.
""Europe is a massive, massive thing for us,"" Mount said.
""The Champions League would be amazing for us and as a group we want to be playing in that competition.
""But I'd say Europe. I think that's the focus.""
Ruben Amorim's side need to improve on their 24-25 performance, when they finished 23 points behind seventh-placed Nottingham Forest, who took up the last of the European qualifying places based on a league finish.
United have already spent more than £125m to bring in forwards Matheus Cunha from Wolves and Bryan Mbeumo from Brentford.
They also continue to be linked with strikers, with Aston Villa's Ollie Watkins' the most recent subject of speculation following suggestions of a move for Chelsea's Nicolas Jackson.
Both rumours involved out-of-favour winger Alejandro Garnacho going the other way.
United sources are adamant no deal is imminent, with Villa privately saying Watkins is going nowhere.
The club have travelled to the Unired States for their three-match Premier League Summer Series campaign featuring games against West Ham, Bournemouth and Everton.
In the meantime, Garnacho and fellow outcasts Jadon Sancho, Antony and Tyrell Malacia are training with club staff at United's Carrington training complex.
Real Betis are still keen to bring Antony back to the club after last season's successful loan spell, while Juventus are keen on Sancho but need to create room in their squad before they can pursue any deal.
",BBC
