Title,Summary,Link,Date,Author,Teams,Article,Outlet
Papers: Fresh Spurs injury blow as Kulusevski timeline revealed,The top stories and transfer rumours from Friday's newspapers...,https://www.skysports.com/football/news/11095/13415874/thomas-frank-suffers-fresh-tottenham-injury-blow-as-dejan-kulusevski-expected-to-be-out-until-2026-paper-talk,"Thu, 21 Aug 2025 23:00:00",,['Tottenham Hotspur'],"The top stories and transfer rumours from Friday's newspapers...
THE GUARDIAN
Tottenham have suffered another injury blow as Dejan Kulusevski is expected to be out until around the turn of the year.
THE ATHLETIC
Borussia Monchengladbach are in talks over a deal to sign USMNT international Gio Reyna from Borussia Dortmund.
Borussia Dortmund are interested in signing Chelsea defender Aaron Anselmino on loan.
DAILY MAIL
Manuel Akanji is debating his future after Galatasaray hit Manchester City's valuation of the defender.
Crystal Palace are exploring a move for Villarreal attacking midfielder Yeremy Pino as they continue to evaluate options to replace Eberechi Eze.
DAILY TELEGRAPH
The Hundred's most successful franchise, Oval Invincibles, are expected to rebrand as MI London, the first choice of their Indian co-owners.
DAILY MIRROR
Barcelona and Oriol Romeu are set to part ways 10 months early in order to allow the La Liga champions to register players in their squad.
Manchester United have promoted wonderkid JJ Gabriel to train with the first team after Ruben Amorim was impressed by his performances.
THE TIMES
Morgan Rogers has insisted he is happy at Aston Villa amid transfer links to other Premier League clubs.




From this season, Sky Sports' Premier League coverage will increase from 128 matches to at least 215 games exclusively live.
And 80 per cent of all televised Premier League games this season will be on Sky Sports.
",SkySports
Liverpool's Frimpong out until end of international break,Liverpool defender Jeremie Frimpong has been ruled out until after the September international break.,https://www.skysports.com/football/news/11095/13415711/jeremie-frimpong-injury-liverpool-defender-ruled-out-until-after-the-international-break-missing-games-against-newcastle-and-arsenal,"Thu, 21 Aug 2025 14:43:00",,['Liverpool'],"Liverpool defender Jeremie Frimpong has been ruled out until after the September international break.
The Dutch right-back - who limped off during the Premier League opener against Bournemouth - will miss Liverpool's crucial games against Newcastle on Monday, and Arsenal on the following Sunday. Both games are live on Sky Sports.
Liverpool boss Arne Slot said: ""The medical team was completely right about Jeremie, to tell me I had to take him off because he's out until the end of the international break.
""I think I got criticised a bit by taking him off. [The medical staff] felt he had an issue in his hamstring. Good call to take him off otherwise he might have been out for longer. We expect to have him back after the international break.""
Conor Bradley returned to training with the first team on Thursday while Joe Gomez is another right-back option in the squad - but Slot said he has not played a lot of minutes, raising doubts about his ability to start.
""Conor played for a few minutes with us today, for the first time,"" said Slot, who revealed Wataru Endo and Dominik Szoboszlai could also fit in at right-back. Curtis Jones has also slotted in at right-back before for Liverpool and England.
""These things happen in a season. We have only at the moment two injuries - unfortunately it's two for the same position,"" added Slot.
""The good thing is some others can play in that position as well. Wataru played in that position for a few minutes, Dominik Szoboszlai already played in that position. There are other options we can explore.
""Joe Gomez is definitely one of them. But for him to already play 20 minutes, that was already quite a lot. I wouldn't say he had a setback but he wasn't able to train three days in a row completely with the team. It's completely normal if you've been out for so long and all of a sudden the manager needs you for 20 minutes.
""He's training with the team so let's see where he is on Monday, if he can be involved in the team or if he can even start. But there are other options as well.
""You cannot prepare for two injuries in one position. It would be stupid for us to have three full-backs or five left-backs - although we have three left-backs!""
Sky Sports' Paul Merson on The Premier League Show:
""You worry for those two games coming up. The way they play, they let [Mohamed] Salah stay up top and he doesn't have to be tracking back.
""And now with Harvey Barnes probably playing out on that wing for Newcastle, then either Eberechi Eze or Gabriel Martinelli playing there the week after, they will have to get through those next two games.
""That gives the other two teams a chance.
""I was at the Community Shield the week before and I was worried about Liverpool defensively. Frimpong likes bombing forward and Salah is staying up the pitch. There's always going to be space down their right and the opposition's left. I worry for Liverpool down there.
""If Frimpong's injured and Bradley is fit - it's probably the right move for them in the next two games who have ammunition down that side of the pitch.
""Bradley isn't fit yet, Gomez has had a few injuries so it's only right you look after him. So it will be interesting. That's where you can hurt Liverpool, anywhere else I'm not too sure.""
Liverpool received some criticism for their defending in the season opener against Bournemouth, with Jamie Carragher calling it ""absolutely shocking"".
However, the Reds will be boosted by the return of midfielder Ryan Gravenberch, who was suspended last Friday following a red card on the final day of last season.
""If he's the same player as he was last season that could help us a lot,"" said Slot of Gravenberch.
""If you look at the second goal we conceded [against Bournemouth] they could go from one side to the other side without being attacked. If you look back at last season, every single time Ryan played, he would have been in that position.
""For him not being there and us playing with very good players but very attacking-minded players, that for example hurt us in that goal. And that wasn't the first time where we lacked a player in that position in a counter-attack for the other team.""
Analysis by Sky Sports' Richard Morgan:
Liverpool head coach Arne Slot will have various options to pick from to replace the injured Jeremie Frimpong at right-back after the Netherlands international suffered a hamstring injury in the champions' opening-night win over Bournemouth, although none of them are ideal.
Frimpong will be out until after the international break, meaning Slot now needs cover for the upcoming Premier League games at Newcastle United on Monday Night Football, followed by the huge clash with title rivals Arsenal at Anfield on Sunday August 31.
Conor Bradley would be the natural choice, but the right-back has only just returned to training after his own hamstring issue saw him return early from the club's preseason tour of the Far East.
The experienced Joe Gomez, meanwhile, would be another option, but like Bradley, the versatile defender is also only just back from an Achilles injury that cut short his summer tour of Hong Kong and Japan. And while Gomez did come on for the final 18 minutes against Bournemouth, Slot indicated that Monday's trip to St James' Park may come too soon for him, at least to start the game.
And that could see the Dutchman having to convert a midfield player into a right-back, with the likes of Wataru Endo - who initially replaced Frimpong on Friday Night Football, before Gomez took over in the role - Dominik Szoboszlai, or most likely Curtis Jones - who was used there against Everton and Fulham during a similar injury crisis last April, while Thomas Tuchel also played him there in his first game as England boss - all candidates.
Unless, of course, Slot opts to try recent new centre-back signing Giovanni Leoni out in an unfamiliar right-back role, as he did with Jarell Quansah in last season's League Cup final loss to Newcastle at Wembley.
But whoever he goes for, trying to tame Newcastle's pacy left-sided forward Harvey Barnes under the St James' lights will be no easy task.
August 25: Newcastle (A), Premier League, kick-off 8pm, live on Sky Sports
August 31: Arsenal (H), Premier League, kick-off 4.30pm, live on Sky Sports
September 14: Burnley (A), Premier League, kick-off 2pm, live on Sky Sports
September 16-18: First Champions League game of the season
September 20: Everton (H), Premier League, kick-off 12.30pm
September 27: Crystal Palace (A), Premier League, kick-off 2pm
",SkySports
Eze expected to undergo medical ahead of move to Arsenal,Arsenal have agreed a &#163;67.5m deal to sign Eberechi Eze after hijacking Tottenham Hotspur's move for the Crystal Palace forward.,https://www.skysports.com/football/news/11095/13390844/eberechi-eze-transfer-news-arsenal-agree-67-5m-deal-to-sign-crystal-palace-forward-after-hijacking-tottenham-move,"Fri, 22 Aug 2025 08:00:00",,"['Arsenal', 'Tottenham Hotspur']","Arsenal have agreed a £67.5m deal to sign Eberechi Eze after hijacking Tottenham Hotspur's move for the Crystal Palace forward.
The Gunners will pay a guaranteed £60m plus £7.5m in add-ons for the forward, with personal terms now close to being totally agreed and a medical expected to take place on Friday.
The 27-year-old's release clause, worth £60m plus £8m in add-ons, expired before the Premier League season started.
Eze was absent from the Eagles squad as they beat Fredrikstad, in the first leg of their Conference League play-off at Selhurst Park on Thursday but was spotted at the ground after the game by Sky cameras.
Spurs felt they had an agreement in place with Palace and Eze on Wednesday before their north London rivals reignited their interest and swooped in following an injury to Kai Havertz.
Eze was one of a number of players Arsenal looked into in the first few weeks of the window, where, significantly, a lot of the work was carried out in June when they explored the conditions of a deal. Since then, their focus has been on other positions and player departures.
Spurs were considering offering Richarlison in a deal for Eze. That would have freed up striker space for them to try and sign Yoane Wissa, who played under Thomas Frank at Brentford. Wissa still wants to join Newcastle, who had a second bid rejected on Wednesday.
Eze, who started in Palace's draw at Chelsea on Sunday, has two years left on his contract at Selhurst Park.
Arsenal have a long-standing interest in Eze, who was previously on the books of their academy and has said he was a supporter of the club growing up.
They explored a potential deal earlier in the window, but chose not to pursue a deal at that stage as they prioritised strengthening other areas of the squad and agreeing new contracts with existing players.
Spurs then came in for Eze after Morgan Gibbs-White chose to sign a new contract at Nottingham Forest and they lost James Maddison to an ACL injury.
Talks were held between Tottenham and Palace, and Spurs felt they had an agreement in place on Wednesday with club and the player.
However, Arsenal then came in to hijack the deal in a major twist on Wednesday evening.
Sky Sports' Peter Smith:
Eberechi Eze is electric. The 27-year-old is a delight to watch with his poise and swagger on the ball and craft to open up defences, not to mention his penchant for scoring spectacular strikes himself.
He finished last season as one of the hottest prospects in the country, scoring in six games in a row, including both the FA Cup semi-final and final at Wembley as he helped inspire Crystal Palace to their first ever major honour.
Last season wasn't all plain sailing, though. ""I think Ebere has had a strange season,"" said Palace boss Glasner at the end of March. ""He hasn't had many goals in the Premier League and he has been unlucky, but he keeps going. He's also struggled with strange injuries.""
Those comments came after Eze had ignited Palace in an FA Cup tie at Fulham, scoring one and setting up another. That standout display came on the back of a first goal for England. Fit and full of confidence, Eze was back to his best during the run-in.
It is that livewire maverick Arsenal will hope can unlock deep defences and bring a spark to their previously at-times predictable patterns of attack. He offers something completely different to Leandro Trossard and Gabriel Martinelli, the current wide left options and Viktor Gyokeres will be relishing the prospect of latching onto the type of passes which have proved so productive for Jean-Philippe Mateta.
After being released by the Gunners as a 13-year-old, Eze will be motivated to seize a second-chance in north London - and, in his prime, he looks set to do just that and make a big impact for Mikel Arteta.
Sky Sports News chief reporter Kaveh Solhekol:
""Arsenal have pulled off a real coup here. At the last minute, they matched Spurs' offer, and it's important to remember Eze himself is an Arsenal supporter.
""His wish was very important in this - Arsenal matched Spurs' bid of £60m, including £7.5m in add-ons. Remember, he had a release clause which expired last week, which was worth up to £68m.
""Arsenal have been interested in signing him all summer and their fans were crying out for them to make a move for him.
""When you looked at how much business they had already done this summer you could suggest they had to sell before they brought in another player.
""Is this move motivated by the fact Kai Havertz picked up this injury at Old Trafford? Or have they been really smart and avoided getting involved in a bidding war, and knew he would choose Arsenal if he had a choice, and waited for Spurs to agree a deal before they turn up at the 11th hour and matched it. I think it's a bit of both.
""I have some sympathy for Spurs. This is not football manager, this is real life. I don't want to kick Spurs when they're down - I'm trying to see it from the perspective of their hierarchy.
""I think they did everything they could to try to sell the club to Eze. A lot of Spurs fans are asking why they didn't trigger his release clause before Friday, but maybe they tried to do that and the player could've dragged his feet. Maybe he was keeping his options open.
""Spurs fans are very angry and criticising Daniel Levy and the owners, but I think we should keep things in perspective; these kind of things happen all the time in the window.
""Ultimately, everyone knows Eze is an Arsenal fan, as are his whole family. He played for them until he was 13 when he was released.
""Why didn't Spurs trigger the release clause? It might've needed paying in one lump sum. They might've waited until it expired to get a better deal.""
This season, Sky Sports' Premier League coverage will increase from 128 matches to at least 215 games exclusively live.
And 80 per cent of all televised Premier League games next season are on Sky Sports.
",SkySports
'Reeking of desperation?' - who could Spurs turn to next?,BBC Sport looks at who Spurs might turn to in the transfer market after losing out on Eberechi Eze and finds out how the club's fans are feeling.,https://www.bbc.com/sport/football/articles/c987kgyw329o?at_medium=RSS&at_campaign=rss,"Thu, 21 Aug 2025 18:51:16",Umir Irfan,['Tottenham Hotspur'],"It's been a nightmare few days for Tottenham.
After reaching an agreement to sign England international Eberechi Eze from Crystal Palace on Wednesday, they received the news that instead he is set to join bitter north London rivals Arsenal.
Spurs are in the market for a high quality attacking midfield reinforcement. James Maddison and Dejan Kulusevski have both suffered serious injuries while Yves Bissouma missed the opening game of the season in the Premier League.
Earlier this summer, a proposed move for Morgan Gibbs-White from Nottingham Forest fell through.
Fans have been speaking to BBC Sport to vent their frustration at the situation, with one saying: ""Spurs now enter the final few weeks of the transfer window reeking of desperation.""
However, another said: ""If he's a Gooner we don't want him. Simple.""
With less than two weeks of the window left, the options for Spurs in the transfer market are limited, but there are players that could prove to be smart targets should Spurs choose to pursue them.
It will be important to ensure any new midfield signing is physical, a good carrier of the ball over distance, technically secure when deeper, and a strong passer.
BBC Sport looks at Spurs' possible transfer options and speaks to fans to analyse the situation.
Who could Spurs target?
Mikkel Damsgaard (Brentford)
Spurs boss Thomas Frank's former midfielder was pivotal to Brentford last season, with two goals and 10 assists. In describing what Frank may be looking for in his attacking midfielder, there isn't a better place to look than the Denmark international.
Damsgaard provided Frank with solutions to their build-up play, frequently dropping into wide areas, deeper. Opposition defenders were unsure whether or not to follow him into these areas and Brentford could get up the pitch more often.
He would help Brentford with smart passes to the wingers or turning on the ball and driving with it himself. When under pressure, he would bounce it back to a defender with a first-time pass, not taking unnecessary risks.
By playing well-weighted direct through balls often, Damsgaard was a large factor in Yoane Wissa and Bryan Mbeumo's goal output.
Off the ball, Damsgaard pressed in a front two, intercepting the ball in dangerous situations. His pressing intensity and willingness to defend embodied the culture Frank has tried to instil in his teams throughout his career.
Although slightly on the nose, the well-rounded midfielder would slot into Frank's system at Spurs with ease. The familiarity ensures questions about tactical fit are a non-issue.
At only 25 years old, he combines experience, Premier League know-how and technical and physical quality, allowing him to scale up to a Champions League side.
Bilal El Khannouss (Leicester)
It is important to contextualise El Khannouss' Premier League performances and statistics, given he played for a poor Leicester side who spent large parts of last season defending deep.
Although he only scored two goals and assisted three times in the league, his performances have caught the eye of teams in the Premier League, most recently being linked to Crystal Palace as a potential Eze replacement.
What stands out immediately is his technical quality. El Khannouss is accomplished with both feet and is often seen playing passes and crosses with either, depending on what flank he has floated towards.
The manner in which he dropped as deep as the defensive midfielders, to improve the Foxes' build-up, is something Frank would appreciate. In these situations, he would carry his team upfield using deceptive feints to create space from opponents pressing him.
Although El Khannouss is an attacking midfielder, he often found himself in wing positions and showcased great crossing quality and high-level ball manipulation.
He has good pace in big spaces but on the ball plays at a slower pace appropriately. His two-footedness provides balance and additional creative solutions alongside left-footed wingers.
The only real question mark in his game is how quickly he gets his shots off. He has a powerful strike of the ball and is excellent on set-pieces but takes time to set up his shot, leading to his strikes being blocked. This makes scoring for El Khannouss more difficult in crowded spaces, but he should be a threat when shooting from distance.
Maghnes Akliouche (Monaco)
Akliouche, just like Eze, is a natural winger who moves to play more centrally during the game. With five goals and 10 assists in Ligue 1 last season, the Frenchman took a step up, although he underperformed against his expected goals total of 9.3.
Even as a winger, he has a tendency to drop deep. From such areas, he can drive the ball over large distances quickly, showing strength to hold off defenders. His ball manipulation is impressive, often using his studs and ball rolls to confuse defenders.
Against deep defences, the Monaco winger has been seen moving into central midfield positions to find solutions. Here he passes well and can find team-mates at a variety of angles. As a talented passer, he would help to provide balance to Spurs' group of impressive ball carriers.
Despite his on-the-ball quality, he doesn't neglect his off-the-ball work. He tracks back diligently if his team have lost the ball. In attack, he makes good runs behind the opposition's back line.
Frank likes his versatile attackers, particularly those that can play multiple roles. Akliouche provides a different profile down the middle and would work well with Porro on the right flank. This would free Kudus to play centrally too.
Akliouche displays a goal threat greater than the rest of the names in this list. However, he is the most naturally attacking player, playing in a more dominant side compared to Brentford and Leicester.
Tyler Dibling (Southampton)
Like Eze, Dibling is a winger who can play centrally. For Southampton last season, there were games in which he stayed fairly central.
As a winger, Dibling resists pressure well from defenders on his back, getting used to being closely marked in the Premier League with pressure from behind him. He takes this quality with him when playing in midfield.
When starting centrally, he often dropped deep and towards the right side of the pitch to provide his team's defenders with an extra passing option. To find space in these situations, he would fake to run in behind, dragging a midfielder with him, before dropping deep quickly to receive the ball.
If there is the opportunity to turn with the ball, the Englishman does so and impressively avoids being tackled by riding contact well over large distances and having quick feet in small spaces.
He can be less active than others on this list when he doesn't have the ball and prefers to receive the ball to feet, rather than making runs behind a defender.
At times, Dibling would suit playing down the middle more than on the wing if he were to sign for Spurs.
Down the middle, he is able to showcase his ability to shift the ball and shoot quickly. Out wide, he can be susceptible to not quite getting the right flight on in-swinging crosses from the right flank, a method of chance creation that Frank likes to use.
'Selling clubs know how to squeeze us' - Spurs fan reaction
By Bardi, fan writer from The Extra Inch, external
Daniel Levy's reign has seen an upturn in fortune and fortunes at Spurs, but they still seem unable to compete and complete transfers.
With Morgan Gibbs-White's move to Spurs in pieces, Eze seemed the next logical step, especially with top-four rivals out of the equation, but somehow Levy and Spurs failed to get it over the line.
Who moved the line depends on where you stand in the great Levy debate, but what's clear is that he seems unable to work with other Premier League clubs.
Premier League chairmen know what to expect from him. They expect to be ""drawn over the coals"" and they've had enough.
Eze was probably not the player we needed. He's not a high-volume creative passer or a dribbling sensation, but he represented far more than that. He's a player at the peak of his powers, and his signature would be a statement of intent. It would also ultimately deny Arsenal a player they coveted.
Spurs now enter the final few weeks of the window reeking of desperation. Selling clubs know what we're holding and how to squeeze us. We have no other option but to pay what they want.
A selection of fan responses to BBC Sport on Thursday
Brian: Totally embarrassing. Over a week to get Eze signed and still couldn't manage it and Arsenal do it in hours. A kick in the teeth to Spurs fans. We spend so much wasted time on negotiating deals, it's pure frustration!
Bob: Can't say I'm that bothered. He is 27 years old and his career so far has been QPR and Palace. He's not been wanted by anyone like Barca or Real - move on.
Ian: Spurs' mentality is like being a multi-millionaire and driving 25 minutes out of town because the petrol is 5p cheaper. By the time you get home you haven't saved anything, wasted a bunch of time, and everyone else is confused by what you're doing and laughing at you.
Andre: Eze is a fantastic player and would strengthen any team he plays for. But, we can't look back. He isn't a Spurs player so let's not cry about him. Onwards and upwards!
Christopher: Can't help but feel that Ange would've sounded Eze out and identified if his heart was in joining THFC or if he was stringing them along. If anything, it would have prevented this song and dance from playing out at Levy's Tottenham.
Anthony: Completely get it from Eze's perspective, it's his boyhood club. For me, it's another case of Levy and co. taking far too long to wrap something up. Realistically this only reportedly happened because of Havertz's injury, but in football you should never take anything for granted. Not sure where to go now, put the extra funds towards Savinho and find another 10 quick.
Bob: If he's a Gooner we don't want him. Simple.
Mark: For once I don't think we can blame Levy for dragging his heels on this outcome. I don't think Eze ever wanted to sign for us, all we did was set it up for Arsenal to step in. Fair play to their buying team and no doubt our smug North London neighbours will be letting us know how good they feel.
",BBC
