Title,Summary,Link,Date,Author,Teams,Article,Outlet
Liverpool to retire number 20 in honour of Jota,Liverpool have confirmed that the number 20 shirt will be permanently retired in honour of Diogo Jota.,https://www.skysports.com/football/news/11095/13395583/diogo-jota-liverpool-confirm-number-20-shirt-will-be-retired-to-honour-forward,"Fri, 11 Jul 2025 20:20:00",,['Liverpool'],"Liverpool have confirmed that the number 20 shirt will be permanently retired in honour of Diogo Jota.
The tribute marks the first time Liverpool have retired a player's number throughout their 133-year history, as they honour the lives of Jota and his brother, Andre Silva, who were killed in a car crash in Spain on July 3.
The retirement applies to the club at all levels, including men's first team, women's team and all academy sides.
Liverpool came to the decision after consulting with Jota's wife, Rute, and other members of his family.
A statement from the club read: ""The move is recognition of not only the immeasurable contribution our lad from Portugal made to the Reds' on-pitch successes over the last five years, but also the profound personal impact he had on his teammates, colleagues and supporters and the everlasting connections he built with them.""
Club CEO Michael Edwards also spoke on the matter, saying: ""As a club, we were all acutely aware of the sentiment of our supporters - and we felt exactly the same way.
""It was vitally important to us to involve Diogo's wife, Rute, and his family in the decision and to ensure they were the first to know of our intention.
""I believe this is the first time in Liverpool Football Club's history that such an honour has been bestowed upon an individual. Therefore, we can say this is a unique tribute to a uniquely wonderful person.
""By retiring this squad number, we are making it eternal - and therefore never to be forgotten.
""Diogo joined us in 2020, he won us number 20, and he wore - with honour, distinction and affection - the number 20.
""As far as Liverpool Football Club is concerned, he will be forever our number 20.""
The Reds have also announced plans to pay tribute to them during Sunday's pre-season friendly against Preston.
There will be a rendition of 'You'll Never Walk Alone' prior to the 3pm kick-off and Preston will lay a wreath alongside the away supporters, Liverpool said.
A minute's silence will then be observed, with digital tributes displayed on the stadium big screen and on pitchside LED boards.
Players from both teams will wear black armbands.
The pre-match programme will also feature written tributes to Jota and Silva.
",SkySports
Forest consider Gibbs-White's Spurs switch off for now and consult lawyers over move,"Nottingham Forest consider Morgan Gibbs-White's proposed move to Tottenham to be off for now,<em> Sky Sports News</em> has been told, while Forest consult their lawyers over potential legal action.",https://www.skysports.com/football/news/11095/13395403/morgan-gibbs-white-transfer-news-tottenham-hotspur-move-in-jeopardy-as-nottingham-forest-consider-legal-action,"Fri, 11 Jul 2025 20:17:00",Rob Dorsett,['Tottenham Hotspur'],"Nottingham Forest consider Morgan Gibbs-White's proposed move to Tottenham to be off for now, Sky Sports News has been told, while Forest consult their lawyers over potential legal action.
Sky Sports News understands Forest have ceased all communication with Spurs as things stand. However, Tottenham are hopeful their deal for the England international will still be completed.
Forest believe Spurs made an illegal approach to the player and never granted permission for them to speak to him.
Sky Sports News reported on Thursday that Tottenham had triggered a £60m release clause in his Forest contract.
Forest believe there has also been a breach in confidentiality around his release clause because Tottenham's bid was pitched at exactly that level.
It is not yet clear if Forest are able to block the transfer entirely. However, it is now expected to be delayed as Forest prepare a complaint to the Premier League.
Forest have refused to comment on Sky Sports News' information. Spurs did not comment when contacted.
From next season, Sky Sports' Premier League coverage will increase from 128 matches to at least 215 games exclusively live.
And 80 per cent of all televised Premier League games next season are on Sky Sports.
",SkySports
Why fans doubt Madueke – and why they might be wrong,"Arsenal&#8217;s pursuit of <a href=""https://www.skysports.com/football/news/11095/13395213/noni-madueke-transfer-news-arsenal-close-to-agreeing-50m-deal-for-chelsea-winger"">Noni Madueke</a> has provoked a vociferous online reaction from fans. A poll conducted by <em>Sky Sports</em> shows around 70 per cent of 35,000 voters feel he would be a bad signing. Some have even signed a petition against the deal.",https://www.skysports.com/football/news/11095/13395319/noni-madueke-to-arsenal-why-fans-are-doubting-the-chelsea-winger-and-why-they-might-be-wrong,"Fri, 11 Jul 2025 10:00:00",Nick Wright,"['Arsenal', 'Chelsea']","Arsenal’s pursuit of Noni Madueke has provoked a vociferous online reaction from fans. A poll conducted by Sky Sports shows around 70 per cent of 35,000 voters feel he would be a bad signing. Some have even signed a petition against the deal.
For many, the frustration stems from Arsenal shopping at Chelsea again. Madueke will become the seventh player in six years to move from Stamford Bridge to the Emirates Stadium. The list holds cautionary tales in David Luiz, Willian and Raheem Sterling.
Go back further and there are more examples, from William Gallas and Lassana Diarra to Petr Cech. Overall, it is clear which club has benefitted most from the transactions. Even the more successful signings, most notably Kai Havertz, continue to split opinion.
The £65m fee paid for Havertz remains a subject of debate, two years on, and the finances involved in the deal for Madueke are even more contentious. Arsenal will pay up to £52m, allowing Chelsea to make a huge profit on a player they signed for £29m in 2023.
It is a hefty fee, particularly for a player who primarily plays in the same position as Bukayo Saka. Arsenal fans are entitled to wonder whether Madueke has done enough in the last two and a half years at Chelsea to justify a 70 per cent increase in his value.
A lack of end product has been a source of frustration. Madueke started last season with a hat-trick against Wolves in a 6-2 win at Molineux but went on to score only seven times and provide only three assists in 32 Premier League appearances in total.
The top-line numbers are modest but Arsenal will have noted that they could easily have been higher. Statistically, Madueke's shots were worth a total of 9.66 expected goals.
The fact he scored nearly three goals fewer than 'expected' can be interpreted as evidence he is a poor finisher but it is more likely down to variance. Last season looks an outlier; the first in Madueke's career in which he has underperformed on his expected goals.
Arsenal will feel confident that a reversion to the mean could bring higher returns in future and, even amid questions over his end-product, there is no doubting the threat he provides.
Madueke ranked among the Premier League's top 15 players for non-penalty expected goals and expected assists combined per 90 minutes last season. He was in the top 10 for shots per 90 minutes and even higher for touches in the opposition box, in fifth.
Long-legged and upright, he is not the most aesthetically pleasing of players. His running style can appear awkward. But he is a quick and effective ball-carrier whose directness would give Arsenal another weapon on transitions and when breaking down compact defences.
Last season, he ranked top among all Premier League players for shot-ending carries per 90 minutes, on 1.63. His average of 1.98 successful dribbles put him nearly level with Saka (2.13) and a long way ahead of either Martinelli (1.29) or Leandro Trossard (1.34).
Of course, Madueke's best work has come from the right-hand side, where Saka has become a fixture in Mikel Arteta's team. The academy product is Arsenal's best and most important player.
Madueke's chance of usurping him looks slim. What he can do, though, is provide a high-quality alternative, sharing his England team-mate's workload and therefore lowering the risk of another injury like the hamstring tear that proved so costly last term.
Surely, though, Arsenal are not spending £50m just for a Saka back-up? Especially when they already have the hugely promising Ethan Nwaneri, whose development should remain a priority.
With reports suggesting Trossard could be sold this summer, Madueke is also expected to be used as an option on the left.
It is reasonable for Arsenal fans to feel underwhelmed at that prospect given previous links to more high-profile targets such as Real Madrid's Rodrygo. Madueke, unlike the Brazil international, is not even a natural on that side.
On the face of it, his appearances on the left for Chelsea in the final weeks of last season do not appear to offer much encouragement either. Madueke produced no goals or assists when starting on that side. He did, though, produce some encouraging displays.
There was a particularly eye-catching performance in a 1-0 win over Everton in April, when he forced a string of saves from Jordan Pickford. A week later, in a 3-1 win over Liverpool, he was similarly dangerous, with Arne Slot describing the problems caused by his dribbling as ""something he hadn't seen before"" against his side.
Madueke was subsequently used on the left by England boss Thomas Tuchel. He was one of few players to impress in their narrow World Cup qualifying win over Andorra last month.
Still, it is not the most compelling body of work.
Madueke was used almost exclusively on the right-hand side by former club PSV Eindhoven. Less than 10 per cent of his Premier League minutes have come on the left for Chelsea.
Madueke will need to prove his left-wing credentials to Arsenal fans. Some will say he also has something to prove in terms of his work rate and temperament.
Enzo Maresca clearly valued Madueke, starting him more times than any other Chelsea winger last season, but he also questioned the consistency of his application. ""Noni can do much more,"" he said in December, before dropping him for a game against Fulham. ""He has to understand that he has to train well every day.""
Maresca's comments, coupled with an unseemly dispute with team-mate Nicolas Jackson over a penalty against Everton last year, have contributed to shaping negative perceptions of Madueke but others who have coached him paint a very different picture.
Saul Isaksson-Hurst, a technical and skills specialist who has been working with Madueke on an individual basis since his time at PSV, described him as a ""mentality monster"" in conversation with Sky Sports before his move to Chelsea.
""He is so driven,"" he added. ""He's got such a clear vision of what he wants to do and he is willing to put the work in."" This is, after all, a young player who chose to leave Tottenham's academy for PSV at the age of only 16 in the interests of self-improvement.
Another coach who worked with Madueke in England's youth teams describes him in similar terms when asked by Sky Sports, saying he is a ""lovely lad"" who is ""driven to succeed and single-minded"", and who ""listens to the advice of his coaches.""
That same sentiment came across from Maresca's predecessor Mauricio Pochettino in May of last year, when, in the press room at Stamford Bridge after a win over Tottenham, he singled out Madueke for his ""unbelievable"" defensive work in helping rookie full-back Alfie Gilchrist deal with Heung-Min Son.
For Arteta, the hope is that he will be able to mould Madueke into the player he needs, whether that's on the right or the left.
But there is no escaping that it is a high-risk move at the price. On some levels, the doubts of supporters are understandable. Madueke is not an obvious upgrade on either flank. He does, though, have exciting tools to work with, and, at 23, potential to be tapped into.
From next season, Sky Sports' Premier League coverage will increase from 128 matches to at least 215 games exclusively live.
And 80 per cent of all televised Premier League games next season are on Sky Sports.
",SkySports
Arsenal close to Madueke deal after Chelsea give permission to leave CWC,Chelsea have given Noni Madueke permission to leave their Club World Cup camp in the USA to finalise a &#163;52m move to Arsenal.&#160;,https://www.skysports.com/football/news/11095/13395213/noni-madueke-transfer-news-arsenal-close-to-agreeing-52m-deal-for-chelsea-winger,"Fri, 11 Jul 2025 15:49:00",,"['Arsenal', 'Chelsea']","Chelsea have given Noni Madueke permission to leave their Club World Cup camp in the USA to finalise a £52m move to Arsenal.
The England international is expected to join the Gunners for an initial £48m plus £4m in add-ons.
The 23-year-old will undergo a medical with Arsenal soon.
Arsenal have been looking to sign a left-sided forward this summer, although Madueke featured 33 times on the right side of Chelsea's attack during the 2024/25 season and on only seven occasions on the left, contributing no goals or assists in that time.
The Gunners, who have also looked at a number of other players in the forward positions, including Real Madrid's Rodrygo, have both Bukayo Saka and Ethan Nwaneri to fill the right-winger spot.
Chelsea signed Madueke from PSV for £29m in January 2023 and he has five years left on his contract. However, the Blues have strengthened significantly in attacking areas this summer.
Liam Delap arrived for £30m from Ipswich and Joao Pedro joined from Brighton in a deal worth up to £60m.
The west London club also added Jamie Gittens from Borussia Dortmund for an initial fee of £48.5m, plus £3.5m in potential add-ons.
Chelsea boss Enzo Maresca:
""Noni is in contact with the new club and I guess he is going to be [announced] in the next hours. Selling him to a rival? If players want to leave, then it is difficult for the club and the manager.""
""Noni decided to leave. Nobody told Noni he had to leave. If he is happy, we are happy.""
Real Madrid forward Rodrygo is the other top target Arsenal have for that position but it appears unlikely they are going to sign both players.
Rodrygo would certainly be the more exciting signing given his profile and pedigree, being a two-time Champions League winner.
Reports in Spain indicate he is valued at around £69m (€80m) - more than Chelsea demanded for Madueke.
Rodrygo's future at Real is up in the air under new boss Xabi Alonso, who gave him a limited role at the Club World Cup. The Brazil forward only started one of their six matches.
The 24-year-old has become known for being a right winger at Madrid but his preferred position is on the left, which would suit Arsenal's needs.
Sky Sports' Sam Blitz:
Arsenal's pursuit of Noni Madueke has been a surprise - and a significant transfer fee put towards the Chelsea winger would split opinion in the Gunners fanbase.
Arsenal are looking for a new winger to refresh their wide options but many expected the No 1 target to be Real Madrid's Rodrygo or Athletic Club's Nico Williams.
Both have the status and talent to match what Bukayo Saka does on the opposite flank.
As a right winger, Madueke would provide the Gunners with suitable cover for Saka - but is he the answer for Arsenal as a first-choice left winger?
The 23-year-old played most of last season on the right but it is worth noting that eight out of his last nine appearances for club and country have come on the left wing.
In his seven starts for Chelsea on the left last term, Madueke failed to get a goal, an assist or create a big chance in any of them. Looking at the numbers and his overall play, he seems more comfortable on the right.
However, it is worth noting that Chelsea did win six of those seven games where Madueke started on the left - the only defeat was the 2-0 loss at Newcastle, where Nicolas Jackson was sent off and Madueke was sacrificed at half-time.
Madueke did get an assist for England's winner against Andorra after starting on the left wing. But is Madueke going to significantly improve Arsenal's options in that position, even though he may be cheaper than Rodrygo?
Sky Sports News chief reporter Kaveh Solhekol:
""I think it's a bit of a complicated situation regarding Madueke because he's played well for Chelsea since they signed him two-and-a-half years ago from PSV for £29m. But it's been well documented that Chelsea have spent a lot of money in the transfer window already this summer and they need to balance their books.
""Last week they came to an agreement with UEFA that basically said that if they want to register new players for the Champions League next season, they have to make sure that their transfer spend this season is balanced out this summer by the players they sell as well.
""So they've signed players like Liam Delap and Joao Pedro. That means they also have to sell players.""
In
Kepa Arrizabalaga - Chelsea, £5m
Martin Zubimendi - Real Sociedad, £51m
Christian Norgaard - Brentford, £15m
Out
Jorginho - Flamengo, free
Kieran Tierney - Celtic, free
Nuno Taveres - Lazio, £4.3m
Marquinhos - Cruzeiro, undisclosed
Takehiro Tomiyasu - released
Thomas Partey - released
In
Jamie Gittens - Dortmund, £51.5m
Joao Pedro - Brighton, £60m
Liam Delap - Ipswich, £30m
Estevao Willian - Palmeiras, £29.1m
Dario Essugo - Sporting, £18.5m
Mamadou Sarr - RC Strasbourg, undisclosed
Out
Bashir Humphrey - Burnley, undisclosed
Marcus Bettinelli - Man City, undisclosed
Kepa Arrizabalga - Arsenal, £5m
From next season, Sky Sports' Premier League coverage will increase from 128 matches to at least 215 games exclusively live.
And 80 per cent of all televised Premier League games next season are on Sky Sports.
",SkySports
Rashford becomes Barca's top left-wing target - Sky in Germany,"Manchester United forward Marcus Rashford is now Barcelona's clear left-wing target, according to <em>Sky in Germany</em>.",https://www.skysports.com/football/news/11095/13395354/marcus-rashford-transfer-news-man-utd-forward-becomes-barcelonas-top-left-wing-target-sky-in-germany,"Fri, 11 Jul 2025 10:58:00",,['Manchester United'],"Manchester United forward Marcus Rashford is now Barcelona's clear left-wing target, according to Sky in Germany.
Barca are expected to try and agree a deal and are ""prepared to go all-in"".
This is because Liverpool have rejected their advances for Luis Diaz, and Nico Williams has signed a new deal at Athletic Club.
Sky Sports News has already reported that Rashford is keen to join Barcelona.
The forward has returned to Carrington despite being offered extra time off and is training away from the first team, using the medical and rehab facilities.
The 27-year-old is among five Man Utd players who can explore a potential move away after expressing a desire to leave.
Matheus Cunha has taken the No 10 shirt from Rashford, who said he wanted a ""new challenge"" before joining Aston Villa for the second half of last season.
One source has told Sky Sports News it has been made clear to Rashford that he does not figure in Ruben Amorim's plans, and the England international is keen to pursue opportunities elsewhere.
There have been no official offers for Rashford after he returned from his loan at Villa.
Sky Sports News has previously reported that Rashford wants to play Champions League football next season, but is not willing to relocate to London. His representatives are also against their client being involved in any part-exchange deal.
Sky Sports News' senior football news editor Lyall Thomas:
Barcelona remains Rashford's preferred destination should he leave United this summer.
And, intriguingly, the door could be opening on a move to Catalonia.
That's because in the past week, Barcelona have seen their hopes of landing either Liverpool's Diaz or Athletic Club's Nico Williams more or less extinguished.
Financial issues remain a concern at Barcelona. They have tight financial parameters set by LaLiga and a recent history of failing to register players due to problems around funding those deals.
Rashford's prospects of a switch to Barcelona look more likely now than they did two weeks ago - but how a deal will be structured will take some work given Barcelona's financial issues, Rashford's wages at Manchester United, and the Old Trafford club's preference to sell rather than sanction another loan.
Read here for a 360 look at Rashford's future.
From next season, Sky Sports' Premier League coverage will increase from 128 matches to at least 215 games exclusively live.
And 80 per cent of all televised Premier League games next season are on Sky Sports.
",SkySports
Liverpool to retire number 20 in honour of Jota,"Liverpool are to retire the number 20 shirt in honour of Diogo Jota, who died in a car crash along with his brother Andre Silva.",https://www.bbc.com/sport/football/articles/cpqnwpxle79o,"Fri, 11 Jul 2025 19:36:32",Mandeep Sanghera,['Liverpool'],"Liverpool are to retire the number 20 shirt in honour of forward Diogo Jota, who tragically died in a car crash along with his brother Andre Silva.
The Reds took the decision after consulting with Jota's wife Rute Cardoso and his family which means the Portugal international ""will forever be Liverpool's number 20"".
A Liverpool statement, external said the number ""will be retired in honour and memory of Diogo across all levels"", including the women's team and throughout the academy.
They added: ""The move is recognition of not only the immeasurable contribution our lad from Portugal made to the Reds' on-pitch successes over the last five years, but also the profound personal impact he had on his team-mates, colleagues and supporters and the everlasting connections he built with them.""
Jota joined Liverpool from Wolves in 2020 and scored 65 goals in 182 appearances for the club.
He also helped them win the FA Cup and League Cup in 2022 - also winning the latter in 2024 - and the Premier League title last season.
It was Liverpool's 20th top-flight crown and the Reds posted a video on social media, external with the message 'forever our number 20' at 20:20 BST on Friday.
""As a club, we were all acutely aware of the sentiment of our supporters - and we felt exactly the same way,"" said Fenway Sports Group chief executive of football Michael Edwards.
""It was vitally important to us to involve Diogo's wife, Rute, and his family in the decision and to ensure they were the first to know of our intention.
""I believe this is the first time in Liverpool's history that such an honour has been bestowed upon an individual. Therefore, we can say this is a unique tribute to a uniquely wonderful person.
""By retiring this squad number, we are making it eternal - and therefore never to be forgotten.""
Jota and his brother died after their car, a Lamborghini, left the road because of a tyre blowout while overtaking another vehicle at about 00:30 local time on Thursday, 3 July.
Jota was on his way back to Liverpool for pre-season and, as doctors had advised him against flying because he had undergone minor surgery, he was making the trip by car and ferry.
The funeral of the brothers took place in their hometown of Gondomar last Saturday when a large Liverpool delegation were in attendance.
Jota's wife attends Anfield tributes
Jota's wife Rute Cardoso, members of the brothers' family and Liverpool's squad all visited Anfield on Friday to pay their respects.
Cardoso had three children with the Portugal international and the pair had married only 11 days prior to his accident.
She was seen carrying flowers at Anfield as she viewed the wealth of tributes that have been left outside the stadium in honour of Jota and his brother.
Liverpool players and staff have paid personal tributes in the week but the squad went as one with manager Arne Slot along with Cardoso on Friday.
Liverpool will play their first game since Jota's death when they face Preston North End at Deepdale in a pre-season friendly on Sunday.
Jota and Silva will be commemorated with a number of tributes and there will be a minute's silence at the game.
",BBC
