Title,Summary,Link,Date,Author,Teams,Article,Outlet
Eze Q&A: How a shock North London U turn unfolded - and what next,With Eberechi Eze heading for boyhood club Arsenal after the Gunners stole a march on north London rivals Spurs - who looked certain to sign him - what's the full story in yet another dramatic saga in one of the most memorable transfer windows ever?,https://www.skysports.com/football/news/11095/13415595/eberechi-eze-qa-how-arsenal-beat-tottenham-hotspur-to-crystal-palace-winger-and-what-he-can-bring-to-emirates,"Thu, 21 Aug 2025 10:45:00",,"['Arsenal', 'Tottenham Hotspur']","With Eberechi Eze heading for boyhood club Arsenal after the Gunners stole a march on north London rivals Spurs - who looked certain to sign him - what's the full story in yet another dramatic saga in one of the most memorable transfer windows ever?
At the start of Wednesday morning, Tottenham believed they had a deal agreed for the 27-year-old to join them for £67.5m, including add-ons.
But then in stepped Arsenal - who had previously had an interest in the England winger - to gazump them at the final hurdle.
It leaves Gunners fans delighted, their left-wing problems seemingly sorted and Spurs supporters, naturally, in a state of shock at losing out on a major summer signing to their closest rivals.
How has it all played out so far, and what's next for Arsenal, Spurs and Eze?
Sky Sports News chief reporter Kaveh Solhekol:
I have some sympathy for Spurs. This is not Football Manager, this is real life. I don't want to kick Spurs when they're down - I'm trying to see it from the perspective of their hierarchy.
I think they did everything they could to try to sell the club to Eze. A lot of Spurs fans are asking why they didn't trigger his release clause before Friday, but maybe they tried to do that and the player could've dragged his feet. Maybe he was keeping his options open.
Spurs fans are very angry and criticising Daniel Levy and the owners, but I think we should keep things in perspective; these kinds of things happen all the time in the window.
Ultimately, everyone knows Eze is an Arsenal fan, as are his whole family. He played for them until he was 13 when he was released.
Is this move motivated by the fact that Kai Havertz picked up this knee injury?
Or have they been really smart and avoided getting involved in a bidding war? They knew he would choose Arsenal if he had a choice - and waited for Spurs to agree a deal before they turned up at the 11th hour and matched it. I think it's a bit of both.
Today's a great day to be an Arsenal supporter. They have pulled off a real coup here. At the last minute, they matched Spurs' offer, and it's important to remember Eze himself is an Arsenal supporter.
His wish was very important in this - Arsenal matched Spurs' bid of £60m including £7.5m in add-ons. Remember, he had a release clause which expired last week which was worth up to £68m.
Arsenal have been interested in signing him all summer and their fans were crying out for them to make a move for him.
When you looked at how much business they had already done this summer you could suggest they had to sell before they brought in another player.
Crystal Palace boss Oliver Glasner confirmed Eze's previous release clause, of £68.5m - only £1m more than Arsenal are set to pay - expired last Friday.
Speaking after Sunday's 0-0 draw at Chelsea, which Eze started, Glasner said: ""I'm quite calm, but I also know we have two weeks to go, and I know Ebs' clause is gone, so it's the club's decision, and we will see what happens.""
Tottenham could have guaranteed they would have their offer accepted earlier in the window by hitting that target, but only agreed a fee for Eze after it had already expired.
So why didn't they try to trigger it? ""It might've needed paying in one lump sum, said Sky Sports News chief reporter Kaveh Solhekol. ""They might've waited until it expired to get a better deal.""
Sky Sports News' Michael Bridge:
Tottenham Hotspur moved on from Eberechi Eze once it became clear he wanted to join Arsenal and they are now focusing on other targets.
Spurs want to sign a No 10, a winger and a centre back ahead of the deadline.
Several recent reports have linked Spurs with Tyler Dibling, but this is long-standing interest. There is interest in Monaco's Maghnes Akliouche.
It could be a very busy final few weeks at Spurs and clubs are aware they are prepared to pay £60m on the desired player after missing out on Morgan Gibbs-White and Eze for similar fees.
Spurs feel they couldn't have done any more on both failed deals.
Sky Sports' Ron Walker:
Last season, Arsenal's biggest difficulty was breaking down teams with a low block. They won only seven of 17 games where they had at least 60 per cent of the ball - picking up almost 0.4 points per game fewer than when they didn't.
In among his array of attacking talents, Eze has built a reputation as a defence breaker. Not only a technical marvel and excellent in one-on-one duels, he was one of the Premier League's best in delivering passes which broke opposition backlines last season. Only four players completed more take-ons across the Premier League in 2024/25.
He fits the bill for the defensive work rate Mikel Arteta demands, too. Eze won the ball back in the middle and defensive third more than almost any other attacking player in the Premier League last season.
Sky Sports' Paul Merson:
Eze is a brilliant signing for Arsenal. It's a game-changer and a perfect fit. If Arsenal had let Spurs get him, I'd have had to question what the club was doing because he's a quality player.
Arsenal struggle when teams come to the Emirates and put everyone behind the ball. Teams want to limit the space Arsenal have to play in and they have struggled to break teams down with those tactics.
We've seen it over the last few years where they have struggled to break teams down when it gets right to the business end of a game and the business end of a season.
For me, that's where Eze comes in at Arsenal. He's got the X-factor and in tight games, he has the ability to break a low block down.
Away from home, maybe he's not the answer. Against the likes of Liverpool and Man City, they may come under the cosh for a bit, and they may have to play slightly differently.
But that's why you have a big squad. At home, against the lesser teams, where they have 70 to 80 per cent of the ball, let Eze go and do what he wants because he will make something happen.
I think Arsenal win the league with Eze.
They had a chance without him because it's a real heads or tails season with Liverpool, and Man City played well on the opening weekend, but Eze helps get them over the line.
Sky Sports' Ron Walker:
If this late move for Eze is motivated by Havertz's injury, it stands to reason it will be someone else adding to their striking ranks because, bar a brief cameo as a false nine for England against Senegal earlier this summer, it's not a position where Eze has often featured.
It may instead mean a role change for Gabriel Martinelli, however. In fairness, the Brazilian has barely played through the middle in six years at the Emirates either, but it has long been seen as his eventual position by many Arsenal fans.
He was utilised as a No 9 against Liverpool late last season, more through necessity than design, but he showed a glimpse of what he can offer to supplement Viktor Gyokeres, Gabriel Jesus and Havertz as an option in spearheading Arsenal's attack.
After his goalscoring exploits at Anfield, Gary Neville told Sky Sports: ""I actually think in the last half of this game Martinelli showed he actually could be a really dangerous centre-forward with his runs in behind.""
",SkySports
Merson: X-factor Eze can take Arsenal to the title,<em>Sky Sports</em>' Paul Merson believes the signing of Eberechi Eze can take Arsenal to the Premier League title this season.,https://www.skysports.com/football/news/11095/13415592/eberechi-eze-can-take-arsenal-to-the-premier-league-title-says-paul-merson,"Thu, 21 Aug 2025 12:00:00",Paul Merson,['Arsenal'],"Sky Sports' Paul Merson believes the signing of Eberechi Eze can take Arsenal to the Premier League title this season.
Arsenal have agreed a £67.5m deal to sign Eze after hijacking Tottenham Hotspur's move for the Crystal Palace forward.
The Gunners will pay a guaranteed £60m plus £7.5m in add-ons for the forward, with personal terms now close to being totally agreed. Eze's Arsenal medical could take place as soon as Friday.
Merson insists Eze moving to Arsenal is a ""game-changer"" with the former Gunner suggesting the England international could be a key figure in breaking down stubborn defences, particularly at Emirates Stadium.
""Eze is a brilliant signing for Arsenal,"" Merson said. ""It's a game-changer and a perfect fit.
""If Arsenal had let Spurs get him, I'd have had to question what the club was doing because he's a quality player.
""Arsenal struggle when teams come to the Emirates and put everyone behind the ball. Teams want to limit the space Arsenal have to play in and they have struggled to break teams down with those tactics.
""We've seen it over the last few years where they have struggled to break teams down when it gets right to the business end of a game and the business end of a season.
""For me, that's where Eze comes in at Arsenal,"" he added. ""He's got the X-factor and in tight, tight games, he has the ability to break a low block down.
""Away from home, maybe he's not the answer. Against the likes of Liverpool and Man City, they may come under the cosh for a bit, and they may have to play slightly differently.
""But that's why you have a big squad. At home, against the lesser teams, where they have 70 to 80 per cent of the ball, let Eze go and do what he wants because he will make something happen.""
When asked if Eze can be a difference maker in Arsenal's bid for the title, Merson said: ""I think Arsenal win the league with Eze.
""They had a chance without him because it's a real heads or tails season with Liverpool, and Man City played well on the opening weekend, but Eze help get them over the line.""
Sky Sports' Peter Smith:
Eberechi Eze is electric. The 27-year-old is a delight to watch with his poise and swagger on the ball and craft to open up defences, not to mention his penchant for scoring spectacular strikes himself.
He finished last season as one of the hottest prospects in the country, scoring in six games in a row, including both the FA Cup semi-final and final at Wembley as he helped inspire Crystal Palace to their first ever major honour.
Last season wasn't all plain sailing, though. ""I think Ebere has had a strange season,"" said Palace boss Glasner at the end of March. ""He hasn't had many goals in the Premier League and he has been unlucky, but he keeps going. He's also struggled with strange injuries.""
Those comments came after Eze had ignited Palace in a FA Cup tie at Fulham, scoring one and setting up another. That standout display came on the back of a first goal for England. Fit and full of confidence, Eze was back to his best during the run-in.
It is that livewire maverick Arsenal will hope can unlock deep defences and bring a spark to their previously at-times predictable patterns of attack. He offers something completely different to Leandro Trossard and Gabriel Martinelli, the current wide left options and Viktor Gyokeres will be relishing the prospect of latching onto the type of passes which have proved so productive for Jean-Philippe Mateta.
After being released by the Gunners as a 13-year-old, Eze will be motivated to seize a second chance in north London - and, in his prime, he looks set to do just that and make a big impact for Mikel Arteta.
Watch Arsenal vs Leeds on Saturday night Football on Sky Sports; kick-off 5.30pm
This season, Sky Sports' Premier League coverage will increase from 128 matches to at least 215 games exclusively live.
And 80 per cent of all televised Premier League games next season are on Sky Sports.
",SkySports
Premier League predictions: Chelsea to turn up heat on Potter,Our football betting expert and top tipster Jones Knows thinks Chelsea will turn the heat up on West Ham boss Graham Potter on Friday Night Football.,https://www.skysports.com/football/news/11095/13415691/premier-league-predictions-and-best-bets-chelsea-to-turn-up-heat-on-graham-potter-and-9-1-jones-knows-weekend-treble,"Thu, 21 Aug 2025 21:00:00",Lewis Jones,['Chelsea'],"Our football betting expert and top tipster Jones Knows thinks Chelsea will turn the heat up on West Ham boss Graham Potter on Friday Night Football.
If you take the relegated teams out of the equation, West Ham rank bottom in the Premier League per 90 for expected goals, shots, shots on target, chances created from open play and passes played into the box since Graham Potter took charge.
There's a clear problem with converting their possession and territorial advantage into quality chance creation and scoring goals - not the first time we've said that about a Potter team.
It can be possession for the sake of possession. The structure is there, but the soul isn't. It's just not very West Ham. The locals want a team that plays with grit and conviction. It could just be that Potter is a bit too spreadsheety for the Hammers. And things could become worse in the short term.
Chelsea played just fine last weekend against Palace and had the most possession (72 per cent) and made the most passes (568) of all Premier League teams but failed to score from an expected goals tally of 1.7.
They won't leave these points out there. Chelsea to win and under 3.5 goals at 6/4 with Sky Bet stands out.
Here's a sentence that would have made absolutely zero sense this time last year: Tottenham are becoming a serious set-piece threat.
Under Ange Postecoglou it was all vibes and vertical football, but under Thomas Frank there's good reason to believe Spurs could evolve into a set-piece machine. Brentford ranked second for expected goals from such situations last season in the Premier League and the early signs are positive for Spurs' ability to create havoc in the same vein.
Hello, Micky van de Ven.
He's not just a Rolls Royce in open play and with the ball - his power, pace, and timing make him an aerial asset waiting to be unlocked from attacking corners and free-kicks. In two starts under Frank, he's already amassed three shots and a goal against PSG.
He is 6/4 with Sky Bet to register at least one shot and while the markets remain sleeping on the true probability, he is a great bet to attack.
If you wanted some evidence about how much Brentford have potentially fallen in the summer, analysing their win price in the last meeting between these two clubs in March says a lot. The Bees, with Frank, Bryan Mbeumo, Christian Norgaard and Yoane Wissa in tow, were 11/10 shots to beat Aston Villa at home.
They are priced up as 21/10 here just five months later, which indicates almost a five per cent implied probability shift.
That's massive when assessing outright prices.
They were utterly hopeless in the first half of their 3-1 defeat at Nottingham Forest. First day nerves to blame? Or more a deeper underlying issue that this is a bigger rebuilding job than the club first imagined? I'm in the latter camp.
Sometimes in football betting, you just have to go back to basics.
Squad downgrade? Check. Squad imbalance? Check. Dangerous opponents who have one of the best managers in Europe? Check.
All signs point to a Bournemouth win over Wolves this weekend at 4/5 with Sky Bet - and this could be a bleak season for Vítor Pereira's men.
At home, with the crowd behind them and Wolves trying to implement Pereira's possession-based patterns under pressure, this game sets up nicely for Andoni Iraola's side and the fast and frenetic Bournemouth style. The Cherries may just squeeze Wolves into errors and feast on transitions. They may have lost a lot of quality in their dressing room but the most important man remains: Iraola - as shown by their performance at Anfield.
That's why they can be trusted to go again despite the squad overhaul.
The Premier League has become a league where pace, power, directness and ability to have real physicality off the ball is so key. This switch of style has been a trend taking over the Premier League in recent seasons. In the 2018/19 season there were 389 fast breaks (OPTA term for counter-attack) recorded. That figure rose to 775 last season. It's almost doubled.
I think Sunderland have noticed this trend and spent all summer planning to join the fast-break party because their recruitment has centred around bringing in big strong boys who either have lots of physical presence or carry great pace and power. They were so good on the break in the 3-0 win over West Ham. It was all about energy and progressive running.
Habib Diarra was the real star - this kid is powerful and full of direct running forward. Regis Le Bris gave him lots of license to support the front man and he fired in two shots, one of which was defined a big chance. He's 6/5 with Sky Bet to hit two or more shots again in a game Sunderland will be targeting three points from.
Beware: Declan Rice is a player I'll be rabbiting on about a lot this season.
Since moving to Arsenal, Rice has evolved into more than just a midfield shield. Under Mikel Arteta, he's given license to step into advanced pockets, recycle possession and let fly when space opens up. This positional change makes him a fantastic betting prospect in the attacking props markets.
Rice has covered his two or more shots line in his last six starts and boats an overall shots figure of 2.15 when playing in the No 8 role in 2025.
That figure should be capable of being hit against against a newly-promoted team, where Arsenal will dominate territory and Rice finds himself with time to test the 'keeper or pepper the goal. Combining Arsenal to win and Rice to have two or more shots at Evens with Sky Bet looks a nice angle to attack.
My first port of call whenever a key player leaves or suffers a serious injury is the with and without data to try and quantify how much a team will miss that player's output. Well, since the start of the 23/24 season, Eberechi Eze - on his way to Arsenal - hasn't started 21 games in the Premier League and in that time Palace's win percentage goes from 40 per cent to 19 per cent and their points per game drops from 1.5 to just 1.0 per game.
Oliver Glasner has a difficult job in keeping confidence and mentality levels high within his squad after losing such an important and well-liked player.
Forest are a trustworthy team as you know exactly what you're going to get in that they're very good in both boxes, and are led impeccably by Nikola Milenkovic and Murillo in defence - one of the best defensive pairings in Europe.
This looks a great time to head to Selhurst Park and the away win at 21/10 with Sky Bet does appeal.
One lazy narrative that has stuck out during the pre-season chat is how Everton could struggle without the fortress of Goodison Park and may suffer from new stadium nerves. However, the last five teams in the top two tiers of English football that have moved stadiums possess a healthy record across their first five games.
From those 25 games, they won 16 of them, losing just four.
The Hill Dickinson Stadium has been strategically built to keep the atmosphere hot and hostile and when Everton fans turn up the noise, they remain one of the most passionate set of fans in the country. Brighton are a team overrated by the markets in my view and the 19/10 with Sky Bet on Everton starting with a win at their new home looks a solid wager.
The market likes what it saw from Manchester United against Arsenal based on their win price here. They are 21/20 with Sky Bet although it doesn't feel like particularly smart money is driving the United price into what it is. They still looked very timid in central midfield without the ball and doubts remain about whether the wing-backs - a key cog in any 3-5-2 system - provide enough attacking output to turn United into a functional and exciting team.
I like backing Fulham when they are overlooked. Marco Silva's men are mostly ignored by the market but they took 30 of their 54 points last season against top-half teams. That's a huge return and one that made them very profitable to back as outsiders when the price was right. You can get 6/4 with Sky Bet here on Fulham on the draw no bet market meaning stakes are refunded if the game ends level.
Eddie Howe is doing a great job at using the Alexander Isak situation to bring the club together as best he can.
When St James' Park smells disrespect, it bites back. You can expect the atmosphere to be a bearpit on Monday. Every Liverpool touch booed. Newcastle players pumped to play aggressively from the first whistle as they look to utilise that hotbed of noise to their advantage.
And that's when the Toon are at their most dangerous.
Despite the win vs Bournemouth, Liverpool appeared more vulnerable on the break than last season as they faced more fast breaks (5) in that game than in any Premier League game at Anfield last season.
And Newcastle are built to counter-attack with a front three of Anthony Elanga, Anthony Gordon and Harvey Barnes perfectly equipped to hit Liverpool in transition. The hosts look a great bet in the double chance market at 4/5 with Sky Bet.
",SkySports
Merson says: Palmer needs support - but stop him and you stop Chelsea,"Paul Merson called Chelsea's goalless draw with Crystal Palace on the opening weekend a ""concern"" and says West Ham will be aiming to shut down Cole Palmer to close off the Blues' creativity.",https://www.skysports.com/football/news/11095/13414608/paul-merson-says-chelsea-a-worry-friday-night-football-bigger-for-enzo-marescas-blues-than-west-ham,"Thu, 21 Aug 2025 12:00:00",Paul Merson,['Chelsea'],"Paul Merson called Chelsea's goalless draw with Crystal Palace on the opening weekend a ""concern"" and says West Ham will be aiming to shut down Cole Palmer to close off the Blues' creativity.
Read on as Merson discusses Chelsea's lack of cutting edge against Palace, Palmer's struggles and the improvements West Ham need to make...
The draw against Crystal Palace was worrying for Chelsea.
Chelsea were not good.
If Cole Palmer isn't going to break a team down, I'm not sure who is for Chelsea. If opposition teams pick him up and mark him well, I'm not sure what threat Chelsea have. Pedro Neto and Jamie Gittens have pace, but they struggled to beat their defenders on Sunday.
He needs some support.
Palmer is the talk of the town in team talks against Chelsea. Teams are trying to stop him because they think stop him, stop Chelsea. Stop Cole Palmer will be the message for West Ham on Friday. That's just how it is.
Palmer also has to have a bit of faith in the team. He needs to stay as high up the pitch as he can because when he gets frustrated, he gets deeper and deeper. He goes shorter and shorter to get the ball and it's so difficult to hurt a team from inside his own half.
It's hard for Palmer. You've got to have runners around when you get the ball and for me, he hasn't got those.
It's not just all on Palmer because the coach has to come up with solutions, too. He has to work out a way to get him the ball in areas where he can hurt teams. But for Palmer, patience is key. He has to wait for the ball a bit more instead of dropping deep to come and get it.
You cannot hurt anybody on the halfway line. He needs the ball in and around the box where he's special.
Palmer will miss Nicolas Jackson this season.
Jackson was a willing runner for Palmer, and he created so much space for him.
I know he was a bit messy with his play and he missed chances, but he was game. He had an ability to take defenders the other way and when you do that, it opens space for Palmer.
When you play like Palmer, you want as much space as you can, and Jackson helped provide that.
Now, Joao Pedro isn't really an out-and-out centre forward. He likes to come short too and that's not helpful for Palmer. If the middle of the pitch is suffocated, then it takes Palmer out of the equation.
I am not sure the decision to potentially move on Jackson is the right one. You have to remember how good Palmer was with Jackson. Jackson made Palmer and Palmer made Jackson.
I cannot believe Chelsea didn't go for Eberechi Eze.
I really don't know what I am missing.
They buy winger after winger, but they need guile. They need more than Palmer.
If you get Eze, you then have two players who can break teams down.
They are predictable for me. They play with two quick wingers, with Palmer trying to feed them.
I don't think coming up against Chelsea is a bad game for West Ham.
Of course, the defeat at Sunderland is a concern. They were extremely poor at the Stadium of Light, and you can understand the worry from the supporters.
The Hammers need more energy in midfield. They were overrun by Sunderland, who put in a good performance.
The game against West Ham is a bigger game for Chelsea, in my opinion.
Watch West Ham vs Chelsea live on Sky Sports on Friday from 7pm; kick off 8pm
From this season, Sky Sports' Premier League coverage will increase from 128 matches to at least 215 games exclusively live.
And 80 per cent of all televised Premier League games this season are on Sky Sports.
",SkySports
