Title,Summary,Link,Date,Author,Teams,Article,Outlet
Counter-attack Liverpool - what we learned from Premier League weekend,BBC Sport picks out five observations from the opening weekend of the new Premier League season.,https://www.bbc.com/sport/football/articles/c4gz40wvr1zo?at_medium=RSS&at_campaign=rss,"Mon, 18 Aug 2025 13:18:26",Umir Irfan,['Liverpool'],"Another Premier League season has begun, with new-look sides, new-look tactical approaches and plenty of optimism (and pessimism!) among the fans.
We could have picked out many observations across all teams - but here are five that caught our eye in particular at the weekend.
1. Liverpool look weak against counter-attacks
Arne Slot's Liverpool have brought in attacking reinforcements but the balance of their side looks off. Against Bournemouth, they were bright going forward but looked susceptible to conceding on the break.
Last season, Liverpool only conceded two goals from fast breaks all season. In the first game of this season, they equalled that number.
So what has changed for Liverpool?
The personnel informs how tactics are executed and Slot pointed towards sloppy passing in midfield as a reason Liverpool were so exposed. These misplaced passes gave the opposition time and space against a disorganised defensive shape while attacking the centre of the pitch.
This is more dangerous than losing the ball in the wide areas as attackers are closer to goal, in better shooting positions.
Although Slot focuses mainly on the sloppy passing and dispossessions in midfield, it is objectively true that Liverpool committed many bodies to their attack. At times, there were seven or eight players in and around Bournemouth's box, leaving Liverpool with very few players back to defend.
For Antoine Semenyo's second goal, both Joe Gomez and Andy Robertson were attacking in the opposition's box so were unable to get back to defend the counter-attack when the ball was lost.
Yes, decision-making and passing quality needs to be better but Slot may need to tweak the positions of the full-backs or central midfielders when Liverpool are attacking for additional protection against dangerous counter-attacking sides.
2. Man City look like they are back

Many people consider Man City as outsiders in the title race – only five of our 33 pundits predict them lifting the trophy in May – but their impressive 4-0 win at Wolves means that they've now taken 43 points from their 20 games in 2025 - more than any other side.
Rodri's season-ending injury last September clearly derailed their Premier League campaign but rather than simply awaiting his return, Pep Guardiola has found a solution without him and the former champions have been getting back on track since the start of the year.
Below is Man City's 'non-penalty expected goal difference per game' (that's a mouthful) since the start of last season, which tells us how much a team dominates their games by creating lots of good chances and limiting their opponents to few, bad ones.
It's the X-ray stat, the one that shows how good teams are before hot finishing streaks and the rub of the green come into play.
As we can see, Man City are now almost dominating games to the level they were before the Ballon d'Or winner's injury.
Anyone writing them off does so at their peril.
READ MORE: 'Top signing for years' - all-action Reijnders stars for Man City
3. Still no magic spark from Potter at West Ham
It's fair to say that Graham Potter has not had the impact many expected when he replaced Julen Lopetegui as West Ham manager in January, with the 3-0 defeat by Sunderland on Saturday their ninth defeat in 19 Premier League games under him.
In fact, he now needs to orchestrate a win over his former club Chelsea at home on Friday night simply to match Lopetegui's Premier League record before he was sacked after 20 games in charge.
Potter has noticeably improved the defence that he inherited, with the Hammers conceding 13 fewer goals and 69 fewer shots than they did under the Spaniard (although those stats will be slightly worse after the Chelsea game).
However, that defensive improvement has come at a significant cost to the attack. While they've only scored two goals fewer (with a game to play), West Ham's shot and expected goal numbers have deteriorated dramatically.
The big improvement in their goal difference would suggest they've perhaps been a bit unlucky in terms of results, but their xG difference shows that Potter has improved them only slightly overall and is yet to really work his magic on West Ham.
4. Frank's clever kick-off routine
Thomas Frank's Tottenham have adopted many of the same principles we saw work for Brentford last season and the novel use of dead-ball situations is one. Of particular note this weekend was the use of the kick-off as a set-piece routine.
Against Burnley, the ball was passed back to Guglielmo Vicario from kick-off as the home team shuffled up the pitch. Burnley logically shuffled deeper, pre-empting a long ball. The deceptive nature of how Vicario shaped up sold this routine further before a shorter pass to Pedro Porro was played.
By finding Porro towards the inner right side of the pitch, closer to goal, the angle he could play the cross at was more likely to result in a dangerous chance. Porro is one of Spurs' strongest crossers and with Spurs getting an extra body at the back post, on another occasion this may have resulted in an early goal.
By manufacturing a situation in which the ball is launched long early has the added benefit of getting the ball away from your own goal so pressure from the opposition can't be applied.
Frank's sides aim to maximise fine-margin gains across the pitch and the focus on a smart, well-worked kick-off routine is another tool in their expansive skillset. Across this season, they will certainly continue to experiment with their kick-off routines.
READ MORE: Rejuvenated Richarlison helps Frank to 'dream start'
5. Arsenal trying to be more direct: The Good, the Bad & the Ugly
Mikel Arteta's Arsenal have taken an alternative approach to their recent summer transfer business. For a team who have dominated the ball, playing slowly and methodically for the last few seasons, they have now looked to introduce directness and counter-attacking threat.
Against Manchester United, Arsenal played more directly and it was to their detriment on the day. We saw numerous quick attacks consisting of players carrying the ball quickly upfield over large distances before trying to play through balls for the attackers. In seasons gone by, they would've likely opted to hold the ball, passing it backwards before restarting their attack.
Martin Odegaard was primarily the player leading the majority of counter-attacks. Viktor Gyokeres' best attacking zones are in the inside right channel. As the Swede darted in behind, Odegaard's weight of pass was off and chances broke down. This made the game end-to-end, suiting United's quick attackers.
Odegaard being left footed here was slightly problematic too. Angle-wise, using a right-footed player would allow the pass to go towards the goal rather than curling away from it, making it easier for someone like Gyokeres to shoot early. Imagine Kevin de Bruyne's through balls (from right central midfield) to Erling Haaland if you're struggling to understand what I mean.
Although this style of play was ineffective in the opening game, there are positives. If Arsenal can get the final pass correct, they'll find themselves in clear goalscoring opportunities more often. How Arsenal balance their slower possession style with this newer, transitional quality will be an important thread to their season.
READ MORE: 'Big win' for 'resilient' Arsenal but work to do for new-look Gunners
",BBC
Spurs captain Romero signs new four-year contract,Tottenham captain Cristian Romero signs a new four-year contract to commit his future to the club.,https://www.bbc.com/sport/football/articles/cjdyj4m9v0go?at_medium=RSS&at_campaign=rss,"Mon, 18 Aug 2025 17:40:38",Sam Drury,['Tottenham Hotspur'],"Tottenham Hotspur captain Cristian Romero has signed a new four-year contract to commit his future to the club.
The 27-year-old Argentina centre-back joined Spurs from Atalanta in August 2021, initially on loan before the move was made permanent the following summer.
He has made 126 appearances for the club, scoring eight goals, and captained the side in the Europa League final as Tottenham beat Manchester United to end their 17-year wait for a trophy.
After being heavily linked with a move to Atletico Madrid over the summer, Romero was named club captain by new head coach Thomas Frank and the deal ensures he will remain under contract in north London until 2029.
Romero said he was ""very happy"" at Spurs and after helping them win the Europa League in the previous campaign has predicted a ""special season"" ahead for the club.
""We want to win. Maybe why not win again this season? Another trophy with the club is important for everyone,"" Romero explained.
""For me this club is the best in the world. The last two weeks, first [being appointed] captain and now signing the contract with the club - for me it's a fantastic decision.""
Frank said last week that Romero was a player who commands ""big respect"" from his team-mates and ""sets the standards"" on and off the pitch.
""What I like about him and why I have chosen him as captain is his leadership qualities,"" said the Spurs boss.
""The staff have said to me they've never seen him train that well. He's in a very good place. I see a player that will want to lead the team and push the team.""
The former Belgrano defender, who had two years left on his previous deal, follows right-back Djed Spence in signing a new long-term contract.
Spence, 25, arrived from Middlesbrough in 2022 but endured a difficult start to his Spurs career and had loan spells at Rennes, Leeds and Genoa.
Last season he emerged as an important player for former boss Ange Postecoglou and has made 42 appearances, scoring twice.
Spence's existing deal had been set to expire in 2028.
",BBC
AC Milan confirm Hojlund interest,AC Milan sporting director Igli Tare has confirmed the Italian club are interested in Manchester United striker Rasmus Hojlund.,https://www.bbc.com/sport/football/articles/cg7jyz8x1y7o?at_medium=RSS&at_campaign=rss,"Mon, 18 Aug 2025 13:41:28",Simon Stone,['Manchester United'],"AC Milan sporting director Igli Tare has confirmed the Italian club are interested in Manchester United striker Rasmus Hojlund.
The Denmark forward was left out of the matchday squad for United's 1-0 home defeat by Arsenal on Sunday.
It is understood coach Ruben Amorim took the decision amid intense speculation over the 22-year-old's future.
While Hojlund has previously expressed a strong desire to remain at United, the arrival of Benjamin Sesko from RB Leipzig for £73.7m means his opportunities are likely to be severely restricted.
""Hojlund is a good option for us,"" Tare told Sport Mediaset, external before Sunday's 2-0 win over Bari in the Coppa Italia.
""We are evaluating him these days, but the transfer market is unpredictable.
""We know that we have to intervene in that position and we also know that they must be players who can give something more to this group.""
He also confirmed interest in Juventus striker Dusan Vlahovic.
Hojlund was left on the bench for the final pre-season friendly against Fiorentina on 9 August, even though Sesko's only involvement was to be paraded before kick-off as Mason Mount occupied a false nine slot.
Mount started in that role on Sunday, with Sesko and fellow striker Joshua Zirkzee on the bench.
Sesko came on to make his debut with 25 minutes remaining.
""It is a fight for places,"" Amorim said after the defeat.
""We'll see what is going to happen in the market. There are different characteristics. Rasmus has the same characteristics of Benjamin Sesko, so we need to choose.""
Hojlund, who joined for £72m two years ago, was United's main striker last season and scored 10 goals in 52 games.
His debut campaign brought 16 goals after his move from Italian side Atalanta.
The move to drop Hojlund has been backed by United's leadership.
Amorim has spent £200m on a completely revamped forward line, with Bryan Mbeumo and Matheus Cunha set to fill the two number 10 slots Amorim prefers.
In addition to Mount, England international Kobbie Mainoo could also play as a false nine - while Bruno Fernandes did the job successfully in the 2024 FA Cup final.
On United's pre-season tour of the United States, Cunha filled the number nine role - although he also tended to drop deeper.
Seventeen-year-old Chido Obi featured for the first team at the end of last season, although at his stage of his development it is thought unlikely he would be regarded as a regular stater, with his involvement is more likely as a substitute.
",BBC
Scotland winger Doak joins Bournemouth from Liverpool for £25m,Bournemouth sign Liverpool winger Ben Doak for an initial £20m with a further £5m in add-ons.,https://www.bbc.com/sport/football/articles/cm2vxp3e7gro?at_medium=RSS&at_campaign=rss,"Mon, 18 Aug 2025 18:35:19",Nizaar Kinsella,['Liverpool'],"Bournemouth have signed Liverpool winger Ben Doak for an initial £20m with a further £5m in add-ons.
The 19-year-old has signed a five-year contract and becomes Bournemouth's fourth summer acquisition.
Doak was left out of Liverpool's 4-2 win over Bournemouth at Anfield on Friday night.
""I'm buzzing to be here,"" Doak said.
""I feel like it's the right time for me and it's a great opportunity to play regular football at the highest level. It feels like the perfect fit.
""The team play very nice football. It's fast and it really suits my game, so I felt like I couldn't say no to the chance to play here.""
Doak has won six caps for Scotland and spent last season on loan at Middlesbrough in the Championship, scoring three times and recording seven assists in 24 matches.
Bournemouth are understood to have beaten interest from other Premier League clubs, including Leeds, as well as Portuguese side Porto.
Doak's move will give him a better chance of playing first-team football having featured just 10 times for Liverpool since joining from Celtic in 2022.
It takes Liverpool's sales to about £200m this summer, having spent more than £270m on new signings and a £110m bid for Alexander Isak rejected by Newcastle.
Liverpool's major sales have included Luis Diaz to Bayern Munich in a £65.5m deal, Darwin Nunez to Al-Hilal for £46.3m and academy player Jarrell Quansah to Bayer Leverkusen for £35m.
Caoimhin Kelleher, Tyler Morton and Nat Phillips have also been sold, while the club received £8.4m from Real Madrid to release Trent Alexander-Arnold early from his contract, though the Spanish club dispute this figure.
The sale of Doak means Liverpool have brought in about £85m in initial fees for the winger, Phillips, Alexander-Arnold, Kelleher, Quansah and Morton. The six players arrived as either youth players or development projects and cost the Reds an initial £600,000. The subsequent profit for players classed as 'homegrown' gives the Reds an immediate boost in terms of current profit and sustainability rule (PSR) calculations.
Bournemouth have also had a busy summer having sold Dango Ouattara to Brentford for £42.5m last week.
They already lost defenders Illia Zabarnyi, Dean Huijsen and Milos Kerkez for a combined total of about £150m to Paris St-Germain, Real Madrid and Liverpool respectively.
Bournemouth manager Andoni Iraola said his side are ""not where they want to be"" before the defeat at Anfield and added ""important movements"" will be made before the transfer window closes on 1 September.
Goalkeeper Djordje Petrovic, left-back Adrien Truffert and centre-back Bafode Diakite have joined the club this summer, with January signing Eli Junior Kroupi also coming into the squad after finishing last season on loan at Lorient.
Sources say the Cherries are in the market for a further central defender and a striker to compete with Evanilson, with alternative option Enes Unal expected to be out with a major knee injury until November or December.
Doak showcased potential in loan spell - analysis
Noel Sliney, BBC Sport
Doak was regularly terrorising opposition full-backs for Middlesbrough in the Championship with his pace and direct style before a thigh injury ended his 2024-25 season in late January.
The winger, who made his senior Scotland debut last September, provided three goals and seven assists in 21 starts for Boro.
Among players to have featured in at least 20 Championship games last season, the 19-year-old ranked in the top six per 90 minutes for assists, chances created and touches in the opposition penalty area.
",BBC
Tottenham close in on signing Crystal Palace attacker Eberechi Eze,Palace want replacement lined up before sale,https://www.theguardian.com/football/2025/aug/18/eberechi-eze-tottenham-crystal-palace-cristian-romero,"Mon, 18 Aug 2025 16:45:28",David Hytner,['Tottenham Hotspur'],"Tottenham have stepped up their pursuit of Eberechi Eze by holding further talks regarding signing the England forward, but Crystal Palace want to line up a replacement before sanctioning his sale.
Spurs, who confirmed contract extensions for their new captain, Cristian Romero, on Monday, are longstanding admirers of Eze, having made a move for him last summer. They are even keener to get him now that James Maddison is out with an anterior cruciate ligament rupture. Dejan Kulusevski, another of the club’s key attacking midfielders, is out with a knee problem.
Eze is represented by the influential CAA Base agency, which has close links to Spurs, and he is open to the transfer. The 27-year-old forward has also been tracked by Arsenal, the club he supported as a boy and played for during his formative years.
Eze’s contract at Palace contained a £68m release clause but it expired last Friday. Spurs hope to get him for around £55m plus bonuses. Eze’s previous club, Queens Park Rangers, are entitled to 15% of any profits that Palace make on him. Palace paid around £19m to QPR for the player in August 2020.
Romero has re-signed at Spurs until 2029 and it represents something of a turnaround for him after he was linked with a move away at the start of the summer. The Argentina centre-half has made no secret of his ambition to one day play in Spain and he was of interest to Atlético Madrid. But having been given the Spurs captaincy after the departure of Son Heung-min to Los Angeles FC, the 27-year-old has re-emphasised his commitment. The right-back Djed Spence has also signed a new long-term contract with the club.
Palace, meanwhile, have targeted Leicester’s Bilal El Khannouss and Christos Tzolis of Club Bruges as potential replacements for Eze. The club are believed to have failed with an initial offer of £20m for El Khannouss, whose release clause expired at the weekend, with Leicester thought to want around £26m for the Morocco forward. Palace have also made an offer of £25m for Tzolis, a Greece international who spent three seasons at Norwich.
Oliver Glasner said he expected Eze to play for Palace in the Conference League playoff first leg against Fredrikstad at Selhurst Park on Thursday. If he did, he would still be able to play for another team in the league phase of European competition this season.
Marc Guéhi is also expected to feature on Thursday as Liverpool have yet to match Palace’s £40m valuation of the England defender, whose contract expires at the end of the season. Guéhi is understood to be willing to stay at Selhurst Park and leave on a free transfer although the Palace chair, Steve Parish, has admitted that he would prefer to sell the 25-year-old this month.
Palace had considered the Sporting defender Ousmane Diomande as a potential replacement for Guéhi but the 21-year-old is expected to be out for six weeks with a muscle injury and is unlikely to move this window.
Palace have also shown an interest in Jakub Kiwior but the Poland defender is believed to prefer to move overseas having been left out of Arsenal’s squad for the game against Manchester United on Sunday. Porto are in talks over a season-long loan for Kiwior with an obligation to make the move permanent at the end of the season.
",TheGuardian
Manchester United’s opening defeat throws up more questions than answers,The loss to Arsenal at Old Trafford underlined the scale of the task facing Ruben Amorim as his first full season begins,https://www.theguardian.com/football/2025/aug/18/manchester-united-rubin-amorim-bryan-mbeumo-matheus-cunha-benjamin-sesko,"Mon, 18 Aug 2025 14:30:02",Jamie Jackson,"['Arsenal', 'Manchester United']","Points the whole point?
A great appeal of football is the myriad pub and parlour opinions any game conjures. In the wake of Manchester United’s 1-0 defeat against Arsenal on Sunday, social media lit-up with differing takes from those of a United persuasion. The case for optimism featured United’s 22 shots to Arsenal’s eight and the beginnings of what may flower into an on-field bromance between Bryan Mbeumo and Matheus Cunha. The case for pessimism: a crisis at No 1, with Altay Bayindir’s timidness leading to Riccardo Calafiori’s winner and André Onana’s ongoing flakiness. Then there is the bottom line: United were defeated. As midfielder Casemiro said afterwards: “I’m not going to say that losing is OK; we have to win. Manchester United always has to win. I think we have shown good moments, and we have played much better, but we have to look for the victory.”
Everything but the goal
Within a few seconds of the game on Sunday, Mbeumo charged down the right wing and then picked out Cunha after hearing the yells of his fellow No 10. Here, then, was a glimpse of how the new boys may gel beyond the weekend, which would have been heartening to see for all United fans. Mbeumo’s skillset features a killer touch, a cut-throat running ability, a calibrated pass radar and an eye for a shot. Cunha has the same abilities as well as a tendency to purr past opponents, as he did in one game-breaking run during the first half. And operating as a No 9, the Brazilian also showed he can be a differing option in that position to Benjamin Sesko. Yet neither Mbeumo or Cunha scored, spurning a slew of chances. This has to be fixed.
Sesko needs fast start
Sesko arrived at Old Trafford on a £73.7m ticket of being a tall, awkward, skilful, fast No 9 and, in a 25-minute debut on Sunday after coming on as a substitute, the Slovenian offered glimpses of those traits. But, as is the case with Mbeumo and Cunha, the heat is on the 22-year-old to tear up defences and stick the ball in the net. United managed a paltry 44 Premier League goals last season and if Ruben Amorim cannot get more out of his newly-established attack then the head coach will be the latest to have his career sucked into an Old Trafford-shaped black hole. Sesko needs to start at Fulham on Sunday and be allowed to show he has what it takes to lead the line for Amorim’s side.
Managing expectations
All No 1s are a few bad games away from pressure but in the fevered hothouse of United, scrutiny is a 24-7 occupation. Amorim has spent £200m-plus on Mbeumo, Cunha and Sesko, is in the market for a new No 6 and goalkeeper, and has had since early November to implement his ideas. Oh, and there is no European football, meaning more time on the training ground. What, then, is a reasonable expectation from Amorim’s United this season? No one should expect them to mount a top-four challenge, but a return to continental competition seems a reasonable expectation via an upturn in performance, meaning discernible patterns of attractive and controlled front-foot play. The United results graph for last season read 11 wins and 18 defeats for 42 points, and a goal difference of -10 and a 15th-place finish. This has to be reversed.
Six appeal
Amorim continuing to select Casemiro ahead of Manuel Ugarte and Kobbie Mainoo is a red flag regarding the weakness of United’s midfield department. The player, himself, is content. “I am very happy here,” he told manutd.com. “My family is happy here. I enjoy every day at Carrington [the training base] and at Old Trafford. If people talk from the outside, that’s fine, it doesn’t interest me. I just want to focus on winning.” To have a man with five Champions Leagues on the CV is a boon for Amorim as he aims to pull off what proved a sisyphean task for David Moyes, Louis van Gaal, José Mourinho, Ole Gunnar Solskjær and Erik ten Hag: to make United great again. And if a No 6 can be recruited before the close of the transfer window, then Casemiro can be eased back to the bench where his experience and professionalism can continue to influence teammates.
",TheGuardian
