Title,Summary,Link,Date,Author,Teams,Article,Outlet
Liverpool’s mourning players prepare to honour Diogo Jota back on the pitch,Arne Slot’s squad face an emotional afternoon at Preston on Sunday but believe it is better to start again at Deepdale than on tour in Hong Kong,https://www.theguardian.com/football/2025/jul/12/liverpools-mourning-players-prepare-to-honour-diogo-jota-back-on-the-pitch,"Sat, 12 Jul 2025 07:00:05",Andy Hunter,['Liverpool'],"Outside Anfield, the red sea of tributes to Diogo Jota and André Silva has continued to grow this week along with questions over whether Liverpool could play at Preston on Sunday, their first game since the brothers’ tragic loss. Inside Anfield, and specifically a grieving Liverpool dressing room, there was no major debate over the pre-season friendly. The Premier League champions intend to honour their teammate in the best way they know how.
It will be only 10 days since the deaths of Jota and Silva when Liverpool appear at Deepdale for what is certain to be a hugely emotional occasion, and less than two days since the club retired Jota’s No 20 shirt. There was no pressure on Liverpool to honour a friendly that could have been cancelled easily – unlike their commitment to a tour of Hong Kong and Japan at the end of the month – but at no point was that option relayed to Preston.
Delaying a first appearance since the accident until they play Milan in Hong Kong on 26 July or Yokohama F. Marinos at the Nissan Stadium four days later was not considered a suitable alternative by Liverpool’s players. The consensus was to get out and play, albeit while being acutely aware of how difficult the first stepswill be.
Their reactions to hearing You’ll Never Walk Alone before kick-off on Sunday and seeing tributes to Jota and Silva at Deepdale will be broadcast live. ITV agreed a deal in principle to televise the game last month and finalised the decision days before the brothers were killed in north-western Spain.
Those at Deepdale and watching on television will be witnessing a club in mourning, to use the words of Liverpool’s chief executive, Billy Hogan. The past week, said Hogan, “has been just absolutely devastating”. The club are also having to balance the professional obligations of preparing for a new season with the personal tragedy that has enveloped players, coaches and staff. They have lost a much-loved friend at the age of 28 and someone who was a positive, vocal presence in the dressing room. Jota was a player who managed to enforce standards at Liverpool while lifting the atmosphere.
The new signings Florian Wirtz, Jeremie Frimpong, Milos Kerkez and Giorgi Mamardashvili were due to report for the usual pre-season tests last Friday, with their teammates starting back from Tuesday onwards, but all football-related activity was placed on hold once the deaths of Jota and Silva were confirmed. Some did report on Tuesday but the full squad were not reunited at the training ground until the end of this week, having been given time to process an unimaginable loss. It is one that some may never process.
Sombre training sessions have been followed by visits to the mass of bouquets and scarves left in tribute to Jota and Silva behind the main stand at Anfield. The whole first team attended the scene on Friday in the company of Jota’s wife, Rute Cardoso, and parents, Isabel and Joaquim. Andy Robertson, one of Jota’s closest friends at the club, had led the way earlier in the week with his tribute to “MacJota”, so called by the Scotland captain given the striker’s love of darts, horse racing and British life. The former players Steven Gerrard and Adam Lallana were also among the thousands who have paid their respects at Anfield.
Arne Slot and his wife, Mirjam, also left an emotional tribute and took time to read many of the messages on 97 Avenue. “Diogo, we had the same dream and we fulfilled it together. André and yourself will for ever be in our hearts,” read the tribute from the Slot family. Jota’s character, along with his ability as a footballer, were eloquently captured in a message from Michael Edwards, the chief executive of football at Liverpool’s owner, Fenway Sports Group, who oversaw Jota’s £41m move from Wolves in 2020. “Down to earth, determined, a great finisher and, above all, loved and respected by all who knew him,” Edwards wrote. “He gave everything to the team, with quiet strength and unwavering humility. His impact reached far beyond the pitch.”
Luis Díaz and Alisson returned to pre-season training on Merseyside via Jota’s home city of Gondomar, near Porto. The Liverpool forward and goalkeeper were unable to attend the brothers’ funeral on Saturday because they were in Colombia and Brazil respectively. However, along with some of Jota’s Portugal teammates including Rúben Neves, José Sá and Diogo Costa, and the Penafiel team that Silva played for, they attended a seventh-day mass in memory of the siblings at the Igreja Matriz de Gondomar on Wednesday. Players who had extended international commitments this summer are unlikely to be considered for Sunday’s game.
Liverpool and Preston will pay several tributes to Jota and Silva at Deepdale. The home team will lay a wreath close to the Liverpool fans, there will be a rendition of You’ll Never Walk Alone and a minute’s silence before kick-off, and both sets of players will wear black armbands. Fans had called for Liverpool to retire the No 20 shirt and the club did so after consulting his family.
Hogan said after paying his respects outside Anfield on Wednesday: “I think the most important thing in this process is that we want to make sure we are respecting the family … Obviously they have gone through an unimaginable situation over the course of the last several days. We certainly will, obviously, remember both André and Diogo.”
",TheGuardian
Ambitious Chelsea will not park bus despite challenge of full-throttle PSG,Club World Cup final features two youth-driven teams but Enzo Maresca’s side believe they can hurt favourites,https://www.theguardian.com/football/2025/jul/12/ambitious-chelsea-will-not-park-bus-despite-challenge-of-full-throttle-psg,"Sat, 12 Jul 2025 07:01:03",Jacob Steinberg,"['Arsenal', 'Chelsea', 'Liverpool', 'Manchester City']","Chelsea have already made over £80m from their Club World Cup adventure but they can achieve something priceless against Paris Saint-Germain. This goes beyond gaudy gold badges and money in the bank. The season with no end is almost over, the final of the tournament that nobody asked for is here and while Chelsea have no intention of getting carried away if they triumph in New Jersey on Sunday it is also the case that there would be no better way to demonstrate that they are on to something with their youth-driven project than by beating Luis Enrique’s awesome PSG.
Easier said than done, of course. One school of thought is that Chelsea will have done well if they leave the MetLife Stadium with their dignity intact. Premier League opponents hold no fears for PSG, whose path to Champions League glory was paved by wins over Manchester City, Liverpool, Aston Villa and Arsenal, while they were in terrifying form against Real Madrid on Wednesday. It finished 4-0, but it could have been 10; PSG really were that good and the reality is there will only be one outcome if they hit those heights again.
A free hit for Chelsea, then? They have made plenty of cash from the tournament, boosting their profitability and sustainability position. They have answered questions about their mentality by coming through a series of challenges. Clear evidence of progress means Chelsea face the European champions able to resist the temptation to judge themselves on one big game.
Chelsea aim to be sustainable. That means maintaining a steady temperament no matter what happens against PSG. It is worth going back to the club finishing 12th in their first season under the ownership of Todd Boehly and Clearlake Capital. The criticism was fierce and sustained. The perception was of a chaotic institution.
Yet Chelsea stuck with the strategy implemented in January 2023 and continued to buy more young players. They know that they have made mistakes along the way – there is no appetite for any more mid-season managerial changes – but there is satisfaction with how they have not deviated from their chosen path.
Replacing Mauricio Pochettino, whose approach did not suit the squad, with the more technical but more inexperienced Enzo Maresca last summer? “It’s much more about tactics,” Malo Gusto, the Chelsea right-back, said of the change from Maresca to Pochettino. “That’s why we are in the final – it’s because of him.”
Chelsea laugh at the narrative about needing older players. They won the Conference League last season and are back in the Champions League. They appear to have bought well this summer and are pleased with the recruitment team of Paul Winstanley, Laurence Stewart, Sam Jewell and Joe Shields.
It was noted before the tournament that results will follow if you put the right strategies in place and build patiently. Chelsea have invested in data and scouting. It cannot be a coincidence that they are the second-youngest team at the Club World Cup. The youngest? PSG. A source suggests that PSG and Chelsea have given other clubs a model to follow. “Aggressive, fresh teams,” is the observation. Another is that Chelsea were signing young players long before PSG adopted the model.
PSG are further along in their development, though. Having a dash of experience in key areas surely helps while they also have the more established coach.
Chelsea met with Luis Enrique after sacking Graham Potter in April 2023, only to go with Pochettino. Hindsight is a funny thing. It is not easy to know how a foreign coach will adapt to the Premier League. Luis Enrique had just come off a disappointing World Cup with Spain. It is not rewriting history to say his stock was not as high as it is now; that he had dipped since winning the Champions League with Barcelona in 2015.
In any case Chelsea are happy with Maresca’s first year in charge. They are adapting to his positional-based style and play with a clear idea. “Most people expect PSG to win but we don’t think that,” Levi Colwill said on Friday. “When you play for Chelsea you’re not scared to play against anyone. I think they’ll be looking at our forwards and know it’s not going to be easy.”
The centre-back acknowledged that dealing with the ferocity and immediacy of PSG’s press will not be easy. Do Chelsea play out of the back regardless? “You have to respect how they press but we’re not going to change our whole way to play them,” Colwill said. “We’ve got this far playing our football so why are we going to change that now?”
Everyone has a plan until Ousmane Dembélé, Désiré Doué and Kvara Kvaratskhelia run at them, though. The feeling is that Maresca has no intention of parking the bus; that betraying his identity for one game would be folly. Still, though, Chelsea have to box clever. Do Enzo Fernández and Moisés Caicedo need an extra body in midfield to deal with João Neves, Vitinha and Fabián Ruiz? Can Chelsea beat the press if Roméo Lavia is out? How to contain Achraf Hakimi and Nuno Mendes’s surges from full-back? Colwill noted the heat in New Jersey, saying it cannot become a basketball game.
But Chelsea have their weapons. They have Cole Palmer and the counterattacking threat of Pedro Neto and Liam Delap. João Pedro scored two stunners against Fluminense; Fernández and Caicedo are in sparkling form.
Speaking at a Fifa technical briefing on Thursday, Roberto Martínez noted that the best way to play PSG is to go man to man, to hit the triggers required to exploit the high line. Bayern Munich caused them problems in the quarter-final. They still lost, though. The issue is that the press has to be perfect. PSG can rip through at will.
Chelsea know they are facing the best team in the world. PSG were supreme against Inter in the Champions League final. Logic suggests this one should only go one way. Chelsea have other ideas. Imagine how they would feel going into next season as world champions. Chelsea have no plans to change course but beating PSG would give the project immense validation.
Chelsea will be underdogs against PSG and will be without Noni Madueke, who has left the camp to complete a £52m move to Arsenal. Bournemouth have agreed a £25m deal to sign the Serbian goalkeeper Djordje Petrovic and Milan are interested in Nicolas Jackson but are unlikely to be able to afford the striker.
“Noni is in contact with a new club,” Maresca said. “I said in one of the last press conferences that if players want to leave it’s difficult for the club and for the manager. Noni decided to leave. Nobody told Noni he had to leave. If he is happy, we are happy.”
Lavia was absent from training on Friday and it remains to be seen if Caicedo has shaken off an ankle injury. “ Moisés is such an important player for us,” Maresca said.“This morning he trained but he couldn’t take part in the session fully. We hope he can play on Sunday.”
Maresca bristled at the idea that Chelsea will have to suffer and endure long spells without the ball.
“Who said that?” the Italian said. “We’ll see in two days. For sure they are a top team, the best team in the world. Every game is different. We are going to try our best for a good game.”
",TheGuardian
Luis Enrique shrugs off praise for PSG’s season with Club World Cup final to come,Paris Saint-Germain coach cautious of difficult game against Chelsea,https://www.theguardian.com/football/2025/jul/12/luis-enrique-shrugs-off-praise-for-psgs-season-with-club-world-cup-final-to-come,"Sat, 12 Jul 2025 01:14:40",Sid Lowe,"['Chelsea', 'Manchester City']","There is just one game left in the season in which Paris Saint-Germain finally won the first Champions League in their history to complete a historic treble and that game is the Club World Cup final, but Luis Enrique says it has not been his best. He was better, he claims, when he lost. Besides, the PSG coach said, Manchester City remain the best team around and his side must face a Chelsea team he likened to his own which can still deny them the perfect campaign and have a manager he “loves”.
“The Champions League was our first and it was very important: that was our main objective when we came to Paris last year,” Enrique said. “And on Sunday we have the chance, with the last game of the season, to win another one, with the Club World Cup. But it is important that we are conscious of the difficulty of the game. [Enzo] Maresca is a coach I love. I love the way he has of playing with the ball. They have a lot of good individual platers but they also have a real sense of duty. They are a bit like our team. They are physically strong too. It will be a very even game and a very difficult one.
“Chelsea won the Conference League, they finished fourth in the league, they are growing a lot. They have great players, technical players, and a great coach who I like a lot because of how they try to play from deep, always press, always want to attack. They are a very complete team that has produced a sensational season. This is no easy team and it is not a formality or anything like it. We will approach it 100% focused to try to round off a historic season.
“Was it our best season? Maybe, but we have to win to complete it. Anyway, you go a final and there is a loser and there is a winner too, but that doesn’t mean the loser has done badly. We will give 100% and see which prize we get.
“A team is 11 stars, that’s football,” the PSG coach continued. “We don’t want one, we want 11, or 13, 14, 15 … that is what we want. We are looking for the real star to be the entire team. It’s like the fans: there is not one star, it is the whole of the Parc des Princes. I think the path is clear for everyone. We want stars, but at the service of the team.”
It was then put to him that the star was him, and that he was the favourite to win the Ballon d’Or coach’s award.
“I don’t believe in individual awards in general and still less for a coach,” he replied. “The team is always above the individual and that is something we try to transmit at PSG. Ousmane [Dembélé] is the best for what he has done individually, for the goals and assists, but above the goals and the assists it is because his work has meant that PSG won all the trophies. And that should be the only criteria by which a player is rewarded individually. That’s my opinion, and I am sure there are others.
“There is nothing star about me. There wasn’t as a player and there isn’t as a coach. I like the work I do. I enjoyed my career as a player and I am enjoying it as a coach – especially the hard moments. That’s when I feel most happy. It is nice when things go well because in our job you can make a lot of people happy, and I have learned to appreciate that as the years passed.
“But I know how this ‘show’ works: I know that people think you are good or bad based on your results. The praise comes because you win. The best team over the last decade was Manchester City. They lose 10 games and everyone kills them. They still have the best coach, they’re still the best team. It’s incredible.
“I accept that. But I have been better when I lost. I don’t mind; I like being criticised more than being praised. I think I have got it right much more when I didn’t win and everyone killed me with criticism. You all think that because we’re winning, I am getting everything right now. No. I got it right much more, I did much better, when I lost. But in terms of efficiency it has been an extraordinary year and now we have to finish it off.”
",TheGuardian
Morgan Gibbs-White move to Spurs on hold as Nottingham Forest consider legal action,Forest also preparing complaint to Premier League,https://www.theguardian.com/football/2025/jul/11/morgan-gibbs-white-spurs-move-on-hold-nottingham-forest-consider-legal-action-alleged-illegal-approach,"Fri, 11 Jul 2025 12:59:33",Ben Fisher,['Tottenham Hotspur'],"Morgan Gibbs-White’s expected £60m move to Tottenham is on hold because Nottingham Forest are considering legal action over an alleged illegal approach for the player.
Forest are also preparing a complaint to the Premier League, arguing that Spurs’ conduct surrounding the proposed transfer has been inappropriate. It had been expected that Gibbs-White would have a medical on Friday before completing the move.
Forest are consulting lawyers about possible legal action because they believe they have not granted Spurs permission to speak with Gibbs-White and also feel there has been a breach in confidentiality regarding the release clause in the England midfielder’s contract.
Spurs, who signed Mohammed Kudus from West Ham on Thursday, still plan to proceed with the deal as they look to boost Thomas Frank’s squad. This summer they have also tracked the Crystal Palace and England midfielder Eberechi Eze, who is wanted by their rivals Arsenal, Brentford’s Bryan Mbeumo and Southampton’s Tyler Dibling. Forest and Tottenham declined to comment when contacted. Forest consider the deal to be off but their anger may delay and not prevent the move.
",TheGuardian
Jordan Henderson will sign for Brentford next week after Ajax exit,England international will join on a two-year deal,https://www.theguardian.com/football/2025/jul/11/jordan-henderson-poised-to-bolster-brentford-midfield-after-ajax-exit,"Fri, 11 Jul 2025 14:50:02",Nick Ames,['Arsenal'],"Jordan Henderson’s return to the Premier League with Brentford will be confirmed next week after the England midfielder agreed a two-year contract with the Bees.
The 35-year-old, who ended a sometimes turbulent spell at Ajax this month, will fill the void left by Christian Nørgaard in a much-changed Brentford setup. Nørgaard, who had been the club’s captain, joined Arsenal this week and the expectation is that Henderson’s experience will be critical to the revamped engine room.
It means Henderson will add to his 431 top-flight appearances two years after leaving Liverpool and joining the Saudi club Al-Ettifaq. That transfer sparked controversy owing to a perceived clash with his high-profile support of LGBTQ+ rights. His spell there lasted only six months, an early contract termination allowing him to join Ajax in January 2024.
Magpies swoop for Elanga
Anthony Elanga has finally completed his move to Newcastle after the Magpies refused to give up their dogged pursuit.
The 23-year-old Sweden international has signed a long-term deal after the Tyneside club agreed an undisclosed fee with Nottingham Forest to secure the winger’s services.
Elanga, who was a target for Eddie Howe last summer, will join international teammate Alexander Isak at St James’ Park as his new employers prepare for a season which will include a return to Champions League football.
The Newcastle manager Howe told the club's website: “I’m delighted to welcome Anthony to Newcastle. He has been a key target for us so I’m delighted to secure him at this early part of pre-season.
“He is an exciting talent with attributes that make him a unique attacking threat. His pace, energy and ability to create and score goals will strengthen us and complement the way we want to play.
“Anthony is hungry to develop even further with us and to achieve success here and we’re all looking forward to working with him.”
Elanga, who began his career at Manchester United, has prospered since his £15m switch to Forest during the summer of 2023.
Elanga said: “I’m excited, I’m really happy but most importantly I’m ready. I’m ready to put on this black and white top to really fight for this team and give everything for the passionate fanbase that lives and breathes football.""
PA Media
Henderson captained Ajax but they dramatically missed out on last season’s Eredivisie title and he received criticism early this year after claims he was seeking a move to Monaco. Although contracted to the Amsterdam club until next summer, they agreed to release him and facilitate his move back to England.
He is the latest player to join Brentford in a summer of change that has seen Keith Andrews step up to replace the Spurs-bound Thomas Frank as head coach. The goalkeeper Caoimhín Kelleher, who joined in June, will be a familiar face from Henderson’s Liverpool days. There is considerable doubt over whether Bryan Mbeumo, a long-term target of Manchester United, will remain among his teammates when next season begins.
Henderson may hope that renewed Premier League exposure enhances his chances of a call-up to next summer’s World Cup squad. He has won 84 caps for England and, after missing out on Euro 2024, was recalled by Thomas Tuchel for the March qualifiers against Albania and Latvia. Those appearances from the bench were followed by a start in last month’s narrow win over Andorra.
Last week Henderson was among the many friends and teammates to pay emotional tributes outside Anfield to Diogo Jota, the Liverpool forward who was tragically killed in a car accident in Spain.
",TheGuardian
Athletic Bilbao’s Álvarez blames hair loss medicine for provisional doping suspension,Footballer revealed details in social media post,https://www.theguardian.com/football/2025/jul/11/athletic-bilbao-yeray-alvarez-blames-hair-loss-medicine-doping-test-suspension,"Fri, 11 Jul 2025 09:37:30",Athletic Bilbao,['Manchester United'],"Athletic Bilbao’s Yeray Álvarez has been provisionally suspended because of a failed doping test after a Europa League game against Manchester United, with the defender saying he unintentionally ingested a banned substance in medicine used to treat hair loss.
Álvarez said he had tested positive after Bilbao’s 3-0 home defeat in the semi-finals of Uefa’s second-tier club competition in May. The Spanish side also lost the return leg 4-1.
The 30-year-old centre-back was diagnosed with testicular cancer in 2016 and said he had been taking the medicine as part of his treatment for alopecia.
“After studying the case, we have established that I tested positive because I unintentionally took a hair loss prevention medicine containing a banned substance,” Álvarez said in a social media post on Thursday.
“The disciplinary procedure is currently under investigation and subject to confidentiality, so I am provisionally suspended and am not authorised to make any further public statements.
“I would like to say to all of you that I very much regret this situation but, with the support of the club, I am working on my defence in the belief that I will be able to return to the field of play as soon as possible.”
Uefa said it would not comment on the case until a final disciplinary decision had been made.
Bilbao threw their full support behind Álvarez, who came through the club’s youth academy and has made 257 appearances in all competitions for the senior team.
",TheGuardian
