Title,Summary,Link,Date,Author,Teams,Article,Outlet
Football transfer rumours: Real Madrid’s Rodrygo to join Manchester City?,Today’s rumours quibbles with their valuation,https://www.theguardian.com/football/2025/aug/12/football-transfer-rumours-real-madrids-rodrygo-to-join-manchester-city,"Tue, 12 Aug 2025 07:44:40",Daniel Harris,"['Manchester City', 'Tottenham Hotspur']","Pep Guardiola is the foremost football genius of his generation, revolutionising the game with imaginative tactics such as having the best players and the most money. But he has a particular expertise when it comes to wingers: consider Jack Grealish, now binned to Everton; Savinho, in the process of being binned to Spurs; Jérémy Doku, once fun, now ineffective; Julián Alvarez, binned to be brilliant at Atlético Madrid; Ferran Torres, binned after two seasons; Nolito, binned to Sevilla after a season; all acquired for a combined total of roughly £234.4m.
Consequently, one can only imagine Rodrygo’s excitement at the prospect of joining Manchester City from Real Madrid, who have decided that, though he offers goals, assists, energy, effort, experience, selflessness, variety, balance and big-game performances, he simply isn’t famous enough or attention-seeking enough to remain part of their squad. They value him at £87m – or, if he moves to the Etihad, £29.99 in two years’ time.
None of this is to decry Guardiola’s expertise when it comes to midfielders: in other City news, James McAtee is the latest to be deemed sub-par, following Cole Palmer, Morgan Rogers and Roméo Lavia out of the club. Nottingham Forest are close to agreeing a deal for the 22-year-old and, having paid £52m for Anthony Elanga, expect the price to be somewhere in the region of £9067m; Matheus Nunes, Nico González and Matteo Kovacic are all expected to remain in situ.
Elsewhere Chelsea are, of course, in the market. They are contemplating a bid for Piero Hincapié, the Bayer Leverkusen centre-back, but any move may be affected by their apparent antipathy towards Newcastle. Having already deprived them of João Pedro and Liam Delap, they are now trying to give Liverpool £43m for Ibrahima Konaté because, as last season proves, a frequently injured and inattentive defender is a mark of champions. Though this profile would need replacing, Arne Slot might well repurpose some loot for the acquisition of Alexander Isak, who will only contemplate reintegrating or signing a new contract if he is informed there is no prospect of a move to Anfield.
Meantime, the feelgood story of the summer continues apace as Eddie Howe seeks a centre-forward, any centre-forward, prepared to play for him. As such, Newcastle are talking to Rennes about Arnaud Kalimuendo … but so too are Brentford, whose negotiations are the more advanced. Stay tuned for yet more heartwarming hilarity.
Howe is also interested in Bilal El Khannouss, Leicester’s attacking midfielder, but so are Leeds, while Everton, having been rebuffed in various attempts to sign Tyler Dibling, will instead try for Tyler Durden. Should he fail to materialise, they too will contact the KP Stadium, with Abdul Fatawu the target.
Down the East Lancs Road and to Old Trafford where, holding a placard reading “I AM THE TRUTH”, Rasmus Højlund has chained himself to the Manchester United team bus; shortly afterwards, Ruben Amorim ordered its sending to the breaker’s yard. However there is interest in the player from Italy, with Inter, Roma and Juventus joining Milan in the chase, but the smart money is on him joining his fellow reject Scott McTominay at Napoli and proving once again the old adage that when you leave United, the only way is stratospheric. Maybe they’ve got more in common with City than they think.
",TheGuardian
Frustrated Crystal Palace count cost after Cas upholds Europa League ban | Ed Aarons,Oliver Glasner will fancy his chances of winning the Conference League but the fans have been left disappointed,https://www.theguardian.com/football/2025/aug/11/crystal-palace-cas-europa-league-conference-appeal,"Mon, 11 Aug 2025 18:49:25",Ed Aarons,['Liverpool'],"The news Steve Parish was dreading arrived less than 24 hours after he basked in the glory of watching Crystal Palace win their second trophy in three months. Parish had been confident that the club’s appeal against their demotion from the Europa League would succeed as he discussed their prospects at Wembley Stadium after beating Liverpool in the Community Shield on Sunday.
“I really am, even more after Friday,” the club chair said. “I don’t understand that we cannot be in the competition. I really can’t. But it’s up to the judges to decide. We trust them and that they listened to everything we said so let’s see.”
Confirmation from the court of arbitration for sport that it had upheld the decision made by Uefa’s club financial control body to punish Palace for breaching its multi-club ownership rules has brought Parish and the team’s fans back to earth.
The Cas statement made clear the role of John Textor, the American businessman who last month sold his 43% stake in Palace to the New York Jets owner, Woody Johnson, was decisive. Textor has admitted that seconds after Palace’s victory against Manchester City in the FA Cup final in May that he feared the worst regarding participation in the Europa League, given that he owns Lyon, who also qualified.
The Cas panel – consisting of a Dutch former striker, a Swiss former fencer who competed in the 1984 Olympics, and an Italian professor – backed Uefa’s findings that Textor “was a board member with decisive influence over both clubs at the time of Uefa’s assessment date”. It also dismissed Palace’s argument that they had received unfair treatment compared to Nottingham Forest and Lyon, and said missing the 1 March deadline for Textor to place his shares into a blind trust had been crucial.
Textor has been the target of most Palace fans’ frustration, although several have also taken aim at the Nottingham Forest owner, Evangelos Marinakis. Forest, who are poised to take Palace’s Europa League place, wrote to Uefa a few weeks after the FA Cup final expressing concern that Palace may have contravened multi-club ownership regulations.
Parish suggested last month in an interview with Gary Lineker that their Premier League rivals had played a role in the decision to ban them. “We were told that and I think it’s been made public,” he said. “These things seem to be played out in public. There doesn’t seem to be a lot of confidentiality that comes out of certain organisations. But we’re led to believe that’s the issue – if there wasn’t somebody that wanted to get in as a consequence, then there wouldn’t be a problem.
“People have got to look at themselves. Some people will say it’s fine, some people will say it’s not. I don’t really have control of that. I only have control of the arguments that we put forward to Uefa.” Forest declined to comment on Parish’s remarks at the time.
Palace’s case is believed to have included evidence that only members of the European Club Association were informed Uefa’s 1 March deadline for complying with multi-club rules could be extended until 31 May – a fact that enabled Marinakis to place Forest into a blind trust when it seemed they might qualify for the Champions League along with his Greek club, Olympiakos.
Palace are also understood to have highlighted the burgeoning friendship between Marinakis and Textor. The American denies that had any bearing on his conduct and described as untrue reports he is planning to incorporate his Brazilian club Botafogo into the Greek shipping magnate’s network of clubs.
Forest sent a legal delegation to the Cas hearing to argue their case and they have been silent since Palace were demoted by Uefa last month. Marinakis has resumed control of shares in the two-time European champions after they finished seventh in the Premier League.
Their supporters can look forward to the Europa League’s league stage while Palace prepare for a Conference League playoff against the losers of the Europa League qualifier between Norway’s Fredrikstad and Midtjylland. The Danish side lead 3-1 going into their home leg on Thursday.
It is estimated demotion will cost Palace up to £20m in lost revenue, given the Conference League’s league stage has two fewer games than the Europa League’s, although Oliver Glasner will fancy his chances of winning a competition that has had two English winners in its first four editions.
The chance for Palace to play in Europe for the first time since a short-lived Intertoto Cup experience in 1998, when they qualified after being the only English team to apply for entry, will be consolation for a club that also missed out in 1991 when they finished third in the First Division. Only the top two went into Europe via league position.
",TheGuardian
Jack Grealish agrees to join Everton on season’s loan from Manchester City,Forest closing on City’s James McAtee after new offer,https://www.theguardian.com/football/2025/aug/11/jack-grealish-agrees-to-join-everton-season-loan-manchester-city,"Mon, 11 Aug 2025 12:42:02",Andy Hunter,"['Manchester City', 'Tottenham Hotspur']","Jack Grealish is poised to join Everton on a season’s loan after agreeing to leave Manchester City in an attempt to revive his stalled career.
Everton’s interest in the City midfielder was reciprocated over the weekend with Grealish accepting an opportunity to be part of the club’s first season at Hill Dickinson Stadium. The 29-year-old wants to move in time to feature in Everton’s opening game of the Premier League season at Leeds. He is due to begin a medical on Monday.
City are looking to recoup most of Grealish’s £300,000-a-week wages and Everton’s outlay could exceed £12m once a loan fee is accounted for. City also want to include an option for a permanent transfer, although a suggested price of £50m appears optimistic for a player who will be 30 and in the final year of his contract in 12 months. City’s financial demands are unlikely to scupper the move, however.
Grealish is determined to reignite his career in the Premier League before the World Cup next summer. The £100m signing from Aston Villa, who has had several offers to leave City this summer, missed out on the England squad for the 2024 European Championship after losing his regular first-team place under Pep Guardiola.
The playmaker’s role has continued to decline since the high mark of City’s treble-winning season in 2023. He made seven Premier League starts last season, scoring once, and was omitted from Guardiola’s 27-man squad for the Club World Cup this summer.
Moyes is desperate to inject more creativity into his side. Everton have made five signings, including Kiernan Dewsbury-Hall from Chelsea for £28m, but remain short of attacking options. Southampton have rejected three offers from Everton for Tyler Dibling, the latest at about £40m, and are holding out for about £50m. A right-sided forward is a priority for Moyes and Everton, who lost their fourth friendly of pre-season against Roma on Saturday, are considering alternative options to the 19-year-old.
Nottingham Forest are closer to signing midfielder James McAtee from City. A bid worth £25m was rejected by City last month, but Forest have increased their offer.
McAtee won the European Under-21 Championship with England in June, but is not part of Guardiola’s plans. He made 15 Premier League appearances last season, scoring three times, but the academy graduate has never been at regular at the Etihad Stadium. McAtee had interest from Eintracht Frankfurt and Borussia Dortmund, but was eager to stay in England.
Forest are also keen to add a striker, full-back and central midfielder. Regarding midfielders they maintain interest in Monaco’s Soungoutou Magassa and Milan’s Yunus Musah, and Liverpool’s Kostas Tsimikas is a potential defensive reinforcement.
Savinho could also be heading for a City exit after Tottenham registered an interest in the winger. Preliminary talks have been held over the 21-year-old, who joined City from Girona last summer. It is expected to take at least £50m for City to consider selling the Brazilian. Spurs are looking for attacking reinforcements after missing out on Nottingham Forest’s Morgan Gibbs-White and losing James Maddison to a long-term knee injury.
Any outgoings may be followed by City looking to strengthen their options in the final third. They are understood to be considering a hijack of Chelsea’s pursuit of RB Leipzig’s Xavi Simons. Chelsea have held talks over the Netherlands international, but have not made progress on a fee and want to sell players before lodging a bid.
The deadlock may open the door for City to move for Simons, who has also been linked with Bayern Munich. Chelsea have agreed personal terms with the versatile 22-year-old, but the situation is complicated by their desire to find buyers for Christopher Nkunku, Nicolas Jackson and Tyrique George before making additions.
Chelsea have plenty of depth and are determined not to panic after the England defender Levi Colwill sustained an anterior cruciate ligament injury. They have options in central defence and will try to sign a new centre-back only if a suitable player comes on to the market.
",TheGuardian
"New additions have Liverpool looking rejuvenated in attack, and withered in defense | Jonathan Wilson","It was only the Community Shield, but issues from pre-season popped up again for Arne Slot in Liverpool’s loss on penalties to Crystal Palace",https://www.theguardian.com/football/2025/aug/11/liverpool-crystal-palace-community-shield,"Mon, 11 Aug 2025 14:50:07",Jonathan Wilson,['Liverpool'],"It was the Community Shield, and that should not be forgotten. There isn’t anybody who has been watching English football for any period of time who hasn’t made the mistake of taking too seriously a conclusion drawn in the midst of the traditional curtain-raiser, giddy on the sight of Wembley in its pomp and the return of competitive club football from the summer wilderness.
Any analysis has to be tempered. Teams are always works in progress, evolving and developing, but that is never truer than in early August with new signings adapting to their teammates and surroundings, and others shaking the summer from their legs. Things will change. But after Liverpool’s 2-2 draw with Crystal Palace and subsequent defeat on penalties in the Community Shield, it can be said with a degree of certainty that their new signings have gelled better at the front of the pitch than the back.
Hugo Ekitiké, signed from Eintracht Frankfurt, and Florian Wirtz, signed from Bayer Leverkusen, had hugely encouraging debuts. Ekitiké and the attacking right-back Jeremie Frimpong, another from Leverkusen, both scored. But Liverpool were shockingly, startlingly open at times, as they have been throughout pre-season – and it cost them the game.
They are learning a new system, the 4-3-3/4-2-3-1 hybrid of last season yielding to a 4-2-3-1. It’s not a huge shift but Wirtz, as the most advanced of the triangle of central players between the centre-backs and the centre-forward, is very much a forward, whereas Dominik Szoboszlai, who tended to be the most advanced of the central midfield triangle last season, is an attacking midfielder. It’s not that Wirtz does not perform his defensive duties – he does, and is notably assiduous in doing so, a highly effective presser of the ball – it’s that he does so in slightly different positions.
The expectation is that the midfield two in most games going forward, at least when Liverpool are not going to monopolise possession, will be Ryan Gravenberch and Alexis Mac Allister. Gravenberch was unavailable for the Community Shield after becoming a father on Saturday night, while Mac Allister is still regaining fitness and was restricted to the final 20 minutes. That led to Szoboszlai occupying a deeper role than usual alongside Curtis Jones, who made a convincing case for occupying the role more frequently with a controlled performance in which he completed all 53 of the passes he attempted. It was after he and Ekitiké were withdrawn that Palace began to mount concerted pressure.
Coming to terms with an unfamiliar system without the two key cogs at the back of midfield, the area that was always likely to come under pressure with the change of formation, was far from ideal for Liverpool. They had looked entirely comfortable for the first 15 minutes but then a simple straight through-ball opened them up, Jean-Philippe Mateta played onside by at least one and possibly both full-backs as Virgil Van Dijk and Ibrahima Konaté stepped up in the centre. Although Alisson made the initial save, Liverpool were still resetting as the ball was returned to the middle, leading to Van Dijk’s clumsy lunge on Mateta and the penalty that brought the first equaliser.
Sign up to Soccer with Jonathan Wilson
Jonathan Wilson brings expert analysis on the biggest stories from European soccer
Van Dijk looked unsettled by what was happening immediately in front of him all afternoon, often stepping into the space Gravenberch might usually have been expected to be occupying, which in turn disrupted the back four. That was what led to the second equaliser: Van Dijk being drawn forward, leaving the gap into which Ismaïla Sarr burst to score. Clearly Gravenberch’s absence made a difference but nobody should think that his return will immediately solve the problems. The new shape means a different approach, with Liverpool adopting an aggressive man-to-man press that left space behind the defensive line. Sarr caused problems all game, repeatedly dragging Milos Kerkez, the fourth of the new signings in the starting lineup, infield, which meant Cody Gakpo had to do a lot of work tracking Palace’s right wing-back, Daniel Muñoz.
None of this is unsolvable, but it does mean that Liverpool may be more defensively vulnerable, at least in the early part of the campaign, than they were in winning the league last season. Ekitiké had an excellent game, his movement and his touch, his awareness, all excellent. Wirtz impressed as well with his energy and invention; the penultimate pass he played in the buildup to the first goal demonstrating his capacity to see opportunities others would not, crafting a service to Ekitiké that took three Palace players out of the game.
But for any side making as many changes as Liverpool have this summer, with four big new signings and a fifth perhaps to arrive in Alexander Isak, there will be a degree of uncertainty, a period of bedding in. The possibilities are exciting but, as Slot reshapes the squad to his own specifications, some teething troubles are only to be expected.
On this day…
Paris Saint-Germain are by some margin the youngest of Europe’s giants, having come into being on 11 August 1970, a day after the birth of the former Manchester United and Ireland midfielder Roy Keane. The French capital had no major club which, as European competition became established through the 1960s, came to seem increasingly bizarre. So, in 1969, the French Football Federation, the mayor of Paris, the editor of French sports newspaper l’Équipe and Guy Crescent, who ran the Calberson truck company and was prepared to provide financing, got together to decide the best way of setting up a team for Paris. A referendum confirmed the scheme had overwhelming popularity, voting for the name Paris FC, and, in February 1970, a telethon attracted 10,000 people to sign up as members, each paying 20 francs.
But Paris FC had no stadium, players, coach or licence, so a merger was arranged with the second-flight side Stade Saint-Germain, creating Paris Saint-Germain (Paris FC broke away in 1972 and, after promotion this past May, will compete again in the French top flight this season). After the fashion designer Daniel Hechter took over in 1973, redesigning the kit and providing investment, the club gained promotion to the top-flight, moving in to the Parc des Princes in 1974 as Paris FC were relegated.
This is an extract from Soccer with Jonathan Wilson, a weekly look from the Guardian US at the game in Europe and beyond. Subscribe for free here. Have a question for Jonathan? Email soccerwithjw@theguardian.com, and he’ll answer the best in a future edition.
",TheGuardian
