Title,Summary,Link,Date,Author,Teams,Article,Outlet
Rice 'didn't like' Madueke signing backlash,"New Arsenal signing Noni Madueke will ""shock a lot of people"" this season, says midfielder Declan Rice.",https://www.bbc.com/sport/football/articles/c1k89kv2w27o,"Thu, 24 Jul 2025 11:01:29",Alex Howell,['Arsenal'],"Arsenal midfielder Declan Rice says he ""didn't like"" the reaction online from some fans about the signing of Noni Madueke from Chelsea, but backed the winger to ""shock"" with his talent.
Madueke, 23, joined for an initial £48.5m last week as Arsenal look to increase their attacking options.
However, the signing caused a backlash, with the hashtag #NoToMadueke posted across social media, and a petition started which had more than 5,000 signatures.
""I know how driven he is,"" Rice said after Arsenal's 1-0 pre-season win over AC Milan in Singapore.
""I've spoken to him and you're going to see what he's about this season. He wants to prove and show everyone what he really can do.
""He's hungry, he wants to play for Arsenal and that's the type of players we want. It's so positive.
""He's going to shock a lot of people and I can't wait for him to come.
""People have been speaking internally - the players, the staff. We know the player that we're getting and we're really looking forward to having him at our club. It's going to be really exciting.""
'That's an unbelievable trait to have'
Rice wrote a letter to Madueke when he signed for Arsenal, and the winger was seen reading some of it during the transfer announcement video that Arsenal posted across their channels.
Rice said the club came up with the idea and it was ""a nice little touch for him to join the club and feel welcome"", and Madueke had ""messaged me about it, saying that he really, really appreciates it"".
Madueke has been signed to support Bukayo Saka on the right wing and to challenge Gabriel Martinelli for his starting role on the left-hand side.
Madueke has been a regular for Chelsea over the past two seasons, scoring 20 goals in 92 appearances.
The Gunners have struggled to break down teams that defend deep against them at times and Madueke's ability to beat his defender is seen a huge boost to the squad as they look to win a trophy this season after coming so close in previous campaigns.
""When you're an attacking player and in your mind the first thought you have is to go past your defender, that's an unbelievable trait to have,"" Rice said about Madueke's ability.
""He's going to bring that to the squad along with the other wingers we have. Let's be real - last year we hardly had any depth in any areas.
""We played half the season pretty much with so many injuries, so to now be able to rotate and push in different competitions with different players is going to be really, really good. That's key for us.""
Rice ready to score more goals
Arsenal have been active in the transfer market and have completed deals for Martin Zubimendi, Christian Norgaard and Kepa Arrizabalaga, with Cristhian Mosquera and Viktor Gyokeres expected to follow shortly.
Rice finished the season playing for Arsenal as a more advanced number eight and, with the signings of Norgaard and Zubimendi, it is expected that is where he will continue playing for the Gunners.
""I think the manager now sees me as a box-to-box player and I think at the back end of last season, off the back of Christmas, I showed fully what I can do in that position and I really kicked on.""
Rice scored nine goals and registered 10 assists in all competitions for Arsenal last season and is looking to better those numbers this campaign.
""I'm putting really big demands on myself this year,"" he said. ""I'm really trying to push myself because the back end of the season I finished really, really strong.
""At the start of the season last year I was nowhere near the level that I require of myself.
""I put it down to a few things - the back of the Euros final was mentally really tough, having 16 days off, going straight back into a Premier League season.
""More goals. More assists. Impact the games more. Not just do it at the back end of the season; do it in a full season and set myself some numbers.
""I think the best players in the world do that. They want to try and push themselves and that's what I'm trying to do and the manager is certainly on me to do that as well.""
",BBC
Ex-Man Utd striker Hernandez apologises for sexism,Mexico striker Javier Hernandez says he regrets making sexist comments which saw him fined and warned about his conduct.,https://www.bbc.com/sport/football/articles/c79q939wdr7o,"Thu, 24 Jul 2025 19:03:11",,['Manchester United'],"Former Manchester United striker Javier Hernandez says he ""deeply regrets"" making the sexist remarks that led to him being fined and warned about his future conduct.
The Mexican Football Federation (FMF) said the 37-year-old, now with Liga MX side Chivas, made a series of statements on TikTok ""promoting sexist stereotypes that are considered media violence and go against gender equality in sport"".
Hernandez said women are ""failing"" and ""eradicating masculinity"".
""Don't be afraid to be women, to allow yourselves to be led by a man,"" said the former Mexico captain on social media.
In an apology posted on Instagram on Thursday, he said it was ""never my intention"" to ""hurt or divide"".
""I deeply regret any confusion or discomfort that my recent words have caused,"" added Hernandez, who won two Premier League titles during his five-year spell at United.
He said he was ""listening, reflecting and committed to expressing myself with better clarity and sensitivity"" and he would ""take this opportunity to understand, grow and continue working to be a better version of myself"".
The original comments, which were made last weekend, were met with a backlash in Mexico.
President Claudia Sheinbaum, the country's first female president, said: ""Chicharito is a very good soccer [player] but when it comes to his opinion on women... he still has a lot to learn.""
In a joint statement, the FMF and Mexico's top men's and women's leagues said the Gender and Diversity Commission has started an investigation ""that seeks to prevent and punish this behaviour"", and it will ""take more severe measures in the event of a repeat offence"".
Chivas said the comments were ""contrary to the principles and values"" of the club and they had taken ""appropriate action"" against Hernandez, though they did not specify what that was.
Hernandez, Mexico's all-time leading scorer, joined Manchester United from Chivas in 2010.
Spells with Real Madrid and Bayer Leverkusen followed, before he returned to the Premier League in 2017 with West Ham for a three-season stint.
Hernandez left them for Sevilla, before spending four seasons with MLS side Los Angeles Galaxy.
He returned to first club Chivas in 2023, signing a two-year deal.
",BBC
Arsenal sign defender Mosquera from Valencia,Cristhian Mosquera is set to join up with Arsenal's pre-season tour in Singapore after completing his transfer from Valencia.,https://www.bbc.com/sport/football/articles/cx2je763nlno,"Thu, 24 Jul 2025 16:04:14",Alex Howell,['Arsenal'],"Arsenal say they have secured ""one of the strongest young defenders in European football"" after completing the signing of Cristhian Mosquera from Valencia for an initial fee in the region of 15m euros (£13m).
The 21-year-old has joined the Gunners on a five-year contract, which has an option for a further 12 months.
Mosquera can play at both centre-back and right-back and will fill the gap in the squad left by the departure of Takehiro Tomiyasu, who mutually agreed to terminate his contract earlier this month.
""I couldn't let it pass me by. I'm joining a historic, massive club. When you arrive here with your family, you really feel the greatness of the place,"" Mosquera told the club's website.
""My career has moved faster than I expected and I've had to mature fast. Coming here is a chance to keep learning and improving.""
The Spain Under-21 international joined Valencia in 2016 as a 12-year-old before making his first-team debut in 2022 when he became the youngest centre-back to play for the club.
Mosquera made 90 appearances for Valencia and was a regular for them last season, playing the full match in 37 of the club's 38 La Liga games as they finished 12th.
Manager Mikel Arteta described Mosquera as a player with ""exciting talent and enormous potential"" while sporting director Andrea Berta hailed the defender's long-term prospects.
""We identified Cristhian as one of the strongest young defenders in European football, and he is an important signing for our future. Cristhian is a versatile defender who will strengthen our squad,"" Berta said.
He follows Martin Zubimendi, Kepa Arrizabalaga, Christian Norgaard and Noni Madueke in being added to Mikel Arteta's squad this summer, with Viktor Gyokeres also close to joining the Gunners.
Mosquera is set to join up with the Arsenal squad on their pre-season tour in Asia as he had already been given permission to travel by Valencia before the deal had been confirmed.
Arsenal beat AC Milan 1-0 in Singapore in the National Stadium on Wednesday and take on Newcastle United at the same venue on Sunday.
They then travel to Hong Kong to play Tottenham Hotspur before returning to London.
Mosquera gives availability and versatility - analysis
Arsenal have secured the signing of Mosquera and have added what they feel is a young defender with quality to add options to their backline.
He has played senior football for two seasons and in 2024-25, he not only played the most minutes of anyone in the Valencia squad, but also the second-most of any outfield player in the whole of La Liga.
That type of availability is important to Arsenal manager Arteta who will be hopeful to avoid the injuries which caused so many issues for him last season.
Alongside the availability, Mosquera can play across every position in defence, adding versatility to a strong Arsenal squad.
The 21-year-old may take time to adapt to the league and country but with a large contingent of Spanish speakers at Arsenal, the process of settling in should be a lot easier.
",BBC
Why one extra day could be secret to England getting revenge on Spain,History and science show playing their semi before their final rivals should be advantage for Sarina Wiegman’s team,https://www.theguardian.com/football/2025/jul/25/why-one-extra-day-could-be-secret-to-england-getting-revenge-on-spain,"Fri, 25 Jul 2025 07:00:53",Tom Garry,['Chelsea'],"What do the past three Women’s World Cups, the past three men’s World Cups and the past four men’s European Championships have in common with this summer’s men’s Club World Cup? The answer may give England fans an extra glimmer of hope for Sunday’s Women’s Euro 2025 final because all of those competitions were won by the team who contested the first semi-final, 24 hours earlier than their opponents in the final.
Most women’s football tournaments used to schedule the semi-finals for the same day but, since that began to change about 20 years ago, it has been a trend in international tournaments for the winners to have come from the first semi-final. As the Lionesses prepare to meet Spain, who came through their semi-final against Germany a day later than England’s comeback win over Italy, it begs the question: how much of an advantage could it offer to Sarina Wiegman’s team?
Darren Robinson, a performance specialist and accredited sports psychologist who holds the Uefa pro licence coaching qualification, told the Guardian: “Having that extra time, from a physiology point of view, helps with muscle recovery; you’ll have a reduction in soreness with an extra 24 hours. Particularly in a multi-sprint sport like football, you do generally have a lot of muscle soreness; it’s multi-sprint, multi-turn, jumping, landing and all of these things create extension forces that cause muscle soreness, so that extra 24 hours helps a team be a bit fresher.
“I would suggest one of the benefits England have is resources, with the expertise that comes out of St George’s Park and supports the national teams: specialists in recovery, hydration and nutrition, meaning the players should benefit from some of those marginal gains, so the governing body has played its part when they’ve won games in the dying stages.”
England overcame Sweden on penalties in the quarter-finals and Chloe Kelly’s 119th-minute goal enabled them to edge past Italy in the semi-finals, setting up a repeat of the 2023 World Cup final in Australia. But in Sydney they were beaten by a Spain side who had played the first semi-final.
Excluding the 2017 Women’s Euros, when the semi-finals were on the same day, all the past 12 men’s or women’s Euros or World Cup finals were won by the first semi-finalists. Starting from Women’s Euro 2005, 18 of the 20 tournaments have had semi-finals on different days and of those 80% of men’s Euros or World Cups and 87.5% of the women’s Euros or World Cups were won by the first semi-finalist.
Nile Robbins, women’s high performance coach at the University of Stirling, told the Guardian: “How you schedule your sessions and your recovery looks completely different, based on whether you’ve got three or four days before you play your next game. But sometimes the main impact is not just physical, it’s mental. Take Spain v Germany, for example; Germany’s quarter-final game will have been far more emotionally and mentally draining than Spain’s.”
It appears it takes a great team to defy the disadvantage of playing in the second semi-final. Germany’s formidable women’s team managed it when cruising past England in Euro 2009’s final, and the all-conquering Spain men’s side managed to win Euro 2008 and 2010’s World Cup after playing second, exemplifying their rare excellence, but no other side have managed it in the past 20 years. Many will feel this talented Spain side, full of Barcelona stars, could be another such team capable of defying their shorter turnaround.
Sign up to Moving the Goalposts
No topic is too small or too big for us to cover as we deliver a twice-weekly roundup of the wonderful world of women’s football
Robinson, who has also held various head of performance roles, mostly in the men’s Championship, including at Hull and Birmingham, said: “The other aspect which will be really important is they’re going to play the Spanish, who have controlled and dominated matches. Against a Spanish team capable of dominating possession, you need to be at full capacity.”
How teams recover from late-night matches varies, naturally, depending on the coaches and the regime but Robinson says: “Having protein shakes, hydration and carbohydrate replenishment, within the dressing room, that would start instantly after a game and the first 20 minutes are crucial, replenishing that lost energy.
“The challenge of course is after sport your appetite is suppressed, and particularly after a big game you’re celebrating and having something to eat or drink is the last thing that you want. And you can’t treat the whole group the same. While you’re piling food into the starting XI, you don’t want the players who didn’t play overeating. That’s why the culture and the discipline is so important. On the day after a game, we would definitely promote active recovery, so it could be things like going in the pool or jogging, exercise bikes or go for a walk together as a team.”
As some England players walked near their hotel on a hillside in Zurich on Thursday, perhaps their confidence grew, knowing that Spain also played 120 minutes in their semi-final. But Robbins, who has also worked at the University of Glasgow, says: “All of these things don’t automatically mean England will win but it does mean that they have those little advantages, and when the differences at the top level are so small, as little as 1% can make a huge difference.”
",TheGuardian
Alexander Isak open to leaving Newcastle with Liverpool his preferred destination,Striker not in squad for pre-season friendlies in Asia,https://www.theguardian.com/football/2025/jul/24/alexander-isak-not-part-of-newcastle-squad-for-pre-season-friendlies-in-asia,"Thu, 24 Jul 2025 16:35:46",Will Unwin,"['Arsenal', 'Liverpool']","Alexander Isak is open to a move away from Newcastle, with Liverpool his preferred destination. The Sweden striker has not travelled with his teammates on a pre-season tour to Asia and is looking into his options.
Isak has long been interested in joining Liverpool but the possibility of it happening this summer is remote. The striker has a contract until 2028 and the Premier League champions would need to raise funds through sales to afford a player valued at about £120m.
Liverpool signed another striker, Hugo Ekitiké, this week for £79m after concluding that Isak was out of reach. They may prioritise a centre-back over another forward. Newcastle had also been interested in Ekitiké but missed out after also failing to lure Liam Delap, who preferred to join Chelsea from Ipswich. Newcastle retain an interest in Yoane Wissa and have bid for the Brentford forward.
Isak missed a friendly at Celtic last Saturday and was left out of the 30-man squad that travelled to Asia because of what Newcastle described as a minor thigh injury. Eddie Howe’s side will play Arsenal in Singapore on Sunday and then face two fixtures in South Korea, against a K League XI and Tottenham.
Howe said after the Celtic game of Isak’s absence: “It was my decision. He travelled back to Glasgow with us but I decided to send him home due to the speculation around him. The last thing he wanted is to be sat in the stand watching, that wasn’t fair to him. But I’m confident he will be a Newcastle player come the end of the window.”
Newcastle have no desire to sell Isak as they prepare for a Champions League campaign. There has been an eagerness at the club to extend and improve Isak’s contract, after he scored 23 goals in 34 Premier League games to help the team finish fifth, but the 25-year-old has shown little enthusiasm for the idea.
Arsenal have made the Valencia defender Cristhian Mosquera their fifth signing of the summer, taking the club’s spending to close to £140m. The Spaniard joins for an initial fee of £13m – with performance-related add-ons – and is understood to have agreed a five-year deal with an option of a further year.
The 21-year-old is set to provide cover for William Saliba and Gabriel Magalhães at the heart of the Gunners’ defence, but can operate anywhere along the backline. Mosquera, who played 41 times for Valencia last season, has joined Arsenal for their tour of Singapore and Hong Kong.
“It means a lot to me,” Mosquera told his new club’s website. “There’s been a lot of hard work behind all of this. It’s an opportunity that came up and I couldn’t let it pass me by. I’m joining a historic, massive club. When you arrive here with your family, you really feel the greatness of this place.”
",TheGuardian
"Brilliant Bonmatí sends Spain into Euro 2025 final, plus transfer talk – Football Weekly Extra","Max Rushden is joined by Jonathan Liew, Nedum Onuoha and Seb Hutchinson to discuss Euro 2025 and the latest transfer news",https://www.theguardian.com/football/audio/2025/jul/24/spain-euro-2025-final-transfers-tottenham-football-weekly-extra,"Thu, 24 Jul 2025 11:12:19",Max Rushden,['Tottenham Hotspur'],"Rate, review, share on Apple Podcasts, Soundcloud, Audioboom, Mixcloud, Acast and Stitcher, and join the conversation on Facebook, Twitter and email.
On the podcast today: it took a moment of Aitana Bonmatí brilliance for Spain to overcome Germany in extra-time and reach the Euro 2025 final. The pre-tournament favourites are now one game away from glory but what can England do to stop them and retain their trophy?
In the transfer market, Chelsea have had the novel idea to sign an attacking player in Xavi Simons and Rodrygo might follow Hugo Ekitike to big-spending Liverpool.
Plus, what lies ahead for Thomas Frank’s Spurs this season and your questions answered.
Buy tickets to Football Weekly LIVE in September here.
Support the Guardian here.
You can also find Football Weekly on Instagram, TikTok, and YouTube.
",TheGuardian
