Title,Summary,Link,Date,Author,Teams,Article,Outlet
Madueke emerging as a top Arsenal target with Chelsea expecting bid,Chelsea are expecting an offer from Arsenal for Noni Madueke.,https://www.skysports.com/football/news/11095/13392819/noni-madueke-transfer-news-chelsea-expecting-bid-from-arsenal-for-winger,"Sat, 05 Jul 2025 16:12:00",,"['Arsenal', 'Chelsea']","Chelsea are expecting an offer from Arsenal for Noni Madueke.
Sky Sports News understands the 23-year-old winger is emerging as a top target for Arsenal.
The Gunners have looked at a number of players in the forward positions, including Real Madrid's Rodrygo. It is understood they have kept an eye on Madueke's development. There has not been any club-to-club contact yet.
Arsenal have only added goalkeeper Kepa Arrizabalaga and are looking to sign a left winger. Madueke, though, played at right wing 33 times for Chelsea during the 2024/25 season and only seven on the left.
Arsenal also have Bukayo Saka and Ethan Nwaneri to fill the right-winger spot.
Following Chelsea's 2-1 quarter-final win against Palmeiras at the Club World Cup on Saturday, head coach Enzo Maresca said that any players in his squad who are unhappy are free to leave.
Madueke came on as a second-half substitute for Christopher Nkunku in Philadelphia and stretched the Palmeiras defence.
Chelsea signed Madueke from PSV Eindhoven for £29m in January 2023 and he has five years left on his contract.
Chelsea have strengthened significantly in attack with strikers Liam Delap arriving for £30m from Ipswich Town and Joao Pedro joining from Brighton in a deal worth up to £60m.
The club also added Jamie Gittens from Borussia Dortmund for an initial fee of £48.5m plus £3.5m in potential add-ons.
In
Jamie Gittens - Dortmund, £51.5m
Joao Pedro - Brighton, £60m
Liam Delap - Ipswich, £30m
Estevao Willian - Palmeiras, £29.1m
Dario Essugo - Sporting, £18.5m
Mamadou Sarr - RC Strasbourg, undisclosed
Out
Bashir Humphrey - Burnley, undisclosed
Marcus Bettinelli - Man City, undisclosed
Kepa Arrizabalga - Arsenal, £5m
From next season, Sky Sports' Premier League coverage will increase from 128 matches to at least 215 games exclusively live.
And 80 per cent of all televised Premier League games next season are on Sky Sports.
",SkySports
Jota's wife and family joined by Liverpool players for funeral,"Diogo Jota's wife and family were joined by Liverpool players for the funeral of the forward and his brother, Andre Silva, in Portugal following their deaths in a car crash in Spain.",https://www.skysports.com/football/news/11095/13392534/diogo-jota-funeral-wife-and-family-joined-by-liverpool-players-in-portugal,"Sat, 05 Jul 2025 12:00:00",,['Liverpool'],"Diogo Jota's wife and family were joined by Liverpool players for the funeral of the forward and his brother, Andre Silva, in Portugal following their deaths in a car crash in Spain.
The father-of-three, who married his long-term partner Rute Cardoso 11 days before the accident, died alongside his brother after a Lamborghini they were travelling in burst into flames following a suspected tyre blowout in the early hours of Thursday morning.
The coffins of Jota and Silva were carried into Igreja Matriz de Gondomar church in the town of Gondomar near Porto on Saturday morning, followed by mourners.
A church bell tolled and crowds applauded as the brothers' coffins were carried into the church, followed by mourners, some with their arms around each other.
Others seen arriving at the church included Reds head coach Arne Slot, captain Virgil van Dijk and team-mates including Andy Robertson, Conor Bradley, Ryan Gravenberch, Cody Gakpo, Curtis Jones, Darwin Nunez and Joe Gomez.
Also at the funeral for the Portugal international were his national team-mates Bruno Fernandes of Manchester United, Ruben Dias and Bernardo Silva of Manchester City, Joao Felix and Renato Veiga of Chelsea, Nelson Semedo from Wolves, Joao Moutinho, Rui Patricio and Ruben Neves, as well as former Liverpool player Fabinho, Porto president Andre Villas-Boas and Portugal manager Roberto Martinez.
Neves served as one of the pallbearers for Jota after flying in from Florida, where he played for Al Hilal in the Club World Cup quarter-final on Friday night.
Some of the players carried wreaths shaped like football shirts as they arrived at the church.
""They are [have been] really sad days, as you can imagine, but today we have shown we are a very large, but close family,"" Martinez told Sky Sports News.
""We are Portugal, and it was essential for us that [with] Andre Silva and Diogo Jota, we are together and we will always be together and their spirit will be with us forever.
""Thank you very much for your messages, for your support and everything that we have received [from] all over the world. It means a lot and today we are all one football family.""
City midfielder Silva also paid tribute to his fellow Portugal international.
""I can't even imagine the pain of the family, of Rute, of the children, of the parents,"" Silva told Portuguese broadcaster TVI.
""I must talk a little about Jota, who was a great friend to all of us.
""His career, although not the most important thing, speaks for itself. His passion, will and determination allowed him to succeed in life and have a brilliant career.
""More important than that, as a person, the memories that remain. Jota will remain in our hearts forever. He will always be present at all breakfasts, lunches, dinners, national team gatherings, PlayStation or card games.
""It is a very tough episode for all of us, because we spent a lot of time together. The memories I have with him are fantastic. These happy memories will remain; he will be present in every victory.
""We were rivals and team-mates for many years. He became a great friend. He was present at my wedding. Unfortunately, I wasn't at his, because I was at the Club World Cup.
""It is a family that will always be with us and that we will try to preserve.""
After the funeral service, the coffins were carried to the cemetery next to the church.
Family and friends gathered for the brothers' wake on Friday, with a queue forming outside the Portuguese chapel.
The brothers' parents attended the Sao Cosme Chapel, the Capela da Ressurreicao, in Gondomar, with Portuguese President Marcelo Rebelo de Sousa, Prime Minister Luis Montenegro and Jota's agent also there.
People held service sheets featuring pictures of both brothers, the largest one showing Jota smiling in his Liverpool shirt and making a heart sign with his hands.
Liverpool postponed the return of their players for pre-season following Jota's death and players past and present paid tribute to him and his brother on social media.
A sea of floral tributes had been left outside Anfield, with many Liverpool fans and supporters of other clubs looking to pay their respects.
Flags have been lowered to half-mast at the stadium and all club stores, museums and tours have been closed until Monday, with staff offered wellbeing support.
Jota and Silva were found dead after the car crashed on the A-52 in Palacios de Sanabria near the city of Zamora at 12.40am on Thursday.
Police said they were investigating the possibility that the Lamborghini left the road because of a tyre blowout while overtaking, and a source from the government sub-delegation in Zamora confirmed ""a possible speeding incident"" was being looked at.
Pictures of the aftermath of the crash showed debris scattered along the side of the road including what appeared to be charred parts of the vehicle.
No other vehicles are said to have been involved in the incident.
",SkySports
Chelsea seal £51.5m deal for Dortmund forward Gittens,Chelsea have signed Borussia Dortmund forward Jamie Gittens in a deal worth &#163;51.5m on a seven-year contract.,https://www.skysports.com/football/news/11095/13378111/jamie-gittens-transfer-news-chelsea-sign-borussia-dortmund-forward-in-51-5m-deal,"Sat, 05 Jul 2025 15:00:00",,['Chelsea'],"Chelsea have signed Borussia Dortmund forward Jamie Gittens in a deal worth £51.5m on a seven-year contract.
Talks had been progressing in the US, where both teams had been taking part in the Club World Cup and despite Bayern Munich also being interested, the 20-year-old has moved for an initial fee of £48m plus £3.5m in add-ons.
Dortmund confirmed the transfer had been agreed in Florida on Thursday evening.
The west London club have been looking to strengthen the wide areas following the decision not to take up the option to sign Jadon Sancho permanently.
The England U21 international contributed 12 goals and five assists in 48 games in all competitions for Dortmund last season.
Upon signing for Chelsea, Gittens said: ""It feels great. It's a great feeling to join such a big club as Chelsea.
""I can't wait to learn from everyone in the team and to push myself to the max here. It's an amazing feeling.""
Sky Sports' Peter Smith:
It wasn't always thrill-a-minute under Enzo Maresca last season at Chelsea. Far from it. Gittens can add spark to the team's attacking play.
Comparisons with Sancho are inevitable, given their career histories and preferred left-wing role but Gittens' output of dribbles and crosses at around twice the rate of the former Blues loanee illustrates the different approach the new arrival is likely to bring.
In fact, Gittens' mesmeric, high-speed dribbling ability is on another level in terms of frequency compared to what we saw from Pedro Neto and Noni Madueke in the Premier League this past season, too. Gittens has been a livewire in the Bundesliga and the plan will be for him to translate that into Maresca's set-up.
On paper, it should be a good fit. As the passing network for Chelsea last season shows, Maresca likes his players to find the wingers high and wide. From there, Gittens will relish the one-on-one battles with full-backs as he looks to create opportunities to cut inside and shoot on his favoured right foot or go on the outside to cross for England youth-team pal Liam Delap or Nicolas Jackson.
Gittens' top speed of 35.96km/hr was the 16th-fastest clocked in the German top flight last season and the prospect of him stretching defences or igniting counters is an enticing one for Blues fans who have found their side too predictable of late. If Sancho's lack of pace was a criticism aimed at him, it won't be an issue for Gittens.
Like most Chelsea signings, at 20 years old, Gittens has room to improve and experience to add to his game. He is not the finished article. But his unpredictability on the ball will be a welcome addition at Stamford Bridge.
In
Jamie Gittens - Dortmund, £51.5m
Joao Pedro - Brighton, £60m
Liam Delap - Ipswich, £30m
Estevao Willian - Palmeiras, £29.1m
Dario Essugo - Sporting, £18.5m
Mamadou Sarr - RC Strasbourg, undisclosed
Out
Bashir Humphrey - Burnley, undisclosed
Marcus Bettinelli - Man City, undisclosed
Kepa Arrizabalga - Arsenal, £5m
The first of two summer transfer windows is upon us - and there is no better place than Sky Sports to get all the latest transfer news and rumours.
Use the Sky Sports app and website for all your updates in our dedicated Transfer Centre and Premier League club blogs, plus live Q&As with our reporters throughout the summer.
The Transfer Show returns to Sky Sports News from Sunday June 1 for the start of the pre-Club World Cup window and will then be on every weeknight at 5pm and 7pm until the deadline on Tuesday June 10.
The summer transfer window will open again on Monday June 16 until Monday September 1 - with the deadline brought forward to 7pm this year.
From next season, Sky Sports' Premier League coverage will increase from 128 matches to at least 215 games exclusively live.
And 80 per cent of all televised Premier League games next season are on Sky Sports.
",SkySports
The rise of Gittens - and how he can spark Chelsea attack,"Chelsea have completed the signing of Jamie Gittens and the 20-year-old winger is set to become a Premier League player, but his route there has been a little different.",https://www.skysports.com/football/news/11095/13380877/jamie-gittens-to-chelsea-from-reading-to-borussia-dortmund-via-man-city-charting-the-rise-of-the-young-winger,"Sat, 05 Jul 2025 15:00:00",,['Chelsea'],"Chelsea have completed the signing of Jamie Gittens and the 20-year-old winger is set to become a Premier League player, but his route there has been a little different.
In conversation with coaches and team-mates, we analyse the reasons for his rise and what could come next for him at Stamford Bridge...
🔵 Early promise at Reading🟡 Developing at Dortmund🔵 How he fits in at Chelsea
Sky Sports' Nick Wright:
Gittens made his move to Borussia Dortmund from Manchester City, following the same path as Jadon Sancho, a player he now replaces at Chelsea, but the bulk of his formative years were spent at Reading, where those who worked with him remember him fondly.
Speaking to Sky Sports in 2023, one of the club's former academy coaches Rhys Denton explained how they went about nurturing his considerable skill and flair.
""For a wide player, you're looking for somebody who can dominate one-v-one and it was clear that he had those traits in abundance, so we tried to encourage him to play with freedom.
""You want those players to have the confidence and feel free to go again, and again, and again, and Jamie was really relentless with it. He wanted to have the ball, he wanted to travel with it and beat players, but he also had a lens on being productive.
""He wanted to score a goal, he wanted to assist his team-mates, he wanted to be that exciting player who got people out of their chairs.""
Gittens relished the freedom afforded to him at Reading and, after joining Manchester City in 2018, there was further encouragement to express himself when he featured in a series of showcase matches run by London-based youth football organisation FFDTV.
The small-sided games replicated cage football, encouraging the kind of one-v-one qualities that have formed such a big part of Gittens' appeal to Chelsea.
""It was easy to see Jamie was a very unique talent,"" said the organisers. ""A lot of the boys come from playing 11-a-side with their clubs, but it's more difficult to shine in our sessions because they are three-v-three, four-v-four matches and the intensity is very high.
""He was just fearless. Those sessions are about as close as you can get to street or cage football and Jamie thrives off that.""
It was around a year after those showcase games that Gittens made his move to Dortmund, a brave step for a young player which underlined some of his other qualities.
""I think that takes a certain level of maturity,"" said Denton. ""I think it takes an understanding of what the project you see for yourself is and how you see your game developing.
""I can't speak any higher of that. In this day and age, especially at youth level, a lot of people look at the flashy boots and all of the gifts that come with football, but how many of them are really planning? How many are really looking in-depth at what is going to help them have a long career?""
Gittens, Denton said, was completely dedicated to learning and improving his game, even at that young age. ""A year after he had joined Dortmund from City, I caught up with him to do some training at a performance camp in Bristol where I'd been doing some work.
""We spent a lot of time in the car travelling down together and he was just looking at clips of players. Older players like Ronaldinho, right the way through to your Jadon Sanchos.
""He's the type of player who wants to take the best things from the best players and put them into his game in order to make the best of himself.
""That coupled with some brilliant behaviours - making sure he looks after himself, being well-mannered - and you understand the performances and maturity you're seeing from him now.""
Sky Sports' Adam Bate:
When Dortmund signed Gittens from Manchester City at the age of 16, the transfer flew under the radar. But it was part of the club's policy to identify promising young talent that might not see the same pathway to the first team that Dortmund could provide.
""We convinced him to sign,"" said managing director Carsten Cramer. ""We had good proof through the other ones who we signed - and not only the English ones. The younger ones know they will receive minutes, that Dortmund is an excellent platform.""
However, Gittens was so young that there was not quite the same level of hype around him as there had been Sancho. But, as Cramer points out, Dortmund ""gives you the time to develop yourself"" and Gittens has blossomed in his five years in the Ruhr.
Visiting Dortmund late last year, there was a chance to speak to Lars Ricken, the club's managing director of sport, as well as Cramer. ""When we signed him, he was not on Sancho's level but we said, we can develop him to the level of a great player,"" said Ricken.
""I can remember when he was playing with the youth team, we said we needed time until April and then he will be ready for the first team. It was under Marco Rose [in 2022] that he made his debut. Since then, great development, especially this season.""
Gittens had to overcome adversity at Dortmund. Arriving in the midst of a pandemic, a serious injury hampered his first season. ""Even in the last season he never played 90 minutes,"" said Ricken in November. ""Now, he is improving his playing time.""
It was later that day that Gittens underlined Ricken's point by scoring a sensational solo goal to open the scoring against Bayern Munich in Der Klassiker. It was one of a dozen goals for Dortmund this past season, making 48 appearances for the club in total.
Speaking to Felix Nmecha that evening, the Dortmund midfielder who had also been a team-mate of Gittens at Manchester City's academy, he discussed his progression.
""He has grown and developed, also just through more game time,"" Nmecha told Sky Sports. ""He is getting more experience and starting to make the right decisions at the right time. If he keeps going like this he has such a huge future ahead of him.""
Sky Sports' Peter Smith:
It wasn't always thrill-a-minute under Enzo Maresca last season at Chelsea. Far from it. But Gittens can add spark to the team's attacking play.
Comparisons with Sancho are inevitable, given their career histories and preferred left-wing role but Gittens' output of dribbles and crosses at around twice the rate of the former Blues loanee illustrates the different approach the new arrival is likely to bring.
In fact, Gittens' mesmeric, high-speed dribbling ability is on another level in terms of frequency to what we've seen from Pedro Neto and Noni Madueke in the Premier League this past season, too. Gittens has been a livewire in the Bundesliga and the plan will be for him to translate that into Maresca's set-up.
On paper, it should be a good fit. As the passing network for Chelsea last season shows, Maresca likes his players to find the wingers high and wide. From there, Gittens will relish the one-on-one battles with full-backs as he looks to create opportunities to cut inside and shoot on his favoured right foot or go on the outside to cross for England youth-team pal Liam Delap or Nicolas Jackson.
Gittens' top speed of 35.96km/h was the 16th-fastest clocked in the German top flight last season and the prospect of him stretching defences or igniting counters is an enticing one for Blues fans who have found their side too predictable of late. If Sancho's lack of pace was a criticism aimed at him, it won't be an issue for Gittens.
Like most Chelsea signings, at 20 years old, Gittens has room to improve and experience to add to his game. He is not the finished article, but his unpredictability on the ball will be a welcome addition at Stamford Bridge.
",SkySports
Walker completes move to Burnley from Man City,Burnley have completed a deal to sign Manchester City defender Kyle Walker in a deal worth up to &#163;5m.,https://www.skysports.com/football/news/11095/13392549/kyle-walker-transfer-news-burnley-sign-england-defender-from-man-city-in-deal-worth-up-to-5m,"Sat, 05 Jul 2025 11:30:00",,['Manchester City'],"Burnley have completed a deal to sign Manchester City defender Kyle Walker in a deal worth up to £5m.
Walker has signed a two-year deal at the newly-promoted Premier League club after he had entered the final year of his Man City contract.
It is understood City could make a £10m saving on the remaining year of Walker's contract.
The experienced Premier League defender becomes Burnley's latest summer signing after the arrivals of Max Weiss, Quilindschy Hartman, Axel Tuanzebe and Loum Tchouana, while loan deals for Bashir Humphreys, Marcus Edwards, Zian Flemming and Jaidon Anthony have also been made permanent.
Burnley boss Scott Parker knows Walker from their playing days at Tottenham from 2011 to 2013, while they were also England team-mates.
Walker spent the second half of last season on loan at AC Milan, making 16 appearances across all competitions, but the Serie A side did not take up the option to make the deal permanent.
He now departs City following a trophy-laden eight-year stay at the Etihad Stadium, which saw him win 17 trophies with the club, including six Premier League titles and the Champions League as part of their treble success in the 2022/23 campaign.
Walker had started as City's club captain last season, but was not part of Pep Guardiola's squad for this summer's Club World Cup.
Walker said of his move to Burnley: ""I'm delighted to be here. When I spoke to Scott and heard about his plans for next season, it was an opportunity I jumped at.
""He's done an amazing job here, guiding the club back to the Premier League with a 100-point haul, and now we're looking forward, together, at being back in the greatest league in the world.
""Burnley had a tremendous campaign last season, built on an incredible defensive record, and I can't wait to come in and add my experience and quality to what looks an exciting squad.""
Walker began his career with Sheffield United before switching to Tottenham and eventually joined City in a £50m move in 2017, where he has gone on to make 410 English top-flight appearances.
Walker has also been a key cog for England having been capped 96 times.
In
Loum Tchaouna - Lazio, £12m
Axel Tuanzebe - Ipswich, free transfer
Quilindschy Hartman - Feyenoord, undisclosed
Bashir Humphrey - Chelsea, undisclosed
Jaidon Anthony - Bournemouth, undisclosed
Marcus Edwards - Sporting CP, undisclosed
Zian Flemming - Millwall, undisclosed
Max Weiss - Karlsruher, £4.2m
Kyle Walker - Man City, £5m
Out
Nathan Redmond - released
Jonjo Shelvey - released
CJ Egan-Riley - Marseille, free
",SkySports
'Jota was with me' - Trent's tribute after Real Madrid win,"Real Madrid's Trent Alexander-Arnold says his former Liverpool team-mate Diogo Jota ""was there with me"" after helping the Spanish club reach the semi-finals of the Club World Cup.",https://www.bbc.com/sport/football/articles/cdxlrvl616eo,"Sat, 05 Jul 2025 23:39:29",Adwaidh Rajan,['Liverpool'],"Trent Alexander-Arnold says former Liverpool team-mate Diogo Jota ""was there with me"" after helping Real Madrid reach the Club World Cup semi-finals.
Alexander-Arnold and Jota spent five years together at Liverpool before the England full-back left for Madrid in June.
Jota, aged 28, died in a car crash on Thursday along with his 25-year-old brother Andre Silva. Their joint funeral was held on Saturday in Portugal.
Alexander-Arnold has been featuring for Real Madrid at the Club World Cup in the United States and assisted Fran Garcia's goal in their 3-2 win against Borussia Dortmund in the quarter-final in New Jersey.
He said the news of Jota's death had been ""extremely difficult"" to take in.
""I had to try to perform for the team and help them win the game, no matter how difficult it was,"" Alexander-Arnold told DAZN after the game.
""As hard as it was to do it, I had to push myself to focus on what my job and role was. I tried to do it as best as I could, but it was difficult and I am not going to lie about that.
""[Jota] was one of my close friends - and I am sure that's what he would have wanted me to do. I'm sure we would have had a laugh and joke about the assist as well. He was there with me, I am sure.""
Alexander-Arnold said the Portuguese forward was ""someone who lit up the room when he was in it"".
""I shared the dressing room with him for five years - amazing memories on and off the pitch,"" he added.
""It goes without saying he will never be forgotten by anyone. He will live long in all our memories for the amazing man and the player he was.""
Alexander-Arnold said it had been ""very emotional and heartwarming to see the footballing world come together to show their love and support for [Jota], his brother and their family"".
""I've been around him, his brother, his family, his amazing wife, his amazing parents and his amazing children. It's truly, truly heartbreaking to wake up to news like that,"" added the England international.
""It's something you never expect.""
Real Madrid's Kylian Mbappe was among the players who paid tribute to Jota on Saturday, with the France forward indicating number 20 after scoring an acrobatic late goal, in recognition of Jota's Liverpool shirt number.
Frenchman Ousmane Dembele also paid a tribute to the Portuguese by copying his Fifa gaming celebration after sealing a 2-0 win for Paris St-Germain against Bayern Munich, which set up a last-four meeting with Real Madrid.
",BBC
