Title,Summary,Link,Date,Author,Teams,Article,Outlet
'A win-win' - reaction in Barcelona to Rashford's arrival,Spanish football expert Andy West looks at how Marcus Rashford's loan move from Manchester United to Barcelona has been received in Spain.,https://www.bbc.com/sport/football/articles/cj9vk917mrjo,"Thu, 24 Jul 2025 08:07:52",Andy West,['Manchester United'],"Marcus Rashford's move from Manchester United to Barcelona has provoked huge interest, with fans and media across the UK fascinated to see whether the forward can reignite a stalled career that once looked so promising.
And there's a similar level of intrigue on the shores of the Mediterranean, with Barca fans anxious to see what kind of player is arriving in the Catalan capital.
To gauge the mood, BBC Sport has spoken to three Barcelona-based journalists and asked for their views on the England international's arrival.
Here are the thoughts of Jamie Easton Gombau (La Liga TV presenter), Jordi Pons (Spanish TV commentator) and Toni Padilla (journalist for local newspaper Ara).
How well will Rashford fit in?
Barca's forward line is already well stocked, with veteran marksman Robert Lewandowski, teen sensation Lamine Yamal and rejuvenated Raphinha all coming off brilliant seasons, while further depth comes from Spain internationals Dani Olmo and Ferran Torres. So where does Rashford fit in?
Jamie Easton Gombau: We know from Deco, Barca's sporting director, that they wanted another winger - partly to rest Lamine Yamal and Raphinha, and also to play Raphinha in a different role as a number 10. But Rashford is a joker in the pack because he can also fit as a false nine or striker, which will be even more important this season to give some rest to Lewandowski, considering his age.
Luis Diaz and Nico Williams were the first choices, so Rashford was option C... at least! He's also the cheapest option which is important because Barca's financial situation is a long way from being solved.
Toni Padilla: Barca wanted someone who can play mostly on the left side, but also as a striker. Barca's first idea was to have a younger player, like Williams, but Rashford is still young enough. From a tactical point of view, considering Rashford's evolution in the last few years, it fits perfectly. But we should remember he's only here because Nico said no.
Jordi Pons: Manager Hansi Flick is looking for more alternatives, so he can have competition for places in every position. Above all, he wants to be able to give rest to Raphinha, who started nearly every game across every competition last season. Flick wants to raise the level of the squad.
Is he good enough to improve this Barca team?
Rashford's career has been a mixed bag, with great early promise fading dramatically in more recent times. Do those in Barcelona regard him as good enough to make a meaningful impression for his new team?
Jamie Easton Gombau: Well, it depends on which Marcus Rashford we see. A few years ago, he was quite something - one of the best players in the Premier League. But if he gives the same level of performance that we saw last season for Aston Villa, that won't be good enough for Barcelona.
We need to understand one thing: Barca have effectively swapped Ansu Fati for Rashford, and Fati isn't the player we saw a few years ago. So I think it's a win-win for Barca and for Rashford... and maybe also for Manchester United, because if he scores and assists in double figures, his market value will go up.
Toni Padilla: It will be hard for him to start a lot of games, because Raphinha, Lamine Yamal and Lewandowski are already there. Torres and Olmo won't be too happy that Rashford is in town because now they have more competition, but Flick has asked to have a deep squad so Rashford will have opportunities. It's on him: he needs to prove that he deserves to play in the big games.
Jordi Pons: I remember when Rashford was young and promised so much. He beat defenders, ran up and down the wing, and above all I liked his shot from mid-range.
Sometimes players can lose their way, but I see someone who is willing to drop his salary and try to re-establish himself in a team like Barca. A few years ago, everyone was talking about how great he was, and what a huge career he was going to have. Now he's got a big opportunity ahead of him to return to that world-class level.
What do you think about Barca signing an English player?
Rashford becomes the first Englishman to represent Barcelona since Gary Lineker left in 1989, and he will look to emulate the success of his predecessor who scored 52 goals in 138 appearances. But does his nationality matter to Barca followers?
Jamie Easton Gombau: It was about time! It's shocking to me that for a country producing so much talent, so few English players have been coming to La Liga. I think there's a belief around Spain that British players struggle to adapt to the country and the culture, but Jude Bellingham changed that in his astonishing first season for Real Madrid.
Spain and England might be the strongest two footballing countries in the world, so there should be a greater exchange of players and coaches. Before Bellingham it was just one-way from Spain to the UK, but maybe now there will be a change in that tendency.
Toni Padilla: I think most Barca fans will be happy. It's global football now, so you get used to having new players from all over the world arriving every season. It will be a bit strange to see a British player with Barca so that will create hype, but I think people are happy about it.
Jordi Pons: I can still remember being at Camp Nou and singing 'Go Gary Gary, Gary Gary Gary Gary Lin-e-ker!' I was a student at the time, and Lineker was greatly loved by Barca fans. I think most Barca fans appreciate English football because of the atmosphere, the songs of the fans, and being English could help Rashford.
A lot of Barca fans will say 'come on, it's been a long time since we had an English player, let's see what this guy is like'.
Are you worried about off-field distractions?
Over the past few years, Rashford has made more headlines off the pitch than for his exploits on the field. Will his strong personality and ability to capture media headlines be tolerated in the Catalan capital?
Jamie Easton Gombau: People say he arrives with baggage, but what's that baggage? That he became a social activist? Is that a bad thing? I don't think it will be a problem. He just wants to play again and feel important, and he believes Barcelona is the right club for that.
I understand that maybe Rashford has been distracted from football, but remember what happened with Antony: he came from the same club, and it was seen as a very big risk, but he was one of the best players in La Liga for Real Betis in the second half of last season. I don't think there's a major concern.
Toni Padilla: Let's see. Right now in Barcelona we're talking more about the private life of Lamine Yamal after his famous 18th birthday party! That hadn't happened before for such a young player, so it has taken us to a new dimension.
Jordi Pons: I look at what players do on the pitch. After that, if they want to do whatever they feel they have to do, I don't think it matters. I don't think it will be a problem.
",BBC
How Ekitike shows Slot shift towards Klopp tactics,"Hugo Ekitike is the latest addition in Liverpool's summer rebuild, so is Arne Slot shifting back towards Jurgen Klopp tactics?",https://www.bbc.com/sport/football/articles/c4g86lj0yr0o,"Wed, 23 Jul 2025 18:43:28",Alex Keble,['Liverpool'],"Arne Slot's summer reshuffle was already the most significant by a reigning Premier League champion in the competition's history.
Florian Wirtz's arrival points to a reconstruction of the Liverpool midfield. Deals for Jeremie Frimpong and Milos Kerkez mark the end of the celebrated full-back pairing of Trent Alexander-Arnold and Andy Robertson. But the arrival of Hugo Ekitike is the final flourish that makes it practically a full-scale revolution.
This is not Jurgen Klopp's team any more.
And yet, as the Bundesliga stars file in, it curiously looks as though Slot is taking Liverpool on a journey back towards his predecessor's ideas.
Before we consider how and why Ekitike will have an impact on Slot's tactics, it's worth looking at the headline numbers to show why Liverpool are prepared to spend £69m, with £10m in add-ons, on the 23-year-old.
Ekitike scored 15 goals and provided eight assists in 31 Bundesliga games last season, totalling the fifth-most goal involvements in the division. He was also involved in the fifth-most 'attacking sequences' in the Bundesliga.
That can be interpreted as showing the quality of Ekitike's all-round game, whether holding up the ball, running into channels, or bursting in behind.
In that respect – in most respects, in fact – he is very similar to Alexander Isak, albeit with considerably more flair to his game and a penchant for taking players on in the dribble.
He is particularly adept at setting up team-mates, too, creating more chances from open play (44) in 2024-25 than any other Bundesliga forward.
The only slight concern is that Ekitike is a little raw in front of goal. He took 117 shots in the Bundesliga last season, more than anyone else, but converted a disappointing 12.8%, leading to an xG under-performance of 6.6 goals – a bigger gap than any other player in Europe's 'Big Five' leagues.
But that just means Ekitike needs a little tuning up.
It's worth nothing that when Isak was the same age, playing for Real Sociedad in 2021-22, he scored just six goals in 32 league games, under-performed his xG by 3.8, and converted just 8.2% of his shots.
In an era when utilising attacking transitions are of increasing importance, Ekitike's smart assists, his give-and-go moves, and his line-breaking carries into the final third are all hallmarks of the elite modern number nine.
As a case in point, he topped the 2024-25 Bundesliga charts for shot-ending carries (44) and ranked fifth for attempted dribbles (126), while also scoring more goals from fast breaks (4) than anyone else in the division.
That's why Ekitike's arrival represents such an interesting shift for Slot.
In his debut year, Slot tamed the wilder aspects of Klopp's football to create a slower, calmer Liverpool, living up to widely held expectations of a manager who once described Pep Guardiola teams as the ""ultimate joy in football"".
But Ekitike represents a shift back the other way, perhaps reflecting a similar realisation to the one that recently struck Guardiola.
""Modern football is not positional,"" Guardiola told TNT Sports a few month ago, not long after signing a direct and transition-centric forward in Omar Marmoush, Ekitike's striker partner at the time. ""You have to ride the rhythm.""
Slot, too, appears to be making concessions to the way modern Premier League football is changing.
It's telling that Ekitike is arriving in the same summer as another Bundesliga star, Germany international Wirtz, forming a new-look attack built on piercing forward movement and an inclination to weave through the thirds as quickly as possible.
The two should combine superbly. Both are sharp one-touch passers between the lines, both love to crash the box, and both were sculpted in fast-transitioning Bundesliga teams.
That is a clear step change for Slot and, to an extent, a surprising turn back towards the 'heavy metal' days of Klopp.
Is Slot making major revisions to Liverpool's formation?
Along with Wirtz and the two new full-backs, Ekitike points to a different Liverpool set-up.
In 2024-25, some 47 of Liverpool's 86 goals (55%) were scored or assisted by Mohamed Salah, who ran the right wing almost on his own as Alexander-Arnold drifted inside.
By contrast, Frimpong is a very attacking, very wide right-back. That should take some of the pressure off Salah, but it might also see the Egyptian move infield to support the new creator-in-chief Wirtz, Liverpool's first proper number 10 in years.
Adding weight to that theory is Ekitike's history of playing in a strike partnership. He was arguably at his best in a 3-5-2 alongside Marmoush at Frankfurt, with whom he regularly swapped positions in a fluid forward line.
He was also more often than not playing in a two at Reims, where he made his name. Could Slot be planning something similar with Ekitike and Salah?
In a 4-2-3-1, Frimpong's aggressive wing play on the right could free Salah to drift inside and operate as something like a split striker alongside Ekitike, with Wirtz and a number eight sitting just behind.
That would certainly be direct, dynamic and straight-lined, and would certainly be ready for a turn towards fast-transitioning football next season.
But it's just one of the options available to Slot now he has such a versatile number nine leading the charge.
Ekitike can drop like Roberto Firmino or get in behind, can play alone or in a two, and can play transitional football or in a possession-centric side.
He is the real deal: the centre-forward of the calibre and tactical dexterity pretty much every 'Big Six' club has been looking for.
Whether Slot continues with Guardiola-like patience or swings back towards Klopp-like verticality, Liverpool's chances of retaining the Premier League title just improved.
",BBC
Ex-Man Utd striker Hernandez fined for sexist comments,"Mexico striker Javier Hernandez is fined for making comments that ""promoted sexual stereotypes"".",https://www.bbc.com/sport/football/articles/cd97194vveqo,"Thu, 24 Jul 2025 06:55:40",Sean Kearns,['Manchester United'],"Former Manchester United striker Javier Hernandez has been fined and warned about his future conduct after making sexist remarks on social media.
The Mexican Football Federation (FMF) said the 37-year-old, now with Liga MX side Chivas, made a series of statements ""promoting sexist stereotypes that are considered media violence and go against gender equality in sport"" on TikTok.
The striker said on social media that women are ""failing"" and ""eradicating masculinity"".
""Don't be afraid to be women, to allow yourselves to be led by a man,"" said the former Mexico captain.
The comments, which were made last weekend, were met with a backlash in Mexico.
President Claudia Sheinbaum, the country's first female president, said: ""Chicharito is a very good soccer [player] but when it comes to his opinion on women... he still has a lot to learn.""
In a joint statement, the FMF and Mexico's top men's and women's leagues said the Gender and Diversity Commission has started an investigation ""that seeks to prevent and punish this behaviour"" and it will ""take more severe measures in the event of a repeat offence"".
Chivas said the comments were ""contrary to the principles and values"" of the club and that they had taken ""appropriate action"" against Hernandez, though they did not specify which action.
Hernandez, Mexico's all-time leading scorer, joined Manchester United from Chivas in 2010.
He spent four years at Old Trafford, winning the Premier League twice.
After spells with Real Madrid and Bayer Leverkusen, he returned to the Premier League with West Ham for a three-season stint between 2017 and 2020.
Hernandez then joined Sevilla from the Hammers, before spending four seasons with MLS side Los Angeles Galaxy.
He returned to former club Chivas in 2023, signing a two-year deal.
",BBC
Chelsea in talks for Dutch duo Simons and Hato,Chelsea are in talks over moves for Ajax defender Jorrel Hato and RB Leipzig forward Xavi Simons.,https://www.bbc.com/sport/football/articles/clyzmv088rpo,"Wed, 23 Jul 2025 18:39:28",,['Chelsea'],"Chelsea have opened talks with Ajax over a move for centre-back Jorrel Hato while pushing ahead with interest in RB Leipzig forward Xavi Simons.
Hato, 19, has emerged as one of Europe's most promising young defenders after an impressive campaign in the Eredivisie, making 31 appearances.
BBC Sport understands that Chelsea are in direct communication with both Ajax and Hato's camp to explore the possibility of a summer transfer. Talks are understood to be in the early stages, with no agreement yet in place.
Meanwhile, Chelsea are discussing personal terms with Simons.
The Netherlands international, 22, is understood to be open to a move to Stamford Bridge, as the Blues look to add more creativity and attacking flair.
RB Leipzig are aware of Chelsea's approach, though no agreement has yet been reached.
Simons, who joined Leipzig permanently from Paris St-Germain in January following two loan stints lasting a season and a half in total, is also attracting interest from Bayern Munich and Arsenal.
Sources indicate Bayern have an interest in Simons but are prioritising a move for Liverpool winger Luis Diaz.
Arsenal, meanwhile, have been made aware of Simons' situation as they consider their summer options.
'Any manager would like him in his team'
Before Euro 2024, former Ajax and PSV coach Aad de Mos said there was ""too much hype"" around Simons.
""At times I think he is too eager,"" explains former Netherlands winger Zenden. ""Not eager as in selfish, but eager to do well.
""He is a threat. He has got the right attitude, he's got the skills, he's got the engine, he is willing to work hard, he is never complaining. Any manager would like him in his team.""
Simons showcased his obvious talent against England in the semi-finals in Germany, with his superb strike putting the Netherlands 1-0 up before the Three Lions recovered to win 2-1.
""He is a very talented player who has so much to give,"" adds Netherlands captain Virgil van Dijk.
""He can still be so much better than he is already, but he has a good mentality, so I am not worried that won't happen. I am confident in him.""
Simons, who only made his transfer from PSG to Leipzig permanent in January, enjoyed another productive season for RB - scoring 11 goals and making eight assists across 33 games in all competitions.
But it was not enough to guarantee his club Champions League football, with RB finishing seventh in the Bundesliga.
Who have Chelsea signed this summer?
Chelsea have been active in the summer transfer window as they continue to build a youthful and dynamic squad under their long-term project. The club have already secured several high-potential signings:
Jamie Gittens – £48m from Borussia Dortmund. The England youth international arrives from the Bundesliga with a growing reputation as a direct, pacey winger capable of unlocking defences.
Joao Pedro – £60m from Brighton. Chelsea moved swiftly to secure the Brazilian forward, who impressed in the Premier League with his creativity, link-up play, and finishing ability.
Liam Delap – £30m from Ipswich Town. A powerful striker with Premier League experience, Delap adds a different profile to Chelsea's attacking options.
Mamadou Sarr – £12m from Lyon. The 19-year-old centre-back joins as one for the future, bringing strength and composure in defence after progressing through Lyon's academy.
Dario Essugo – £18m from Sporting CP. A highly rated Portuguese midfielder, Essugo is known for his tenacity and maturity, having debuted in Liga Portugal at just 16 years old.
Estevao Willian - the Brazil winger joined the Blues from Palmeiras this summer in a £29m deal that was agreed in May 2024.
Kendry Paez - a £17m deal to sign Ecuadorian teenager Paez was agreed in 2023 but he has linked up with Chelsea this summer after turning 18 in May.
",BBC
'I feel like I'm at home' - Rashford joins Barcelona,Manchester United striker Marcus Rashford joins Barcelona on an initial 12-month loan deal.,https://www.bbc.com/sport/football/articles/c873zvn37jvo,"Wed, 23 Jul 2025 16:50:11",Sean Kearns,['Manchester United'],"Marcus Rashford says he feels like he is ""at home"" at Barcelona after completing a season-long loan move to the La Liga club.
The 27-year-old has joined on an initial 12-month loan from Manchester United, with the Catalan giants having the option of signing the England international on a permanent basis for £30.3m (35m euros) in 2026.
He is the first men's England international to sign for Barcelona since Gary Lineker in 1986.
Rashford hasn't played for Manchester United, his boyhood club, since last December after being dropped by manager Ruben Amorin, and spent the second half of the 2024-25 season on loan at Aston Villa.
In July, it was confirmed that he was one of five players to tell the club that he wanted to leave.
""I'm very excited,"" Rashford told Barcelona's YouTube channel. ""It's a club where people's dreams come true, they win big prizes.
""What the club stands for means a lot for me. I feel like I'm at home and a big factor in my choice to come here is because it is a family place and a good place for good players to showcase their skills.
""Another factor is because the conversations I had with [Hansi Flick] were positive. What he did last season was terrific. To lead such a young team to a very successful season and come back to pre-season and still want to do more, it shows me everything I thought I knew about the club and it's everything I wished.
""I'm eager to learn the Barcelona way.""
Barcelona will cover the entirety of Rashford's wages during his time at the club after the forward agreed to take a pay cut.
Removing Rashford from the wage bill is expected to save United between £14-£15m over the next 12 months.
The England international trained with his new team-mates for the first time on Tuesday and is expected to be included in the squad that travels to Japan for a pre-season tour of Asia on Thursday.
In moving, the forward leaves the Premier League for the first time in his career.
Rashford has scored 138 goals in 426 matches for Manchester United since making his debut for the club in 2016 and won five major trophies.
He is 15th on the club's all-time scorers list, having emerged from United's academy.
How did we get to this point?
Rashford's departure from Old Trafford has been a relatively long time coming.
Manager Ruben Amorim dropped him for the Manchester derby on 15 December last year - and he has not played for United since.
Amorim later criticised Rashford for a perceived lack of effort, suggesting that he would rather give a place on the bench to his 63-year-old goalkeeping coach than someone who ""doesn't give the maximum every day"".
He joined Aston Villa on loan in January, making 17 appearances and earning an England recall, but returned to Old Trafford last month with his long-term future still uncertain.
However, that uncertainty has been more about where he would go rather than whether he would stay, with Rashford one of five players who told the club they wanted to leave - and who were subsequently told to train separately from the rest of the squad.
But Rashford's problems at Old Trafford pre-dated Amorim.
After signing a new five-year deal at the club in 2023 - following a stellar 30-goal season the campaign before - Rashford's form dropped dramatically.
He managed just eight goals in 43 appearances in 2023/24 and was disciplined three times in 13 months by manager Erik ten Hag.
Rashford was dropped for an away trip to Wolves after turning up late for a team meeting, while he then apologised to the Dutchman for attending a pre-arranged birthday party hours after a 3-0 home defeat by Manchester City.
The forward was then dropped for an FA Cup tie against Newport after reporting ill for training after being pictured partying in nightclubs in Belfast.
Despite his prolonged and public fall from grace at Manchester United, Rashford expressed his gratitude and had ""nothing bad to say"" about the club.
While he alluded to them being in a ""period of change"", he focused more on his ""new chapter"" at Barcelona and the opportunity the move presents to win trophies.
Rashford won two FA Cups, two League Cups, and the Europa League with Manchester United but is yet to win a league title or the Champions League.
""[Manchester United] is in a period of change and they have been for a while. I don't have anything bad to say as it has been an important part not just of my career but my life, so I was grateful for the opportunity,"" Rashford said, speaking to the media following his unveiling.
""I wish them all the best and hope they are successful in the future.
""I want to win the biggest trophies and I feel like Barcelona is a huge club in the football world, so it is the perfect place.
""They have a young, ambitious team and I want to add my qualities, my personality, improve the team, and help them win.
""[The Champions League] is what the club was fighting for last year and they were very close. I hope they can take the next step this year. This is a historic club and they are known for winning the biggest prizes. I am here to help the club do that. It is a dream of mine.""
'United cannot worry about optics' - analysis
There is no doubt a fully-motivated, focused and determined Marcus Rashford would walk into Ruben Amorim's team.
But, in reality, that Rashford has only been seen for one full season since 2021 and the campaign that led to Ole Gunnar Solskjaer getting sacked.
There were signs of the old Rashford during his half season loan at Villa - but there were also games where he didn't perform so well.
Offloading an unwanted player to Barcelona is bizarre for a club in Manchester United's position. But that is where they are right now. What they have to do is maximise the opportunity.
At Old Trafford, they cannot worry about optics. They have to deliver a squad Amorim can drive up the table.
",BBC
