Title,Summary,Link,Date,Author,Teams,Article,Outlet
Mateta gives Crystal Palace advantage over Fredrikstad in Conference playoff,Crystal Palace 1-0 Fredrikstad,https://www.theguardian.com/football/2025/aug/21/crystal-palace-fredrikstad-conference-league-playoff-match-report,"Thu, 21 Aug 2025 21:08:52",Ed Aarons,['Arsenal'],"It might not be the Europa League. But even the absence of Eberechi Eze as he closes in on his £67.5m move to Arsenal could not spoil Crystal Palace’s first taste of European football as they sealed a victory in the first leg of their Conference League playoff.
After a summer of uncertainty over which competition they would play in, the last thing that Oliver Glasner would have wanted was to receive a call from Eze on the morning of the game informing the Palace manager that he was not feeling well enough to play. Yet having struggled to break down well-drilled Norwegian side Fredrikstad in the first half in the absence of their talismanic England forward, Jean-Philippe Mateta’s goal calmed Palace’s nerves, even if they could not find a second that could have proved crucial as Palace attempt to secure their place in the group stages of Uefa’s third-tier competition. Glasner, who led Eintracht Frankfurt to victory in the Europa League in 2022, will know that this tie is far from over given that they must play the second leg next week on an artificial surface. Nothing is ever certain when it comes to Palace.
Glasner could not hide his disappointment beforehand that Eze would not feature, admitting that it had disrupted his side’s preparations. “It is not what you want to do, to change the starting XI on matchday, especially in this situation – the first time in European football for Crystal Palace,” he said before kick-off.
Despite the lingering feeling of disappointment of not being able to take up their place in the Europa League, there was still a sense of anticipation on the streets of south London beforehand. The Conference League anthem was widely booed as the Palace ultras behind the goal immediately struck up their chant that takes aim at Uefa, former part-owner John Textor and the Nottingham Forest owner, Evangelos Marinakis – all of whom have been blamed for their controversial demotion to this competition for breaking multi-club ownership regulations.
Strictly speaking, Palace have played in Europe before but it was in the long forgotten Intertoto Cup in 1998 when they qualified because they were the only English team to apply for entry. That adventure lasted only two matches in 4-0 aggregate defeat against Turkish side Samsunspor and having been eliminated in a playoff while in charge of Wolfsburg, Glasner was clearly taking no chances here. Justin Devenny – who scored the winning penalty in the Community Shield victory – struggled after being handed the unenviable task of replacing Eze, although the Croatia defender Borna Sosa impressed on his full debut.
Fredrikstad, who capped their first season back in Norway’s top flight since 2012 by winning their domestic cup competition, lined up with five at the back and came ready to defend. They could even have snatched an equaliser when substitute Henrik Skogvold dragged his shot wide in injury-time.
Without Eze to inspire them, it took Palace time to find their feet against a side that are more than half way through their league campaign and will have the weekend off before the second leg. Mateta finally forced goalkeeper Martin Børsheim into a save after 20 minutes but otherwise the vociferous group of travelling supporters had reason to feel encouraged. A speculative shot that flew way off target from Marc Guéhi – another Palace player whose future is uncertain – summed up the hosts’ frustration. The swaggering Adam Wharton looked like their most likely creative source from his deeper midfield role, although it was from a corner that Mateta was able to swivel and strike the post. That seemed to wake Palace up and Ismaïla Sarr’s header moments later was just about scrambled away to safety.
Glasner did not seem happy as he strode down the tunnel. His side emerged with renewed purpose for the second half and Devenny headed over a golden opportunity from Guéhi’s cross. But, to the home crowd’s relief, they finally found the breakthrough when Mateta cleverly redirected a wayward volley from Will Hughes. Sosa could have extended their lead but he fired just over after good work from Sarr, with Glasner turning to the out-of-favour Odsonne Édouard to replace Devenny as they went on the attack. Daniel Muñoz hit the post from Jefferson Lerma’s cross and Guéhi headed wide from a corner but Fredrikstad’s defence was able to hold firm.
The lack of alternatives from the bench – Romain Esse, the 20-year-old who cost around £12m from Millwall in January was surprisingly not called upon here – will only strengthen Glasner’s case for reinforcements before the transfer window closes, as he made his feelings clear after the game. But after the disruption of the last few days, Palace will still be strong favourites to finish the job next week.
",TheGuardian
More woe for Spurs as Dejan Kulusevski is likely to be out until turn of the year,Midfielder sidelined after undergoing knee surgery,https://www.theguardian.com/football/2025/aug/21/more-woe-for-spurs-as-dejan-kulusevski-is-likely-to-be-out-until-turn-of-the-year,"Thu, 21 Aug 2025 17:30:14",David Hytner,"['Arsenal', 'Tottenham Hotspur']","Dejan Kulusevski is expected to be out until around the turn of the year, the Guardian understands. The Tottenham attacking midfielder underwent knee surgery in mid-May and, although the injury was serious, the extent of the lay-off he faces has until now been unclear.
Losing the Sweden international, who scored 10 goals and provided 11 assists in 50 appearances for Spurs last season, is another headache for Thomas Frank, who is digesting the club being gazumped by Arsenal for the £67.5m signature of Crystal Palace’s Eberechi Eze. The manager’s other key attacking midfielder, James Maddison, is a long-term casualty after rupturing his anterior cruciate ligament against Newcastle in pre-season.
The pressure is on Spurs to respond to missing out on Eze with a statement signing after the failure earlier in the summer to sign Nottingham Forest’s Morgan Gibbs-White. They thought they had the midfielder after moving on a £60m buyout clause in his contract only for the Forest owner, Evangelos Marinakis, to refuse to sanction the deal.
Spurs have shown an interest in the Manchester City winger Savinho, although City maintain they want to keep the Brazilian. Spurs play at City on Saturday lunchtime. Whether their opponents soften their stance after the game remains to be seen.
Spurs have made inquiries about Monaco’s Maghnes Akliouche. The France Under-21 international, who has burnished his reputation after two impressive seasons at Monaco, can play on the wing or through the middle. Frank is also open to signing Yoane Wissa from his former club Brentford and retains an interest in the Southampton winger Tyler Dibling, while Como’s Nico Paz is another option.
Spurs have been relatively quiet so far in the transfer window. In terms of new faces, they have added Mohammed Kudus, João Paulinha, Luka Vuskovic and Kota Takai.
",TheGuardian
Liverpool’s Frimpong out until after international break with hamstring injury,Full-back sustained injury during win over Bournemouth,https://www.theguardian.com/football/2025/aug/21/jeremie-frimpong-out-until-after-international-break-hamstring-injury,"Thu, 21 Aug 2025 16:35:44",Andy Hunter,['Liverpool'],"Liverpool will be without new signing Jeremie Frimpong until after the next international break as a result of a hamstring injury. Conor Bradley is in contention to replace Frimpong having recovered from a hamstring injury of his own.
Frimpong suffered the setback during the Premier League opener against Bournemouth, when he was replaced on the hour mark, and the head coach, Arne Slot, revealed the injury could have been worse but for the intervention of Liverpool’s medical team.
The £29.5m signing from Bayer Leverkusen is likely to be out for four weeks but, with the first international break of the season from 1-9 September, the only games he should miss for Liverpool are Monday’s visit to Newcastle and the home match against Arsenal next Sunday.
Slot said: “Conor trained for a few minutes with us today for the first time. The medical team were completely right about Jeremie and to tell me that I had to take him off because he is out until the end of the international break.
“I think I got criticised a bit for taking him off. It had nothing to do with how he played but we felt he had an issue with his hamstring and by we, I mean the medical staff. They were completely right. It was a good call to take him off, otherwise he maybe would have been out for longer. We expect to have him back after the international break.”
Bradley is not guaranteed to start at St James’ Park given he has been out for several weeks while Joe Gomez, another potential replacement for Frimpong, has just recovered from an achilles injury.
“At the moment we only have two injuries but unfortunately it is two in the same position,” Slot added. “The good thing is we have other players that can play there. Wataru [Endo] played there for a few minutes, Dominik Szoboszlai has already played there. There are other options we can explore. Joe Gomez is definitely one of them but for him to already play 20 minutes [against Bournemouth] that is already quite a lot.
“I wouldn’t say [Gomez] has had a setback but he wasn’t able to train three days in a row completely with the team, which is completely normal when you have been out for so long and all of a sudden the manager needs you for 20 minutes. He is training with the team, so let’s see where he is on Monday and if he can be involved with the team or even start. But there are other options.”
",TheGuardian
Battle with Arsenal for Eberechi Eze was a fight Spurs feared they wouldn’t win | David Hytner,Despite working on the transfer all summer Tottenham felt their north London rivals were always waiting to pounce for the Crystal Palace man,https://www.theguardian.com/football/2025/aug/21/the-battle-with-arsenal-for-eberechi-eze-was-a-fight-spurs-knew-they-wouldnt-win,"Thu, 21 Aug 2025 19:03:11",David Hytner,"['Arsenal', 'Tottenham Hotspur']","It was towards the end of June when it became clear that Tottenham were considering a move for Eberechi Eze, one to install him as the centrepiece of their new project under Thomas Frank. Or, at least, when it became public knowledge. And it was the prompt for two things to happen.
Firstly, it would be reported a few days later that Arsenal were also on the case. The club’s new sporting director, Andrea Berta, had put the feelers out for the Crystal Palace forward. Call it a declaration of interest, albeit Berta was having a lot of conversations about a lot of potential targets at the time. His idea was to have plenty of options on the boil before deciding which to prioritise.
Then, there was a subtle change to the mood music at Spurs, a kind of step back into a holding pattern. Agent talk, was the word inside the club. Eze was more likely to stay at Palace. It would be wrong to get too far ahead of anything on this one. But it was impossible to ignore the alternative reading: Spurs did not want to be drawn into a battle with their rivals over one of the most exciting talents on the market.
Spurs were fearful of that, and for good reason. They had to know that, given the choice, Eze would go for Arsenal over them. There were the emotional reasons. He had supported Arsenal as a kid and played in their academy until his release as a 13-year-old; the line about how he cried for a week afterwards is a well-known part of his story. Yet it would not only be about dreams and unfinished business. Eze would surely look at the Premier League table from last season. At which club would he stand the better chance of winning the title?
At this point it is worth introducing Mikel Arteta, who let it be known just how highly he rated Eze and how perfectly he would fit into his team. Eze’s head was turned. So Spurs entered territory in which the reward was tantalising, almost irresistible, but the risk was extreme. It was as if they were shadow boxing with Arsenal, their every move over Eze likely to come right back at them. Arsenal were a devil on their shoulder; watching, waiting.
Spurs would pivot to Morgan Gibbs-White in July only to run into the immovable object that is Evangelos Marinakis. No deal, the Nottingham Forest owner said. There would be a new one for Gibbs-White at Forest and, sadly for Spurs, egg on their face after they believed they would be able to exploit a £60m release clause in his old contract.
The Gibbs-White episode has been a climate-shaper in Spurs’s summer and then there was the moment when James Maddison ruptured his anterior cruciate ligament in the pre-season game against Newcastle on 3 August; a shattering blow for him and Spurs.
Dejan Kulusevski, the club’s other key central attacking midfielder, had knee surgery in May and is out until around the turn of the year, so the need to act in the market was obvious and urgent. Why not move straight away for Eze; give him and Palace a decision to make by meeting the £68m release clause in his deal, which was in place until 15 August?
Spurs’s hesitation was to do with the fact they considered the number to be too high for a 27-year-old with 12 England caps and no experience of European football at club level. It is not the only detail in terms of optics that has hurt them as Arsenal prepare to pay pretty much that amount to take Eze to the Emirates, with Spurs themselves having ended up ready to do likewise.
There has been the idea that Spurs had a clear run at Eze because Arsenal, after spending around £200m on six other signings, would need to raise money via sales before they could make a bid. Well, they have sold nobody and still pushed the button. Unless Arsenal have a sale or two lined up, could it be that they have more financial headroom than they have let on?
It is easy to pick over the curiosities. Eze is represented by CAA Base, the influential firm of agents who have close links to Spurs. Should that have given Spurs an edge? It must be said that Base will always put the wishes of their players first. And why did it seemingly take Kai Havertz feeling a knee injury after Sunday’s win at Manchester United for Arsenal to move on Eze? There are similarities in the profile of both players but there is a fundamental difference: Havertz can play as a No 9, Eze cannot. With Gabriel Jesus a long-term injury casualty, the loss of Havertz ought to have led Arsenal to look for a No 9 to provide support for the new signing, Viktor Gyökeres. Not take Eze.
The reality is that Spurs were never going to win this fight. We will never know what would have happened if they had offered to pay Eze’s release clause. But it feels fair to assume that it would have led Arsenal into following suit. Spurs eventually reached an agreement with Palace on Wednesday and they believed they had one with Eze, too.
If Arsenal were not an option, Eze would have joined Spurs. At this stage of his career, after giving everything for Palace across five seasons, he is ready for a change; the chance to play in the Champions League. But Arsenal were an option; they never went away. It took them a matter of hours to slide in for the steal. The bad news for Spurs is that the very thing they feared has come to pass. The memes are out, an Eze mural has appeared in the tunnel outside the Emirates and the time is tighter to provide Frank with a new No 10.
Have Spurs built on the momentum of their Europa League triumph from last season? They have added João Paulinha and Mohammed Kudus for the starting XI, while it was a tonic to tie the new captain, Cristian Romero, to a long-term contract. But when their supporters look around, they see that Liverpool, Chelsea, Manchester United and Arsenal have spent £200m or significantly upwards on signings. Manchester City, meanwhile, have invested £150m. The mood at Tottenham is back to being edgy. Arsenal have made a statement of intent.
",TheGuardian
Graham Potter has ‘no doubt about ability’ as West Ham push for signings,West Ham host Chelsea on Friday after Sunderland loss,https://www.theguardian.com/football/2025/aug/21/graham-potter-west-ham-chelsea-transfer-window,"Thu, 21 Aug 2025 21:30:17",Jacob Steinberg,['Chelsea'],"Graham Potter has not been left with any doubt about his managerial ability after making a poor start to the season but he has warned West Ham will struggle to improve if they do not learn from previous mistakes in the transfer market.
Potter, who is looking for a response from his players in Friday evening’s home game against Chelsea, inherited an ageing squad after his appointment as manager in January. He is urgently looking for reinforcements after losing 3-0 to Sunderland last Saturday but West Ham have not landed many of their top targets and found a tight budget limited by the difficulty of selling players who are on lucrative long-term deals.
There is hope that the club, who are paying the price for ill-advised spending sprees in recent summer windows, will be able to sign two midfielders after agreeing to send Edson Álvarez on loan to Fenerbahce. But Potter, who works closely with his recruitment chief, Kyle Macaulay, stressed that he will avoid quick fixes after being asked if he is worried about a lack of depth in several key areas.
“We need a few silver bullets, not just one,” the former Chelsea manager said. “We analyse where we think the improvements can be and then we have to try to work within the financial position of the club to make the right decision to bring the right player and the right person here. If I look historically, West Ham have spent money, have signed players. Signing players is easy. It doesn’t mean that they’re going to be the right ones.
“It doesn’t mean to say that the team’s going to improve. It doesn’t mean to say that in six months’ time you’re stuck with a player that’s on too much money, that’s too old and you can’t sell them. It would be nice to have £200m to spend but that’s not the case. I have to work with what I have responsibly.”
Potter has won only five league games since replacing Julen Lopetegui. “I have no doubt whatsoever about my ability,” he said. “I have no doubt about the players and I have no doubt about the team that we’ll improve. I understand people will be critical. That’s the world we’re in. No point complaining about it. I couldn’t care less what you guys think or what people say from outside.”
Potter suggested that West Ham became too emotional after going behind against Sunderland. He added that he trusts the squad’s leadership group of Nayef Aguerd, Jarrod Bowen, Niclas Füllkrug, Maximilian Kilman, Tomas Soucek and James Ward-Prowse to lift the mood in the dressing room.
Meanwhile, Enzo Maresca has said Wesley Fofana is happy at Chelsea despite the defender removing pictures of himself playing for the club from his Instagram account.
The 24-year-old, who was an unused substitute during Sunday’s 0-0 draw at home to Crystal Palace, previously did the same in 2022 as he sought a move away from Leicester, just before sealing a £70m switch to Stamford Bridge.
Fofana, who missed a large part of last season after injuring his hamstring in December, is expected to play some part against West Ham. “I spoke with Wes every day, he’s very happy, first of all because he’s back from injury, he’s joining all the sessions with us,” said Maresca. “He was on the bench just to be with us but from [Friday] he can get some minutes.
“We are happy, he is happy. About Instagram, I don’t have any idea because I don’t use social networks.”
",TheGuardian
"‘Lads, it’s Tottenham’: missing out on Eze just the latest banana skin | Rob Davies",Supporting Spurs means imagining the most embarrassing thing that could befall a club and knowing it’s going to happen,https://www.theguardian.com/football/2025/aug/21/lads-its-tottenham-missing-out-on-eze-just-the-latest-slip-on-a-banana-skin,"Thu, 21 Aug 2025 16:01:07",Rob Davies,"['Arsenal', 'Tottenham Hotspur']","Earlier this month, my Spurs WhatsApp group was debating whether, if you could only have one, you’d sign Eberechi Eze or Savinho. Ever the ray of sunshine, I confessed that my “gut feeling” was that we wouldn’t get either. A few days later, I doubled down.
Despite reports suggesting Eze was practically on the 149 bus heading for N17, I had the nagging sense that Arsenal might gazump us at the last minute. The reason for such a grim forecast was that I’d seen this tragi-comic movie before. Spurs have “nearly” signed everyone from Jean-Pierre Papin to Eden Hazard to Rivaldo, who famously wrote to Glenn Hoddle outlining why he’d inexplicably chosen San Siro over White Hart Lane.
All clubs miss out on transfers from time to time. My pessimism sprang from somewhere else, somewhere darker and more psychologically deep-rooted.
Supporting Tottenham Hotspur so often means imagining the most ludicrous, embarrassing thing that could possibly befall the club and then knowing, with crystal clarity, that it’s going to happen. Fans of other clubs – Wimbledon, Bury or Morecambe – have had it much worse, but no other club so expertly combines the slapstick and the high-profile. At Tottenham we wait until everyone is watching, then we slip on the banana skin.
Think missing out on the Champions League because of a dodgy lasagne, or blowing a 2-0 lead in a European tie to a team whose manager is in prison. Think the famous “Lads, it’s Tottenham” game, which warped my expectations of football – and indeed life – as an 18-year-old in the stands in growing horror. Far from breaking the curse, the Europa League triumph seems merely to have angered the footballing gods, who swiftly set about restoring the karmic balance via the Morgan Gibbs-White debacle, the heartbreaking injury to James Maddison, and now this.
Missing out on Eze is a worthy addition to the pantheon of pratfalls, although not necessarily because of the player himself. A fine footballer he may be, but Eze isn’t necessarily the right fit for the gap left by Maddison’s injury. Right now, Spurs badly lack passing ability and there are better candidates who are younger, cheaper and have a higher ceiling than Eze. No, there are two reasons this one will stick in the collective psyche of Spurs fans. The first, of course, is that we’ve been done over by that lot up the road, who appear to have been stealthily plotting for weeks, even as details of our haggling over add-ons and chairman-to-chairman talks played out in public.
Arsenal fans won’t tire of reminding us about this all season; in the office, the pub and in the ground. More than that, though, this episode encapsulates the reign of Daniel Levy in microcosm. While rivals act decisively, we dither in the hope of a better deal, then miss out entirely. We spend but not quite enough, unwisely, or at the wrong time. We are all mouth – Levy says he wants to win the Premier League and Champions League – and no trousers. When it comes to transfers, the failure of Levy-era Tottenham to match his supposed ambition does not even have in it, to paraphrase the great Bill Nicholson, an echo of glory. Rather it is an echo of incompetence.
Nobody can argue with what Levy has achieved, delivering state-of-the-art facilities, a world-leading stadium and a regular place – albeit a fragile one – at football’s top table. For all the vitriol that is aimed at Levy, many of us are grateful for what he has done. But Levy is like a man who spends thousands of pounds tricking out a car that he never takes out of the garage because of the price of petrol. What was the point if you’re not going to test what it can do?
There remain many reasons to be optimistic about this season. Tottenham have a tactically astute new manager, taking charge of a squad that is both young and underrated after last year’s freakshow. The scouting set-up and club administration have been professionalised, putting Tottenham on a good footing for the future.
Yet, as long as the clownish blunders continue, the calls will grow louder for Levy to step aside, to find a new steward for Spurs, one who refuses to allow the club and its fans to be the butt of every joke. The game, after all, is supposed to be about glory.
",TheGuardian
