Title,Summary,Link,Date,Author,Teams,Article,Outlet
Club World Cup heat 'very dangerous' - Fernandez,Chelsea midfielder Enzo Fernandez has urged Fifa to re-think kick-off times to mitigate the 'very dangerous' heat in the United States at the Club World Cup.,https://www.bbc.com/sport/football/articles/c78nxlz24z9o,"Fri, 11 Jul 2025 18:01:56",Nizaar Kinsella,['Chelsea'],"Chelsea midfielder Enzo Fernandez said he has felt ""dizzy"" while playing in ""very dangerous"" heat at the Club World Cup in the United States.
The 24-year-old has featured in all six of Chelsea's matches en route to the final against Paris St-Germain in New Jersey on Sunday.
Three of Chelsea's games were played in temperatures described as ""extreme heat"", with local weather warnings urging people against involvement in strenuous physical activity or being outside.
In New Jersey, where Sunday's final takes place, temperatures have reached 38C in recent days.
Manager Enzo Maresca has complained it is ""impossible"" to have a normal training session because of the heat, despite reaching the final of the lucrative and newly-expanded tournament.
When asked about the experience of playing at the Club World Cup, Fernandez said: ""Honestly, the heat is incredible. The other day I had to lie down on the ground because I was really dizzy.
""Playing in this temperature is very dangerous, it's very dangerous. Moreover, for the spectacle, for the people who come to enjoy the stadium, for the people who watch it at home.
""The game, the speed of the game is not the same, everything becomes very slow.""
Players and managers have also complained about afternoon kick-off times throughout the tournament, which are designed in part to help TV audiences in Europe and Africa watch matches at convenient times.
Fernandez, who is likely to be in Argentina's squad at the 2026 World Cup across North America, added: ""Well, let's hope that next year they change the schedule, at least so that it remains a beautiful and attractive football spectacle, right?""
PSG manager Luis Enrique said ""it is not good for the show"" before their 4-0 semi-final win over Real Madrid on Wednesday.
Chelsea defender Levi Colwill added: ""Some places have been really hot, the last round was hot and I was stuck watching it and I was thinking: 'wow, this is so tough.' I felt bad for them but they managed it really well.""
Earlier this month, players' union Fifpro said it believed that Chelsea's game v ES Tunis in Philadelphia should have been delayed or postponed because of the heat.
On Thursday, former Germany striker Jurgen Klinsmann, now on Fifa's technical study group, recalled punishing conditions in Dallas during the 1994 World Cup in the United States, but said teams must adapt.
""The heat is difficult. If you play in 90 degree [Fahrenheit; 32C] heat then you are going to suffer,"" Klinsmann said. ""I played in Dallas at 120 degrees [49C] and I was dying!
""We were leading 3-0 at half time, then South Korea came back and made it 3-2 and if we had been on the pitch for another five minutes it would have been 3-3.
""But do I go to Qatar like Germany and complain, complain and bring karma - and then go home early? The teams here now and the teams here next summer who get the draw here in July and July next summer will have to adapt.
""But there will be two teams in the game. It's not always nice, especially for European teams but they will have to adapt.""
In a statement on the heat last week, Fifa said: ""Heat conditions are a serious topic that affect football globally.
""At the Club World Cup some significant and progressive measures are being taken to protect the players from the heat. For instance, cooling breaks were implemented in 31 out of 54 matches so far.
""Discussions on how to deal with heat conditions need to take place collectively and Fifa stands ready to facilitate this dialogue, including through the task force on player welfare, and to receive constructive input from all stakeholders on how to further enhance heat management.
""In all of this, the protection of players must be at the centre.""
",BBC
Forest consider legal action against Spurs over Gibbs-White,"Nottingham Forest are considering legal action over Tottenham's interest in midfielder Morgan Gibbs-White, sources tell BBC Sport.",https://www.bbc.com/sport/football/articles/c5y7g44dle3o,"Fri, 11 Jul 2025 13:59:05",Sami Mokbel,['Tottenham Hotspur'],"Nottingham Forest are considering legal action over Tottenham's interest in midfielder Morgan Gibbs-White, sources have told BBC Sport.
Forest are believed to be looking at whether a specific confidentiality agreement in the £60m release clause in Gibbs-White's contract has been breached.
BBC Sport reported on Thursday that Gibbs-White was set to have a medical on Friday as Spurs look to trigger that release clause.
Sources have told BBC Sport that Forest are furious at Tottenham's conduct in their pursuit of the England international, and they insist Forest's threat to take legal action is genuine.
It is understood Forest insist they have not given Spurs permission to speak to Gibbs-White and are willing to go to whatever lengths required to prevent the transfer taking place.
Under Premier League rules clubs are not allowed to talk to players under contract with another team unless they have permission.
Tottenham are aware of the situation but are still hopeful a deal can be concluded.
Gibbs-White joined Forest from Wolves in a move worth up to £42.5m in August 2022, on a five-year deal. He has made 118 appearances in three years at Forest, scoring 18 goals and providing 28 assists.
He made his England debut as a substitute in the Nations League win over the Republic of Ireland in September under interim manager Lee Carsley, with his most recent appearance coming off the bench in the 3-1 friendly defeat by Senegal at the City Ground under new boss Thomas Tuchel.
Tottenham have already signed Mohammed Kudus from West Ham for £55m this week.
Gibbs-White's team-mate Anthony Elanga is close to joining Newcastle for £55m.
",BBC
How are Spurs funding spending spree - and where would signings fit in?,Tottenham look set to spend £115m on deals for Mohammed Kudus and Morgan Gibb-White. BBC Sport looks at where the funding is coming from and how the signings would fit.,https://www.bbc.com/sport/football/articles/c8e4g51g892o,"Fri, 11 Jul 2025 14:25:39","Sami Mokbel, Noel Sliney and Matt Hobbs",['Tottenham Hotspur'],"The last 48 hours or so have seemed very un-Tottenham like.
Preparing to commit £115m on Mohammed Kudus and Morgan Gibbs-White isn't behaviour you'd necessarily associate with Spurs in the Daniel Levy era.
The general feeling around Tottenham and their transfer market spending in recent years has been one of frugality – although those at Spurs would be quick to point out they did spend £55m on Dominic Solanke last season, in a deal that could eventually become a club-record £65m.
Yet you can't escape the sense that the previous couple of days represents a change in narrative.
If Gibbs-White's £60m signing from Nottingham Forest goes through - after some late legal issues - it will be the biggest initial fee paid by the club.
Tottenham remain hopeful the deal will be completed despite Forest looking at whether a confidentiality agreement in the player's contract had been breached. It is also understood the club are claiming Spurs haven't asked permission to speak to the player.
Heading into the summer transfer window, well-placed sources indicated the club would be limited in the amount they would be able to spend.
But the capture of Kudus for £55m and the potential arrival of Gibbs-White for £60m flies in the face of any such restrictions.
So what has changed?
It is no secret Tottenham chairman Levy has been canvassing for external investment into the club in recent months.
However, BBC Sport understands the current spending on transfers is more likely to be the result of an injection of cash from owners Enic, who are understood to have kept a closer eye on club operations in recent months, rather than any external investment.
There has been talk of overseas investment – particularly from the Middle East.
For fans, of course, the source of the finances is neither here nor there.
All they really care about is the assembling of a team that can eventually challenge for the title and qualify consistently for the Champions League.
In Kudus and Gibbs-White, they would have two players capable of helping fulfil supporters' wishes.
Both are flair players that live up to Tottenham's attacking traditions and crucially are players who have Premier League experience.
Indeed, that was the remit for the club's recruitment team this summer.
The squad is already packed full of exciting young potential, but experience is what new boss Thomas Frank believes it needs.
While Kudus and Gibbs-White are relatively young - 24 and 25, respectively - they are well-versed in the rigours of England's top-flight.
Kudus has two full seasons for West Ham under his belt, making 80 appearances across all competitions, while Gibbs-White has played in the last three Premier League campaigns for Forest and had prior experience while a teenager at Wolves.
Spurs' interest in Brentford duo Yoane Wissa and Bryan Mbeumo is further illustration of Tottenham's recruitment remit.
Unusual big-money deals or continuing a trend?
The Gibbs-White deal - if it goes through - would take Tottenham's summer spending to £170m in initial fees, including the permanent signings of Mathys Tel and Kevin Danso after loan spells last season.
That kind of outlay may feel atypical to some supporters but it actually continues a recent trend of heavy spending by the club.
They were among the Premier League's top five highest spenders in each of the previous three summers, including a £219m splurge on eight players in 2023 shortly after Ange Postecoglou was appointed head coach. That figure was partially offset by Harry Kane's £86.5m move to Bayern Munich.
It's true to say, though, Spurs don't often spend as much on any individual player as they are hoping to this week. Gibbs-White would be only the fifth £50m-plus signing in their history, just a day or so after Kudus became the fourth.
The sums being spent now are certainly a far cry from 2018, when the club become the first in Premier League history not to sign a single player during a summer transfer window.
Plenty of attacking options - but how will it work?
Gibbs-White's creativity is not in doubt - just ask Nottingham Forest.
Thriving in the No.10 role for his club under Nuno Espirito Santo, he made his England debut last September and contributed seven top-flight goals and eight assists as Forest improved by 10 places on their finishing position in 2024.
He is the club's only player to reach double figures for combined goals and assists in three consecutive Premier League seasons.
Last season, the 25-year-old was involved in 148 attacks that led to an attempt on goal in the Premier League, either through him taking the shot, creating the chance or being involved in the build-up. None of his team-mates came close to matching that tally.
New Spurs head coach Frank will have an abundance of options to play as the central attacking midfielder, with Kudus' preferred position also as a No.10 - despite typically playing out wide for West Ham.
Tottenham, of course, already had James Maddison and Dejan Kulusevski in the building for that role, although all four players are versatile.
Across their Premier League careers, it's Maddison who fares best per 90 minutes in terms of goals, assists, shots on target, chances created, through-balls and passes played into the opposition penalty area.
Swede Kulusevski ranks highest for chances created from open play, and also after he's carried the ball a distance of at least five metres.
In short, it remains to be seen how much of an upgrade, if at all, Tottenham's two latest signings would prove to be if given the opportunity in that position.
Are defensive reinforcements still needed?
Spurs' current squad is stacked in attack with Kudus, Maddison, Kulusevski, Wilson Odobert, Manor Solomon and Brennan Johnson.
But Frank's reported interest in Christian Norgaard, before he signed for Arsenal from Brentford, suggests they are also looking for defensive reinforcements in midfield.
They may well be needed. Only the three relegated teams conceded a higher tally of expected goals than Spurs last season, while they also ranked fourth overall for errors leading to shots (41).
",BBC
Liverpool to commemorate Jota at Preston friendly,Diogo Jota and his brother Andre Silva will be commemorated with a number of tributes at Liverpool's friendly at Preston North End on Sunday.,https://www.bbc.com/sport/football/articles/cn0zegd32nwo,"Fri, 11 Jul 2025 11:33:16",Paul Battison,['Liverpool'],"Diogo Jota and his brother Andre Silva will be commemorated with a number of tributes at Liverpool's friendly at Preston North End on Sunday.
Portugal forward Jota and Silva died in a car crash last week in the Spanish province of Zamora.
Liverpool's match at Deepdale is their first since Jota's passing, which the club described as an ""unimaginable loss"".
There will be a rendition of Liverpool's anthem You'll Never Walk Alone, while Preston captain Ben Whiteman will lay a wreath in front of the away fans.
The Lillywhites will pay pre-match tributes and have created a commemorative edition of the matchday programme.
A minute's silence will be observed alongside televised tributes, with both sets of players wearing black armbands.
The game, which kicks off at 15:00 BST, will also be broadcast live on ITV and LFCTV.
Jota scored 65 goals in 182 appearances for Liverpool, helping them win the FA Cup and League Cup in 2022 and the Premier League title last season.
He played his final match for Portugal as they beat Spain in the final of the Nations League on 8 June. He scored 14 goals in 49 internationals.
The Guardia Civil told BBC Sport that Jota and his brother died after their car, a Lamborghini, left the road due to a tyre blowout while overtaking another vehicle.
The brothers had been heading to the Spanish port of Santander so Jota could return to Liverpool for pre-season training.
Their funeral took place in their hometown of Gondomar, near Porto at the weekend.
",BBC
Beever-Jones relishing chance to put herself in the picture with Lionesses,Young Chelsea striker is mixing first experience of tournament football with photography hobby and family time in effort to stay focused,https://www.theguardian.com/football/2025/jul/12/beever-jones-relishing-chance-to-put-herself-in-the-picture-with-lionesses,"Sat, 12 Jul 2025 07:00:05",Suzanne Wrack,['Chelsea'],"Aggie Beever-Jones doesn’t have much tournament experience. The England striker missed out on the 2020 under-17 Euros owing to Covid cancellations and featured at only the under-19s Euros in 2022, where she scored twice in the group stage against Norway, before arriving at Euro 2025.
By the time a player breaks into the senior side they usually have several tournaments under their belt but Covid means Beever-Jones is a part of the generation of young players coming through that lost out.
“I was unfortunate in that sense when I was growing up,” she says. “I’ve never really experienced tournament football and being away from family. It was a crazy time in the world; I think everyone was a bit unsure what was going on. We were lucky enough that football was able to carry on.
“That’s why I think it makes it a bit more special this time round. It is my first proper tournament and at the highest level. It’s exactly where I want to be. I feel comfortable enough to push for my place as well as getting pushed every day to become a better person and player. So I’m really, really enjoying it. Hopefully we can make our mark and keep going.”
The 21-year-old made her senior tournament debut on Wednesday night, coming on in place of Alessia Russo in the 84th minute of England’s 4-0 defeat of the Netherlands, and hopes to play a part on Sunday against Wales. The Chelsea forward’s former manager Emma Hayes spoke of the impact Beever-Jones could have on the international stage at the end of her tenure at the club, saying: “Aggie Beever-Jones. Don’t forget that name. She’s going to be a legend not just for Chelsea but for England.”
Beever-Jones says she feels “extremely lucky” to have achieved her goal of getting to these Euros and reflects on Hayes’ assessment by saying: “For Emma to say those words about me, that probably is one of the best compliments I’ve ever had, and from such an incredible person. I’m just looking to help where I can and enjoy it. I’ve always said I play my best football when I’m enjoying it.”
Making sure you enjoy it off the pitch matters too at a tournament. Taking photos is one of Beever-Jones’s means of distraction. “There’s a few of us,” she says. “I know Alex [Greenwood] bought a camera recently. It’s just nice to find some hobbies outside of football sometimes. The prints are in my journal – got a few Polaroids stuck in there … it’s finding the beauty in the little things and just being able to explore a beautiful city and enjoy it.”
Stepping out of the team bubble to hang out with family and friends also helps. “It’s refreshing to come out of that bubble sometimes and take a step back to spend time with your family and not talk about football,” says Beever-Jones. “My sister’s not a football-head at all so I just talk to her about everything but football. She’s a midwife; I talk a lot to her about her work. She has her boyfriend here who’s equally one of my best friends and it’s just nice to have that relationship. And equally with my mum and dad as well, just spending time and having a general family catchup. It’s a great balance of: you come here, you switch on, we have the bubble, and, equally, you can go out and have a coffee and enjoy time with your family and switch off from football.”
Beever-Jones waits for the chance to make her mark on this tournament and announce herself on the world stage like Alessia Russo and Ella Toone did as England’s super subs in 2022.
“That would be the dream,” she says. “For me, it’s about trusting Sarina [Wiegman] and trusting the process. We have a squad full of incredible players. I just have to take my opportunity when it comes. I was grateful to come on the other day and show a little bit of what I can do. Hopefully I get some more opportunities to do that.”
Was it disheartening not to feature in the opening defeat by France, with Michelle Agyemang the player who came on? “Me and Sarina had a conversation and ultimately I have to respect her decision,” she says. “She did say it was a tough game and she looked elsewhere to bring other people on and I just have to respect that. I know my strengths and I have done it for two years coming off the bench for Chelsea and hopefully making an impact.
“Sarina is well aware of that and I respected that decision. She knows I’ll be ready no matter what, whenever the time comes. I’m just delighted we were able to turn it around the other night. It doesn’t mean anything if we don’t go and beat Wales.”
",TheGuardian
"Taking flight: how Premier League clubs are racking up 175,000 summer air miles","All 20 teams are jetting around between league seasons, including for friendlies, training camps and the Club World Cup",https://www.theguardian.com/football/2025/jul/12/taking-flight-how-premier-league-clubs-are-racking-up-175000-summer-air-miles,"Sat, 12 Jul 2025 07:00:04",Connor Myers,"['Arsenal', 'Tottenham Hotspur']","Arsenal
After a training camp in Spain the Gunners head to Asia, kicking off their tour with a friendly against Milan in Singapore. They play again at the National Stadium four days later, against Newcastle, then face Spurs in Hong Kong. Two friendlies follow at the Emirates Stadium, against Villarreal and Athletic Club.
Aston Villa
Unai Emery’s side begin pre-season at Walsall and play again at the EFL club’s stadium, against Roma, three weeks later after stops in Germany and the US. A game at Hansa Rostock is followed by Villa facing Eintracht Frankfurt in Kentucky, St Louis in Missouri and Nashville in Tennessee before returning home. They finish by playing at Marseille and Villarreal in a final weekend of action.
Bournemouth
After behind-closed-doors friendlies at home to Hibs and Bristol City, the club travel to the US. Premier League Summer Series fixtures against Everton, Manchester United and West Ham take place in New Jersey, Chicago and Atlanta respectively. The club finish preparations at home to Real Sociedad.
Brentford
Three friendlies have been announced – two London. After a game at QPR, Brentford host Borussia Mönchengladbach. But first they travel to Portugal for a training camp which will include a game against Gil Vicente just north of Porto.
Brighton
Two games in England in front of fans – at Southampton and at home to Wolfsburg – will be augmented by at least one match behind closed doors and a training camp in southern Spain.
Burnley
After a week’s training in Portugal the club play four friendlies in England. Games at Huddersfield, Shrewsbury and Stoke are followed by a home match against Lazio.
Chelsea
Chelsea started their Club World Cup adventure based in Philadelphia, playing two group games there and one in Atlanta. After relocating to Miami for their last-16 tie in Charlotte, they returned to Philadelphia for a quarter-final there before heading to New York for the semi-final and final. After returning they have two friendlies at home, against Bayer Leverkusen and Milan.
Crystal Palace
A training camp in Austria includes games against Mainz and Augsburg. Before that come a friendly behind closed doors against Millwall and a match at Crawley. Preparations finish with the Community Shield against Liverpool.
Everton
After a training camp in Scotland and two games in Lancashire, against Accrington and Blackburn, Everton head to the US to play in New Jersey (Bournemouth), Chicago (West Ham) and Atlanta (Manchester United). On 9 August comes the first full-capacity game at their new Hill Dickinson Stadium home, with Roma the opponents.
Fulham
A training camp in the Algarve is expected to feature two matches in front of fans in the Faro area, and one of those has been announced – against Nottingham Forest. Eintracht Frankfurt then provide the opposition at Craven Cottage in the only other confirmed friendly.
Leeds
Matches during a training camp in Germany cannot be watched by fans after a ruling by police and local authorities. Supporters can see the team face Manchester United in Stockholm, Villarreal at Elland Road and Milan in Dublin.
Liverpool
After a game at Preston the champions face Milan in Hong Kong then play at Yokohama F Marinos on a first pre-season trip to Japan. Five days later they host Athletic Club in an unusual double header, the games kicking off at 5pm and 8pm. The Community Shield concludes their pre-season.
Manchester City
At the Club World Cup they travelled from their Boca Raton training base in Florida to games in Philadelphia, Atlanta and Orlando. After missing out on that prize they face Palermo in Sicily to contest the inaugural Anglo Palermitan Trophy.
Manchester United
After post-season matches in Malaysia and Hong Kong, the club start pre-season preparations against Leeds in Stockholm. They then play three games in the US – against West Ham in New Jersey, Bournemouth in Chicago and Everton in Atlanta –before ending with a home game against Fiorentina.
Newcastle
A training camp in Austria and a relatively short trip to Glasgow to face Celtic are followed by three games in east Asia. After taking on Arsenal in Singapore, the club play in South Korea for the first time, against a K-League Select XI in Suwon, and stay in the country for a game against Spurs in nearby Seoul. Then come home games against Espanyol and Atlético Madrid.
Nottingham Forest
After two games at Chesterfield, against the League Two club and Monaco, Forest head to the Algarve to face Fulham and Estoril. They go local again after that, playing at Birmingham City before hosting Fiorentina and the Saudi Arabian club Al-Qadsiah.
Sunderland
After local matches at Gateshead and South Shields the players head to the Algarve to face Sevilla and Sporting. Another trip aboard, to face Augsburg, follows but not before matches at Hearts, Hull and at home to Real Betis. The day after the match in Germany, preparations wrap up with a home game against Rayo Vallecano.
Tottenham
After games at Reading and Luton come four matches in four countries in a fortnight. Arsenal in Hong Kong and Newcastle in Seoul are followed by a visit to Bayern Munich to face Harry Kane. Then comes the Uefa Super Cup fixture against Paris Saint-Germain in the north-eastern Italian city of Udine.
West Ham
Another club participating in the US Summer Series, with games in New Jersey (Manchester United), Chicago (Everton) and Atlanta (Bournemouth). Before that a pre-season training camp in Germany’s Black Forest will include a game across the Swiss border against Grasshopper. Preparations conclude with Lille’s visit to the London Stadium.
Wolves
A trip to Portugal for games behind closed doors is followed by a match at Stoke and a fixture against Lens at Walsall. Then the team head to Spain for a short camp that includes a friendly against Girona before they finish at home to Celta Vigo.
",TheGuardian
