Title,Summary,Link,Date,Author,Teams,Article,Outlet
Premier League 2025-26 preview No 12: Liverpool,Big-money signings have shown the champions’ ambition but the death of Diogo Jota cast a shadow over the summer,https://www.theguardian.com/football/2025/aug/11/premier-league-2025-26-preview-no-12-liverpool,"Mon, 11 Aug 2025 11:00:03",Andy Hunter,['Liverpool'],"Guardian writers’ predicted position: 1st (NB: this is not necessarily Andy Hunter’s prediction but the average of our writers’ tips)
Last season’s position: 1st
Prospects
Champions for a record-equalling 20th time, and by a comfortable margin, first-choice transfer targets secured in an ambitious recruitment drive and the possibility of Alexander Isak arriving too: Liverpool look in outstanding shape to celebrate their 21st title this season. A seventh Champions League triumph will also be considered a realistic target by Arne Slot.
Expectations are high at Anfield but any analysis of the club must consider the immeasurable impact of Diogo Jota’s tragic death on teammates and colleagues. It is the unknown factor in their title defence.
On paper Liverpool have upgraded the squad that won the Premier League with four matches to spare and handed Slot greater depth and versatility for his second season. The head coach rotated sparingly in the league and his approach was rewarded handsomely. Slot, however, felt that fatigue caught up with the team during a sequence of 30 matches between November and March and he should have made more changes for the Carabao Cup final defeat by Newcastle. Expect more rotation this season.
Liverpool have added pace in both full-back positions with the signings of Milos Kerkez and Jeremie Frimpong, two parts of a statement transfer window when they spent almost £300m. Hugo Ekitiké was signed from under Newcastle’s noses after a breakthrough season with Eintracht Frankfurt and the coveted Florian Wirtz arrived for a club record – and potentially British record – fee. Slot believes the Germany international will bring “a few extra weapons” to the side. Rich in attacking options, Liverpool by contrast appear light in central defence and will require another imperious campaign from Virgil van Dijk and Ibrahima Konaté. The pair were a formidable unit last season. The defending champions appear the same.
The manager
There is a stark contrast between the character of the Liverpool head coach and the manager he succeeded last summer but, thanks to his tactical brilliance and calm, grounded manner, Slot exceeded expectations in evolving the squad built by Jürgen Klopp. History was made as a result. Slot made the best start by any Liverpool manager with 11 wins in his first 12 games, became the first Dutch coach to win the Premier League and joined the Anfield greats Joe Fagan and Sir Kenny Dalglish in winning the title in his first season. After the tragic events of the summer, the 46-year-old said: “To represent this club in this city now even means more to me and to my wife than it did before.”
Off-field picture
It has been a devastating summer for Liverpool after the deaths of Jota and his brother André Silva in a car accident on 3 July. The Portugal international was one of the most down-to-earth and popular figures in the dressing room, as well as a brilliant finisher who won the Premier League and Nations League in the weeks before his death. The grass verge behind the Main Stand at Anfield became a sea of tributes to the 28-year-old, who married his long-term partner Rute Cardoso, the mother of their three young children, 11 days before the accident. Liverpool have permanently retired Jota’s No 20 shirt in his honour across all levels of the club and have plans for a permanent memorial.
Star signing
A certain Newcastle striker could make a late play for this title but, in the meantime, it is Wirtz who embodies Liverpool’s ambition and willingness to pay a record fee for a transformative signing. The champions beat off competition from Bayern Munich and Manchester City for the 22-year-old attacking midfielder, who also had interest from Real Madrid. Slot believes Wirtz’s creativity will compensate for Trent Alexander-Arnold’s exit and enable Liverpool to turn dominance in possession into more emphatic victories. Wirtz has looked a class act in pre-season, the former Bayer Leverkusen player’s passing, touch, awareness and ability to find pockets of space in and around the penalty area impressing.
Stepping up
With impeccable timing, the 16-year-old left-winger Rio Ngumoha shone in a pre-season friendly against Yokohama F. Marinos on the day Luis Díaz completed his £65.5m move to Bayern. A fine display capped by an excellent individual goal showed Slot there could be another option to replace the Colombian. Ngumoha repeated the trick in his next outing against Athletic Bilbao. Chelsea were furious when Ngumoha left for Liverpool last summer. The teenager, for his part, felt there was a more straightforward pathway to the first team at Anfield. He will sign his first professional contract when he turns 17 on 29 August.
A big season for
Alexander-Arnold’s departure creates an opening for Conor Bradley to establish himself as the first-choice right-back. However, any prospect of a straightforward promotion for a 22-year-old who has all the attributes for the job, and the experience of 57 appearances for Liverpool, was curtailed days after the Premier League trophy was lifted. The champions announced the £29.5m signing of Frimpong on the day they accepted a €10m package from Madrid for Alexander-Arnold’s early release. The competition for Bradley remains as fierce as ever, but an opportunity is there to be seized.
",TheGuardian
John Textor teams up with football financier in push to buy Sheffield Wednesday,Working with former investment banker Keith Harris,https://www.theguardian.com/football/2025/aug/11/john-textor-sheffield-wednesday-teams-up-with-football-financier-keith-harris,"Mon, 11 Aug 2025 10:08:22",Matt Hughes,['Manchester City'],"John Textor has teamed up with the football financier Keith Harris in an attempt to buy Sheffield Wednesday. Harris, a former investment banker, has brokered takeovers at West Ham, Manchester City and Aston Villa and put together a consortium to buy Everton last year, although that bid was unsuccessful.
Textor was granted exclusivity in his attempt to buy Everton through his investment vehicle, Eagle Football, but also failed to complete. The American was not working with ­Harris, but they got to know each other through the Englishman’s work for Sportsbank, which this year offered Textor £230m to buy 45% of Eagle. The multiclub operation owns Lyon, Botafogo, the Belgian club RWD Molenbeek and was the biggest shareholder at Crystal Palace until selling to Woody Johnson last month.
Sportsbank, a group of investors from the United Arab Emirates and the US led by Zechariah Janjua and Navshir Jaffer, did not complete that deal, with Textor opting to float Eagle on the New York Stock Exchange. Sportsbank is not involved in the bid for Wednesday; Harris is ­working with Textor to source ­funding elsewhere.
Wednesday are in a perilous situa­tion. The owner, Dejphon Chansiri, has held talks with several potential buyers this summer and said in June that he had rejected an offer of £40m from an unknown American consortium, which is not connected to ­Textor. Chansiri’s asking price is thought to be closer to £100m.
The players have been paid late in four of the past five months, but their salaries are up to date after ­Wednesday last week received a £2.7m solidarity payment from the Premier League. The second instalment is due in January.
This week Wednesday will receive their monthly central ­distribution of £460,000 from the EFL, but short‑term problems remain. The North Stand at Hillsborough has not been granted a safety certificate so fans will have to be moved for their first home game of the season against Stoke on Saturday unless work is carried out in time. Money is so tight that some players paid for their own hotel room before the 2-1 defeat at Leicester on Sunday. As things stand, overnight stays will be rationed for the rest of the season, with day trips from Sheffield likely the norm when practical.
Textor confirmed last week he was interested in Wednesday. Harris has been chair of the Football League, a board member of Wembley Stadium and a director at Everton.
",TheGuardian
Crystal Palace win the Community Shield and the Championship is back – Football Weekly,"Max Rushden is joined by Barry Glendenning, Ali Maxwell and George Elek as Crystal Palace get the better of Liverpool at Wembley and the Championship gets under way",https://www.theguardian.com/football/audio/2025/aug/11/crystal-palace-win-the-community-shield-and-the-championship-is-back-football-weekly,"Mon, 11 Aug 2025 11:13:12",Max Rushden,['Liverpool'],"Rate, review, share on Apple Podcasts, Soundcloud, Audioboom, Mixcloud, Acast and Stitcher, and join the conversation on Facebook, Twitter and email.
On the podcast today: Crystal Palace beat Liverpool on penalties in the Community Shield … Dean Henderson doffing his cap, impressive debuts for Hugo Ekitike, Florian Wirtz and Jeremie Frimpong … not bad for a glorified pre-season friendly.
Elsewhere, some great games on the opening weekend of the Championship. There was Southampton’s stunning late comeback against Wrexham, Bristol City hammering Sheffield United, and Ipswich getting one of those the-game’s-gone handball penalties to rescue a point at Birmingham.
Plus, a roundup of League One and League Two, while we’ve also had more PhD correspondence and your questions are answered.
Buy tickets to Football Weekly LIVE in September here.
Support the Guardian here.
You can also find Football Weekly on Instagram, TikTok, and YouTube.
",TheGuardian
‘They have 24 months to milk the hell out of it’: will Son signing open up Asia for MLS?,"The South Korean superstar is one of the most beloved players on his home continent, giving MLS a valuable chance to raise its profile",https://www.theguardian.com/football/2025/aug/11/son-heung-min-lafc-mls-south-korea-business-commercial,"Mon, 11 Aug 2025 11:36:57",John Duerden,['Tottenham Hotspur'],"South Korean baseball fans have long been accustomed to organizing their weekends around MLB schedules – now it is time for the country’s soccer supporters to do the same with MLS.
Son Heung-min has started his two-year contract with Los Angeles FC, coming just after the attacker helped Tottenham Hotspur become the biggest club in his homeland (even if claims of close to 13 million fans are surely wildly overexaggerated) and one of the biggest in his home continent. Now it is the time to see what he can do in Los Angeles on the field and what the club can do off it.
“They’ve got 24 months to milk the hell out of it,” Sasi Kumar, a former Singapore international and founder of sports marketing agency Red Card Global, told the Guardian. “The commercial opportunities are obvious, staring LAFC in the face.”
Son has been the main man in Asian soccer for years: a golden boot and Puskas award recipient who lifted one of European football’s biggest trophies as a captain of a major club just months ago. Having one of the biggest stars in the world’s most popular league for so long was a matter of national pride in Korea and appealed across Asia. It fueled his superstardom. Son has helped to ensure that, now, pretty much every talented young Korean star wants to go straight to England’s top tier.
MLS does not enjoy anywhere close to the same stature – there has traditionally been little interest in the league in Asia, and it was barely mentioned as a possible destination for the 33-year-old. There has been a debate in Korea going back a few years when and where Son should go – a club like Barcelona was the one often mentioned. Even when the forward struggled for form and fitness last season, there were still options in Europe, where most expected him to stay. A move to Saudi Arabia was always unlikely. For a player who has never played in the K-League, going to a rival Asian competition may not have gone down well in his homeland where he has been the face of more than 30 brands. Still, MLS was not, initially, a popular choice.
“At the beginning, the fans’ reaction was divided as some wanted Son to stay in Europe and play in the Champions League for at least one more season,” said Lee Seung-mo, a Seoul-based author and journalist. “However, after Son explained why he chose LAFC and MLS, now the majority of fans understand and support his decision.” Being based Stateside also makes sense ahead of the World Cup, likely to be Son’s fourth and last appearance at the tournament.
Lee admits that not all the fans who have watched Son in England will watch him in the US. “It won’t be 100% the same in MLS in terms of viewership as the Premier League has the most fans of any league but most Son fans will want to watch MLS.”
Those years at the top of the game have made Son into such an icon in his homeland that he can transcend any competition he plays in. “His image cuts across different demographics, geography – everything,” said Kumar. “Whenever Spurs played you got Asians from all of Asia supporting him, he’s such a loveable character, you didn’t need to be a Spurs fan to like him,”
Sign up to Soccer with Jonathan Wilson
Jonathan Wilson brings expert analysis on the biggest stories from European soccer
LAFC has advantages. While MLS may not be the EPL, the USA is also not the UK. Economically, South Korea already has a strong connection with the US, sending almost 20% of exports in an export-based economy to the United States in 2024, compared to just 1% for Great Britain. “The Korean market is so connected to the US; it is a huge market for Korean beauty products, electronics, cars, phones etc,” Kumar said. “Son has provided a platform and opportunity to enter the market with a huge asset. The obvious thing for LAFC is to tour Asia and they should actively look in different markets for brand and content partnerships. LAFC’s commercial team will be working overtime how to sell digital assets, image rights and work with global brands like Samsung and Kia.”
Such Korean companies have always been involved in sports (the K.League was – and, to a large extent, still is- based on corporate ownership and Hyundai has been hugely influential in the Korean Football Association over the years) and there should be plenty of knowhow on the opposite side. “What is well known about American sports in general is that they are arguably the best in sports marketing, and I’m sure LAFC and MLS both will try their best in Korean market,” said Lee.
The fact that LA have made such a big deal of the signing has gone down well. Steve Han is a LA-based Korean content lead for Fifa and host of Fairpoint podcast and has witnessed the excitement. “At the introductory press conference, there were Korean journalists who attended with LAFC shirts on,” Han told the Guardian. “⁠For years, LAFC have already been one of the most well-branded clubs in MLS. Even the contents that the club pushed out so far have really got the fans excited. The stage is set for Son to put the icing on the cake now.”
",TheGuardian
"Football Daily | Virgil v the cosmos, plus shootout ineptitude: the Community Shield delivers",Sign up now! Sign up now! Sign up now? Sign up now!,https://www.theguardian.com/football/2025/aug/11/football-daily-email-crystal-palace-liverpool-community-shield,"Mon, 11 Aug 2025 13:54:40",Soccer,['Liverpool'],"S.H.I.E.L.D
Though rumours abound that, somewhere in the USA USA USA, the Copa Gianni continues in perpetuity, Donald Trump cavorting with Infantino in front of a rapt crowd of -67, back in England, the new season is well under way. Somehow, the Community Shield – or, to give it its proper name, The Annual Curtain-Raiser – has negotiated the logistical nightmare that is a transfer window yet to slam shut, revealing a game that, in a shocking turn of events, did not encourage one to pretend that football does not and has never existed.
Liverpool took just four minutes to go in front with a gift significantly more charitable than the Shield itself: the opportunity to hear “Ekitike” said in a scouse accent, a joy perhaps even more intense than Ross Barkley saying “Lukaku”. And what a finish it was, the champions’ new striker showing exactly why a team which scored 86 league goals last season – 14 more than the next best – invested so much money in him and the also-impressive Florian Wirtz (if only they’d not conceded 41, the most of any title winner in 12 years). Arne Slot does, though, hope to address the imbalance by spending considerably more than £100m on Alexander Isak.
In the meantime, though, his team are able to rely on the mononymaniacal “Virgil” who, after conceding the penalty from which Jean-Philippe Mateta equalised, treated all bar the -67 to one of the finest sights in all sport: righteous indignance at the effrontery of the cosmos in failing to accept divinity of his will. Were there hilarious puns to be made comparing the Aeneid to a body-part, or the Iliad to an intelligence-challenging insult, we would surely dive in, but sadly there are not. It wasn’t long before Liverpool retook the lead, courtesy of Jeremie Frimpong’s fluke second goal. Palace, though, remained uncowed, fighting their way back into the contest and, in the second half, looking the likelier scorers. But just as they looked like running out of steam, Milos Kerkez – a left-back better going forwards than backwards, signed to replace Andy Robertson, etc and so on – lost track of his whereabouts, in the process allowing Ismaïla Sarr to equalise.
Palace might then have won the match in normal time, but with a cross into the box looking dangerous, Alexis Mac Allister – arm well away from his body and raised to shoulder-height – took the ball away from Sarr. Oddly, Virgil’s search for truth was less pronounced this time – likewise that of the officials – so to penalties we went, a shootout of notable incompetence failing to provoke the dignified gentlemen of the internet into a flurry of misandric rage and condescension. The Daily can only conclude they are all somewhere in America, among the -67 still rapt by the sight of Trump cavorting with Infantino.
QUOTE OF THE DAY
“After considering the evidence, the panel found that John Textor, founder of Eagle Football Holdings, had shares in CPFC and [Lyon] and was a board member with decisive influence over both clubs at the time of Uefa’s assessment date. The panel also dismissed the argument by CPFC that they received unfair treatment in comparison to Nottingham Forest and OL. The panel considered that the Uefa regulations are clear and do not provide flexibility to clubs that are non-compliant on the assessment date, as CPFC claimed” – a quick comedown means it’s Tin Pot for Crystal Palace after they lost their appeal against demotion from Bigger Vase at Cas. And beyond that they’re also looking to sell Marc Guéhi, sharpish.
FOOTBALL DAILY LETTERS
Hannah Hampton’s skulduggery (Friday’s Quote of the Day) at the business end of the Euros final certainly puts a new slant on the notion of a player losing their bottle during a shootout. Buried somewhere deep down, 1% of me wonders whether she should be admonished. The other 99% looks at the bare-faced cheek of what she did, and how joyously she’s owned it since, and thinks – what an absolute, unparalleled star” – Phil Taverner.
Hampton had likely seen the [flamin’] antics of Socceroos substitute keeper Andrew Redmayne at a World Cup qualifier against Peru in 2022. As well as his stalling tactics and windmill-waving arms, Redmayne saw that the Peruvian keeper had notes of Australia’s penalty takers taped to his water bottle; names, faces and likely directions of the shots. As soon as he spotted it, Redmayne walked over, picked up the water bottle and threw it towards the stands, robbing Pedro Gallese of any advantage or insight. A beloved example of Australian sh!thousery” – Gerry Suchy.
Can I just express my appreciation for the contribution of Darwin Núñez’s time at Liverpool? His talent was there for all to see and his ability to score incredible goals from impossible situations was unfortunately dwarfed by his ability to miss the most obvious opportunities. It was his misfortune to be on the same team as Luis Díaz, who was much more successful in his similar role. I have come to realise that football is not about perfection or the expectation of perfection, despite what internet trolls would ascertain. I will miss his frustrating manifestation of the human side to the game. He did play better when he was smiling” – Nigel Sanders.
If you have any, please send letters to the.boss@theguardian.com. Today’s winner of our prizeless letter o’ the day is … Phil Taverner. Terms and conditions for our competitions, when we run them, can be viewed here.
RECOMMENDED LISTENING
Join Max Rushden, Barry Glendenning and the Football Weekly pod squad for a look back at the Community Shield and Championship action.
RECOMMENDED BOOKING
On Thursday 11 September, join Max Rushden, Barry Glendenning and a host of your other Football Weekly favourites live on stage for an evening of unfiltered football punditry at Troxy in London and livestreamed globally. Book now.
This is an extract from our daily football email … Football Daily. To get the full version, just visit this page and follow the instructions.
",TheGuardian
Football transfer rumours: Spurs in for Savinho? Magassa off to Forest?,Today’s rumours are awaiting the building email,https://www.theguardian.com/football/2025/aug/11/football-transfer-rumours-spurs-in-for-savinho-wissa-to-liverpool,"Mon, 11 Aug 2025 08:22:05",Daniel Harris,"['Chelsea', 'Liverpool', 'Tottenham Hotspur']","It’s been at least 13 minutes since Chelsea bought a player they don’t need and withdrawal symptoms are biting hard. As such, they’ve begun talks with RB Leipzig, the idea being to swap Christopher Nkunku and cash for Xavi Simons. Though presumably the deal wouldn’t actually be a swap, rather 793 separate deals payable over 32,321 years with the players valued at knockdown prices of £9,065m and £19,324m, respectively.
Nor will that be it. No squad is complete without someone who scores few and creates fewer, so Enzo Maresca is also keen to add Alejandro Garnacho to his squad. Leipzig, meanwhile, would like to acquire Harvey Elliott from Liverpool, who reportedly rejected a move to Nottingham Forest as he does not think they suit his playing style – they must’ve expected him to start rather than hang about as sub. Rather, he is said to favour a move to Serie A instead: the golden era of Harvelissimo may be just a few short weeks away.
Chelsea are, though, also looking to sell – most particularly Nicolas Jackson. Newcastle, having been rejected by Benjamin Sesko, Bryan Mbeumo, Hugo Ekitike, Ian Ormondroyd, Liam Delap, Ian Olney, João Pedro, Bill Brewer, Jan Stewer, Peter Gurney and Peter Davey, seem most interested in the striker who can not strike; the player seemingly prefers Alloa Athletic, San Marino Academy and Wormwood Scrubs Reserves. But if all else fails and given how much the Gallowgate loves a No 9, the romantic thrill of following Hughie Gallagher, Wor Jackie, Supermac, Coley, Sir Les and Alan Shearer means he’ll instead accept whatever he can find that isn’t that, but if that’s all he can find, then that’s what he’ll do.
Similarly, Randal Kolo Muani, another centre-forward target, would rather join Juventus, where he spent the second half of last season on loan, while Liverpool are keeping an eye on Yoane Wissa, whom they might take should they fail to relieve Newcastle of Alexander Isak. Quite why and how all these players have failed to be dazzled by Eddie Howe remains a mystery, but here we are.
In other striker news, Ruben Amorim has packed Rasmus Højlund’s bags, put his house on the market and booked him a one-way to ticket Anywhere But Here; Højlund retains every confidence he will soon be Manchester United’s first choice. However, should his manager remain unseduced by his preference for wrestling defenders to scoring goals, Milan are interested; they’d like a loan with an option to buy, whereas United just want shot of the shot-shy.
They are, though, considering taking Dominic Calvert-Lewin on a free transfer. The out-of-contract player has reportedly dismissed his agent to negotiate his own deal, which makes sense if you consider how much spare time he has, while 13 seconds of persistence appears to have worn down Jack Grealish – he’s agreed to join Everton on loan from Manchester City, who are also trying to shift Savinho to Spurs.
Otherwise, Régis Le Bris appears to be the only person in England who has heard of Lloyd Kelly. He fancies bringing the 26-year-old defender – who recently joined Juventus on a loan-with-an-obligation-to-buy deal from Newcastle – to Sunderland, should the clubs be able to strike a deal.
And finally for today to Nottingham, where Forest have made an offer for Monaco midfielder Soungoutou Magassa; they also hold an interest in Kostas Tsimikas, left out of Liverpool’s Community Shield squad. The absence of Harvelissimo is a factor not believed to be a factor operative in their decision-making process.
",TheGuardian
