Title,Summary,Link,Date,Author,Teams,Article,Outlet
'Excellent prospect' Ngumoha stars for Liverpool - but who is he?,Liverpool's second youngest ever player Rio Ngumoha shines again in pre-season to get fans wondering if he could be part of the first team this year.,https://www.bbc.com/sport/football/articles/c4gmevn5ye0o?at_medium=RSS&at_campaign=rss,"Mon, 04 Aug 2025 21:00:52",Emlyn Begley,['Liverpool'],"Liverpool's big summer signings made their Anfield bows - but it was 16-year-old Rio Ngumoha who stole the show despite not playing in the same game as them.
The Reds played an unusual double header against Athletic Bilbao, with - loosely speaking - their second XIs meeting at 17:00 BST and their first teams facing off at 20:00.
England Under-17 forward Ngumoha started the first game - and had a goal and assist to his name in the opening five minutes.
It ended 4-1 with Darwin Nunez, Ben Doak and Harvey Elliott also on the scoresheet.
Later on in the first-team game, Arne Slot fielded £263.5m worth of summer signings.
They were midfielder Florian Wirtz, forward Hugo Ekitike, full-backs Jeremie Frimpong and Milos Kerkez and goalkeeper Giorgi Mamardashvili - whose deal has gone through a year after it was agreed.
But it was Cody Gakpo who probably earned the headlines - scoring twice in the right net, and once in his own goal, as Liverpool won 3-2. Mohamed Salah netted the opener and later skied a penalty.
""In both games we created a lot of chances and scored seven goals. That's very pleasing to see,"" said boss Slot.
'Hard to put a lid on' Ngumoha hype
Ngumoha, who turns 17 later this month, shone again in pre-season to get fans wondering if he could be part of the first team this year.
The second youngest Liverpool player in a competitive game ever started this friendly on the left wing - and he caught the eye as he has done all summer.
The teenager scored in just the second minute as he ran onto a loose ball in his own half before racing forward and curling a fine effort in from 20 yards out.
Just three minutes later he nodded a Doak cross down for Darwin Nunez to convert from close range.
Liverpool fans were singing his name as Curtis Jones urged them to show their appreciation.
And he caused the La Liga side all kinds of problems with his dribbling and trickery.
The 16-year-old left to a standing ovation midway through the second half.
""He is such an excellent prospect,"" said ex-Reds defender Gary Gillespie on LFC TV.
""The difficult is managing expectations but it's hard to put a lid on it.""
Slot said: ""Rio is showing things every time in pre-season.""
Ngumoha's performance came on the back of an assist against AC Milan and goal against Yokohama F. Marinos in Asian friendlies.
He looks a fine talent, if raw, and will be hoping more first-team competitive games are on the way.
In January, Ngumoha became the youngest player to start a match for Liverpool  - aged 16 years and 135 days old - in the 4-0 win over Accrington in the FA Cup.
But that was his only first-team appearance and he never made the bench for a Premier League game.
That could well change this season, especially with so many changes in the Liverpool front line.
The sad death of centre forward Diogo Jota in a car crash has been the main focus of Liverpool's pre-season. There were tributes to him before and during the game at Anfield.
Winger Luis Diaz was sold to Bayern Munich and Nunez is a target for Saudi Pro League clubs.
An exit for Nunez would mean the Reds' only really strong frontline options would be Salah, new signing Ekitike and Gakpo - giving a chance for somebody like Ngumoha to break through.
That is unless they managed to sign Newcastle striker Alexander Isak. An initial bid of £110m has been rejected.
""I'm not trying to rush because I'm still only young,"" said Ngumoha last week.
""But at the same time, I just want to show the manager what I can do and not get too complacent. I just want to do bigger and better things for me and the club.""
Ngumoha is not actually a Liverpool academy product, having only joined Liverpool from Chelsea's youth set-up last summer.
At the time Blues legend John Terry wrote ""this boy is and will be a top player"".
He's not looking wrong.
Slot's Liverpool 2.0 show promising signs
Slot managed the remarkable achievement of winning the Premier League title in his first season despite barely making a signing - only fringe player Federico Chiesa arrived.
But now he is building a team of his own. And the signs are promising in a fluid looking 4-2-3-1.
The £100m Germany attacking midfielder Wirtz shown some exciting flashes in the first half with some great touches - and went close to scoring on a few occasions.
At right-back Frimpong had similarities to his predecessor Trent Alexander-Arnold, now at Real Madrid - better at attacking than defending.
The Dutchman got up and down the flank well at Anfield here - although did not deal with a free-kick into the box which led to Oihan Sancet's equaliser.
Ex-Bournemouth left-back Kerkez looked good. Ekitike was lively and ran to the byeline before setting up Salah's opener.
The Frenchman almost netted his first Anfield goal but Gakpo took the ball off his foot to score his second of the game.
Well his third including the accidental header into his own net from a Maroan Sannadi flick-on.
A concern remains at centre-back. With Virgil van Dijk out through illness and Joe Gomez injured, midfielder Wataro Endo had to start at the back alongside Ibrahima Konate.
After that the choices are other players out of position or youngsters. Or both. In the first game, 18-year-old midfielder Trey Nyoni had to play there.
""Today we hardly conceded anything at all [in terms of chances] which pleased me,"" said Slot.
""But to concede from two set-pieces is not what we want, especially against Palace next week [in the Community Shield]. They're strong at set-pieces. Another thing to work on.""
",BBC
Liverpool remember Jota before first Anfield game,Liverpool pay tribute to late forward Diogo Jota in their first match at Anfield since his death.,https://www.bbc.com/sport/football/articles/cly64e43ex5o?at_medium=RSS&at_campaign=rss,"Mon, 04 Aug 2025 16:24:45",Emlyn Begley,['Liverpool'],"Liverpool paid tribute to Diogo Jota in their first match at Anfield since the late forward's death.
The 28-year-old Portugal international died in a car crash in Spain along with his brother Andre Silva, 25, in July.
The Reds played Athletic Bilbao in a double header of pre-season friendlies on Monday, with games at 17:00 and 20:00 BST.
Liverpool legend Phil Thompson and Athletic president Jon Uriarte brought wreaths out on to the pitch and laid them on the edge of the six-yard box before the opening game.
The billboards around Anfield read 'Rest in Peace Diogo Jota and Andre Silva - You'll Never Walk Alone', while fans sang about Jota.
Reds supporters also held up flags and banners remembering their number 20 - a number that has been retired by the club this summer.
Both sets of players, coaches and fans applauded as both games were stopped in the 20th minute.
Jota scored 65 goals in 182 appearances for the Reds, helping them win the Premier League, FA Cup and League Cup, following his arrival from Wolves in 2020.
""I know that you will want to pay your tributes before, during and after the games, and I know that we will hear his song ringing out throughout the evening,"" said Reds boss Arne Slot in his match programme notes.
""It has been a tough time for everyone connected with the club, but especially for Diogo's family, his wife, his children and friends.
""We cannot imagine the pain that they have been going through, and the club will continue to give them all the support they can going forward. We will always carry him with us in our hearts, in our thoughts, wherever we go.
""Diogo's passing has had a big impact on us all, but what has been so important has been the love and care shown from the football world, and in particular of course the Liverpool FC community.""
The Reds play Crystal Palace in the Community Shield at Wembley on Sunday and open the Premier League season at Anfield against Bournemouth on Friday, 15 August.
",BBC
Everton agree £28m deal for Chelsea's Dewsbury-Hall,Everton agree to sign Chelsea midfielder Kiernan Dewsbury-Hall in a deal worth around £28m.,https://www.bbc.com/sport/football/articles/c7vlzjd3nero?at_medium=RSS&at_campaign=rss,"Mon, 04 Aug 2025 14:42:56",Nizaar Kinsella,['Chelsea'],"Everton have agreed to sign Chelsea midfielder Kiernan Dewsbury-Hall in a deal worth around £28m.
The fee for the 26-year-old is an initial £24m with a further £3-4m due in add-ons, and he will now finalise personal terms and undergo a medical despite late interest from Fulham.
Dewsbury-Hall had initially been reluctant to leave Stamford Bridge after a season playing in a supporting role as the side won the Fifa Club World Cup and Uefa Conference League, as well as qualifying for the Champions League.
However, the Blues were open to letting the midfielder go as they look to recoup the vast majority of the £30m it took to prise him from Leicester City in 2024, where he rejoined Enzo Maresca who also left the Foxes to manage Chelsea.
Everton have also been in negotiations with Southampton for winger Tyler Dibling, but are considering walking away if the valuation for the 19-year-old doesn't drop after a second bid was rejected.
In manager David Moyes's final press conference at the Premier League Summer Series, he said: ""I think there'll be deals next week. I think we're getting much closer, but I felt that four or five weeks ago as well.
""Obviously, we're getting near the tickly bits and we've got to get some things done.""
Following the signing of Dutch defender Jorrel Hato from Ajax on Sunday, Chelsea are negotiating multiple sales this week.
French midfielder Lesley Ugochukwu, 21, has agreed to join Burnley, who are also in advanced talks with their Albanian forward Armando Broja, 23.
Borussia Dortmund have also re-opened negotiations for midfielder Carney Chukwuemeka as the Blues look to trim their squad.
Did Dewsbury-Hall fail at Chelsea?
Dewsbury-Hall found it difficult to adapt to life at Chelsea despite working with Maresca again.
Having starred in Leicester's Championship-winning campaign, he was hopeful of playing in the Premier League with his boyhood club. So much so that he rejected a move to Brighton to stay with the Foxes.
However, Chelsea's move in late June was too big to turn down, especially as Leicester were pushing for the £30m sale - which also involved a swap with teenage midfielder Michael Golding going in the other direction - amid pressure to meet the Premier League's Profit and Sustainability (PSR) requirements.
Dewsbury-Hall adapted well to Maresca's system at Chelsea, but not to playing a bit-part role as Moises Caicedo, Romeo Lavia and Enzo Fernandez all featured ahead of him in the midfield pecking order.
He started only twice in the Premier League but made an impact, eventually, in their Conference League run, where he scored four times and came off the bench to set up Jadon Sancho's goal in the 4-1 triumph over Real Betis in May's final.
Dewsbury-Hall was used mainly as a substitute in the Club World Cup, but scored his fifth goal for the club in a 4-1 victory over Benfica and appeared in the 3-0 final success over Paris St-Germain.
He was a decent performer when given a chance for the Stamford Bridge side, but became part of a trend of players moving quickly in and then out again.
The sale of Dewsbury-Hall is particularly important as Uefa's recent punishment for financial control violations suggests Chelsea must sell players from their last Conference League squad to ensure a ""positive transfer balance"" this summer.
If not, they can't register new signings like Joao Pedro, Jamie Gittens and Liam Delap for the Champions League by September.
Chelsea are also still looking to strengthen their midfield options for next season, with talks ongoing for RB Leipzig's Netherlands international Xavi Simons.
",BBC
Might Newcastle owner's cash help Liverpool buy Isak?,"With PIF-owned Al-Hilal interested in Darwin Nunez, could Newcastle's owners be paving the way for Alexander Isak's move to Liverpool?",https://www.bbc.com/sport/football/articles/ce83vqqll00o?at_medium=RSS&at_campaign=rss,"Mon, 04 Aug 2025 14:56:56",Sami Mokbel,['Liverpool'],"The Saudi Pro League is emerging as a possible destination for Liverpool striker Darwin Nunez this summer.
BBC Sport understands that a potential move to the Middle East for the Uruguay international has been explored this summer with intermediaries actively working on trying to broker a deal.
Al-Hilal, who are controlled by Saudi Arabia's Public Investment Fund (PIF) and coached by former Inter Milan boss Simone Inzaghi, are interested in Nunez.
And offloading Nunez would financially aid Liverpool's efforts to land striker Alexander Isak from Newcastle - another club owned by PIF - this summer.
So, would PIF be allowing one of their clubs to benefit at the expense of another if Al-Hilal sign Nunez?
'What is PIF's priority?'
There is some uncertainty over whether Nunez, 26, is prepared to leave European football at this stage in his career.
Nunez has also been a target for Italian champions Napoli this summer while other European sides have shown an interest.
PIF owns 75% stakes in four of the leading Saudi Arabian clubs, including Al-Hilal, while it also owns a 80% stake in Newcastle.
The Magpies rejected a £110m bid from Liverpool for Isak on Friday, with Newcastle valuing the Sweden international at about £150m.
""It makes me think about what the priority is for PIF,"" Newcastle fan writer Charlotte Robson told BBC Sport.
""More and more discontent has been felt in the fanbase lately over where Newcastle sit on PIF's list of priorities, and allowing another of their clubs to benefit at the potential expense of us feels even more like we are being overlooked.
""Perhaps it's their clever way of getting money into NUFC, but I think most fans would say we'd rather an improved contract was given to Isak, the dust of the summer settles, and he stays with us a little while longer.""
'Liverpool can afford Isak without Nunez money'
However, football finance expert Kieran Maguire says Liverpool can afford to buy Isak regardless of whether Nunez stays or leaves.
""Although they've been very active in the transfer window, if they really wanted to, they could have spent another £200-250m, and still would have been within the PSR [profit and sustainability rules] limits,"" he told BBC Sport.
Liverpool have signed Florian Wirtz, Hugo Ekitike, Milos Kerkez, Jeremie Frimpong, Giorgi Mamardashvili and Armin Pecsi for a combined total of about £265m without add-ons.
However, the departures of Luis Diaz, Jarell Quansah, Caoimhin Kelleher and Trent Alexander-Arnold have recouped an initial £115m.
Maguire added: ""I think people are joining the dots and perhaps making two plus two equals five in terms of, is this a 'you scratching my back? I'll scratch yours' type of situation. But in my view, there's insufficient evidence to back that up.
""I suspect that Liverpool are likely to be the biggest beneficiary of this, rather than a PIF club. Newcastle don't want to sell Isak.
""As far as Al-Hilal are concerned, there are plenty of strikers that they could have bought. It just so happens that Nunez is effectively available, and therefore they decided to pursue that as an option.""
What's the latest on Isak?
Isak joined Newcastle in a £60m move from La Liga side Real Sociedad in 2022.
He was the club's top scorer last season as they won the Carabao Cup, ending their 70-year wait for domestic silverware.
The 25-year-old, who was reported as wanting to explore a move away from Tyneside by BBC Sport in July, was left out of the club's pre-season tour of Asia with what the club called a ""minor thigh injury"".
Last week, the Sweden international trained alone at his former club Real Sociedad amid ongoing uncertainty about his future, although sources say he returned to Newcastle training on Monday.
His boss Eddie Howe said Isak must ""earn the right"" to train with his squad again and, speaking to the Newcastle Chronicle, said he had not spoken to the forward since Liverpool lodged a bid.
The Newcastle boss, speaking before he travelled back home with his squad from South Korea, added that Liverpool, as far as he was aware, had not been back in touch since making their offer.
",BBC
Rio Ngumoha shines to fuel Liverpool’s optimism for new season,Young winger showed great promise in the 4-1 rout of Athletic Bilbao as Anfield paid its respects to Diogo Jota,https://www.theguardian.com/football/2025/aug/04/rio-ngumoha-liverpool-athletic-bilbao-diogo-jota,"Mon, 04 Aug 2025 19:30:11",Andy Hunter,['Liverpool'],"A vacancy has arisen on the left of Liverpool’s forward line and an early, eye-catching application to fill the role has arrived from a 16-year-old. Rio Ngumoha further enhanced his first‑team claims with a sparkling display against Athletic Bilbao that underlined the formidable strength, and options, available to Arne Slot.
Ngumoha opened the scoring superbly and teed up a goal for Darwin Núñez inside five minutes at Anfield in the first of two pre-season friendlies against the Basque club.
A packed Anfield crowd had to wait for the second fixture to catch a first glimpse of new signings Florian Wirtz, Milos Kerkez, Giorgi Mamardashvili, Hugo Ekitiké and Jeremie Frimpong. Ngumoha kept them entertained before then as Liverpool recorded a comfortable 4-1 win in match one. The second game also went Liverpool’s way, a 3-2 victory in which Wirtz, Ekitiké and Frimpong added to the flowing, blistering quality of the champions’ attacking play.
Ngumoha is not eligible to sign a professional contract until he turns 17 on the 29th of this month but showed why Chelsea were livid when Liverpool tempted him away from their academy last summer. In only the second minute of his second senior appearance at Anfield the teenager, who made his full debut against Accrington Stanley in the FA Cup last season, set off from halfway and, with Athletic defenders all in retreat, curled an excellent finish into the bottom corner of the Kop goal from 20 yards.
The left winger produced something similar in Liverpool’s previous pre‑season outing against Yokohama F Marinos last week. That goal came on the day Luis Díaz completed his £65.5m transfer to Bayern Munich, creating an opening on the left that could be filled by any one of Cody Gakpo, Wirtz, Ekitiké and perhaps the 16-year-old talent from London. His display was enough to prompt chants of “Rio” from the Kop and a song in his honour from the singer who appeared during the interval.
Ngumoha’s emergence – predicted with confidence by John Terry when he lamented the youngster’s exit from Chelsea – is timely for Liverpool as they await Newcastle’s next move on Alexander Isak. There may not be a rush to replace Díaz directly given the options already at Slot’s disposal. The Premier League champions can afford to wait on their prime target for the No 9 role and leave their £110m offer for Isak on Newcastle’s table.
Three minutes after his individual goal Ngumoha headed down a Ben Doak cross for Núñez to convert from close range. Anyone looking for clues as to Núñez’s next step – with Al-Hilal interested in taking him to the Saudi Pro League – will have noted the hand-on-the-heart celebration that followed from the £60m-rated Uruguay international in front of the Kop. A glimpse of Liverpool’s past and future, perhaps. Doak and Harvey Elliott, two other players who could leave Anfield in this window, were also on the scoresheet in the first contest against Ernesto Valverde’s side. Ngumoha’s footwork and pace also impressed in the 67 minutes he was on the pitch. He received a well-earned rousing reception when replaced by Trent Koné-Doherty.
The opening game started at 5pm as scheduled despite supporters in the Main Stand having to be evacuated just over an hour before kick-off due to a false alarm.
Liverpool’s first appearance on home soil since the tragic deaths of Diogo Jota and his brother, André Silva, was marked by the club’s former captain Phil Thompson and Athletic president, Jon Uriarte, laying wreaths in front of the Kop before the game. There were moving moments 20 minutes into both games when everyone inside the stadium rose to their feet to applaud Liverpool’s No 20. Play stopped and players from both teams also joined in the applause for Jota and Silva.
Slot was without Virgil van Dijk for both Bilbao games due to illness. The Liverpool head coach indicated the club captain could be a doubt for Sunday’s Community Shield against Crystal Palace. Conor Bradley and Joe Gomez were also absent through injury, forcing Slot to deploy 18-year-old midfielder Trey Nyoni in central defence for the first Bilbao contest and Luca Stephenson at right-back.
Goalkeeper Alisson was unavailable having left Liverpool’s recent pre‑season tour of Asia due to personal reasons. Summer signings Freddie Woodman and Armin Pecsi filled in, playing one half each, while Georgia international Mamardashvili made his Anfield bow in the second game behind a central defence of Ibrahima Konaté and Wataru Endo. That is one department where the champions appear light at present. Ngumoha could add to their riches up front.
",TheGuardian
Everton push again for Dibling with £40m offer and target Chelsea’s Dewsbury-Hall,Southampton have rejected two Everton bids for winger,https://www.theguardian.com/football/2025/aug/04/everton-tyler-dibling-kiernan-dewsbury-hall-chelsea-transfer-news,"Mon, 04 Aug 2025 13:48:59",Andy Hunter,['Chelsea'],"Everton have raised their bid for Tyler Dibling to about £40m and opened talks with Chelsea over signing Kiernan Dewsbury-Hall. Southampton have rejected two offers from Everton for the 19-year-old Dibling in recent days, of £27m and £35m, but Everton have returned with a third package worth iabout £40m including add-ons.
The England Under-21 international, who is believed to be open to joining Everton, has two years on his contract and Southampton are pushing for package nearer to £50m. They think others may come to the table.
Everton have missed out on several wide options this summer, including Francisco Conceição, who joined Juventus from Porto, and RB Leipzig’s recent signing from PSV, Johan Bakayoko. They also have interest in Lyon’s Malick Fofana, but the 20-year-old would prefer to join a club offering Champions League football.
David Moyes also wants to strengthen in central midfield and Dewsbury-Hall is a longstanding target. The 26-year-old started two Premier League games last season after his £30m arrival from Leicester and was deployed more often in Chelsea’s Conference League campaign. Everton have opened talks over a permanent deal, with Chelsea seeking to recoup their outlay.
Everton have completed four signings this summer – Carlos Alcaraz, the striker Thierno Barry, goalkeeper Mark Travers and the young left-back Adam Aznou – but 11 players have left, including nine members of last season’s first-team squad.
",TheGuardian
