Title,Summary,Link,Date,Author,Teams,Article,Outlet
Partey charged with rape and sexual assault,"Former Arsenal footballer Thomas Partey has been charged with five counts of rape and one count of sexual assault, London's Metropolitan Police have said. Partey denies the charges.",https://www.skysports.com/football/news/11095/13392367/thomas-partey-former-arsenal-midfielder-charged-with-rape-and-sexual-assault,"Fri, 04 Jul 2025 14:42:00",,['Arsenal'],"Former Arsenal footballer Thomas Partey has been charged with five counts of rape and one count of sexual assault, London's Metropolitan Police have said. Partey denies the charges.
The charges relate to three women and the offences are reported to have taken place between 2021 and 2022.
He is due to appear at London's Westminster Magistrates' Court on August 5.
Partey, 32, was first arrested in July 2022, though he was not named at the time and continued to play for Arsenal while investigations were ongoing.
In a statement, Partey's lawyer Jenny Wiltshire of Hickman and Rose, said: ""Thomas Partey denies all the charges against him. He has fully cooperated with the police and CPS throughout their three-year investigation. He now welcomes the opportunity to finally clear his name.
""Given that there are now ongoing legal proceedings, my client is unable to comment further.""
The Ghana international spent five seasons at Arsenal after being signed in 2020 for £45m but is now a free agent after his contract expired on Monday. He made 52 appearances for Arsenal last season across all competitions.
In a statement to Sky Sports News, Arsenal said: ""The player's contract ended on June 30. Due to ongoing legal proceedings the club is unable to comment on the case.""
Two counts of rape relate to one woman, three counts of rape relate to a second woman and one count of sexual assault relates to a third woman.
""The charges follow an investigation by detectives, which commenced in February 2022 after police first received a report of rape,"" according to the Met Police statement.
Detective Superintendent Andy Furphy, whose team is leading the investigation, said: ""Our priority remains providing support to the women who have come forward.""
Anyone who has information about the case, or has been impacted by it, is being asked to contact the Met Police.
",SkySports
Man Utd give five players extra time off to find moves away,Alejandro Garnacho and Marcus Rashford are among five Manchester United players that have been given extra time off to explore potential moves away after expressing a desire to leave.,https://www.skysports.com/football/news/11095/13392393/man-utd-marcus-rashford-alejandro-garnacho-among-five-players-given-time-to-explore-moves-away,"Fri, 04 Jul 2025 15:45:00",Dharmesh Sheth,['Manchester United'],"Alejandro Garnacho and Marcus Rashford are among five Manchester United players that have been given extra time off to explore potential moves away after expressing a desire to leave.
Jadon Sancho, Antony and Tyrell Malacia - who, along with Rashford, were away on loan last season - are part of the group that will not be reporting back to Carrington on Monday with the rest of the squad.
Matheus Cunha will take the No 10 shirt from Rashford, who said he wanted a ""new challenge"" before joining Aston Villa for the second half of last season.
One source has told Sky Sports News it has been made clear to both Rashford and Sancho that they do not figure in Ruben Amorim's plans and the pair are keen to pursue opportunities elsewhere.
If the five players' futures are not resolved during this period, they will return to Carrington, where they will continue to have full access to medical and training support.
There have been no official offers for Rashford, who remains keen on joining Barcelona. Any potential move for the 27-year-old could come later in the window after he returned from his loan at Aston Villa.
Sky Sports News has previously reported that Rashford wants to play Champions League football next season, but is not willing to relocate to London. His representatives are also against their client being involved in any part-exchange deal.
Juventus are in ongoing talks with United over the signing of Sancho. Discussions also continue with the forward's representatives over personal terms.
United's asking price is thought to be £25m for Sancho after Chelsea paid a £5m penalty to get out of their obligation to turn his loan deal permanent this summer.
Real Betis want to re-sign Antony after his successful loan spell in the second half of last season but will find it difficult to meet United's asking price.
Como have also shown an interest in Antony, but it is understood the player's preference is a return to Betis. Bayer Leverkusen, coached by Erik ten Hag, have also shown interest in the winger.
United are yet to receive any offers for Garnacho, who has been of interest to Chelsea.
The forward cast doubt over his future after being used as a substitute in the Europa League final and was subsequently left out of United's matchday squad for the final game of the season against Aston Villa.
Malacia spent the second half of last season on loan at PSV Eindhoven after recovering from a long-term knee injury.
Manchester United are expected to go in with an improved offer for Brentford forward Bryan Mbeumo.
Internal discussions at United continue over their next steps regarding their pursuit of the 25-year-old, who effectively has two years left on his deal.
There is a feeling that United's latest proposal - worth an initial £55m, reaching £62.5m with add-ons, is not far away from what Brentford want. However, the structure of the deal will be significant.
Brentford want at least £65m - with most, if not all, of that amount guaranteed.
Mbeumo only wants to join United and Brentford sporting director Phil Giles says the Cameroon international is happy stay if a deal cannot be agreed.
While United's focus is on Mbeumo and potential sales, they are still exploring a deal for a striker.
It is understood Juventus mentioned the sale of Dusan Vlahovic when talks took place over Sancho.
Juventus are desperate to sell Vlahovic - he is on huge wages and has entered the final year of his contract.
Juve are still interested in Napoli striker Victor Osimhen, who was on loan at Galatasaray last season.
Vlahovic is one of a number of strikers United have looked at and they continue to keep an eye on Ollie Watkins' situation at Aston Villa.
From next season, Sky Sports' Premier League coverage will increase from 128 matches to at least 215 games exclusively live.
And 80 per cent of all televised Premier League games next season are on Sky Sports.
",SkySports
Walker completes Burnley medical ahead of Man City exit,Kyle Walker has completed his Burnley medical after the promoted Premier League side agreed a deal with&#160;Manchester City&#160;to sign the defender.,https://www.skysports.com/football/news/11095/13392492/kyle-walker-transfer-burnley-agree-5m-deal-to-sign-man-city-and-england-defender,"Fri, 04 Jul 2025 19:30:00",,['Manchester City'],"Kyle Walker has completed his Burnley medical after the promoted Premier League side agreed a deal with Manchester City to sign the defender.
Sky Sports News understands the deal could be worth £5m and there is confidence that the transfer can be completed in the next few days.
Contract discussions are over a two-year deal. Walker had entered the final year of his contract at City.
He spent last season on loan at AC Milan, making 16 appearances across all competitions, but they didn't take up the option to make the deal permanent.
Walker wasn't part of City's squad for the FIFA Club World Cup, alongside fellow England international Jack Grealish.
Walker knows Burnley boss Scott Parker following their time playing together at Tottenham from 2011 to 2013.
The experienced Premier League defender is in line to become Burnley's fifth new signing of the summer followingMax Weiss, Quilindschy Hartman, Axel Tuanzebe and Loum Tchouana, while loan deals for Bashir Humphreys, Marcus Edwards, Zian Flemming and Jaidon Anthony have been made permanent.
In
Loum Tchaouna - Lazio, £12m
Axel Tuanzebe - Ipswich, free transfer
Quilindschy Hartman - Feyenoord, undisclosed
Bashir Humphrey - Chelsea, undisclosed
Jaidon Anthony - Bournemouth, undisclosed
Marcus Edwards - Sporting CP, undisclosed
Zian Flemming - Millwall, undisclosed
Max Weiss - Karlsruher, £4.2m
Out
Nathan Redmond - released
Jonjo Shelvey - released
CJ Egan-Riley - Marseille, free
From next season, Sky Sports' Premier League coverage will increase from 128 matches to at least 215 games exclusively live.
And 80 per cent of all televised Premier League games next season are on Sky Sports.
",SkySports
Villa and Chelsea fined by UEFA for breaching financial rules,Aston Villa and Chelsea have been fined by UEFA for breaches of its financial rules.,https://www.skysports.com/football/news/11095/13392443/chelsea-and-aston-villa-fined-27m-and-9-5m-respectively-by-uefa-for-breaching-financial-rules,"Fri, 04 Jul 2025 17:10:00",,['Chelsea'],"Aston Villa and Chelsea have been fined by UEFA for breaches of its financial rules.
Chelsea have to pay a total of £27m in fines and could pay up to £52m more if they breach their four-year agreement with the CFCB.
Aston Villa must pay £9.5m in fines and failure to comply with their three-year settlement could lead to a further penalty of up to £13m more.
Both Premier League clubs broke UEFA's football earnings rule and squad cost rule.
Villa and Chelsea had a squad cost ratio (percentage of a club's income spent on the first-team squad) of between 80 and 90 per cent for 2024.
Their fines for this breach - Aston Villa £5.1m and Chelsea £9.4m - are proportionate to the size of the club's squad cost excess. From 2025, the squad cost ratio will be 70 per cent.
Chelsea have to pay £17.2m for their breaches of the football earnings rule and that could rise to more than £69m if they breach the four-year settlement with the CFCB.
Villa were handed an unconditional fine of £4.3m for their breach of the rule and it could rise to £17.2m if they do not comply with the three-year agreement.
Both teams have agreed to a restriction on registering new players for UEFA competitions in the 2025/26 season - unless the value of new signings added to their squads is recouped in sales.
For Chelsea, this measure will also be in place for the 2026/2027 season.
If either of the clubs do not stick to the financial targets set out in the settlement, this restriction could come back into effect in subsequent seasons.
Chelsea have since commented on the matter, where they claimed to have worked ""closely and transparently"" with UEFA regarding the breaches.
The statement read: ""Chelsea FC has entered into a settlement agreement with UEFA concerning a break-even deficit reported by the club under UEFA's Financial Sustainability Regulations covering the financial years 2022/2023 and 2023/2024.
""The club has also agreed to pay a fine as a result of the club's squad cost ratio in the 2024 reporting year being between 80 per cent and 90 per cent.
""The club has worked closely and transparently with UEFA to provide a full and detailed breakdown of its financial reporting, which indicates that the financial performance of the club is on a strong upwards trajectory.
""Chelsea FC greatly values its relationship with UEFA and considered it important to bring this matter to a swift conclusion by entering into a settlement agreement.""
Villa were handed fines of £4.3m (€5m) and £5.2m (€6m) due to their respective violations.
Latest from Sky Sports News' chief reporter Kaveh Solhekol:
""Chelsea have been fined a total of €31m by UEFA for breaking their financial rules. But that fine could go up to €91m, if over the next four years, they do not meet the financial targets set for them by UEFA.
""UEFA were investigating the sale of the two hotels at Stamford Bridge a couple of years ago for £76m. Those hotels were sold from one subsidiary of Chelsea's holding company to another subsidiary.
""That is allowed under Premier League rules but not UEFA rules, that is one reason why they have been fined €20m for breaking UEFA's financial monitoring rules.
""They have also been fined another €11m, which makes it €31m, for breaking the squad cost rules. Those rules say you can only spend a maximum of 80 per cent of your revenue on transfers and players' costs, such as wages and agent fees.
""They found that Chelsea had broken the 80 per cent cap and in fact, Chelsea in the 2024 financial reporting year, spent between 80 and 90 per cent of their revenue on squad costs. That is why they have been fined €11m.
""If over the four years, they step out of line, they could be in line for another fine of up to €60m.""
Sky Sports News' chief reporter Kaveh Solhekol:
""They have been fined a total of €11m and if they miss targets set for them by UEFA, it could increase to a maximum of €26m.
""The €11m fine is made up of a €5m fine for breaking football earnings rules and they will pay an extra €20m if they miss the financial targets set for them by UEFA.
""They have also been fined for breaking UEFA's squad cost rule and their fine is €6m.""
From next season, Sky Sports' Premier League coverage will increase from 128 matches to at least 215 games exclusively live.
And 80 per cent of all televised Premier League games next season are on Sky Sports.
",SkySports
'Perfect night' for Chelsea as 'exciting' Estevao gives glimpse of future,"It was a 'perfect night' for Chelsea as they beat Palmeiras to reach the Club World Cup semi-final, despite new signing Estevao Willian scoring against them.",https://www.bbc.com/sport/football/articles/c70r1d35e1ko,"Sat, 05 Jul 2025 04:04:33",Marcus alves,['Chelsea'],"Estevao Willian could hardly have introduced himself to Chelsea in a better way.
When the 18-year-old Brazilian smashed home an equaliser for Palmeiras against the Blues from an almost impossible angle on Saturday - Chelsea fans could have been forgiven for feeling a little bit excited.
Yes, he had just equalised against their side in the Club World Cup quarter-final but it was also a thrilling glimpse of the talent Chelsea have signed in a deal that could eventually be worth £52m.
A late Palmeiras own goal meant it was ultimately Chelsea looking forward to a semi-final against Fluminense, but Estevao's last game for the Brazilians was certainly a memorable one.
The Blues beat the likes of Bayern Munich, Paris St-Germain and Manchester City to sign the Palmeiras wonderkid last summer - before allowing him to stay in Brazil last season and to play for the Brazilians in this summer's Club World Cup.
And, while they may have been regretting that decision as his direct running and silky skills tormented them in Philadelphia, anyone connected with Chelsea can't fail but to be excited by what they saw.
Chelsea boss Enzo Maresca said: ""Happy because we won and also happy because Estevao scored, the perfect night.
""He is very good, a huge talent, fantastic player. The only thing is when you come from South America or another part of the world is that you need to adapt.
""We are going to help him to adapt, be happy and enjoy football. We have no doubt he will be an important player for Chelsea.""
The forward was a constant threat down Palmeiras's right, had the most touches in Chelsea's box for his side (8), and was awarded man of the match for his display.
Blues midfielder Cole Palmer, who was pictured talking to him after the final whistle, added: ""You can see he is a top player, so it is very exciting.
""I just said we are excited for you to join, but he didn't understand a single word I said.""
Estevao and Palmeiras manager Abel Ferreira were tearful at the post-match press conference as they reflected on their time together.
Ferreira said: ""I spoke before with Maresca and told him 'you bought an amazing player but more than this you bought an amazing person'.
""You need to take care of him. You need to embrace him and in the beginning for sure he will make mistakes. Like you saw today he is an amazing player with a lot of skill. He is a player who can win a game alone.""
Estevao, said: ""Palmeiras opened the door for me. I was deeply happy in Palmeiras and my family knows how happy I was.
""I'm very happy I could score a goal to help my club unfortunately this wasn't the result we wanted but we gave our best on the pitch and now I am moving on.""

'Best Brazilian since Neymar'
Other Brazilian teenagers such as Vinicius Jr and Rodrygo left for Europe at the same age for huge fees.
They've both proved themselves already on the big stages since then. But none of them were as hyped as Estevao when they first moved abroad.
There's a feeling in Brazil that the boy from the countryside of Sao Paulo may be something else, the kind of player that comes along once a decade and seems destined to the very top.
""Estevao is the best player to have emerged from Brazilian football since Neymar. You watch him and you fall in love,"" the head of Palmeiras' academy, Joao Paulo Sampaio, told BBC Sport.
""He already impresses with his technique but, like Neymar at this same point in his career, he has not yet matured physically and is not as strong as Endrick, so he could still develop a lot. That's what amazes everyone and makes them think that he will reach a much higher level.""
Forget about Messinho - his name is Estevao
Estevao is a member of the so-called ""geracao do bilhao"" - a generation of players that also includes Real Madrid's Endrick and West Ham's Luis Guilherme and with whom Palmeiras expected to make 1bn Brazilian Real (around £152m).
All three have been making waves since they were kids - Estevao himself was only 10 the first time Palmeiras tried to lure him to their academy, but failed to match an offer reportedly 10 times higher from Cruzeiro.
He then became the youngest Brazilian footballer to sign a contract with Nike, surpassing Neymar (13) and Rodrygo (11), and was dubbed 'Messinho' (little Messi) for his ability to change direction and dribble past opponents while running with the ball at speed.
It hardly came as a surprise to those who had been following him when Spanish newspaper AS said during the 2023 U-17 World Cup that ""Brazil have a new genius"".
Despite the similarities with Lionel Messi, Estevao has stated he doesn't want to be called 'Messinho' anymore.
It's not only his left foot that leaves others fascinated, but also the mentality he already possesses. Sampaio recalls an episode that illustrated that.
""When we won the 2022 U-17 Brazilian Championship title, Estevao ended up breaking one of his toes during a decisive game,"" he said.
""But even so he still didn't want to leave [the game], so he came to me at half-time saying, 'I'll go back for the second half'. And I challenged him: 'You better go back.' And so he had a painkilling injection in his toe and told me, 'I'll go back, score a goal and look for you in the stands to shush you.' That's how strong he is mentally.""
No concern at all about Chelsea situation
A right winger who can also play as number 10, Estevao has always been treated differently.
He was still five months away from being able to sign his first senior contract at the age of 16 when Palmeiras, in an unusual move, announced they had agreed the terms of it.
His decision to choose Chelsea as the next step in his career has been questioned back home, due to the confusing situation of the English club and their recent record with young Brazilians such as Andrey Santos, Deivid Washington and Angelo Gabriel.
Estevao's staff has told BBC Sport they have no concerns whatsoever about it and added they believe a transfer to West London will give him a chance to break into the team more quickly compared to other clubs.
With the 2026 World Cup as his main goal, the plan is to hit the ground running at Stamford Bridge once he arrives.
""I would say that with Estevao it's not a matter of whether this place is easier or not because he's the kind of player that just goes there and gets things done. When you are an extra-class like him, that's how you do it,"" Sampaio concluded.
",BBC
Former Arsenal midfielder Partey charged with rape,"The ex-Arsenal player is charged with five counts of rape relating to two women, and one count of sexual assault over a third woman.",https://www.bbc.com/news/articles/c39zr7y9ep3o,"Fri, 04 Jul 2025 21:29:51",,['Arsenal'],"Former Arsenal footballer Thomas Partey has been charged with five counts of rape and one count of sexual assault.
The offences are reported to have taken place between 2021-2022, the Metropolitan Police said.
The charges involve three women, with two counts of rape relating to one woman, three counts of rape in connection to a second woman and one count of sexual assault linked to a third woman.
The Ghanaian international denies the charges and ""welcomes the opportunity to finally clear his name"", his lawyer said.

The charges follow an investigation by detectives, which started in February 2022 after police first received a report of rape.
The 32-year-old's contract with Arsenal ended on Monday after playing with the team since 2020.
An Arsenal spokesman said: ""The player's contract ended on June 30. Due to ongoing legal proceedings the club is unable to comment on the case.""
The Football Association and the Premier League declined to comment.
Det Supt Andy Furphy, who is leading the investigation, said: ""Our priority remains providing support to the women who have come forward.
""We would ask anyone who has been impacted by this case, or anyone who has information, to speak with our team. You can contact detectives about this investigation by emailing CIT@met.police.uk""
Mr Partey, of Hertfordshire, is expected to appear at Westminster Magistrates' Court on Tuesday 5 August.
In a statement, his lawyer Jenny Wiltshire said: ""Thomas Partey denies all the charges against him.
""He has fully cooperated with the police and CPS throughout their three-year investigation.
""He now welcomes the opportunity to finally clear his name.
""Given that there are now ongoing legal proceedings, my client is unable to comment further.""
Mr Partey joined Arsenal for £45.3m from Atletico Madrid in October 2020, made 35 top-flight appearances last season and scored four goals as the London club finished second in the Premier League.
He also played 12 times in the Champions League as the Gunners reached the semi-finals before being knocked out by eventual winners Paris St-Germain.
Overall, he made 130 Premier League appearances for Mikel Arteta's side, scoring nine goals.
Mr Partey has also made more than 50 appearances for Ghana's national team, and most recently played at World Cup qualification matches in March.
",BBC
