Title,Summary,Link,Date,Author,Teams,Article,Outlet
Champions transformed: Slot's Liverpool relaunch explained,"If the secret to Arne Slot's success in his first Premier League season was evolution from the Jurgen Klopp era, then a revolution at Liverpool looks to be the plan for the title defence.",https://www.skysports.com/football/news/11095/13398183/premier-league-champions-liverpool-will-look-very-different-this-season-after-a-busy-transfer-window,"Wed, 23 Jul 2025 19:30:00",Peter Smith,['Liverpool'],"If the secret to Arne Slot's success in his first Premier League season was evolution from the Jurgen Klopp era, then a revolution at Liverpool looks to be the plan for the title defence.
With canny alterations, smart in-game changes and an incredible individual campaign from Mohamed Salah, Slot exceeded expectations with Liverpool's Premier League triumph.
Which makes this summer's overhaul all the more intriguing.
There is a saying that you should strengthen when you're in front. Don't admire the view from the top of the mountain, immediately start planning for how you can climb it again - and how to do it better next time.
But few Premier League champions have been reshaped to go again the way this Liverpool side have. Almost £300m has been spent in the window so far.
A potential British transfer record spend on Florian Wirtz is the headline deal of the window and he will play a leading role in attack. But Jeremie Frimpong and Milos Kerkez will transform Liverpool's approach out wide.
There will be knock-on impacts for the centre of defence, Ryan Gravenberch's role in midfield and Mohamed Salah's positioning. Hugo Ekitike has the potential to knit it all together.
While there was an acceptance at Anfield the 2024/25 champions needed a refresh, Slot's season two will see a big shift.
Trent Alexander-Arnold's exit has driven the change. While on the left side, Kerkez looks like the heir to Robertson, reminiscent of the flying Scotsman in his pomp, bombing up and down that flank, overlapping, underlapping, cutting back and crossing, Frimpong is a completely different player to Alexander-Arnold.
Firstly, Frimpong played in a different position to Alexander-Arnold while he was at Bayer Leverkusen, tasked as a right wing-back to get into the danger zone. While Alexander-Arnold delivered from deep at Anfield, Frimpong was virtually a right winger for Xabi Alonso, taking his team up the pitch with his runs off the ball or through his dribbling with it.
Alexander-Arnold delivers the ball into the box, Frimpong delivers himself into the box.
Expect Kerkez and Frimpong to be high and wide when Liverpool attack.
With Kerkez and Frimpong darting into those positions, the opportunity will be there for Wirtz, from the left, and Salah from the right, to step inside onto their stronger foot and take aim at goal or pick out a chance-creating pass.
It's a trademark move from Salah but also one Wirtz caused substantial damage with while at Leverkusen.
Wirtz's range of skills - the top dribbler in the Bundesliga recorded double figures for goals and assists but also led the way for high turnovers - makes him an option in a range of positions. But a roaming role from the left was Alonso's vision for him and could be Slot's plan, with the futures of Luis Diaz and Cody Gakpo uncertain.
Salah was the Premier League player of the year and top scorer last term but as the 33-year-old ages, this is a team that now looks set up to enhance his goal threat over work rate. There were already signs of that shift last season, with Salah revealing Slot had relieved him of many defensive duties. It's a theme which could now continue.
The tragic passing of Diogo Jota will be in people's minds whenever Liverpool's central attackers are discussed next season. The Portuguese forward played 37 times across all competitions last year.
Ekitike has joined Liverpool from Eintracht Frankfurt and his performances in the Bundesliga suggest he has the attributes to link up the new-look Liverpool when they go forward.
He's 6ft 3in but more than just a target man. Eager to run the channels or drop into midfield to help build attacks, Ekitike's movement should provide opportunities for Wirtz and Salah to run in behind him and profit from the space he creates.
The hope for Slot will be he can combine that teamwork with a striker's selfishness at times and build on his career-best 15 league goals last season. The Bundesliga's top shot-taker in 2024/25 will carry plenty of threat of his own.
All those attacking ideas will need to be supplemented by smart midfield movement behind.
Gravenberch dropping back between the centre-backs to make a three in the first phase of Liverpool's build-up play was spotted at times last season while the Dutchman also came across to plug gaps in the right-back area at times.
He is likely to be required to do similar next season, while Liverpool will need to lean on Ibrahima Konate's ability to look after the right channel and Virgil van Dijk's experience to marshal all these moving pieces.
Alexis Mac Allister and Dominik Szoboszlai will also have key roles, whether they are used as two No8s ahead of Gravenberch or whether one of them drops alongside to form a double pivot. The other will then be tasked with linking up with and running beyond Ekitike as a dynamic No10.
Conor Bradley and Curtis Jones are among a squad of players who will be itching to carve out their own roles, too. With Liverpool aiming to compete across multiple fronts, they will get their opportunities. And further signings could add extra layers to Slot's gameplan.
But one thing is clear: this Liverpool will look a lot different to last year's.
",SkySports
Ekitike joins Liverpool in £79m deal,Hugo Ekitike has signed for Liverpool in a deal worth &#163;79m (&#8364;91.5m) from Eintracht Frankfurt.,https://www.skysports.com/football/news/11095/13399673/hugo-ekitike-joins-liverpool-eintracht-frankfurt-striker-completes-79m-transfer-to-premier-league-champions,"Wed, 23 Jul 2025 19:29:00",,['Liverpool'],"Hugo Ekitike has signed for Liverpool in a deal worth £79m (€91.5m) from Eintracht Frankfurt.
Liverpool will pay an initial fee of £69m (€80m) plus £10m (€12.5m) in add-ons for the striker as their summer spending edges towards £300m.
Similar to the Florian Wirtz deal, the majority of the bonuses in Ekitike's move are tied to Liverpool's trophy success and the player making a significant contribution.
Liverpool made their move for Ekitike last week after being told Newcastle striker Alexander Isak is not for sale. Newcastle had a club-record offer of £70m for Ekitike rejected by Frankfurt.
Sky Sports News has been told that Liverpool were comfortable with Newcastle making the first move, as they knew Frankfurt were looking for a bidding war - so the Reds stayed away.
Once Newcastle were close to an agreement, Liverpool entered negotiations, similar to how they signed Luis Diaz from Porto when Tottenham Hotspur were close to doing a deal in January 2022.
One source claims Manchester United made a last-ditch attempt to swoop for Ekitike, but the player had his heart set on Liverpool.
The 23-year-old was an unused substitute during his side's pre-season game against FSV Frankfurt on July 19 and after the game, Frankfurt boss, quoted by Sky Germany, said Ekitike's departure is ""a bitter loss"".
Ekitike scored 22 goals in 48 games across all competitions last season for Frankfurt as he helped them qualify for the Champions League.
Liverpool see him as a multi-functional centre forward who primarily plays as a No 9 but can also drop into a second striker role, or operate wide.
The club believes Ekitike has the potential to become one of the best strikers in the world if he continues on this trajectory.
Liverpool are now the Premier League's biggest spenders, with their summer spree now verging on £300m.
The £79m deal for Hugo Ekitike has taken Liverpool's spending to £295.5m, which is over £75m more than the next biggest spenders in Chelsea.
Liverpool have even spent more than Manchester City and Arsenal combined - the third and fourth biggest spenders - so far.
Tottenham are the fourth biggest spenders with £110.7m spent, just above newly-promoted Sunderland who have spent £107m already.
But how can Liverpool afford Ekitike having already spent a club-record fee to bring Florian Wirtz to Anfield earlier this summer?
Well, the club's financial records indicated they could potentially lose a further £200m this summer and still be compliant with Profit & Sustainability Rules (PSR) - where clubs are permitted to lose £105m over a three-year period.
According to football finance expert Swiss Ramble, the Reds' most recent financial results showed Liverpool have actually made £48m in the current three-year PSR period, partly due to modest recent transfer spend.
That means Liverpool can lose a further £158m and still be compliant next summer.
And while Liverpool have already spent around £185m on new players in the current window - including a fee of up to £116m for Wirtz - the Reds posted a club record revenue of £613.8m for the 2023-24 season, partly due to commercial success.
That figure will only increase on the 2024-25 season accounts given Liverpool added Champions League football, knockout qualification for that tournament and also became Premier League champions.
Academy product Jarell Quansah has already joined Bayer Leverkusen in a £35m deal that represents 100 per cent profit under PSR rules, and the Reds could further boost sales figures by the end of the summer.
And earlier in the summer, Brentford signed backup Reds goalkeeper Caoimhin Kelleher for an initial £12.5m.
Darwin Nunez, Harvey Elliott and Luiz Diaz are all further potential departures, although a Diaz exit is currently less likely despite Bayern Munich's attempts to prise him away.
Ekitike is a multi-functional centre-forward who can operate as a No.9 but has the ability to fulfil other roles too. As such, Liverpool feel they are signing a high-performing player who is capable of justifying this price tag - and with huge potential to improve.
Much has been made of the similarity between the French forward and Isak, the Newcastle striker who would have been many clubs' top target this summer had it not been for the prohibitive costs of the deal. Ekitike matches up on many metrics.

In fact, the numbers suggest that he brings others into play even more, a team player who makes intelligent runs with and without the ball. Ekitike can stretch defences by attacking the space in behind on transition but is also creative operating in tight spaces.
Critics might point to Isak's superior scoring record - Ekitike registered 15 goals in the Bundesliga last season - but Liverpool may well regard the underlying numbers as more encouraging and evidence that Ekitike could even be undervalued in the current market.
Data experts would take the view that Ekitike's expected-goals figure, which was among the highest in the Bundesliga last season, proves that he is a player whose physicality and intelligent movement sees him arrive in good situations time and time again.
Such numbers tend to regress to the mean. The club would prefer to invest in a player whose numbers are likely to trend upwards. If Ekitike can do that then - even at an initial price of £69m - Liverpool could come to see their investment in him as a bargain.
Sky Sports' Adam Bate:
When Hugo Ekitike was still a teenager at Stade Reims, the coaching staff prepared a development plan for him. They analysed the performances of Kylian Mbappe and then picked out two more players that Ekitike might realistically aspire to replicate.
""These were players with similar profiles from teams that were better than our team, but not at the distance Paris Saint-Germain were from us,"" Oscar Garcia, Reims' then head coach, told Sky Sports. ""We challenged him to reach the level of the other two strikers.""
On the face of it, that was a perfectly reasonable short-term target. Prior to his final season at Reims, Ekitike had not even scored a goal in France's top tier. He had spent the second half of the previous campaign on loan at Danish club Vejle Boldklub.
He returned to Reims as the fourth-choice forward but soon forced Oscar to reassess. Soon after that, the two strikers whose level he had been encouraged to hit were no longer in his sights. ""Within months, he wanted to reach the same level as Mbappe.""
It is a tale that offers a glimpse into the mindset of the Eintracht Frankfurt forward who has long been linked with a move to the Premier League.
""He always was a talented player but some coaches did not like him because of his profile and sometimes because of his character,"" concedes Oscar. ""They were thinking he was a little bit arrogant. He always wanted to be compared with the best ones.""
From next season, Sky Sports' Premier League coverage will increase from 128 matches to at least 215 games exclusively live.
And 80 per cent of all televised Premier League games next season are on Sky Sports.
",SkySports
Chelsea in talks to sign Hato and Simons,Chelsea are in advanced talks with Ajax over a deal for centre-back Jorrel Hato and have also held discussions over the signing of RB Leipzig's Xavi Simons.,https://www.skysports.com/football/news/11095/13400601/chelsea-transfer-news-blues-in-talks-to-sign-ajax-defender-jorrel-hato-and-rb-leipzig-midfielder-xavi-simons,"Wed, 23 Jul 2025 12:52:00",,['Chelsea'],"Chelsea are in advanced talks with Ajax over a deal for centre-back Jorrel Hato and have also held discussions over the signing of RB Leipzig's Xavi Simons.
It's understood Chelsea are ready to pay £44m (€50m) for Hato, but Ajax are holding out for around £52m (€60m).
Hato has told Ajax he wants to leave and the clubs have been in locked in high-level talks on Wednesday.
The 19-year-old central defender, who can also play as a left back, has been watched closely by Chelsea, whose interest is longstanding.He is a player they are understood to admire as he has quickly developed into one of the best young defenders in the world.
Chelsea value Hato at around €40m (£35m), using the £38.5m Arsenal paid Ajax for Jurien Timber (£34m, plus £4.5m in add-ons) as a benchmark.
He is contracted to Ajax until 2028 and his agent has confirmed the Blues are in talks to sign the defender.
Humphry Nijman told De Telegraaf: ""Yes, the club has contacted Ajax.
""The only thing I can say is that Jorrel is now in talks with Chelsea.""
Meanwhile, attacking midfielder Simons - another player Chelsea have held talks over - is set to leave RB Leipzig this summer as he has two years left on his contract.
Chelsea have other targets as well and any more incomings are dependent on players also leaving.
Simons is in demand and may wait until later in the window before moving.
Once again, Chelsea have another summer where they are looking to move on players in a bloated squad.
One of the attacking players who could make way for Simons' arrival is Christopher Nkunku - despite the Frenchman playing a significant role in Chelsea's successful Club World Cup campaign.
Many of the players Chelsea are looking to move on were on loan last season. One of them is Raheem Sterling, who returned from an unsuccessful spell at Arsenal last term.
Other players out on loan last term include Joao Felix, Ben Chilwell, Renato Veiga and Axel Disasi.
Another player who Chelsea could move on is Carney Chukwuemeka, with RB Leipzig pursuing a move for the Chelsea midfielder.
Chukwuemeka spent the second half of last season on loan at Borussia Dortmund. But it is Leipzig that are now pushing to sign the 21-year-old, who has three years left on his deal.
Another player Chelsea could move on is Kiernan Dewsbury-Hall, with Fulham keen on the midfielder.
It is understood that Fulham have explored the conditions of both a loan and permanent move. A formal approach to Chelsea will follow if they believe there is a deal to be done.
Dewsbury-Hall featured in six of Chelsea's eight Club World Cup matches - starting once. He has a contract until 2029 with the club holding the option to extend for a further year.
From next season, Sky Sports' Premier League coverage will increase from 128 matches to at least 215 games exclusively live.
And 80 per cent of all televised Premier League games next season are on Sky Sports.
",SkySports
'It's a club where dreams come true' - Rashford joins Barcelona on loan,"Manchester United forward Marcus Rashford has completed a season-long loan move to Barcelona, describing his new side as ""a club where dreams come true"".",https://www.skysports.com/football/news/11095/13399346/marcus-rashford-joins-barcelona-man-utd-forward-completes-season-long-loan-move-to-laliga-club,"Wed, 23 Jul 2025 17:00:00",,['Manchester United'],"Manchester United forward Marcus Rashford has completed a season-long loan move to Barcelona, describing his new side as ""a club where dreams come true"".
The agreed loan deal is for the 2025/26 season with an option to buy him next summer. Sky Sports News understands the option price is around £26m (€30m).
Rashford will wear the No 14 shirt, which has been worn by many Barcelona greats in the past - including Michael Laudrup, Ronald Koeman, Thierry Henry and Javier Mascherano.
""I'm very excited,"" Rashford said at his unveiling. ""It's a club where dreams come true. They win big prizes and what the club stands for really means a lot to me.
""It feels like I'm at home and it's a big factor in my choice to come here.
""It's a family club and people are comfortable here. It's a good place for good players to showcase their skills.""
A Barcelona statement said: ""FC Barcelona and Manchester United have reached an agreement for the loan of the player Marcus Rashford until 30 June 2026. The agreement also establishes an option to buy the English forward.
""The player has signed his contract as a Barça player this afternoon at a private meeting in the presence of the FC Barcelona president, Joan Laporta; the director of the Football Area, and other Board members.""
Barcelona are expected to cover all of Rashford's wages during the proposed loan, although they are currently unable to register the forward due to LaLiga's financial rules.
The Spanish champions are deemed to have spent more on signings and wages than they made in revenue for the 2024/25 season.
LaLiga's rules dictate that clubs can only spend as much as they generate, so Barcelona will be required to make sales, cut wages or increase their revenue streams to make space for new signings.
The deadline for this issue to be resolved is the end of August. Barcelona are confident of registering Rashford and their other new signings in time for the new season.
Despite their long-standing financial issues, the Catalan club have always eventually been able to register their new signings in time despite these challenges.
England international Rashford had publicly said he would like to play for the Catalans this summer and had been interested in a move to the LaLiga champions in January, before joining Aston Villa on loan.
Rashford's move is understood to have been given the green light by Barca head coach Hansi Flick after he spoke with the player.
It is thought Liverpool forward Luis Diaz was a priority target, but Barcelona's advances were rejected earlier in the window.
The academy graduate is one of five players who have been given extra time off to explore potential moves away this summer.
Rashford's career at Old Trafford has appeared to be over since Ruben Amorim claimed he would rather put his 63-year-old goalkeeper coach on the bench than the forward because of what he considers a lack of effort.
However, Rashford declined to criticise Man Utd when it was put to him the Old Trafford club, rather than him, were at fault for causing the situation which has led to his departure.
""The situation with Man Utd, the club is in a period of change, and they have been for a while,"" he said.
""I don't have anything bad to say about Man Utd. It's been an important part of not only my career but my life.
""I am grateful for the opportunity to play for them but football is the same as life, and not everything goes as simple as you may have thought.
""This is my next step, my next chapter, and I am fully focussed on trying to improve myself and help the team win trophies.
""I just wish Man Utd the best and hope they are successful in the future.""
Rashford picked out Barcelona's style of play and the influence of their head coach Hansi Flick as contributing factors to his desire to join the Spanish champions.
""I always try to make decisive actions and fast dynamic plays, and I always like good football. I've always been a fan of watching Barcelona play from a young age, like most football fans,"" he said.
""It's going to be a joy for me to play here and I am going to enjoy every minute of it. I'm full of excitement and hunger to go out and try and help this team win.
""They won so much last year and I can see the ambition of the club is to do better than last year. For a player, that is what you want to hear because it keeps you improving year on year, and that is what you need to be the best version of yourself.
""""Hansi Flick is another key factor in the reason I'm here.
""The conversations I had with him were very positive and what he did last year was a terrific season, but not just last year. In his career he has proved he is one of the top coaches.
""To lead such a young team to a very successful season and then to come back to pre-season and still want to do more, it shows me everything I thought I knew about the club, but now, to be here, it is everything I wished and thought.
""I'm eager to get going now and learn the Barcelona way as I go.""
Sky Sports News reporter Gary Cotterill in Barcelona:
As we know, Barcelona is more than a club. On his big day at the Nou Camp, Marcus Rashford was more than impressive.
Smiling. Suited and booted, and his answers to dozens of questions were tailor made. Tailor made to look forward, not back.
There were journalists who'd travelled from England to be here, me included. All of them were trying to catch the eye of the Barcelona press officer, but none were allowed a question. The feeling being that local reporters would ask about Barcelona, not Manchester United.
And that's how it turned out.
The club's new No 14 said everything a Barcelona fan would want to hear about the place where 'dreams come true'.
When he was finally asked one solitary question about his parent club, he controlled it beautifully, turned on a sixpence (our euro) and hammered it into the top of the net.
""I've nothing bad to say,"" he said. 1-0 to the media chiefs.
The only slight hiccup Rashford made all day was timekeeping. He arrived 15 minutes late for the contract signing ceremony, but no one seemed to mind.
The first Englishman to play for Barcelona since Gary Lineker posed near an old English telephone box as part of his official club video.
Apt.
Because at his media unveiling, Marcus Rashford rang the right tone and kept everyone engaged. He may well have found his calling.
Sky Sports Football's Nick Wright:
Manchester United get a player with no future under Ruben Amorim off their books and free up considerable space on their wage bill. Barcelona acquire a potentially world-class forward without having to commit to signing him on a permanent deal.
But the biggest winner in Marcus Rashford's move from Old Trafford to Camp Nou on loan with an option to buy is the player himself. He swaps a side that finished 15th in the Premier League last term for one which won a domestic double and rank among this season's favourites to win the Champions League.
Read more here...
From next season, Sky Sports' Premier League coverage will increase from 128 matches to at least 215 games exclusively live.
And 80 per cent of all televised Premier League games next season are on Sky Sports.
",SkySports
