Title,Summary,Link,Date,Author,Teams,Article,Outlet
"Wenger loves the Club World Cup, but does anyone agree with him?",Sign up now! Sign up now! Sign up now? Sign up now!,https://www.theguardian.com/football/2025/jul/11/arsene-wenger-club-world-cup-chelsea-psg-football-daily-newsletter,"Fri, 11 Jul 2025 15:29:07",Niall McVeigh,"['Arsenal', 'Chelsea', 'Liverpool']","ARSÈNE KNOWS?
The inaugural Copa Gianni jamboree reaches its end game on Sunday as Chelsea and Paris Saint-Germain, two lavishly-backed super clubs based a short Eurostar trip apart, battle to be kings of the global game. PSG have undermined their rivals’ complaints about packed schedules and player fatigue by flying in after Bigger Cup final and destroying better-rested teams. Chelsea, meanwhile, have benefited from a tournament that allows you to simply buy more players as you go – including those on opposing teams – in order to freshen things up. Whatever happens, football will be the winner, but has Copa Gianni been any good?
Asked at the end of June, Jürgen Klopp was unequivocal in his criticism, calling it the worst idea ever implemented in football (and it has some serious competition – Football Daily Ed). Almost two weeks later, Arsène Wenger has bitten back. “I am going to give a very boring answer to a very interesting question,” Wenger told salivating hacks. “Everyone is entitled to an opinion and I don’t share the view of Klopp at all.” With a full fortnight to prepare his riposte, we were expecting a Bielsa-esque PowerPoint takedown, but instead got the kind of unsubstantiated guff that may have earned Wenger the gig as Fifa’s chief of global football development. “If you make enquiries to all the clubs who were here, 100% [would say] they would want to do it again.”
If by clubs, Wenger means the boardroom bean-counters and PSR plate-spinners who oversee things, he may be right. But what about managers, so often the public face of the team? We would ask Botafogo’s Renato Paiva and Porto’s Martín Anselmi what they thought, but they were both sacked for their Copa Gianni failures (which, in Paiva’s case, included beating PSG). How did Pep Guardiola enjoy Manchester City’s daring run to the last 16? “Maybe [in winter] it will be a disaster, we are exhausted and [Copa Gianni] has destroyed us,” trilled Guardiola. Well, at least his players enjoyed it, right? “My teammates are not exactly overjoyed about the tournament,” said Manuel Akanji, who joined the rest of City’s back line in downing tools against Al-Hilal.
Wenger also took on the issue of low fan turnout, saying “we believe the attendances were projected as low and in reality were much higher,” while squinting up at an empty stand as invisible to him as a contentious decision in Arsenal’s favour. “We shouldn’t underestimate the quality of the permanent pitches,” he added, rubbing a scorched blade of grass between forefinger and thumb. “The grass is a bit harsher here. The pitches were flat. But once we watered the grass, everyone was happy.” Apart from PSG’s Luis Enrique, of course, who complained of playing surfaces “full of holes” that made the ball “jump around like a rabbit”.
And what about the heat, which made it “almost impossible to train,” according to Chelsea head coach Enzo Maresca? Well, it turns out he was doing the training wrong. “I asked our analysts to analyse the impact of the heat,” Wenger added, while stuffing party packs of ice cubes inside his extra-long puffer jacket. “We found heat of over 35C had an impact on high-speed running, so sprints, not distances.” So, it’s simple – to succeed in this tournament, or next year’s Stay Away World Cup, players need to stop running. After all it’s not like this is an elite competitive sport, right? Wenger’s verdict may be good news for Cole Palmer, but it also proves the Copa Gianni – recently described as a “wake-up call” for player welfare – is a marathon, not a sprint.
LIVE ON BIG WEBSITE
It’s the final round of Group B fixtures, with Portugal needing to gain three points and several goals to overhaul Italy in second place. Join us for Italy 1-4 Spain and Portugal 3-1 Belgium to see how it all shakes down (both 8pm BST kick-offs).
QUOTE OF THE DAY
It is great to see and it’s proof that women’s footballers are great, and that is the way that game is going, so long may that continue” – England’s Lauren Hemp weighs in on the news that Arsenal will make Canada forward Olivia Smith the first £1m signing in the women’s game, as revealed in a Big Website exclusive on Thursday.
FOOTBALL DAILY LETTERS
Re: John Terry’s revelation in yesterday’s Daily that he would not have played against his old muckers at Chelsea left me pondering the eternal existential question with JT. Would he have sat on the bench in his full Aston Villa kit regardless?” – Justin Kavanagh.
Sir Alex Ferguson was not afraid to dispense with David Beckham and Cristiano Ronaldo to rebuild Manchester United. Xabi Alonso has a similar task if he is to take Real Madrid back to the lofty heights that they are used to. Will he?” – Krishna Moorthy.
Perhaps David Mack (Thursday’s letters) should also have told Bryan Evans, Frankie Dodds and Barry Glendenning that the M1 (Republic of Ireland version) only starts at the Turnapin Interchange [OK, that’s enough of that – Daily Ed]” – Frank Derwin.
Send letters to the.boss@theguardian.com. Today’s prizeless letter o’ the day winner is … Justin Kavanagh. Terms and conditions for our competitions can be viewed here.
This is an extract from our daily football email … Football Daily. To get the full version, just visit this page and follow the instructions.
",TheGuardian
Football transfer rumours: Bayern to sign Luis Díaz after new bid?,Today’s guff has attacking flair,https://www.theguardian.com/football/2025/jul/11/football-transfer-rumours-bayern-munich-liverpool-newcastle-nottingham-forest,"Fri, 11 Jul 2025 08:31:53",David Tindall,['Liverpool'],"Bayern Munich clearly had the hump when Florian Wirtz was lured to Liverpool rather than Bavaria. So after missing out on the former Bayer Leverkusen playmaker, are they trying to exact a spot of revenge by snatching Luis Díaz from the Reds? Latest reports from Germany suggest Bayern have upped their efforts with a £52m offer for the 28-year-old, and that new talks have taken place between Díaz’s representatives and Bayern Munich’s director of sport, Max Eberl.
Liverpool aren’t having any of it, hinting they would consider letting the Colombian go only if a significant offer arrived; £52m doesn’t fall into that category. The player himself has suggested he is open to an “exciting offer” but that may just be to improve his contract at Anfield. And that’s rather a sticking point: scroll down the list of Liverpool players’ wages and he’s surprisingly low but there appears to be no sign of an increase on the table.
While Darwin Núñez (on more than double Díaz’s wages) continues to be linked with a move to Italian champions Napoli, the big fish for Liverpool’s transfer rod is still Alexander Isak. And maybe Arne Slot’s champions have received some encouragement for a raid on the striker with news from the transfer guru Fabrizio Romano that Newcastle have joined the race to sign the Eintracht Frankfurt frontman Hugo Ekitike.
The 23-year-old, rated at about £85m, has attracted interest from the Saudi Pro League and various Premier League clubs, including Liverpool (this thing goes in never-ending circles, doesn’t it) and Chelsea. But the belief is that he wants to stay in Europe and Newcastle would certainly have the wonga if they sold Isak to Liverpool – even if it would go down like a piece of Ikea furniture with a vital screw missing if they sold the Swede to a Premier League rival.
It’s all happening at Nottingham Forest and not in a good way in many respects. With the winger Anthony Elanga lined up to join Newcastle and the chief string-puller, Morgan Gibbs-White, set for a medical at Tottenham, Forest are in danger of seeing their squad pulled apart after an excellent 2024-25 campaign in which they flirted heavily with a Champions League place before finally finishing seventh.
But news of incomings will boost spirits and one well-known Premier League frontman being heavily linked again is Brentford’s Yoane Wissa. Forest are believed to have had a £25m bid rejected out of hand last winter. Brentford want double that and perhaps the budget is there now for Nuno Espírito Santo to bring in the Congolese international.
The Wissa deal – Spurs have also shown interest – is complicated by the saga of Bryan Mbeumo’s proposed switch to Manchester United. It’s a saga being played out in public and so slow moving that Rio Ferdinand has claimed on his Youtube channel that if it doesn’t come off “it would be a custard, egg on your face situation”. And it doesn’t get any worse than that. Brentford don’t want to lose both players so this may take a fair while to be resolved yet.
Back to Forest and they’re reportedly trying to fill their Gibbs-White-shaped hole with Manchester City midfielder James McAtee. The 22-year-old has just captained England Under-21s to Euros glory, which might have put a few quid on his transfer fee. That, by the way, is a bone of contention. Forest are believed to be offering £25m but City want something north of £40m. West Ham are also sniffing, having just sold Mohammed Kudus to Tottenham.
And finally, talking of Spurs, Thomas Frank seems to be piecing together a new squad rather nicely and there could be a fresh arrival in defence too. Attracting attention is the Belgian centre-back Koni De Winter. The Genoa defender enjoyed an excellent season in Serie A and could be prized away for £25m-£30m. Inevitably, Inter and other Italian clubs are also monitoring the situation.
",TheGuardian
